league|id|time|date|city|title|full|venue|ven_id|score|lat|long|t1|t2|t3|t4|low|med|high|name|xname
ncaa_basketball|5801184|07:00 pm|2023-03-01|Pittsburgh, PA|Massachusetts at Duquesne|UMass Minutemen at Duquesne Dukes Basketball|UPMC Cooper Fieldhouse|  3441|0.226|40.4378| -79.9881|Duquesne Dukes Basketball|UMass Minutemen Basketball|NA|NA|  20|  32|    57|NCAA BB|College Basketball
ncaa_basketball|5803296|06:30 pm|2023-03-05|Minneapolis, MN|Wisconsin Badgers at Minnesota Golden Gophers Basketball|Wisconsin Badgers at Minnesota Golden Gophers Basketball|Williams Arena|  3423|0.593|44.9769| -93.2284|Minnesota Golden Gophers Basketball|Wisconsin Badgers Basketball|NA|NA|  54|  94|   412|NCAA BB|College Basketball
ncaa_basketball|5739332|02:00 pm|2023-03-07|Greensboro, NC|ACC Mens Basketball Tournament - Session 1|ACC Mens Basketball Tournament - Session 1|Greensboro Coliseum Complex|  4318|0.593|36.0580| -79.8248|ACC Men's Basketball Tournament|NA|NA|NA|  10|  27|  1499|NCAA BB|College Basketball
ncaa_basketball|5932175|07:00 pm|2023-02-22|Baltimore, MD|Holy Cross at Loyola Maryland|Holy Cross Crusaders at Loyola Maryland Greyhounds Basketball|Reitz Arena|  5139|0.220|39.3462| -76.6213|Loyola Maryland Greyhounds Basketball|Holy Cross Crusaders Basketball|NA|NA|  35|  57|    58|NCAA BB|College Basketball
ncaa_basketball|5846144|02:00 pm|2023-02-25|Boca Raton, FL|UTEP at Florida Atlantic|UTEP Miners at Florida Atlantic Owls Basketball|Abessinio Court at FAU Arena|  6050|0.338|26.3738| -80.1019|Florida Atlantic Owls Basketball|UTEP Miners Basketball|NA|NA|  47|  74|   134|NCAA BB|College Basketball
ncaa_basketball|5685025|03:30 am|2023-03-24|Kansas City, MO|NCAA Mens Basketball Tournament - Midwest Regional - All Sessions|NCAA Mens Basketball Tournament - Midwest Regional - All Sessions|T-Mobile Center|    84|0.438|39.0973| -94.5799|NCAA Tournament - Midwest Regional|NCAA Sweet 16|NCAA Mens Basketball Tournament|March Madness| 383| 765|  2898|NCAA BB|College Basketball
ncaa_basketball|5782982|03:30 am|2023-03-19|Denver, CO|NCAA Mens Basketball Tournament - Denver - Session 3|NCAA Mens Basketball Tournament - Denver - Session 3|Ball Arena|   187|0.438|39.7487|-105.0080|NCAA Tournament First and Second Round|NCAA Mens Basketball Tournament|March Madness|NA| 131| 341|  1694|NCAA BB|College Basketball
ncaa_basketball|5844474|02:00 pm|2023-02-25|Boston, MA|Princeton at Harvard|Princeton Tigers at Harvard Crimson Basketball|Lavietes Pavilion|  4185|0.438|42.3683| -71.1237|Harvard Crimson Basketball|Princeton Tigers Basketball|NA|NA|  36|  44|    74|NCAA BB|College Basketball
ncaa_basketball|5807666|02:00 pm|2023-02-25|Atlanta, GA|Louisville at Georgia Tech|Louisville Cardinals at Georgia Tech Yellow Jackets Basketball|McCamish Pavilion|  3425|0.591|33.7807| -84.3936|Georgia Tech Yellow Jackets Basketball|Louisville Cardinals Basketball|NA|NA|  19|  38|   170|NCAA BB|College Basketball
ncaa_basketball|5782996|03:30 am|2023-03-25|New York, NY|NCAA Mens Basketball  Tournament - East Regional - Session 2|NCAA Mens Basketball  Tournament - East Regional - Session 2|Madison Square Garden|    93|0.437|40.7509| -73.9943|NCAA Tournament - East Regional|NCAA Mens Basketball Tournament|NCAA Tournament Elite Eight|March Madness| 327| 514|  3749|NCAA BB|College Basketball
ncaa_basketball|5685031|03:30 am|2023-03-23|New York, NY|NCAA Mens Basketball Tournament - East Regional - All Sessions|NCAA Mens Basketball Tournament - East Regional - All Sessions|Madison Square Garden|    93|0.436|40.7509| -73.9943|NCAA Tournament - East Regional|NCAA Mens Basketball Tournament|NCAA Sweet 16|March Madness| 601| 985|  5147|NCAA BB|College Basketball
ncaa_basketball|5853706|06:00 pm|2023-03-11|Las Vegas, NV|Pac-12 Mens Basketball Tournament - Session 6|Pac-12 Mens Basketball Tournament - Session 6|T-Mobile Arena|161601|0.590|36.1029|-115.1780|Pac-12 Men's Basketball Tournament|NA|NA|NA| 167| 317|  1859|NCAA BB|College Basketball
ncaa_basketball|5866266|11:29 am|2023-02-28|Pensacola, FL|Sun Belt Basketball Conference Championships - All Sessions|Sun Belt Basketball Conference Championships - All Sessions|Pensacola Bay Center|   948|0.436|30.4164| -87.2089|Sun Belt Womens Basketball Tournament|Sun Belt Womens Basketball Tournament|NA|NA| 122| 122|   128|NCAA BB|College Basketball
ncaa_basketball|5853704|06:00 pm|2023-03-10|Las Vegas, NV|Pac-12 Mens Basketball Tournament - Session 5|Pac-12 Mens Basketball Tournament - Session 5|T-Mobile Arena|161601|0.590|36.1029|-115.1780|Pac-12 Men's Basketball Tournament|NA|NA|NA| 167| 374|  2033|NCAA BB|College Basketball
ncaa_basketball|5805119|12:00 pm|2023-02-25|New York, NY|UConn at St. John's|UConn Huskies at St. John's Red Storm Basketball|Madison Square Garden|    93|0.654|40.7509| -73.9943|St. John's Red Storm Basketball|UConn Huskies Basketball|NA|NA| 102| 192|  4019|NCAA BB|College Basketball
ncaa_basketball|5844308|02:00 pm|2023-03-04|Denton, TX|Western Kentucky at North Texas|Western Kentucky Hilltoppers at North Texas Mean Green Basketball|UNT Coliseum (Super Pit)|  4159|0.434|33.2086| -97.1541|North Texas Mean Green Basketball|Western Kentucky Hilltoppers Basketball|NA|NA|  20|  33|    64|NCAA BB|College Basketball
ncaa_basketball|5803186|07:00 pm|2023-02-28|Bloomington, IN|Iowa at Indiana|Iowa Hawkeyes at Indiana Hoosiers Basketball|Simon Skjodt Assembly Hall|  3466|0.654|39.1809| -86.5221|Indiana Hoosiers Basketball|Iowa Hawkeyes Basketball|NA|NA| 223| 374|  1009|NCAA BB|College Basketball
ncaa_basketball|5801003|01:00 pm|2023-03-04|Columbia, SC|Georgia at South Carolina|Georgia Bulldogs at South Carolina Gamecocks Basketball|Colonial Life Arena|  1429|0.520|33.9947| -81.0370|South Carolina Gamecocks Basketball|Georgia Bulldogs Basketball|NA|NA|  24|  63|   281|NCAA BB|College Basketball
ncaa_basketball|5937326|06:00 pm|2023-03-04|Asheville, NC|Southern Conference Basketball Championships - Men's Quarterfinal|Southern Conference Basketball Championships - Men's Quarterfinal|Harrah's Cherokee Center - Asheville|  1486|0.375|35.5972| -82.5556|Southern Conference Basketball Tournament|NA|NA|NA| 125| 128|   131|NCAA BB|College Basketball
ncaa_basketball|5937338|12:00 pm|2023-03-03|Charlotte, NC|Big South Basketball Tournament - Men's Quarterfinals|Big South Basketball Tournament - Men's Quarterfinals|Bojangles Coliseum|  1064|0.375|35.2051| -80.7952|Big South Basketball Tournament|NA|NA|NA|  37|  55|   185|NCAA BB|College Basketball
ncaa_basketball|5803222|12:30 pm|2023-03-05|West Lafayette, IN|Illinois at Purdue|Illinois Fighting Illini at Purdue Boilermakers Basketball|Mackey Arena|  3486|0.653|40.4259| -86.9081|Purdue Boilermakers Basketball|Illinois Fighting Illini Basketball|NA|NA| 269| 483|   980|NCAA BB|College Basketball
ncaa_basketball|5812507|03:30 pm|2023-03-04|Boulder, CO|Utah Utes at Colorado Buffaloes Basketball|Utah Utes at Colorado Buffaloes Basketball|CU Events Center|  3427|0.519|40.0048|-105.2620|Colorado Buffaloes Basketball|Utah Utes Basketball|NA|NA|  29|  53|   337|NCAA BB|College Basketball
ncaa_basketball|5817370|07:00 pm|2023-02-25|Tampa, FL|SMU at South Florida|SMU Mustangs at South Florida Bulls Basketball|Yuengling Center|   223|0.431|28.0592| -82.4066|South Florida Bulls Basketball|SMU Mustangs Basketball|NA|NA|  18|  59|   377|NCAA BB|College Basketball
ncaa_basketball|5782980|03:30 am|2023-03-17|Denver, CO|NCAA Mens Basketball Tournament - Denver - Session 2|NCAA Mens Basketball Tournament - Denver - Session 2|Ball Arena|   187|0.430|39.7487|-105.0080|NCAA Tournament First and Second Round|NCAA Mens Basketball Tournament|March Madness|NA| 145| 285|  1517|NCAA BB|College Basketball
ncaa_basketball|5817868|08:00 pm|2023-03-01|Fort Worth, TX|Texas at TCU|Texas Longhorns at TCU Horned Frogs Basketball|Ed and Rae Schollmaier Arena|  4245|0.588|32.7093| -97.3652|TCU Horned Frogs Basketball|Texas Longhorns Basketball|NA|NA| 141| 206|   497|NCAA BB|College Basketball
ncaa_basketball|5937346|01:00 pm|2023-03-05|Charlotte, NC|Big South Basketball Tournament - Men's Championship|Big South Basketball Tournament - Men's Championship|Bojangles Coliseum|  1064|0.372|35.2051| -80.7952|Big South Basketball Tournament|NA|NA|NA|  37|  56|   192|NCAA BB|College Basketball
ncaa_basketball|5939133|06:30 pm|2023-03-10|Las Vegas, NV|Mountain West Mens Basketball Tournament - Session 8|Mountain West Mens Basketball Tournament - Session 8|Thomas and Mack Center|   950|0.506|36.1052|-115.1440|Mountain West Mens Basketball Tournament	|NA|NA|NA|  69|  97|   125|NCAA BB|College Basketball
ncaa_basketball|5932154|07:00 pm|2023-02-22|Washington, DC|Navy at American University|Navy Midshipmen at American University Eagles Basketball|Bender Arena|  4279|0.324|38.9361| -77.0888|American University Eagles Basketball|Navy Midshipmen Basketball|NA|NA|  11|  11|    60|NCAA BB|College Basketball
ncaa_basketball|5782950|03:30 am|2023-03-16|Des Moines, IA|NCAA Mens Basketball Tournament - Des Moines - Session 2|NCAA Mens Basketball Tournament - Des Moines - Session 2|Wells Fargo Arena|    94|0.427|41.5927| -93.6211|NCAA Tournament First and Second Round|NCAA Mens Basketball Tournament|March Madness|NA| 107| 225|   807|NCAA BB|College Basketball
ncaa_basketball|5751123|03:30 am|2023-02-24|San Marcos, TX|Southern Miss at Texas State|Southern Miss Golden Eagles at Texas State Bobcats Basketball|Strahan Arena at the University Events Center|  4260|0.371|29.8887| -97.9374|Texas State Bobcats Basketball|Southern Miss Golden Eagles Basketball|NA|NA|  35|  50|   146|NCAA BB|College Basketball
ncaa_basketball|5932201|11:00 am|2023-03-09|Cleveland, OH|MAC Men's Quarterfinals Session#1|MAC Men's Quarterfinals Session#1|Rocket Mortgage FieldHouse|   120|0.323|41.4971| -81.6884|MAC Men's Basketball Tournament|MAC|NA|NA|  31|  41|   155|NCAA BB|College Basketball
ncaa_basketball|5852990|05:00 pm|2023-03-02|Wilmington, DE|Session 3 (5pm & 7:30pm)|Session 3 (5pm & 7:30pm)|Chase Fieldhouse|460642|0.370|39.7276| -75.5544|Atlantic 10 Women's Basketball Championship|NA|NA|NA|  17|  17|    57|NCAA BB|College Basketball
ncaa_basketball|5843870|04:00 pm|2023-03-04|Fresno, CA|Chicago State at Fresno State|Chicago State Cougars at Fresno State Bulldogs Basketball|Save Mart Center|    76|0.320|36.8099|-119.7390|Fresno State Bulldogs Basketball|Chicago State Cougars Basketball|NA|NA|  33|  45|   199|NCAA BB|College Basketball
ncaa_basketball|5811741|11:30 am|2023-02-26|Cedar Falls, IA|Belmont at UNI|Belmont Bruins at Northern Iowa Panthers Basketball|McLeod Center|  1877|0.409|42.5144| -92.4673|Northern Iowa Panthers Basketball|Belmont Bruins Basketball|NA|NA|  10|  15|    94|NCAA BB|College Basketball
ncaa_basketball|5803362|07:00 pm|2023-03-01|Columbus, OH|Maryland at Ohio State|Maryland Terrapins at Ohio State Buckeyes Basketball|Value City Arena at Schottenstein Center|    99|0.560|40.0077| -83.0251|Ohio State Buckeyes Basketball|Maryland Terrapins Basketball|NA|NA|  13|  74|   751|NCAA BB|College Basketball
ncaa_basketball|5782974|03:30 am|2023-03-17|Columbus, OH|NCAA Mens Basketball Tournament - Columbus - Session 2|NCAA Mens Basketball Tournament - Columbus - Session 2|Nationwide Arena|   430|0.423|39.9694| -83.0064|NCAA Tournament First and Second Round|NCAA Mens Basketball Tournament|March Madness|NA| 116| 233|  1801|NCAA BB|College Basketball
ncaa_basketball|5939135|03:00 pm|2023-03-11|Las Vegas, NV|Mountain West Mens Basketball Tournament - Session 9|Mountain West Mens Basketball Tournament - Session 9|Thomas and Mack Center|   950|0.517|36.1052|-115.1440|Mountain West Mens Basketball Tournament	|NA|NA|NA|  61| 106|   165|NCAA BB|College Basketball
ncaa_basketball|5846613|03:30 am|2023-03-07|Atlantic City, NJ|MAAC Basketball Championships - All Sessions|MAAC Men's & Women's Basketball Championships - All Sessions|Boardwalk Hall|    88|0.318|39.3549| -74.4384|MAAC Womens Basketball Tournament|MAAC Womens Basketball Tournament|NA|NA| 160| 217|  1144|NCAA BB|College Basketball
ncaa_basketball|5812419|07:00 pm|2023-02-25|Corvallis, OR|Oregon at Oregon State|Oregon Ducks at Oregon State Beavers Basketball|Gill Coliseum|  3465|0.496|44.5613|-123.2810|Oregon State Beavers Basketball|Oregon Ducks Basketball|NA|NA|  19|  63|   195|NCAA BB|College Basketball
ncaa_basketball|5800919|08:00 pm|2023-03-01|Baton Rouge, LA|Missouri Tigers at LSU Tigers Basketball|Missouri Tigers at LSU Tigers Basketball|Pete Maravich Assembly Center|  3480|0.517|30.4173| -91.1856|LSU Tigers Basketball|Missouri Tigers Basketball|NA|NA|   7|  15|   248|NCAA BB|College Basketball
ncaa_basketball|5848675|07:00 pm|2023-02-23|Pocatello, ID|Idaho at Idaho State|Idaho Vandals at Idaho State Bengals Basketball|Reed Gym|  6560|0.367|42.8627|-112.4330|Idaho State Bengals Basketball|Idaho Vandals Basketball|NA|NA|  14|  14|    63|NCAA BB|College Basketball
ncaa_basketball|5844028|06:00 pm|2023-03-06|Sioux Falls, SD|Summit League Basketball Tournament - Mens Session 4|Summit League Basketball Tournament - Mens Session 4|Denny Sanford Premier Center| 60477|0.355|43.5635| -96.7470|Summit League Basketball Tournament|NA|NA|NA|  70|  72|    82|NCAA BB|College Basketball
ncaa_basketball|5939098|09:30 pm|2023-03-08|Boise, ID|Big Sky Mens Basketball Tournament - Championship|Big Sky Mens Basketball Tournament - Championship|Idaho Central Arena|  3706|0.366|43.6146|-116.2040|Big Sky Mens Basketball Tournament	|NA|NA|NA|  31|  44|   107|NCAA BB|College Basketball
ncaa_basketball|5811572|03:30 am|2023-02-26|Normal, IL|Evansville at Illinois State|Evansville Purple Aces at Illinois State Redbirds Basketball|Redbird Arena|  2147|0.355|40.5099| -88.9975|Illinois State Redbirds Basketball|Evansville Purple Aces Basketball|NA|NA|  54|  72|    87|NCAA BB|College Basketball
ncaa_basketball|5812378|06:00 pm|2023-03-02|Los Angeles, CA|Arizona State at UCLA|Arizona State Sun Devils at UCLA Bruins Basketball|Pauley Pavilion|  3483|0.559|34.0703|-118.4470|UCLA Bruins Basketball|Arizona State Sun Devils Basketball|NA|NA|  24|  73|   565|NCAA BB|College Basketball
ncaa_basketball|5685011|03:30 am|2023-03-17|Columbus, OH|NCAA Mens Basketball Tournament - Columbus - All Sessions|NCAA Mens Basketball Tournament - Columbus - All Sessions|Nationwide Arena|   430|0.466|39.9694| -83.0064|NCAA Tournament First and Second Round|NCAA Mens Basketball Tournament|March Madness|NA| 300| 582|  2098|NCAA BB|College Basketball
ncaa_basketball|5800852|06:00 pm|2023-03-04|Gainesville, FL|LSU Tigers at Florida Gators Basketball|LSU Tigers at Florida Gators Basketball|Exactech Arena at the Stephen C. O'Connell Center|  3459|0.608|29.6494| -82.3512|Florida Gators Basketball|LSU Tigers Basketball|NA|NA|  27|  92|   789|NCAA BB|College Basketball
ncaa_basketball|5931293|07:00 pm|2023-02-24|Bronx, NY|Marist at Manhattan|Marist Red Foxes at Manhattan Jaspers Basketball|Draddy Gymnasium|  5184|0.313|40.8898| -73.9006|Manhattan Jaspers Basketball|Marist Red Foxes Basketball|NA|NA|  45|  45|    58|NCAA BB|College Basketball
ncaa_basketball|5931939|07:30 pm|2023-02-27|Dover, DE|Coppin State at Delaware State|Coppin State Eagles at Delaware State Hornets Basketball|Memorial Hall (Dover)|  4195|0.312|39.1932| -75.5463|Delaware State Hornets Basketball|Coppin State Eagles Basketball|NA|NA|  27|  35|    61|NCAA BB|College Basketball
ncaa_basketball|5853010|07:00 pm|2023-02-22|Fort Myers, FL|Lipscomb at FGCU|Lipscomb Bisons at Florida Gulf Coast Eagles Basketball|Alico Arena|  4252|0.311|26.4618| -81.7759|Florida Gulf Coast Eagles Basketball|Lipscomb Bisons Basketball|NA|NA|  27| 135|   183|NCAA BB|College Basketball
ncaa_basketball|5932163|07:00 pm|2023-02-28|Bangor, ME|Bryant at Maine|Bryant Bulldogs at Maine Black Bears Basketball|Cross Insurance Center| 53719|0.310|44.7882| -68.7782|Maine Black Bears Basketball|Bryant Bulldogs Basketball|NA|NA|  36|  39|    55|NCAA BB|College Basketball
ncaa_basketball|5849581|03:00 pm|2023-02-25|Spartanburg, SC|Gardner-Webb at USC Upstate|Gardner-Webb Runnin' Bulldogs at USC Upstate Spartans Basketball|G.B. Hodge Center|  5179|0.363|34.9439| -81.9289|USC Upstate Spartans Basketball|Gardner-Webb Runnin' Bulldogs Basketball|NA|NA|  60|  61|    61|NCAA BB|College Basketball
ncaa_basketball|5801340|02:30 pm|2023-03-04|Amherst, MA|St. Bonaventure at Massachusetts|St. Bonaventure Bonnies at UMass Minutemen Basketball|Mullins Center|  1352|0.417|42.3732| -72.5199|UMass Minutemen Basketball|St. Bonaventure Bonnies Basketball|NA|NA|  24|  61|   164|NCAA BB|College Basketball
ncaa_basketball|5880031|05:30 pm|2023-03-16|Fort Wayne, IN|NCAA Division III Basketball Championship|NCAA Division III Basketball Championship|Allen County War Memorial Coliseum|   331|0.363|41.1157| -85.1242|NCAA Division III Mens Basketball Championship|NA|NA|NA| 108| 110|   112|NCAA BB|College Basketball
ncaa_basketball|5937351|12:00 pm|2023-03-10|Fort Worth, TX|AAC Mens Basketball Tournament - Session 3|American Athletic Conference Mens Basketball Tournament - Session 3|Dickies Arena|460055|0.514|32.7414| -97.3688|American Athletic Conference Mens Basketball Tournament|NA|NA|NA|  54| 100|   564|NCAA BB|College Basketball
ncaa_basketball|5939127|11:00 am|2023-03-08|Las Vegas, NV|Mountain West Mens Basketball Tournament - Session 4|Mountain West Mens Basketball Tournament - Session 4|Thomas and Mack Center|   950|0.494|36.1052|-115.1440|Mountain West Mens Basketball Tournament	|NA|NA|NA|  40|  52|    86|NCAA BB|College Basketball
ncaa_basketball|5801294|06:00 pm|2023-03-03|St. Louis, MO|Dayton at Saint Louis|Dayton Flyers at Saint Louis Billikens Basketball|Chaifetz Arena|   775|0.463|38.6325| -90.2279|Saint Louis Billikens Basketball|Dayton Flyers Basketball|NA|NA|  25|  93|  1370|NCAA BB|College Basketball
ncaa_basketball|5805153|06:30 pm|2023-02-22|Storrs, CT|Providence at UConn|Providence Friars at UConn Huskies Basketball|Gampel Pavilion|  3472|0.581|41.8072| -72.2557|UConn Huskies Basketball|Providence Friars Basketball|NA|NA| 160| 217|   894|NCAA BB|College Basketball
ncaa_basketball|5937350|11:30 am|2023-03-09|Fort Worth, TX|AAC Mens Basketball Tournament - Session 1|American Athletic Conference Mens Basketball Tournament - Session 1|Dickies Arena|460055|0.493|32.7414| -97.3688|American Athletic Conference Mens Basketball Tournament|NA|NA|NA|  76|  86|   117|NCAA BB|College Basketball
ncaa_basketball|5937393|06:00 pm|2023-03-07|Henderson, NV|Big West Tournament - Session 2 (Men's First Round)|Big West Tournament - Session 2 (Men's First Round)|Dollar Loan Center|520000|0.361|36.0398|-115.1930|Big West Mens Basketball Tournament	|NA|NA|NA|  47|  77|   118|NCAA BB|College Basketball
ncaa_basketball|5922633|07:00 pm|2023-03-09|Atlantic City, NJ|MAAC Men's Basketball Tournament - Thursday|MAAC Men's Basketball Tournament - Thursday|Boardwalk Hall|    88|0.413|39.3549| -74.4384|MAAC Mens Basketball Tournament|NA|NA|NA|  43|  62|   107|NCAA BB|College Basketball
ncaa_basketball|5783008|03:30 am|2023-03-24|Louisville, KY|NCAA Mens Basketball  Tournament - South Regional - Session 1|NCAA Mens Basketball  Tournament - South Regional - Session 1|KFC Yum! Center|  4353|0.413|38.2572| -85.7540|NCAA Tournament - South Regional|NCAA Mens Basketball Tournament|NCAA Sweet 16|March Madness| 194| 389|  6440|NCAA BB|College Basketball
ncaa_basketball|5841532|07:00 pm|2023-02-25|Milwaukee, WI|Cleveland State at Milwaukee|Cleveland State Vikings at Milwaukee Panthers Basketball|UW-Milwaukee Panther Arena|  1921|0.413|43.0417| -87.9169|Milwaukee Panthers Basketball|Cleveland State Vikings Basketball|NA|NA|  23|  62|   191|NCAA BB|College Basketball
ncaa_basketball|5783005|03:30 am|2023-03-26|Kansas City, MO|NCAA Mens Basketball Tournament - Midwest Regional - Session 2|NCAA Mens Basketball Tournament - Midwest Regional - Session 2|T-Mobile Center|    84|0.412|39.0973| -94.5799|NCAA Tournament - Midwest Regional|NCAA Tournament Elite Eight|NCAA Mens Basketball Tournament|March Madness| 208| 387|  2462|NCAA BB|College Basketball
ncaa_basketball|5795594|08:00 pm|2023-03-01|Las Vegas, NV|Utah State at UNLV|Utah State Aggies at UNLV Rebels Basketball|Thomas and Mack Center|   950|0.412|36.1052|-115.1440|UNLV Rebels Basketball|Utah State Aggies Basketball|NA|NA|  18|  45|   327|NCAA BB|College Basketball
ncaa_basketball|5931715|06:00 pm|2023-02-25|Beaumont, TX|New Orleans at Lamar|New Orleans Privateers at Lamar Cardinals Basketball|Montagne Center|  4204|0.412|30.0439| -94.0708|Lamar Cardinals Basketball|New Orleans Privateers Basketball|NA|NA|  18|  27|    66|NCAA BB|College Basketball
ncaa_basketball|5782978|03:30 am|2023-03-17|Denver, CO|NCAA Mens Basketball Tournament - Denver - Session 1|NCAA Mens Basketball Tournament - Denver - Session 1|Ball Arena|   187|0.429|39.7487|-105.0080|NCAA Tournament First and Second Round|NCAA Mens Basketball Tournament|March Madness|NA| 132| 256|  2080|NCAA BB|College Basketball
ncaa_basketball|5921098|07:00 pm|2023-02-28|Akron, OH|Ball State at Akron|Ball State Cardinals at Akron Zips Basketball|James A. Rhodes Arena|  4141|0.343|41.0755| -81.5076|Akron Zips Basketball|Ball State Cardinals Basketball|NA|NA|  28|  73|   101|NCAA BB|College Basketball
ncaa_basketball|5918329|03:30 am|2023-03-03|Washington, DC|CAA Mens College Basketball Championship - All Sessions|CAA Mens College Basketball Championship - All Sessions|Entertainment & Sports Arena| 78365|0.358|38.8469| -76.9914|CAA Mens Basketball Tournament|NA|NA|NA| 212| 335|   846|NCAA BB|College Basketball
ncaa_basketball|5931078|03:00 pm|2023-02-25|Thibodaux, LA|Houston Christian at Nicholls|Houston Christian Huskies at Nicholls State Colonels Basketball|Stopher Gymnasium| 57703|0.371|29.7957| -90.8015|Nicholls State Colonels Basketball|Houston Christian Huskies Basketball|NA|NA|  31|  38|    68|NCAA BB|College Basketball
ncaa_basketball|5800972|08:00 pm|2023-02-28|Starkville, MS|South Carolina at Mississippi State|South Carolina Gamecocks at Mississippi State Bulldogs Basketball|Humphrey Coliseum|  3433|0.411|33.4595| -88.7896|Mississippi State Bulldogs Basketball|South Carolina Gamecocks Basketball|NA|NA|  18|  47|   233|NCAA BB|College Basketball
ncaa_basketball|5801339|03:30 am|2023-02-22|Amherst, MA|Dayton at Massachusetts|Dayton Flyers at UMass Minutemen Basketball|Mullins Center|  1352|0.410|42.3732| -72.5199|UMass Minutemen Basketball|Dayton Flyers Basketball|NA|NA|  17|  60|   142|NCAA BB|College Basketball
ncaa_basketball|5939125|03:30 am|2023-03-05|Las Vegas, NV|Mountain West Basketball Tournament - All Sessions|Mountain West Basketball Tournament - All Sessions|Thomas and Mack Center|   950|0.511|36.1052|-115.1440|Mountain West Mens Basketball Tournament	|Mountain West Womens Basketball Tournament|NA|NA| 180| 193|   239|NCAA BB|College Basketball
ncaa_basketball|5812427|05:00 pm|2023-03-04|Corvallis, OR|California at Oregon State|California Golden Bears at Oregon State Beavers Basketball|Gill Coliseum|  3465|0.482|44.5613|-123.2810|Oregon State Beavers Basketball|California Golden Bears Basketball|NA|NA|  16|  53|   129|NCAA BB|College Basketball
ncaa_basketball|5928388|02:00 pm|2023-03-04|Evansville, IN|Ohio Valley Conference Basketball Tournament - Women Session 7|Ohio Valley Conference Basketball Tournament - Women Session 7|Ford Center|  6370|0.384|37.9721| -87.5679|Ohio Valley Conference Womens Basketball Tournament|NA|NA|NA|  26|  43|   146|NCAA BB|College Basketball
ncaa_basketball|5932040|04:30 pm|2023-02-25|Huntsville, TX|Southern Utah at Sam Houston|Southern Utah Thunderbirds at Sam Houston Bearkats Basketball|Bernard G Johnson Coliseum|  1979|0.298|30.7124| -95.5498|Sam Houston Bearkats Basketball|Southern Utah Thunderbirds Basketball|NA|NA|  15|  15|    58|NCAA BB|College Basketball
ncaa_basketball|5938433|07:00 pm|2023-02-24|Lawrenceville, NJ|Siena at Rider|Siena Saints at Rider Broncs Basketball|Alumni Gym at Rider University|  5166|0.357|40.2795| -74.7321|Rider Broncs Basketball|Siena Saints Basketball|NA|NA|  13|  29|    51|NCAA BB|College Basketball
ncaa_basketball|5866277|05:00 pm|2023-03-05|Pensacola, FL|Sun Belt Basketball Conference Championships - Session 12|Sun Belt Basketball Conference Championships - Session 12|Pensacola Bay Center|   948|0.405|30.4164| -87.2089|Sun Belt Mens Basketball Tournament|NA|NA|NA|  37|  51|   310|NCAA BB|College Basketball
ncaa_basketball|5750954|07:00 pm|2023-02-22|Statesboro, GA|Coastal Carolina at Georgia Southern|Coastal Carolina Chanticleers at Georgia Southern Eagles Basketball|Hanner Fieldhouse|  4216|0.294|32.4272| -81.7799|Georgia Southern Eagles Basketball|Coastal Carolina Chanticleers Basketball|NA|NA|  15|  38|    58|NCAA BB|College Basketball
ncaa_basketball|5783007|03:30 am|2023-03-26|Louisville, KY|NCAA Mens Basketball Tournament - South Regional - Session 2|NCAA Mens Basketball Tournament - South Regional - Session 2|KFC Yum! Center|  4353|0.404|38.2572| -85.7540|NCAA Tournament - South Regional|NCAA Mens Basketball Tournament|NCAA Tournament Elite Eight|March Madness| 172| 341|  6440|NCAA BB|College Basketball
ncaa_basketball|5926507|12:00 pm|2023-03-05|Washington, DC|CAA Mens College Basketball Championship - Quarterfinals|CAA Mens College Basketball Championship - Quarterfinals|Entertainment & Sports Arena| 78365|0.356|38.8469| -76.9914|CAA Mens Basketball Tournament|NA|NA|NA|  45|  83|   520|NCAA BB|College Basketball
ncaa_basketball|5937342|06:00 pm|2023-03-04|Charlotte, NC|Big South Basketball Tournament - Women's Semifinals|Big South Basketball Tournament - Women's Semifinals|Bojangles Coliseum|  1064|0.381|35.2051| -80.7952|Big South Basketball Tournament|NA|NA|NA|  37|  55|   185|NCAA BB|College Basketball
ncaa_basketball|5811673|03:30 am|2023-02-26|Murray, KY|Valparaiso at Murray State|Valparaiso Beacons at Murray State Racers Basketball|CFSB Center|  4142|0.402|36.6103| -88.3148|Murray State Racers Basketball|Valparaiso Beacons Basketball|NA|NA|  42|  70|   252|NCAA BB|College Basketball
