league|id|time|date|city|title|full|venue|ven_id|score|lat|long|t1|t2|t3|t4|low|med|high|name|xname
ncaa_basketball|5792030|07:30 pm|2022-12-17|Iowa City, IA|Southeast Missouri State at Iowa|Southeast Missouri State Redhawks Basketball at Iowa Hawkeyes Basketball|Carver-Hawkeye Arena|  3467|0.485|41.6639| -91.5545|Iowa Hawkeyes Basketball|Southeast Missouri State Redhawks Basketball|NA|NA|  10|  58|   403|NCAA BB|College Basketball
ncaa_basketball|5811474|03:30 am|2023-01-14|Des Moines, IA|Bradley at Drake|Bradley Braves at Drake Bulldogs Basketball|Drake Knapp Center|  5165|0.484|41.6041| -93.6516|Drake Bulldogs Basketball|Bradley Braves Basketball|NA|NA|  24|  36|    75|NCAA BB|College Basketball
ncaa_basketball|5812437|05:00 pm|2022-12-31|Eugene, OR|Oregon State at Oregon|Oregon State Beavers Basketball at Oregon Ducks Basketball|Matthew Knight Arena|  3454|0.483|44.0449|-123.0660|Oregon Ducks Basketball|Oregon State Beavers Basketball|NA|NA|  22|  59|   868|NCAA BB|College Basketball
ncaa_basketball|5800889|07:00 pm|2022-12-21|Baton Rouge, LA|East Tennessee State Buccaneers at LSU Tigers Basketball|East Tennessee State Buccaneers at LSU Tigers Basketball|Pete Maravich Assembly Center|  3480|0.483|30.4173| -91.1856|LSU Tigers Basketball|East Tennessee State Buccaneers Basketball|NA|NA|   8|  17|    86|NCAA BB|College Basketball
ncaa_basketball|5816608|12:30 pm|2022-12-17|Springfield, MA|Hall of Fame Classic: UMass vs North Texas & Bryant vs Liberty|Hall of Fame Classic: UMass vs North Texas & Bryant vs Liberty|MassMutual Center|  3594|0.483|42.1018| -72.5874|Hall of Fame Classic|Bryant Bulldogs Basketball|Liberty Flames Basketball|North Texas Mean Green Basketball|  18|  42|   187|NCAA BB|College Basketball
ncaa_basketball|5744084|01:00 pm|2022-12-17|Pittsburgh, PA|North Florida at Pittsburgh|North Florida Ospreys at Pittsburgh Panthers Basketball|Petersen Events Center|  1658|0.482|40.4432| -79.9616|Pittsburgh Panthers Basketball|North Florida Ospreys Basketball|NA|NA|  11|  25|   111|NCAA BB|College Basketball
ncaa_basketball|5805188|03:30 am|2023-01-15|Cincinnati, OH|Marquette Golden Eagles at Xavier Musketeers Basketball|Marquette Golden Eagles at Xavier Musketeers Basketball|Cintas Center|  3431|0.525|39.1504| -84.4719|Xavier Musketeers Basketball|Marquette Golden Eagles Basketball|NA|NA|  37|  70|   250|NCAA BB|College Basketball
ncaa_basketball|5766013|07:30 pm|2022-12-29|Champaign, IL|Bethune-Cookman at Illinois|Bethune-Cookman Wildcats at Illinois Fighting Illini Basketball|State Farm Center|   921|0.482|40.0962| -88.2359|Illinois Fighting Illini Basketball|Bethune-Cookman Wildcats Basketball|NA|NA|  31|  44|   295|NCAA BB|College Basketball
ncaa_basketball|5807634|09:00 pm|2023-01-04|Blacksburg, VA|Clemson at Virginia Tech|Clemson Tigers at Virginia Tech Hokies Basketball|Cassell Coliseum|  3460|0.481|37.2230| -80.4196|Virginia Tech Hokies Basketball|Clemson Tigers Basketball|NA|NA|  19|  49|   137|NCAA BB|College Basketball
ncaa_basketball|5817804|11:00 am|2023-01-07|Stillwater, OK|Texas at Oklahoma State|Texas Longhorns at Oklahoma State Cowboys Basketball|Gallagher-Iba Arena|  3439|0.481|36.1257| -97.0651|Oklahoma State Cowboys Basketball|Texas Longhorns Basketball|NA|NA|  28|  53|   355|NCAA BB|College Basketball
ncaa_basketball|5757230|04:00 pm|2022-12-17|Philadelphia, PA|Villanova at Saint Josephs|Villanova Wildcats at Saint Josephs Hawks Basketball|Michael J. Hagan '85 Arena|  3478|0.522|39.9957| -75.2351|Saint Josephs Hawks Basketball|Villanova Wildcats Basketball|NA|NA|  80| 135|   293|NCAA BB|College Basketball
ncaa_basketball|5807530|08:00 pm|2023-01-14|Chestnut Hill, MA|Wake Forest at Boston College|Wake Forest Demon Deacons at Boston College Eagles Basketball|Silvio O. Conte Forum|  3488|0.480|42.3351| -71.1677|Boston College Eagles Basketball|Wake Forest Demon Deacons Basketball|NA|NA|  13|  27|   167|NCAA BB|College Basketball
ncaa_basketball|5768322|06:30 pm|2022-12-22|Minneapolis, MN|Chicago State Cougars at Minnesota Golden Gophers Basketball|Chicago State Cougars at Minnesota Golden Gophers Basketball|Williams Arena|  3423|0.480|44.9769| -93.2284|Minnesota Golden Gophers Basketball|Chicago State Cougars Basketball|NA|NA|  14|  40|    97|NCAA BB|College Basketball
ncaa_basketball|5759142|12:00 pm|2022-12-17|Piscataway, NJ|Wake Forest at Rutgers|Wake Forest Demon Deacons at Rutgers Scarlet Knights Basketball|Jersey Mike's Arena|  3447|0.496|40.5252| -74.4414|Rutgers Scarlet Knights Basketball|Wake Forest Demon Deacons Basketball|NA|NA|  44|  58|   193|NCAA BB|College Basketball
ncaa_basketball|5800854|06:30 pm|2023-01-04|Athens, GA|Auburn at Georgia|Auburn Tigers at Georgia Bulldogs Basketball|Stegeman Coliseum|  3482|0.479|33.9425| -83.3779|Georgia Bulldogs Basketball|Auburn Tigers Basketball|NA|NA|  37|  98|   246|NCAA BB|College Basketball
ncaa_basketball|5768074|08:00 pm|2023-01-05|San Francisco, CA|Gonzaga at San Francisco|Gonzaga Bulldogs at San Francisco Dons Basketball|War Memorial At The Sobrato Center| 39291|0.479|37.7766|-122.4510|San Francisco Dons Basketball|Gonzaga Bulldogs Basketball|NA|NA| 129| 331|   664|NCAA BB|College Basketball
ncaa_basketball|5795544|08:00 pm|2023-01-10|San Diego, CA|Nevada at San Diego State|Nevada Wolf Pack at San Diego State Aztecs Basketball|Viejas Arena at Aztec Bowl|  1328|0.479|32.7745|-117.0750|San Diego State Aztecs Basketball|Nevada Wolf Pack Basketball|NA|NA|  20|  84|   627|NCAA BB|College Basketball
ncaa_basketball|5807714|12:00 pm|2022-12-31|Winston-Salem, NC|Virginia Tech at Wake Forest|Virginia Tech Hokies at Wake Forest Demon Deacons Basketball|Lawrence Joel Veterans Memorial Coliseum|  1515|0.479|36.1277| -80.2575|Wake Forest Demon Deacons Basketball|Virginia Tech Hokies Basketball|NA|NA|  25|  62|   240|NCAA BB|College Basketball
ncaa_basketball|5748777|05:00 pm|2022-12-18|Morgantown, WV|Buffalo Bulls at West Virginia Mountaineers Basketball|Buffalo Bulls at West Virginia Mountaineers Basketball|WVU Coliseum|  3288|0.479|39.6493| -79.9815|West Virginia Mountaineers Basketball|Buffalo Bulls Basketball|NA|NA|  19|  37|   395|NCAA BB|College Basketball
ncaa_basketball|5805129|08:00 pm|2023-01-10|Chicago, IL|Villanova at DePaul|Villanova Wildcats at DePaul Blue Demons Basketball|Wintrust Arena|425897|0.479|41.8537| -87.6213|DePaul Blue Demons Basketball|Villanova Wildcats Basketball|NA|NA|  20|  79|   876|NCAA BB|College Basketball
ncaa_basketball|5825324|07:00 pm|2022-12-12|San Diego, CA|Kennesaw State at San Diego State|Kennesaw State Owls at San Diego State Aztecs Basketball|Viejas Arena at Aztec Bowl|  1328|0.478|32.7745|-117.0750|San Diego State Aztecs Basketball|Kennesaw State Owls Basketball|NA|NA|   9|  42|   594|NCAA BB|College Basketball
ncaa_basketball|5817748|06:00 pm|2023-01-07|Lubbock, TX|Oklahoma at Texas Tech|Oklahoma Sooners at Texas Tech Red Raiders Basketball|United Supermarkets Arena|  3484|0.478|33.5813|-101.8870|Texas Tech Red Raiders Basketball|Oklahoma Sooners Basketball|NA|NA|  54| 251|   656|NCAA BB|College Basketball
ncaa_basketball|5760656|06:30 pm|2022-12-13|Raleigh, NC|Furman at North Carolina State|Furman Paladins at NC State Wolfpack Basketball|PNC Arena|  1430|0.478|35.8033| -78.7218|NC State Wolfpack Basketball|Furman Paladins Basketball|NA|NA|  16|  36|    78|NCAA BB|College Basketball
ncaa_basketball|5795542|08:00 pm|2022-12-28|San Diego, CA|Air Force at San Diego State|Air Force Falcons at San Diego State Aztecs Basketball|Viejas Arena at Aztec Bowl|  1328|0.478|32.7745|-117.0750|San Diego State Aztecs Basketball|Air Force Falcons Basketball|NA|NA|  19|  81|   627|NCAA BB|College Basketball
ncaa_basketball|5766042|04:00 pm|2022-12-17|Provo, UT|Utah Utes at BYU Cougars Basketball|Utah Utes at BYU Cougars Basketball|Marriott Center|  4134|0.476|40.2541|-111.6490|BYU Cougars Basketball|Utah Utes Basketball|NA|NA|  28|  68|   440|NCAA BB|College Basketball
ncaa_basketball|5805218|06:30 pm|2023-01-04|Washington, DC|Villanova at Georgetown|Villanova Wildcats at Georgetown Hoyas Basketball|Capital One Arena|   181|0.607|38.8981| -77.0209|Georgetown Hoyas Basketball|Villanova Wildcats Basketball|NA|NA|  55| 124| 13320|NCAA BB|College Basketball
ncaa_basketball|5800899|06:00 pm|2023-01-18|Baton Rouge, LA|Auburn Tigers at LSU Tigers Basketball|Auburn Tigers at LSU Tigers Basketball|Pete Maravich Assembly Center|  3480|0.518|30.4173| -91.1856|LSU Tigers Basketball|Auburn Tigers Basketball|NA|NA|  14|  54|   338|NCAA BB|College Basketball
ncaa_basketball|5801131|07:00 pm|2022-12-28|Dayton, OH|Duquesne at Dayton|Duquesne Dukes at Dayton Flyers Basketball|University of Dayton Arena|  3463|0.475|39.7355| -84.1995|Dayton Flyers Basketball|Duquesne Dukes Basketball|NA|NA|  29| 101|   631|NCAA BB|College Basketball
ncaa_basketball|5846041|02:00 pm|2023-01-08|Annapolis, MD|Lehigh at Navy|Lehigh Mountain Hawks at Navy Midshipmen Basketball|Alumni Hall - Navy|  4146|0.475|38.9836| -76.4878|Navy Midshipmen Basketball|Lehigh Mountain Hawks Basketball|NA|NA|  31|  38|    66|NCAA BB|College Basketball
ncaa_basketball|5803252|05:30 pm|2023-01-01|University Park, PA|Iowa at Penn State|Iowa Hawkeyes at Penn State Nittany Lions Basketball|Bryce Jordan Center|   108|0.474|40.8099| -77.8562|Penn State Nittany Lions Basketball|Iowa Hawkeyes Basketball|NA|NA|  28|  47|   551|NCAA BB|College Basketball
ncaa_basketball|5811472|03:30 am|2023-01-07|Des Moines, IA|Murray State at Drake|Murray State Racers at Drake Bulldogs Basketball|Drake Knapp Center|  5165|0.474|41.6041| -93.6516|Drake Bulldogs Basketball|Murray State Racers Basketball|NA|NA|  23|  35|    74|NCAA BB|College Basketball
ncaa_basketball|5817374|03:30 pm|2023-01-01|Philadelphia, PA|Cincinnati at Temple|Cincinnati Bearcats at Temple Owls Basketball|Liacouras Center|  3430|0.473|39.9799| -75.1586|Temple Owls Basketball|Cincinnati Bearcats Basketball|NA|NA|  21|  61|   258|NCAA BB|College Basketball
ncaa_basketball|5812384|01:00 pm|2022-12-31|Stanford, CA|Utah Utes at Stanford Cardinal Basketball|Utah Utes at Stanford Cardinal Basketball|Maples Pavilion|  3468|0.473|37.4296|-122.1610|Stanford Cardinal Basketball|Utah Utes Basketball|NA|NA|  35|  38|    90|NCAA BB|College Basketball
ncaa_basketball|5812547|07:00 pm|2022-12-30|Seattle, WA|USC at Washington|USC Trojans at Washington Huskies Basketball|Alaska Airlines Arena at Hec Edmundson Pavilion|  3440|0.473|47.6521|-122.3020|Washington Huskies Basketball|USC Trojans Basketball|NA|NA|  27|  53|   360|NCAA BB|College Basketball
ncaa_basketball|5817834|03:30 am|2022-12-31|Manhattan, KS|West Virginia at Kansas State|West Virginia Mountaineers at Kansas State Wildcats Basketball|Bramlage Coliseum|  3464|0.473|39.2004| -96.5938|Kansas State Wildcats Basketball|West Virginia Mountaineers Basketball|NA|NA|  34|  75|   190|NCAA BB|College Basketball
ncaa_basketball|5807680|07:00 pm|2023-01-10|Notre Dame, IN|Georgia Tech at Notre Dame|Georgia Tech Yellow Jackets at Notre Dame Fighting Irish Basketball|Purcell Pavilion at the Joyce Center|  3453|0.472|41.6972| -86.2313|Notre Dame Fighting Irish Basketball|Georgia Tech Yellow Jackets Basketball|NA|NA|  30|  53|   132|NCAA BB|College Basketball
ncaa_basketball|5800930|12:00 pm|2023-01-14|Oxford, MS|Georgia at Ole Miss|Georgia Bulldogs at Ole Miss Rebels Basketball|The Pavilion at Ole Miss|149274|0.515|34.2742| -89.5270|Ole Miss Rebels Basketball|Georgia Bulldogs Basketball|NA|NA|  27|  78|   388|NCAA BB|College Basketball
ncaa_basketball|5801296|02:00 pm|2022-12-31|Richmond, VA|La Salle at VCU|La Salle Explorers at VCU Rams Basketball|Stuart C. Siegel Center|  6625|0.472|37.5407| -77.4361|VCU Rams Basketball|La Salle Explorers Basketball|NA|NA|  48|  63|   188|NCAA BB|College Basketball
ncaa_basketball|5803330|03:00 pm|2022-12-29|Columbus, OH|Alabama A&M at Ohio State|Alabama A&M Bulldogs at Ohio State Buckeyes Basketball|Value City Arena at Schottenstein Center|    99|0.472|40.0077| -83.0251|Ohio State Buckeyes Basketball|Alabama A&M Bulldogs Basketball|NA|NA|  12|  45| 12654|NCAA BB|College Basketball
ncaa_basketball|5800885|06:00 pm|2022-12-17|Baton Rouge, LA|Winthrop Eagles at LSU Tigers Basketball|Winthrop Eagles at LSU Tigers Basketball|Pete Maravich Assembly Center|  3480|0.471|30.4173| -91.1856|LSU Tigers Basketball|Winthrop Eagles Basketball|NA|NA|   7|  13|   102|NCAA BB|College Basketball
ncaa_basketball|5812465|07:00 pm|2022-12-29|Berkeley, CA|Utah Utes at California Golden Bears Basketball|Utah Utes at California Golden Bears Basketball|Haas Pavilion|  3436|0.469|37.8694|-122.2620|California Golden Bears Basketball|Utah Utes Basketball|NA|NA|  24|  65|   393|NCAA BB|College Basketball
ncaa_basketball|5751164|06:30 pm|2022-12-14|Oxford, MS|UCF at Ole Miss|UCF Knights at Ole Miss Rebels Basketball|The Pavilion at Ole Miss|149274|0.468|34.2742| -89.5270|Ole Miss Rebels Basketball|UCF Knights Basketball|NA|NA|   7|  22|    92|NCAA BB|College Basketball
ncaa_basketball|5805170|08:30 pm|2022-12-20|Cincinnati, OH|Seton Hall at Xavier|Seton Hall Pirates at Xavier Musketeers Basketball|Cintas Center|  3431|0.468|39.1504| -84.4719|Xavier Musketeers Basketball|Seton Hall Pirates Basketball|NA|NA|  16|  30|   262|NCAA BB|College Basketball
ncaa_basketball|5759158|08:00 pm|2022-12-20|Evanston, IL|UIC at Northwestern|UIC Flames at Northwestern Wildcats Basketball|Welsh-Ryan Arena|  3445|0.468|42.0668| -87.6925|Northwestern Wildcats Basketball|UIC Flames Basketball|NA|NA|   8|  16|    74|NCAA BB|College Basketball
ncaa_basketball|5805083|02:00 pm|2022-12-31|Villanova, PA|Marquette Golden Eagles at Villanova Wildcats Basketball|Marquette Golden Eagles at Villanova Wildcats Basketball|Finneran Pavilion|  3424|0.603|40.0345| -75.3365|Villanova Wildcats Basketball|Marquette Golden Eagles Basketball|NA|NA| 298| 338|   537|NCAA BB|College Basketball
ncaa_basketball|5792031|07:00 pm|2022-12-21|Iowa City, IA|Eastern Illinois at Iowa|Eastern Illinois Panthers Basketball at Iowa Hawkeyes Basketball|Carver-Hawkeye Arena|  3467|0.468|41.6639| -91.5545|Iowa Hawkeyes Basketball|Eastern Illinois Panthers Basketball|NA|NA|  10|  54|   403|NCAA BB|College Basketball
ncaa_basketball|5817120|03:00 pm|2023-01-08|Cincinnati, OH|Houston at Cincinnati|Houston Cougars at Cincinnati Bearcats Basketball|Fifth Third Arena|  3457|0.512|39.1312| -84.5141|Cincinnati Bearcats Basketball|Houston Cougars Basketball|NA|NA|  52|  87|   457|NCAA BB|College Basketball
ncaa_basketball|5812443|06:00 pm|2023-01-12|Eugene, OR|Arizona State at Oregon|Arizona State Sun Devils at Oregon Ducks Basketball|Matthew Knight Arena|  3454|0.467|44.0449|-123.0660|Oregon Ducks Basketball|Arizona State Sun Devils Basketball|NA|NA|  23|  58|   225|NCAA BB|College Basketball
ncaa_basketball|5807442|08:00 pm|2022-12-13|Tuscaloosa, AL|Memphis at Alabama|Memphis Tigers at Alabama Crimson Tide Basketball|Coleman Coliseum|  3444|0.467|33.2027| -87.5397|Alabama Crimson Tide Basketball|Memphis Tigers Basketball|NA|NA|  14|  36|   309|NCAA BB|College Basketball
ncaa_basketball|5803322|08:00 pm|2023-01-11|Evanston, IL|Rutgers at Northwestern|Rutgers Scarlet Knights at Northwestern Wildcats Basketball|Welsh-Ryan Arena|  3445|0.466|42.0668| -87.6925|Northwestern Wildcats Basketball|Rutgers Scarlet Knights Basketball|NA|NA|  20|  54|   132|NCAA BB|College Basketball
ncaa_basketball|5817836|06:00 pm|2023-01-10|Manhattan, KS|Oklahoma State at Kansas State|Oklahoma State Cowboys at Kansas State Wildcats Basketball|Bramlage Coliseum|  3464|0.466|39.2004| -96.5938|Kansas State Wildcats Basketball|Oklahoma State Cowboys Basketball|NA|NA|  32|  69|   184|NCAA BB|College Basketball
ncaa_basketball|5817318|07:00 pm|2022-12-22|Wichita, KS|Texas Southern at Wichita State|Texas Southern Tigers at Wichita State Shockers Basketball|Charles Koch Arena|  5140|0.466|37.7215| -97.2862|Wichita State Shockers Basketball|Texas Southern Tigers Basketball|NA|NA|  19|  78|   143|NCAA BB|College Basketball
ncaa_basketball|5803394|06:00 pm|2023-01-08|Philadelphia, PA|Purdue at Penn State|Purdue Boilermakers vs Penn State Nittany Lions Basketball|The Palestra|  3490|0.466|39.9514| -75.1887|Penn State Nittany Lions Basketball|Purdue Boilermakers Basketball|NA|NA|  85| 163|   442|NCAA BB|College Basketball
ncaa_basketball|5805172|07:00 pm|2022-12-27|Milwaukee, WI|Seton Hall Pirates at Marquette Golden Eagles Basketball|Seton Hall Pirates at Marquette Golden Eagles Basketball|Fiserv Forum|435592|0.479|43.0417| -87.9162|Marquette Golden Eagles Basketball|Seton Hall Pirates Basketball|NA|NA|  13|  85|   670|NCAA BB|College Basketball
ncaa_basketball|5812488|07:30 pm|2023-01-07|Boulder, CO|Oregon State at Colorado|Oregon State Beavers at Colorado Buffaloes Basketball|CU Events Center|  3427|0.466|40.0048|-105.2620|Colorado Buffaloes Basketball|Oregon State Beavers Basketball|NA|NA|  39|  78|   271|NCAA BB|College Basketball
ncaa_basketball|5791196|04:00 pm|2022-12-17|Cincinnati, OH|La Salle at Cincinnati|La Salle Explorers at Cincinnati Bearcats Basketball|Fifth Third Arena|  3457|0.465|39.1312| -84.5141|Cincinnati Bearcats Basketball|La Salle Explorers Basketball|NA|NA|  12|  17|    31|NCAA BB|College Basketball
ncaa_basketball|5816901|06:00 pm|2023-01-18|College Station, TX|Florida at Texas A&M|Florida Gators at Texas A&M Aggies Basketball|Reed Arena|  1879|0.465|30.6056| -96.3469|Texas A&M Aggies Basketball|Florida Gators Basketball|NA|NA|   8|  50|  2982|NCAA BB|College Basketball
ncaa_basketball|5812340|06:00 pm|2023-01-12|Los Angeles, CA|Colorado at USC|Colorado Buffaloes at USC Trojans Basketball|Galen Center|  3451|0.465|34.0208|-118.2800|USC Trojans Basketball|Colorado Buffaloes Basketball|NA|NA|  44|  69|   167|NCAA BB|College Basketball
ncaa_basketball|5773024|06:00 pm|2022-12-21|Knoxville, TN|Austin Peay at Tennessee|Austin Peay Governors at Tennessee Volunteers Basketball|Thompson-Boling Arena|   461|0.465|35.9507| -83.9252|Tennessee Volunteers Basketball|Austin Peay Governors Basketball|NA|NA|   8|  38|  6330|NCAA BB|College Basketball
ncaa_basketball|5817726|08:00 pm|2023-01-03|Austin, TX|Kansas State at Texas|Kansas State Wildcats at Texas Longhorns Basketball|Moody Center ATX|518721|0.600|30.2805| -97.7318|Texas Longhorns Basketball|Kansas State Wildcats Basketball|NA|NA|  67| 131|   598|NCAA BB|College Basketball
ncaa_basketball|5805123|07:00 pm|2022-12-29|Chicago, IL|Georgetown at DePaul|Georgetown Hoyas at DePaul Blue Demons Basketball|Wintrust Arena|425897|0.508|41.8537| -87.6213|DePaul Blue Demons Basketball|Georgetown Hoyas Basketball|NA|NA|   6|  54|  1377|NCAA BB|College Basketball
ncaa_basketball|5817699|05:00 pm|2023-01-07|Waco, TX|Kansas State at Baylor|Kansas State Wildcats at Baylor Bears Basketball|Ferrell Center|  3471|0.464|31.5495| -97.1052|Baylor Bears Basketball|Kansas State Wildcats Basketball|NA|NA|  21|  65|   487|NCAA BB|College Basketball
ncaa_basketball|5811470|08:00 pm|2022-12-29|Des Moines, IA|Valparaiso at Drake|Valparaiso Beacons at Drake Bulldogs Basketball|Drake Knapp Center|  5165|0.462|41.6041| -93.6516|Drake Bulldogs Basketball|Valparaiso Beacons Basketball|NA|NA|  18|  36|    64|NCAA BB|College Basketball
ncaa_basketball|5759144|05:00 pm|2022-12-23|Piscataway, NJ|Bucknell at Rutgers|Bucknell Bison at Rutgers Scarlet Knights Basketball|Jersey Mike's Arena|  3447|0.462|40.5252| -74.4414|Rutgers Scarlet Knights Basketball|Bucknell Bison Basketball|NA|NA|  33|  58|   137|NCAA BB|College Basketball
ncaa_basketball|5817706|05:00 pm|2023-01-14|Waco, TX|Oklahoma State at Baylor|Oklahoma State Cowboys at Baylor Bears Basketball|Ferrell Center|  3471|0.462|31.5495| -97.1052|Baylor Bears Basketball|Oklahoma State Cowboys Basketball|NA|NA|  24|  78|   530|NCAA BB|College Basketball
ncaa_basketball|5805184|07:00 pm|2023-01-11|Cincinnati, OH|Creighton at Xavier|Creighton Bluejays at Xavier Musketeers Basketball|Cintas Center|  3431|0.507|39.1504| -84.4719|Xavier Musketeers Basketball|Creighton Bluejays Basketball|NA|NA|  32|  65|   284|NCAA BB|College Basketball
ncaa_basketball|5817310|07:00 pm|2022-12-13|Wichita, KS|Mississippi Valley State at Wichita State|Mississippi Valley State Delta Devils at Wichita State Shockers Basketball|Charles Koch Arena|  5140|0.462|37.7215| -97.2862|Wichita State Shockers Basketball|Mississippi Valley State Delta Devils Basketball|NA|NA|  15|  78|   141|NCAA BB|College Basketball
ncaa_basketball|5817376|02:00 pm|2023-01-07|Philadelphia, PA|Tulane at Temple|Tulane Green Wave at Temple Owls Basketball|Liacouras Center|  3430|0.460|39.9799| -75.1586|Temple Owls Basketball|Tulane Green Wave Basketball|NA|NA|  20|  60|   258|NCAA BB|College Basketball
ncaa_basketball|5805190|08:00 pm|2023-01-18|Milwaukee, WI|Providence Friars at Marquette Golden Eagles Basketball|Providence Friars at Marquette Golden Eagles Basketball|Fiserv Forum|435592|0.460|43.0417| -87.9162|Marquette Golden Eagles Basketball|Providence Friars Basketball|NA|NA|  10|  93|   661|NCAA BB|College Basketball
ncaa_basketball|5807518|06:30 pm|2022-12-21|Chestnut Hill, MA|Virginia Tech at Boston College|Virginia Tech Hokies at Boston College Eagles Basketball|Silvio O. Conte Forum|  3488|0.459|42.3351| -71.1677|Boston College Eagles Basketball|Virginia Tech Hokies Basketball|NA|NA|   8|  15|    57|NCAA BB|College Basketball
ncaa_basketball|5812521|05:00 pm|2023-01-07|Salt Lake City, UT|Oregon Ducks at Utah Utes Basketball|Oregon Ducks at Utah Utes Basketball|Jon M. Huntsman Center|  4255|0.459|40.7621|-111.8390|Utah Utes Basketball|Oregon Ducks Basketball|NA|NA|  17|  48|   527|NCAA BB|College Basketball
ncaa_basketball|5791308|12:00 pm|2022-12-17|Coral Gables, FL|Saint Francis U at Miami (FL)|Saint Francis (PA) Red Flash at Miami Hurricanes Basketball|Watsco Center|  2057|0.459|25.7148| -80.2789|Miami Hurricanes Basketball|Saint Francis (PA) Red Flash Basketball|NA|NA|   8|  13|   638|NCAA BB|College Basketball
ncaa_basketball|5795580|08:00 pm|2023-01-11|Las Vegas, NV|Boise State Broncos at UNLV Rebels Basketball|Boise State Broncos at UNLV Rebels Basketball|Thomas and Mack Center|   950|0.459|36.1052|-115.1440|UNLV Rebels Basketball|Boise State Broncos Basketball|NA|NA|  26|  44|   466|NCAA BB|College Basketball
ncaa_basketball|5791310|08:00 pm|2022-12-28|Coral Gables, FL|Vermont at Miami (FL)|Vermont Catamounts at Miami Hurricanes Basketball|Watsco Center|  2057|0.458|25.7148| -80.2789|Miami Hurricanes Basketball|Vermont Catamounts Basketball|NA|NA|   9|  14|   503|NCAA BB|College Basketball
ncaa_basketball|5748779|06:00 pm|2022-12-22|Morgantown, WV|Stony Brook at West Virginia|Stony Brook Seawolves at West Virginia Mountaineers Basketball|WVU Coliseum|  3288|0.458|39.6493| -79.9815|West Virginia Mountaineers Basketball|Stony Brook Seawolves Basketball|NA|NA|  19|  36|   290|NCAA BB|College Basketball
ncaa_basketball|5812382|08:00 pm|2022-12-29|Stanford, CA|Colorado at Stanford|Colorado Buffaloes at Stanford Cardinal Basketball|Maples Pavilion|  3468|0.457|37.4296|-122.1610|Stanford Cardinal Basketball|Colorado Buffaloes Basketball|NA|NA|  27|  37|    67|NCAA BB|College Basketball
ncaa_basketball|5817216|02:00 pm|2023-01-01|Dallas, TX|Tulsa at SMU|Tulsa Golden Hurricane at SMU Mustangs Basketball|Moody Coliseum|  3452|0.457|32.8420| -96.7825|SMU Mustangs Basketball|Tulsa Golden Hurricane Basketball|NA|NA|  14|  34|   359|NCAA BB|College Basketball
ncaa_basketball|5817204|06:00 pm|2023-01-19|Memphis, TN|Wichita State at Memphis|Wichita State Shockers at Memphis Tigers Basketball|FedExForum|  1243|0.457|35.1383| -90.0522|Memphis Tigers Basketball|Wichita State Shockers Basketball|NA|NA|  11|  84|   299|NCAA BB|College Basketball
ncaa_basketball|5797955|03:30 pm|2022-12-17|Indianapolis, IN|Ball State at Purdue|Indy Classic: Purdue vs Davidson & Ball State vs Illinois State|Gainbridge Fieldhouse|   121|0.596|39.7640| -86.1556|Purdue Boilermakers Basketball|Illinois State Redbirds Basketball|Ball State Cardinals Basketball|NA|  89| 145| 12273|NCAA BB|College Basketball
ncaa_basketball|5766027|04:00 pm|2022-12-17|Blacksburg, VA|Grambling State at Virginia Tech|Grambling Tigers at Virginia Tech Hokies Basketball|Cassell Coliseum|  3460|0.456|37.2230| -80.4196|Virginia Tech Hokies Basketball|Grambling Tigers Basketball|NA|NA|   8|  44|   175|NCAA BB|College Basketball
ncaa_basketball|5817742|06:00 pm|2023-01-04|Norman, OK|Iowa State at Oklahoma|Iowa State Cyclones at Oklahoma Sooners Basketball|Lloyd Noble Center|  3426|0.456|35.1873| -97.4443|Oklahoma Sooners Basketball|Iowa State Cyclones Basketball|NA|NA|  25|  64|   148|NCAA BB|College Basketball
ncaa_basketball|5767911|07:00 pm|2022-12-31|Provo, UT|Portland at BYU|Portland Pilots at BYU Cougars Basketball|Marriott Center|  4134|0.456|40.2541|-111.6490|BYU Cougars Basketball|Portland Pilots Basketball|NA|NA|  13|  31|   360|NCAA BB|College Basketball
ncaa_basketball|5866324|07:00 pm|2023-01-05|Fort Wayne, IN|Green Bay at Purdue Fort Wayne|Green Bay Phoenix at Purdue Fort Wayne Mastodons Basketball|Allen County War Memorial Coliseum|   331|0.455|41.1157| -85.1242|Purdue Fort Wayne Mastodons Basketball|Green Bay Phoenix Basketball|NA|NA|  20|  45|   276|NCAA BB|College Basketball
ncaa_basketball|5800952|08:00 pm|2022-12-28|Starkville, MS|Alabama at Mississippi State|Alabama Crimson Tide at Mississippi State Bulldogs Basketball|Humphrey Coliseum|  3433|0.455|33.4595| -88.7896|Mississippi State Bulldogs Basketball|Alabama Crimson Tide Basketball|NA|NA|  34|  48|   384|NCAA BB|College Basketball
ncaa_basketball|5759146|08:00 pm|2022-12-30|Piscataway, NJ|Coppin State at Rutgers|Coppin State Eagles at Rutgers Scarlet Knights Basketball|Jersey Mike's Arena|  3447|0.455|40.5252| -74.4414|Rutgers Scarlet Knights Basketball|Coppin State Eagles Basketball|NA|NA|  24|  62|   141|NCAA BB|College Basketball
