league|id|time|date|city|title|full|venue|ven_id|score|lat|long|t1|t2|t3|t4|low|med|high|name|xname
nfl|6164984|03:30 pm|2024-02-11|Las Vegas, NV|Super Bowl LVIII: Chiefs vs 49ers|Super Bowl LVIII: Kansas City Chiefs vs San Francisco 49ers|Allegiant Stadium|514837|1.000|36.0909|-115.1830|Super Bowl|San Francisco 49ers|Kansas City Chiefs|NA|7780|9819| 36352|NFL|NFL Football
nba|6121065|02:00 pm|2024-02-11|Miami, FL|Celtics at Heat|Boston Celtics at Miami Heat|Kaseya Center|   183|0.846|25.7812| -80.1879|Miami Heat|Boston Celtics|NA|NA| 110| 374| 23886|NBA|NBA Basketball
nba|6353362|03:00 pm|2024-02-17|Indianapolis, IN|NBA Crossover - Keith Urban|NBA Crossover - Keith Urban|Indiana Convention Center|  5604|0.838|39.7645| -86.1641|NBA Crossover|NBA All-Star Game|Keith Urban|NA| 133| 134|   208|NBA|NBA Basketball
nba|6119929|07:30 pm|2024-02-10|New York, NY|Pacers at Knicks|Indiana Pacers at New York Knicks|Madison Square Garden|    93|0.787|40.7509| -73.9943|New York Knicks|Indiana Pacers|NA|NA| 203| 515| 34955|NBA|NBA Basketball
nba|6120311|06:00 pm|2024-02-10|Brooklyn, NY|Spurs at Nets|San Antonio Spurs at Brooklyn Nets|Barclays Center|  7546|0.820|40.6827| -73.9753|Brooklyn Nets|San Antonio Spurs|NA|NA|  63| 212| 11399|NBA|NBA Basketball
nba|6113835|07:00 pm|2024-02-14|Salt Lake City, UT|Lakers at Jazz|L.A. Lakers at Utah Jazz|Delta Center|   188|0.800|40.7676|-111.9010|Utah Jazz|Los Angeles Lakers|NA|NA|  74| 180|  3131|NBA|NBA Basketball
nba|6120071|07:00 pm|2024-02-08|Los Angeles, CA|Nuggets at Lakers|Denver Nuggets at Los Angeles Lakers|Crypto.com Arena|   134|0.807|34.0430|-118.2670|Los Angeles Lakers|Denver Nuggets|NA|NA| 274| 784| 63616|NBA|NBA Basketball
nba|6121450|02:00 pm|2024-02-10|Dallas, TX|Thunder at Mavericks|Oklahoma City Thunder at Dallas Mavericks|American Airlines Center|   117|0.801|32.7904| -96.8103|Dallas Mavericks|Oklahoma City Thunder|NA|NA|  67| 315| 17076|NBA|NBA Basketball
nba|6120381|07:00 pm|2024-02-10|Charlotte, NC|Grizzlies at Hornets|Memphis Grizzlies at Charlotte Hornets|Spectrum Center|   112|0.741|35.2248| -80.8403|Charlotte Hornets|Memphis Grizzlies|NA|NA|  26| 133|  1769|NBA|NBA Basketball
nba|6113840|07:00 pm|2024-02-15|Salt Lake City, UT|Warriors at Jazz|Golden State Warriors at Utah Jazz|Delta Center|   188|0.792|40.7676|-111.9010|Utah Jazz|Golden State Warriors|NA|NA|  35| 103|  2756|NBA|NBA Basketball
nba|6119927|07:30 pm|2024-02-08|New York, NY|Mavericks at Knicks|Dallas Mavericks at New York Knicks|Madison Square Garden|    93|0.789|40.7509| -73.9943|New York Knicks|Dallas Mavericks|NA|NA| 162| 401| 21951|NBA|NBA Basketball
nba|6113834|07:00 pm|2024-02-12|Salt Lake City, UT|Warriors at Jazz|Golden State Warriors at Utah Jazz|Delta Center|   188|0.793|40.7676|-111.9010|Utah Jazz|Golden State Warriors|NA|NA|  33|  75|  2756|NBA|NBA Basketball
nba|6120907|07:00 pm|2024-02-07|Philadelphia, PA|Warriors at 76ers|Golden State Warriors at Philadelphia 76ers|Wells Fargo Center|  3148|0.792|39.9012| -75.1720|Philadelphia 76ers|Golden State Warriors|NA|NA|  53| 237| 12265|NBA|NBA Basketball
nba|6120078|07:30 pm|2024-02-09|Los Angeles, CA|Pelicans at Lakers|New Orleans Pelicans at Los Angeles Lakers|Crypto.com Arena|   134|0.784|34.0430|-118.2670|Los Angeles Lakers|New Orleans Pelicans|NA|NA| 139| 371| 80333|NBA|NBA Basketball
nba|6121143|07:00 pm|2024-02-08|Indianapolis, IN|Warriors at Pacers|Golden State Warriors at Indiana Pacers|Gainbridge Fieldhouse|   121|0.774|39.7640| -86.1556|Indiana Pacers|Golden State Warriors|NA|NA|  81| 387|  4253|NBA|NBA Basketball
nba|6120681|07:00 pm|2024-02-10|Washington, DC|76ers at Wizards|Philadelphia 76ers at Washington Wizards|Capital One Arena|   181|0.787|38.8981| -77.0209|Washington Wizards|Philadelphia 76ers|NA|NA|  43| 174|  7716|NBA|NBA Basketball
nba|6120099|05:30 pm|2024-03-16|Los Angeles, CA|Warriors at Lakers|Golden State Warriors at Los Angeles Lakers|Crypto.com Arena|   134|0.745|34.0430|-118.2670|Los Angeles Lakers|Golden State Warriors|NA|NA| 335|1190|116504|NBA|NBA Basketball
nba|6119931|08:30 pm|2024-02-24|New York, NY|Celtics at Knicks|Boston Celtics at New York Knicks|Madison Square Garden|    93|0.767|40.7509| -73.9943|New York Knicks|Boston Celtics|NA|NA| 333| 885| 19263|NBA|NBA Basketball
nba|6106054|07:00 pm|2024-03-05|Cleveland, OH|Celtics at Cavaliers|Boston Celtics at Cleveland Cavaliers|Rocket Mortgage FieldHouse|   120|0.744|41.4971| -81.6884|Cleveland Cavaliers|Boston Celtics|NA|NA|  33| 168|  4960|NBA|NBA Basketball
nba|6119861|03:30 pm|2024-03-03|Boston, MA|Warriors at Celtics|Golden State Warriors at Boston Celtics|TD Garden|  1544|0.778|42.3653| -71.0618|Boston Celtics|Golden State Warriors|NA|NA| 265| 720| 20457|NBA|NBA Basketball
nba|6120160|01:30 pm|2024-02-25|Phoenix, AZ|Lakers at Suns|Los Angeles Lakers at Phoenix Suns|Footprint Center|   130|0.760|33.4458|-112.0710|Phoenix Suns|Los Angeles Lakers|NA|NA| 190| 642| 13663|NBA|NBA Basketball
nba|6120150|08:00 pm|2024-02-06|Phoenix, AZ|Bucks at Suns|Milwaukee Bucks at Phoenix Suns|Footprint Center|   130|0.742|33.4458|-112.0710|Phoenix Suns|Milwaukee Bucks|NA|NA| 105| 411| 11454|NBA|NBA Basketball
nba|6106001|07:00 pm|2024-02-12|Cleveland, OH|76ers at Cavaliers|Philadelphia 76ers at Cleveland Cavaliers|Rocket Mortgage FieldHouse|   120|0.765|41.4971| -81.6884|Cleveland Cavaliers|Philadelphia 76ers|NA|NA|  23| 105|  1240|NBA|NBA Basketball
nba|6119853|07:30 pm|2024-02-09|Boston, MA|Wizards at Celtics|Washington Wizards at Boston Celtics|TD Garden|  1544|0.770|42.3653| -71.0618|Boston Celtics|Washington Wizards|NA|NA|  98| 280|  3838|NBA|NBA Basketball
nba|6119859|07:30 pm|2024-03-01|Boston, MA|Mavericks at Celtics|Dallas Mavericks at Boston Celtics|TD Garden|  1544|0.746|42.3653| -71.0618|Boston Celtics|Dallas Mavericks|NA|NA| 179| 510| 18013|NBA|NBA Basketball
nba|6120004|05:30 pm|2024-02-10|San Francisco, CA|Suns at Warriors|Phoenix Suns at Golden State Warriors|Chase Center|467029|0.755|37.7704|-122.3870|Golden State Warriors|Phoenix Suns|NA|NA| 144| 502| 28194|NBA|NBA Basketball
nba|6120313|07:30 pm|2024-02-13|Brooklyn, NY|Celtics at Nets|Boston Celtics at Brooklyn Nets|Barclays Center|  7546|0.765|40.6827| -73.9753|Brooklyn Nets|Boston Celtics|NA|NA|  97| 266| 11598|NBA|NBA Basketball
nba|6120687|07:00 pm|2024-02-27|Washington, DC|Warriors at Wizards|Golden State Warriors at Washington Wizards|Capital One Arena|   181|0.743|38.8981| -77.0209|Washington Wizards|Golden State Warriors|NA|NA|  84| 290|  8714|NBA|NBA Basketball
nba|6119935|07:30 pm|2024-02-29|New York, NY|Warriors at Knicks|Golden State Warriors at New York Knicks|Madison Square Garden|    93|0.748|40.7509| -73.9943|New York Knicks|Golden State Warriors|NA|NA| 208| 604| 24243|NBA|NBA Basketball
nhl|6066749|07:00 pm|2024-02-08|Sunrise, FL|Capitals at Panthers|Washington Capitals at Florida Panthers|Amerant Bank Arena|   126|0.771|26.1585| -80.3255|Florida Panthers|Washington Capitals|NA|NA|  27|  91|  1437|NHL|NHL Hockey
nhl|6065319|07:00 pm|2024-02-06|Sunrise, FL|Flyers at Panthers|Philadelphia Flyers at Florida Panthers|Amerant Bank Arena|   126|0.767|26.1585| -80.3255|Florida Panthers|Philadelphia Flyers|NA|NA|  24|  73|  1437|NHL|NHL Hockey
nhl|6074314|03:30 pm|2024-02-10|Boston, MA|Capitals at Bruins|Washington Capitals at Boston Bruins|TD Garden|  1544|0.780|42.3653| -71.0618|Boston Bruins|Washington Capitals|NA|NA| 196| 395|114504|NHL|NHL Hockey
nhl|6075901|06:30 pm|2024-02-17|East Rutherford, NJ|NHL Stadium Series: Philadelphia Flyers vs New Jersey Devils (Pregame: Jonas Brothers)|NHL Stadium Series: Philadelphia Flyers vs New Jersey Devils (Pregame: Jonas Brothers)|MetLife Stadium|  1587|0.749|40.8142| -74.0737|NHL Stadium Series|Philadelphia 76ers|New Jersey Devils|Jonas Brothers| 112| 294|  2999|NHL|NHL Hockey
nhl|6074156|07:00 pm|2024-02-10|Philadelphia, PA|Kraken at Flyers|Seattle Kraken  at Philadelphia Flyers|Wells Fargo Center|  3148|0.758|39.9012| -75.1720|Philadelphia Flyers|Seattle Kraken|NA|NA|  82| 245|  1589|NHL|NHL Hockey
nhl|6075902|03:00 pm|2024-02-18|East Rutherford, NJ|NHL Stadium Series: New York Rangers vs New York Islanders|NHL Stadium Series: New York Rangers vs New York Islanders|MetLife Stadium|  1587|0.764|40.8142| -74.0737|NHL Stadium Series|New York Rangers|New York Islanders|NA| 112| 320|  2418|NHL|NHL Hockey
nhl|6066760|06:00 pm|2024-02-10|Sunrise, FL|Avalanche at Panthers|Colorado Avalanche at Florida Panthers|Amerant Bank Arena|   126|0.835|26.1585| -80.3255|Florida Panthers|Colorado Avalanche|NA|NA|  51| 147|  1104|NHL|NHL Hockey
nhl|6074396|07:00 pm|2024-02-06|Las Vegas, NV|Oilers at Golden Knights|Edmonton Oilers at Vegas Golden Knights|T-Mobile Arena|161601|0.761|36.1029|-115.1780|Vegas Golden Knights|Edmonton Oilers|NA|NA|  56| 177| 63616|NHL|NHL Hockey
mls|6325432|05:30 pm|2024-02-25|Carson, CA|Inter Miami CF at LA Galaxy|Inter Miami CF at LA Galaxy|Dignity Health Sports Park|    52|0.762|33.8646|-118.2610|LA Galaxy|Inter Miami CF|Lionel Messi|NA| 379| 740|  6358|MLS|MLS Soccer
mls|6325910|06:00 pm|2024-03-10|Fort Lauderdale, FL|CF Montreal at Inter Miami CF|CF Montreal at Inter Miami CF|DRV PNK Stadium|479998|0.749|26.1969| -80.1697|Inter Miami CF|CF Montreal|NA|NA| 115| 395| 11555|MLS|MLS Soccer
mls|6325904|08:00 pm|2024-02-21|Fort Lauderdale, FL|Real Salt Lake at Inter Miami CF|Real Salt Lake at Inter Miami CF|DRV PNK Stadium|479998|0.809|26.1969| -80.1697|Inter Miami CF|Real Salt Lake|NA|NA| 162| 497|  7707|MLS|MLS Soccer
mls|6325364|02:00 pm|2024-03-16|Washington, DC|Inter Miami CF at DC United|Inter Miami CF at D.C. United|Audi Field|439326|0.764|38.8695| -77.0121|D.C. United|Inter Miami CF|NA|NA| 451| 882| 12530|MLS|MLS Soccer
mls|6324012|07:30 pm|2024-02-15|Fort Lauderdale, FL|Newell's Old Boys at Inter Miami CF|Newell's Old Boys at Inter Miami CF|DRV PNK Stadium|479998|0.739|26.1969| -80.1697|Inter Miami CF|Newell's Old Boys|NA|NA| 133| 266| 19681|MLS|MLS Soccer
mls|6325905|04:30 pm|2024-03-02|Fort Lauderdale, FL|Orlando City SC at Inter Miami CF|Orlando City SC at Inter Miami CF|DRV PNK Stadium|479998|0.774|26.1969| -80.1697|Inter Miami CF|Orlando City SC|NA|NA| 150| 486|  6631|MLS|MLS Soccer
ncaa_basketball|6187470|08:00 pm|2024-02-10|West Lafayette, IN|Indiana at Purdue|Indiana Hoosiers at Purdue Boilermakers Mens Basketball|Mackey Arena|  3486|0.798|40.4259| -86.9081|Purdue Boilermakers Mens Basketball|Indiana Hoosiers Mens Basketball|NA|NA| 332| 658|  5830|NCAA BB|College Basketball
ncaa_basketball|6202217|04:00 pm|2024-03-02|Chapel Hill, NC|NC State at North Carolina|NC State Wolfpack at North Carolina Tar Heels Mens Basketball|Dean Smith Center|  3438|0.751|35.9004| -79.0432|North Carolina Tar Heels Mens Basketball|NC State Wolfpack Mens Basketball|NA|NA| 238| 357|  2525|NCAA BB|College Basketball
ncaa_basketball|6148763|04:00 pm|2024-02-10|Lexington, KY|Gonzaga at Kentucky|Gonzaga Bulldogs at Kentucky Wildcats Mens Basketball|Rupp Arena|   209|0.751|38.0493| -84.5025|Kentucky Wildcats Mens Basketball|Gonzaga Bulldogs Mens Basketball|NA|NA| 166| 433| 17067|NCAA BB|College Basketball
ncaa_basketball|6202203|02:00 pm|2024-02-17|Chapel Hill, NC|Virginia Tech at North Carolina|Virginia Tech Hokies at North Carolina Tar Heels Mens Basketball|Dean Smith Center|  3438|0.776|35.9004| -79.0432|North Carolina Tar Heels Mens Basketball|Virginia Tech Hokies Mens Basketball|NA|NA| 209| 409|  1477|NCAA BB|College Basketball
ncaa_basketball|6201058|05:00 pm|2024-02-10|Lawrence, KS|Baylor at Kansas|Baylor Bears at Kansas Jayhawks Mens Basketball|Allen Fieldhouse|  3469|0.801|38.9541| -95.2528|Kansas Jayhawks Mens Basketball|Baylor Bears Mens Basketball|NA|NA| 145| 308|  2510|NCAA BB|College Basketball
ncaa_basketball|6169720|05:00 pm|2024-02-17|Auburn, AL|Kentucky at Auburn|Kentucky Wildcats at Auburn Tigers Mens Basketball|Neville Arena|  3455|0.744|32.6028| -85.4925|Auburn Tigers Mens Basketball|Kentucky Wildcats Mens Basketball|NA|NA| 392| 977|  5291|NCAA BB|College Basketball
ncaa_basketball|6201057|05:00 pm|2024-02-24|Lawrence, KS|Texas at Kansas|Texas Longhorns at Kansas Jayhawks Mens Basketball|Allen Fieldhouse|  3469|0.739|38.9541| -95.2528|Kansas Jayhawks Mens Basketball|Texas Longhorns Mens Basketball|NA|NA| 279| 414|  1170|NCAA BB|College Basketball