league|id|time|date|city|title|full|venue|ven_id|score|lat|long|t1|t2|t3|t4|low|med|high|name|xname
ncaa_basketball|5868274|07:00 pm|2023-01-31|Bowling Green, OH|Ball State at Bowling Green|Ball State Cardinals at Bowling Green Falcons Basketball|Stroh Center|  7484|0.261|41.3752| -83.6262|Bowling Green Falcons Basketball|Ball State Cardinals Basketball|NA|NA|  14|  21|    39|NCAA BB|College Basketball
ncaa_basketball|5811693|07:00 pm|2023-02-08|Carbondale, IL|UIC at Southern Illinois|UIC Flames at Southern Illinois Salukis Basketball|Banterra Center|  4095|0.260|37.7251| -89.2167|Southern Illinois Salukis Basketball|UIC Flames Basketball|NA|NA|  40|  44|    84|NCAA BB|College Basketball
ncaa_basketball|5767978|03:00 pm|2023-01-21|Portland, OR|Pepperdine at Portland|Pepperdine Waves at Portland Pilots Basketball|Chiles Center|  5169|0.361|45.5736|-122.7280|Portland Pilots Basketball|Pepperdine Waves Basketball|NA|NA|  24|  50|    71|NCAA BB|College Basketball
ncaa_basketball|5801385|04:00 pm|2023-02-11|Richmond, VA|Loyola Chicago at Richmond|Loyola Chicago Ramblers at Richmond Spiders Basketball|Robins Center|  3470|0.360|37.5806| -77.5388|Richmond Spiders Basketball|Loyola Chicago Ramblers Basketball|NA|NA|  30|  42|   158|NCAA BB|College Basketball
ncaa_basketball|5898857|07:00 pm|2023-02-11|Seattle, WA|Grand Canyon at Seattle|Grand Canyon Lopes at Seattle Redhawks Basketball|Redhawk Center|  6923|0.360|47.6068|-122.3140|Seattle Redhawks Basketball|Grand Canyon Lopes Basketball|NA|NA|  48|  48|    64|NCAA BB|College Basketball
ncaa_basketball|5827792|07:00 pm|2023-01-19|Highland Heights, KY|Cleveland State Vikings at Northern Kentucky Norse Basketball|Cleveland State Vikings at Northern Kentucky Norse Basketball|Truist Arena|  1350|0.257|39.0320| -84.4591|Northern Kentucky Norse Basketball|Cleveland State Vikings Basketball|NA|NA|  23|  43|   145|NCAA BB|College Basketball
ncaa_basketball|5801521|07:00 pm|2023-02-15|Philadelphia, PA|Richmond at La Salle|Richmond Spiders at La Salle Explorers Basketball|Tom Gola Arena|  4224|0.257|40.0399| -75.1566|La Salle Explorers Basketball|Richmond Spiders Basketball|NA|NA|  23|  81|    98|NCAA BB|College Basketball
ncaa_basketball|5845668|07:00 pm|2023-01-26|Dayton, OH|Milwaukee at Wright State|Milwaukee Panthers at Wright State Raiders Basketball|Wright State University Nutter Center|  1622|0.256|39.7747| -84.0797|Wright State Raiders Basketball|Milwaukee Panthers Basketball|NA|NA|  24|  68|   395|NCAA BB|College Basketball
ncaa_basketball|5853033|07:00 pm|2023-01-26|Towson, MD|Northeastern at Towson|Northeastern Huskies at Towson Tigers Basketball|SECU Arena|  4258|0.256|39.3936| -76.6071|Towson Tigers Basketball|Northeastern Huskies Basketball|NA|NA|  21|  41|    80|NCAA BB|College Basketball
ncaa_basketball|5848496|07:00 pm|2023-02-02|Charlotte, NC|FIU at Charlotte|Florida International Panthers at Charlotte 49ers Basketball|Halton Arena|  3442|0.255|35.3063| -80.7344|Charlotte 49ers Basketball|Florida International Panthers Basketball|NA|NA|  22|  44|    93|NCAA BB|College Basketball
ncaa_basketball|5842152|07:00 pm|2023-02-14|Ypsilanti, MI|Akron at Eastern Michigan|Akron Zips at Eastern Michigan Eagles Basketball|George Gervin GameAbove Center|  3501|0.252|42.2542| -83.6472|Eastern Michigan Eagles Basketball|Akron Zips Basketball|NA|NA|  18|  30|    66|NCAA BB|College Basketball
ncaa_basketball|5844497|03:30 am|2023-02-11|DeKalb, IL|Western Michigan at Northern Illinois|Western Michigan Broncos at Northern Illinois Huskies Basketball|NIU Convocation Center|  1821|0.356|41.9355| -88.7853|Northern Illinois Huskies Basketball|Western Michigan Broncos Basketball|NA|NA|  17|  27|    66|NCAA BB|College Basketball
ncaa_basketball|5860920|03:30 am|2023-02-04|Vermillion, SD|North Dakota at South Dakota|North Dakota Fighting Hawks at South Dakota Coyotes Basketball|Sanford Coyote Sports Center|455132|0.356|42.7904| -96.9278|South Dakota Coyotes Basketball|North Dakota Fighting Hawks Basketball|NA|NA|  18|  19|   104|NCAA BB|College Basketball
ncaa_basketball|5795711|07:00 pm|2023-01-17|Albuquerque, NM|San Jose State at New Mexico|San Jose State Spartans at New Mexico Lobos Basketball|The Pit (University Arena)|  4226|0.355|35.0669|-106.6320|New Mexico Lobos Basketball|San Jose State Spartans Basketball|NA|NA|  47|  78|   146|NCAA BB|College Basketball
ncaa_basketball|5848723|07:00 pm|2023-01-26|Portland, OR|Montana State at Portland State|Montana State Bobcats at Portland State Vikings Basketball|Viking Pavilion|441097|0.250|45.5117|-122.6840|Portland State Vikings Basketball|Montana State Bobcats Basketball|NA|NA|  16|  23|    88|NCAA BB|College Basketball
ncaa_basketball|5811665|03:30 am|2023-02-01|Murray, KY|Belmont at Murray State|Belmont Bruins at Murray State Racers Basketball|CFSB Center|  4142|0.355|36.6103| -88.3148|Murray State Racers Basketball|Belmont Bruins Basketball|NA|NA|  39|  60|    81|NCAA BB|College Basketball
ncaa_basketball|5853034|12:00 pm|2023-01-16|Towson, MD|Hofstra at Towson|Hofstra Pride at Towson Tigers Basketball|SECU Arena|  4258|0.249|39.3936| -76.6071|Towson Tigers Basketball|Hofstra Pride Basketball|NA|NA|  21|  41|    80|NCAA BB|College Basketball
ncaa_basketball|5817200|07:00 pm|2023-01-10|Tulsa, OK|Temple at Tulsa|Temple Owls at Tulsa Golden Hurricane Basketball|Reynolds Center|  3449|0.354|36.1490| -95.9421|Tulsa Golden Hurricane Basketball|Temple Owls Basketball|NA|NA|  52|  70|    87|NCAA BB|College Basketball
ncaa_basketball|5812509|08:00 pm|2023-01-11|Pullman, WA|California at Washington State|California Golden Bears at Washington State Cougars Basketball|Beasley Coliseum|  3481|0.354|46.7352|-117.1580|Washington State Cougars Basketball|California Golden Bears Basketball|NA|NA|  15|  36|    97|NCAA BB|College Basketball
ncaa_basketball|5841533|07:00 pm|2023-02-09|Milwaukee, WI|Detroit at Milwaukee|Detroit Mercy Titans at Milwaukee Panthers Basketball|UW-Milwaukee Panther Arena|  1921|0.354|43.0417| -87.9169|Milwaukee Panthers Basketball|Detroit Mercy Titans Basketball|NA|NA|  16|  52|   129|NCAA BB|College Basketball
ncaa_basketball|5848714|06:00 pm|2023-02-09|Greeley, CO|Portland State at Northern Colorado|Portland State Vikings at Northern Colorado Bears Basketball|Bank of Colorado Arena|  4227|0.247|40.4022|-104.7030|Northern Colorado Bears Basketball|Portland State Vikings Basketball|NA|NA|  25|  25|    60|NCAA BB|College Basketball
ncaa_basketball|5849520|07:00 pm|2023-01-25|Radford, VA|Longwood at Radford|Longwood Lancers at Radford Highlanders Basketball|Dedmon Center|  6589|0.323|37.1385| -80.5416|Radford Highlanders Basketball|Longwood Lancers Basketball|NA|NA|  27|  30|    60|NCAA BB|College Basketball
ncaa_basketball|5849542|06:30 pm|2023-01-11|Asheville, NC|Longwood at UNC Asheville|Longwood Lancers at UNC Asheville Bulldogs Basketball|Kimmel Arena|  6588|0.323|35.6146| -82.5630|UNC Asheville Bulldogs Basketball|Longwood Lancers Basketball|NA|NA|  28|  28|    59|NCAA BB|College Basketball
ncaa_basketball|5882548|07:00 pm|2023-02-02|Macon, GA|UNCG at Mercer|UNC Greensboro Spartans at Mercer Bears Basketball|Hawkins Arena|  4153|0.353|32.8290| -83.6523|Mercer Bears Basketball|UNC Greensboro Spartans Basketball|NA|NA|  30|  30|    60|NCAA BB|College Basketball
ncaa_basketball|5846140|07:00 pm|2023-01-26|Boca Raton, FL|Middle Tennessee at Florida Atlantic|Middle Tennessee Blue Raiders at Florida Atlantic Owls Basketball|Abessinio Court at FAU Arena|  6050|0.245|26.3738| -80.1019|Florida Atlantic Owls Basketball|Middle Tennessee Blue Raiders Basketball|NA|NA|  36|  47|    72|NCAA BB|College Basketball
ncaa_basketball|5846124|07:00 pm|2023-01-10|Athens, OH|Ball State at Ohio|Ball State Cardinals at Ohio Bobcats Basketball|Ohio University|  4254|0.245|39.3292| -82.1013|Ohio Bobcats Basketball|Ball State Cardinals Basketball|NA|NA|  23|  41|    77|NCAA BB|College Basketball
ncaa_basketball|5801349|07:00 pm|2023-01-25|Kingston, RI|Dayton at Rhode Island|Dayton Flyers at Rhode Island Rams Basketball|Ryan Center|  1313|0.352|41.4882| -71.5366|Rhode Island Rams Basketball|Dayton Flyers Basketball|NA|NA|  19|  58|   213|NCAA BB|College Basketball
ncaa_basketball|5801417|07:00 pm|2023-01-25|Saint Bonaventure, NY|Fordham at St. Bonaventure|Fordham Rams at St. Bonaventure Bonnies Basketball|Reilly Center|  3476|0.244|42.0806| -78.4829|St. Bonaventure Bonnies Basketball|Fordham Rams Basketball|NA|NA|  46|  49|    60|NCAA BB|College Basketball
ncaa_basketball|5801217|07:00 pm|2023-01-31|Bronx, NY|Saint Louis at Fordham|Saint Louis Billikens at Fordham Rams Basketball|Rose Hill Gym|  4188|0.322|40.8612| -73.8892|Fordham Rams Basketball|Saint Louis Billikens Basketball|NA|NA|  44|  46|    75|NCAA BB|College Basketball
ncaa_basketball|5842436|06:00 pm|2023-01-16|Bowling Green, KY|Florida Atlantic at Western Kentucky|Florida Atlantic Owls at Western Kentucky Hilltoppers Basketball|Diddle Arena|  4264|0.243|36.9538| -86.3982|Western Kentucky Hilltoppers Basketball|Florida Atlantic Owls Basketball|NA|NA|  23|  33|    93|NCAA BB|College Basketball
ncaa_basketball|5817174|07:00 pm|2023-01-24|Greenville, NC|Tulsa at East Carolina|Tulsa Golden Hurricane at East Carolina Pirates Basketball|Williams Arena at Minges Coliseum|  3428|0.243|35.5975| -77.3673|East Carolina Pirates Basketball|Tulsa Golden Hurricane Basketball|NA|NA|  18|  28|    86|NCAA BB|College Basketball
ncaa_basketball|5888033|02:30 pm|2023-02-04|Kalamazoo, MI|Buffalo Bulls at Western Michigan Broncos Basketball|Buffalo Bulls at Western Michigan Broncos Basketball|University Arena (WMU)|  4213|0.352|42.2841| -85.6170|Western Michigan Broncos Basketball|Buffalo Bulls Basketball|NA|NA|  32|  37|    60|NCAA BB|College Basketball
ncaa_basketball|5842435|06:00 pm|2023-01-21|Bowling Green, KY|Charlotte at Western Kentucky|Charlotte 49ers at Western Kentucky Hilltoppers Basketball|Diddle Arena|  4264|0.352|36.9538| -86.3982|Western Kentucky Hilltoppers Basketball|Charlotte 49ers Basketball|NA|NA|  15|  41|   105|NCAA BB|College Basketball
ncaa_basketball|5868273|07:00 pm|2023-02-14|Bowling Green, OH|Central Michigan Chippewas at Bowling Green Falcons Basketball|Central Michigan Chippewas at Bowling Green Falcons Basketball|Stroh Center|  7484|0.241|41.3752| -83.6262|Bowling Green Falcons Basketball|Central Michigan Chippewas Basketball|NA|NA|  14|  22|    39|NCAA BB|College Basketball
ncaa_basketball|5811562|03:30 am|2023-01-21|Normal, IL|Valparaiso at Illinois State|Valparaiso Beacons at Illinois State Redbirds Basketball|Redbird Arena|  2147|0.351|40.5099| -88.9975|Illinois State Redbirds Basketball|Valparaiso Beacons Basketball|NA|NA|  32|  32|    89|NCAA BB|College Basketball
ncaa_basketball|5848721|07:00 pm|2023-01-12|Portland, OR|Northern Arizona at Portland State|Northern Arizona Lumberjacks at Portland State Vikings Basketball|Viking Pavilion|441097|0.241|45.5117|-122.6840|Portland State Vikings Basketball|Northern Arizona Lumberjacks Basketball|NA|NA|  15|  24|    88|NCAA BB|College Basketball
ncaa_basketball|5751140|03:30 am|2023-02-11|Troy, AL|Louisiana at Troy|Louisiana Ragin' Cajuns at Troy Trojans Basketball|Trojan Arena|  6462|0.349|31.8073| -85.9626|Troy Trojans Basketball|Louisiana Ragin' Cajuns Basketball|NA|NA|  17|  28|    62|NCAA BB|College Basketball
ncaa_basketball|5751045|07:00 pm|2023-02-16|Huntington, WV|Georgia Southern at Marshall|Georgia Southern Eagles at Marshall Thundering Herd Basketball|Cam Henderson Center|  4174|0.240|38.4244| -82.4251|Marshall Thundering Herd Basketball|Georgia Southern Eagles Basketball|NA|NA|  36|  76|    87|NCAA BB|College Basketball
ncaa_basketball|5811691|01:00 pm|2023-02-05|Carbondale, IL|Missouri State at Southern Illinois|Missouri State Bears at Southern Illinois Salukis Basketball|Banterra Center|  4095|0.239|37.7251| -89.2167|Southern Illinois Salukis Basketball|Missouri State Bears Basketball|NA|NA|  38|  46|    86|NCAA BB|College Basketball
ncaa_basketball|5849443|07:00 pm|2023-01-18|Farmville, VA|Gardner-Webb at Longwood|Gardner-Webb Runnin' Bulldogs at Longwood Lancers Basketball|Willett Hall - Longwood| 42091|0.239|37.3016| -78.3944|Longwood Lancers Basketball|Gardner-Webb Runnin' Bulldogs Basketball|NA|NA|  25|  40|    50|NCAA BB|College Basketball
ncaa_basketball|5751119|04:00 pm|2023-02-11|San Marcos, TX|Old Dominion at Texas State|Old Dominion Monarchs at Texas State Bobcats Basketball|Strahan Arena at the University Events Center|  4260|0.349|29.8887| -97.9374|Texas State Bobcats Basketball|Old Dominion Monarchs Basketball|NA|NA|  34|  48|    82|NCAA BB|College Basketball
ncaa_basketball|5827794|06:00 pm|2023-01-21|Highland Heights, KY|Fort Wayne Mastodons at Northern Kentucky Norse Mens Basketball|Fort Wayne Mastodons at Northern Kentucky Norse Mens Basketball|Truist Arena|  1350|0.348|39.0320| -84.4591|Northern Kentucky Norse Basketball|NA|NA|NA|  23|  51|   142|NCAA BB|College Basketball
ncaa_basketball|5801327|07:00 pm|2023-01-11|Amherst, MA|La Salle at Massachusetts|La Salle Explorers at UMass Minutemen Basketball|Mullins Center|  1352|0.348|42.3732| -72.5199|UMass Minutemen Basketball|La Salle Explorers Basketball|NA|NA|  30|  61|   113|NCAA BB|College Basketball
ncaa_basketball|5751071|03:30 am|2023-01-12|Mobile, AL|James Madison at South Alabama|James Madison Dukes at South Alabama Jaguars Basketball|Mitchell Center|  3993|0.318|30.6922| -88.1796|South Alabama Jaguars Basketball|James Madison Dukes Basketball|NA|NA|  14|  34|    61|NCAA BB|College Basketball
ncaa_basketball|5751092|02:00 pm|2023-01-21|Hattiesburg, MS|James Madison at Southern Miss|James Madison Dukes at Southern Miss Golden Eagles Basketball|Reed Green Coliseum|  3474|0.347|31.3319| -89.3373|Southern Miss Golden Eagles Basketball|James Madison Dukes Basketball|NA|NA|  19|  33|    75|NCAA BB|College Basketball
ncaa_basketball|5848497|04:00 pm|2023-02-04|Charlotte, NC|Florida Atlantic at Charlotte|Florida Atlantic Owls at Charlotte 49ers Basketball|Halton Arena|  3442|0.233|35.3063| -80.7344|Charlotte 49ers Basketball|Florida Atlantic Owls Basketball|NA|NA|  25|  47|    94|NCAA BB|College Basketball
ncaa_basketball|5849287|07:00 pm|2023-01-11|Charleston, SC|High Point at Charleston Southern|High Point Panthers at Charleston Southern Buccaneers Basketball|Buccaneer Fieldhouse| 38905|0.347|32.9773| -80.0704|Charleston Southern Buccaneers Basketball|High Point Panthers Basketball|NA|NA|  17|  29|    59|NCAA BB|College Basketball
ncaa_basketball|5845670|07:00 pm|2023-01-19|Dayton, OH|Purdue Fort Wayne at Wright State|Purdue Fort Wayne Mastodons at Wright State Raiders Basketball|Wright State University Nutter Center|  1622|0.232|39.7747| -84.0797|Wright State Raiders Basketball|Purdue Fort Wayne Mastodons Basketball|NA|NA|  23|  69|   389|NCAA BB|College Basketball
ncaa_basketball|5841514|07:00 pm|2023-02-07|Oxford, OH|Western Michigan at Miami (OH)|Western Michigan Broncos at Miami (OH) RedHawks Basketball|Millett Hall|  4176|0.346|39.5171| -84.7346|Miami (OH) RedHawks Basketball|Western Michigan Broncos Basketball|NA|NA|  23|  23|    75|NCAA BB|College Basketball
ncaa_basketball|5811448|07:00 pm|2023-02-01|Peoria, IL|Southern Illinois at Bradley|Southern Illinois Salukis at Bradley Braves Basketball|Peoria Civic Center|  5437|0.229|40.6917| -89.5940|Bradley Braves Basketball|Southern Illinois Salukis Basketball|NA|NA|  30|  40|   228|NCAA BB|College Basketball
ncaa_basketball|5768148|07:00 pm|2023-01-26|Los Angeles, CA|Portland at Loyola Marymount|Portland Pilots at Loyola Marymount Lions Basketball|Gersten Pavilion|  5154|0.224|33.9708|-118.4190|Loyola Marymount Lions Basketball|Portland Pilots Basketball|NA|NA|  18|  52|    88|NCAA BB|College Basketball
ncaa_basketball|5750927|07:00 pm|2023-01-19|Conway, SC|Appalachian State at Coastal Carolina|Appalachian State Mountaineers at Coastal Carolina Chanticleers Basketball|HTC Center|  6586|0.346|33.7951| -79.0145|Coastal Carolina Chanticleers Basketball|Appalachian State Mountaineers Basketball|NA|NA|  31|  41|    86|NCAA BB|College Basketball
ncaa_basketball|5751134|03:30 am|2023-02-02|Troy, AL|Southern Miss at Troy|Southern Miss Golden Eagles at Troy Trojans Basketball|Trojan Arena|  6462|0.346|31.8073| -85.9626|Troy Trojans Basketball|Southern Miss Golden Eagles Basketball|NA|NA|  18|  28|    63|NCAA BB|College Basketball
ncaa_basketball|5849578|07:00 pm|2023-02-08|Spartanburg, SC|Charleston Southern at USC Upstate|Charleston Southern Buccaneers at USC Upstate Spartans Basketball|G.B. Hodge Center|  5179|0.221|34.9439| -81.9289|USC Upstate Spartans Basketball|Charleston Southern Buccaneers Basketball|NA|NA|  26|  26|    64|NCAA BB|College Basketball
ncaa_basketball|5845667|07:00 pm|2023-02-08|Dayton, OH|IUPUI at Wright State|IUPUI Jaguars at Wright State Raiders Basketball|Wright State University Nutter Center|  1622|0.221|39.7747| -84.0797|Wright State Raiders Basketball|IUPUI Jaguars Basketball|NA|NA|  23|  69|   389|NCAA BB|College Basketball
ncaa_basketball|5801173|07:00 pm|2023-01-25|Pittsburgh, PA|Loyola Chicago at Duquesne|Loyola Chicago Ramblers at Duquesne Dukes Basketball|UPMC Cooper Fieldhouse|  3441|0.219|40.4378| -79.9881|Duquesne Dukes Basketball|Loyola Chicago Ramblers Basketball|NA|NA|  29|  34|    59|NCAA BB|College Basketball
ncaa_basketball|5850658|02:00 pm|2023-02-04|Fairfield, CT|Central Connecticut State at Sacred Heart|Central Connecticut State Blue Devils at Sacred Heart Pioneers Basketball|William H Pitt Health And Recreation Center at Sacred Heart University|  4232|0.343|41.1400| -73.2400|Sacred Heart Pioneers Basketball|Central Connecticut State Blue Devils Basketball|NA|NA|  16|  39|   116|NCAA BB|College Basketball
ncaa_basketball|5818006|07:00 pm|2023-01-09|West Point, NY|Colgate at Army West Point|Colgate Raiders at Army Black Knights Basketball|Christl Arena|  5181|0.343|41.3863| -73.9657|Army Black Knights Basketball|Colgate Raiders Basketball|NA|NA|  29|  31|    39|NCAA BB|College Basketball
ncaa_basketball|5801286|08:00 pm|2023-02-07|St. Louis, MO|Rhode Island at Saint Louis|Rhode Island Rams at Saint Louis Billikens Basketball|Chaifetz Arena|   775|0.343|38.6325| -90.2279|Saint Louis Billikens Basketball|Rhode Island Rams Basketball|NA|NA|  13|  73|   406|NCAA BB|College Basketball
ncaa_basketball|5849448|07:00 pm|2023-02-08|Farmville, VA|Presbyterian at Longwood|Presbyterian Blue Hose at Longwood Lancers Basketball|Willett Hall - Longwood| 42091|0.215|37.3016| -78.3944|Longwood Lancers Basketball|Presbyterian Blue Hose Basketball|NA|NA|  24|  39|    46|NCAA BB|College Basketball
ncaa_basketball|5811600|07:00 pm|2023-02-08|Terre Haute, IN|Valparaiso at Indiana State|Valparaiso Beacons at Indiana State Sycamores Basketball|Hulman Center|  4220|0.215|39.4685| -87.4057|Indiana State Sycamores Basketball|Valparaiso Beacons Basketball|NA|NA|  24|  43|   218|NCAA BB|College Basketball
ncaa_basketball|5811442|07:00 pm|2023-01-11|Peoria, IL|Evansville at Bradley|Evansville Purple Aces at Bradley Braves Basketball|Peoria Civic Center|  5437|0.214|40.6917| -89.5940|Bradley Braves Basketball|Evansville Purple Aces Basketball|NA|NA|  30|  40|   755|NCAA BB|College Basketball
ncaa_basketball|5801544|06:00 pm|2023-01-18|Chicago, IL|Saint Louis at Loyola Chicago|Saint Louis Billikens at Loyola Chicago Ramblers Basketball|Gentile Arena|  5183|0.342|42.0006| -87.6591|Loyola Chicago Ramblers Basketball|Saint Louis Billikens Basketball|NA|NA|  66|  66|    69|NCAA BB|College Basketball
ncaa_basketball|5849253|02:00 pm|2023-01-14|Buies Creek, NC|Winthrop at Campbell|Winthrop Eagles at Campbell Fighting Camels Basketball|John W Pope Convocation Center|  4198|0.341|35.4078| -78.7361|Campbell Fighting Camels Basketball|Winthrop Eagles Basketball|NA|NA|  14|  26|    55|NCAA BB|College Basketball
ncaa_basketball|5751037|07:00 pm|2023-01-12|Huntington, WV|Southern Miss at Marshall|Southern Miss Golden Eagles at Marshall Thundering Herd Basketball|Cam Henderson Center|  4174|0.207|38.4244| -82.4251|Marshall Thundering Herd Basketball|Southern Miss Golden Eagles Basketball|NA|NA|  37|  64|    93|NCAA BB|College Basketball
ncaa_basketball|5751001|07:00 pm|2023-01-28|Lafayette, LA|Georgia Southern at Louisiana|Georgia Southern Eagles at Louisiana Ragin' Cajuns Basketball|Cajundome|   113|0.341|30.2184| -92.0389|Louisiana Ragin' Cajuns Basketball|Georgia Southern Eagles Basketball|NA|NA|  29|  55|   131|NCAA BB|College Basketball
ncaa_basketball|5844478|07:00 pm|2023-02-04|Boston, MA|Brown at Harvard|Brown Bears at Harvard Crimson Basketball|Lavietes Pavilion|  4185|0.341|42.3683| -71.1237|Harvard Crimson Basketball|Brown Bears Basketball|NA|NA|  39|  54|   104|NCAA BB|College Basketball
ncaa_basketball|5841133|07:00 pm|2023-01-24|Mt. Pleasant, MI|Bowling Green Falcons at Central Michigan Chippewas Basketball|Bowling Green Falcons at Central Michigan Chippewas Basketball|McGuirk Arena|  3982|0.207|43.5815| -84.7741|Central Michigan Chippewas Basketball|Bowling Green Falcons Basketball|NA|NA|  18|  18|    66|NCAA BB|College Basketball
ncaa_basketball|5751135|03:30 am|2023-02-04|Troy, AL|Texas State at Troy|Texas State Bobcats at Troy Trojans Basketball|Trojan Arena|  6462|0.340|31.8073| -85.9626|Troy Trojans Basketball|Texas State Bobcats Basketball|NA|NA|  18|  28|    63|NCAA BB|College Basketball
ncaa_basketball|5811594|07:00 pm|2023-01-18|Terre Haute, IN|Bradley at Indiana State|Bradley Braves at Indiana State Sycamores Basketball|Hulman Center|  4220|0.200|39.4685| -87.4057|Indiana State Sycamores Basketball|Bradley Braves Basketball|NA|NA|  24|  43|   218|NCAA BB|College Basketball
ncaa_basketball|5795638|08:00 pm|2023-02-08|Logan, UT|San Diego State at Utah State|San Diego State Aztecs at Utah State Aggies Basketball|Dee Glen Smith Spectrum|  4172|0.340|41.7529|-111.8070|Utah State Aggies Basketball|San Diego State Aztecs Basketball|NA|NA|  33|  78|   143|NCAA BB|College Basketball
ncaa_basketball|5801279|07:00 pm|2023-01-11|St. Louis, MO|George Mason at Saint Louis|George Mason Patriots at Saint Louis Billikens Basketball|Chaifetz Arena|   775|0.340|38.6325| -90.2279|Saint Louis Billikens Basketball|George Mason Patriots Basketball|NA|NA|  13|  78|   289|NCAA BB|College Basketball
ncaa_basketball|5811452|07:00 pm|2023-02-15|Peoria, IL|Missouri State at Bradley|Missouri State Bears at Bradley Braves Basketball|Peoria Civic Center|  5437|0.187|40.6917| -89.5940|Bradley Braves Basketball|Missouri State Bears Basketball|NA|NA|  29|  38|   219|NCAA BB|College Basketball
ncaa_basketball|5848457|06:00 pm|2023-01-16|Cheney, WA|Montana at Eastern Washington|Montana Grizzlies at Eastern Washington Eagles Basketball|Reese Court|  4183|0.339|47.4914|-117.5890|Eastern Washington Eagles Basketball|Montana Grizzlies Basketball|NA|NA|  17|  47|    73|NCAA BB|College Basketball
ncaa_basketball|5818007|06:00 pm|2023-01-11|West Point, NY|American University at Army West Point|American University Eagles at Army Black Knights Basketball|Christl Arena|  5181|0.339|41.3863| -73.9657|Army Black Knights Basketball|American University Eagles Basketball|NA|NA|  29|  31|    42|NCAA BB|College Basketball
ncaa_basketball|5795604|04:00 pm|2023-01-14|Fresno, CA|Air Force at Fresno State|Air Force Falcons at Fresno State Bulldogs Basketball|Save Mart Center|    76|0.337|36.8099|-119.7390|Fresno State Bulldogs Basketball|Air Force Falcons Basketball|NA|NA|  28|  46|   223|NCAA BB|College Basketball
ncaa_basketball|5854037|06:00 pm|2023-01-21|Phoenix, AZ|Utah Valley at Grand Canyon|Utah Valley Wolverines at Grand Canyon Lopes Basketball|GCU Arena|171229|0.336|33.5126|-112.1270|Grand Canyon Lopes Basketball|Utah Valley Wolverines Basketball|NA|NA|  93| 135|   177|NCAA BB|College Basketball
ncaa_basketball|5811530|07:00 pm|2023-01-10|Chicago, IL|Drake at UIC|Drake Bulldogs at UIC Flames Basketball|Credit Union 1 Arena at UIC|  1140|0.305|41.8749| -87.6561|UIC Flames Basketball|Drake Bulldogs Basketball|NA|NA|  37|  55|   104|NCAA BB|College Basketball
ncaa_basketball|5849522|02:00 pm|2023-02-04|Radford, VA|Winthrop at Radford|Winthrop Eagles at Radford Highlanders Basketball|Dedmon Center|  6589|0.334|37.1385| -80.5416|Radford Highlanders Basketball|Winthrop Eagles Basketball|NA|NA|  26|  30|    60|NCAA BB|College Basketball
ncaa_basketball|5859578|07:30 pm|2023-01-23|Baltimore, MD|Norfolk State at Morgan State|Norfolk State Spartans at Morgan State Bears Basketball|Hill Field House|  5159|0.334|39.3458| -76.5859|Morgan State Bears Basketball|Norfolk State Spartans Basketball|NA|NA|  52|  51|    52|NCAA BB|College Basketball
ncaa_basketball|5849023|07:00 pm|2023-02-09|Ogden, UT|Montana State at Weber State|Montana State Bobcats at Weber State Wildcats Basketball|Dee Events Center|  4259|0.334|41.1831|-111.9490|Weber State Wildcats Basketball|Montana State Bobcats Basketball|NA|NA|  18|  63|    66|NCAA BB|College Basketball
ncaa_basketball|5795102|07:00 pm|2023-01-24|Boise, ID|Fresno State Bulldogs at Boise State Broncos Basketball|Fresno State Bulldogs at Boise State Broncos Basketball|ExtraMile Arena|   336|0.333|43.6050|-116.2070|Boise State Broncos Basketball|Fresno State Bulldogs Basketball|NA|NA|  33|  65|   288|NCAA BB|College Basketball
ncaa_basketball|5841520|03:30 pm|2023-01-21|Ypsilanti, MI|Northern Illinois at Eastern Michigan|Northern Illinois Huskies at Eastern Michigan Eagles Basketball|George Gervin GameAbove Center|  3501|0.304|42.2542| -83.6472|Eastern Michigan Eagles Basketball|Northern Illinois Huskies Basketball|NA|NA|  28|  32|   132|NCAA BB|College Basketball
ncaa_basketball|5817288|03:30 am|2023-02-11|New Orleans, LA|East Carolina at Tulane|East Carolina Pirates at Tulane Green Wave Basketball|Devlin Fieldhouse|  3473|0.303|29.9404| -90.0884|Tulane Green Wave Basketball|East Carolina Pirates Basketball|NA|NA|  18|  36|    61|NCAA BB|College Basketball
