league|id|time|date|city|title|full|venue|ven_id|score|lat|long|t1|t2|t3|t4|low|med|high|name|xname
nfl|6303358|03:30 am|2024-01-28|Baltimore, MD|AFC Championship: TBD vs. Baltimore Ravens|AFC Championship: TBD vs. Baltimore Ravens|M&T Bank Stadium|  1121|1.000|39.2779| -76.6229|Baltimore Ravens|AFC Championship|TBD|NFL Playoffs| 570|  964| 30937|NFL|NFL Football
nfl|6283432|05:00 pm|2024-01-20|Santa Clara, CA|NFC Divisional: Packers at 49ers|NFC Divisional: Green Bay Packers at San Francisco 49ers|Levi's Stadium| 58670|0.967|37.4023|-121.9690|San Francisco 49ers|Green Bay Packers|NFC Divisional Round|NFL Playoffs| 280|  604|  4870|NFL|NFL Football
nfl|6303341|04:30 pm|2024-01-20|Baltimore, MD|AFC Divisional Round: Houston Texans vs. Baltimore Ravens|AFC Divisional Round: Houston Texans vs. Baltimore Ravens|M&T Bank Stadium|  1121|0.957|39.2779| -76.6229|Baltimore Ravens|Houston Texans|AFC Divisional Round|NFL Playoffs| 167|  421|  6130|NFL|NFL Football
nfl|6283434|03:30 pm|2024-01-28|Santa Clara, CA|NFC Championship: TBD at 49ers|NFC Championship: TBD at San Francisco 49ers|Levi's Stadium| 58670|0.947|37.4023|-121.9690|San Francisco 49ers|NFC Championship|NFL Playoffs|NA| 760| 1692| 68060|NFL|NFL Football
nfl|6164984|03:30 am|2024-02-11|Las Vegas, NV|Super Bowl LVIII|Super Bowl LVIII|Allegiant Stadium|514837|0.901|36.0909|-115.1830|Super Bowl|NA|NA|NA|8532|12632| 82823|NFL|NFL Football
nhl|6074148|01:00 pm|2024-01-21|Philadelphia, PA|Senators at Flyers|Ottawa Senators at Philadelphia Flyers|Wells Fargo Center|  3148|0.863|39.9012| -75.1720|Philadelphia Flyers|Ottawa Senators|NA|NA|  44|  160|  1456|NHL|NHL Hockey
nhl|6074394|07:00 pm|2024-01-20|Las Vegas, NV|Penguins at Golden Knights|Pittsburgh Penguins at Vegas Golden Knights|T-Mobile Arena|161601|0.869|36.1029|-115.1780|Vegas Golden Knights|Pittsburgh Penguins|NA|NA|  82|  189|   745|NHL|NHL Hockey
nhl|6074146|01:00 pm|2024-01-20|Philadelphia, PA|Avalanche at Flyers|Colorado Avalanche at Philadelphia Flyers|Wells Fargo Center|  3148|0.878|39.9012| -75.1720|Philadelphia Flyers|Colorado Avalanche|NA|NA|  92|  169|  1817|NHL|NHL Hockey
nhl|6074307|07:00 pm|2024-01-22|Boston, MA|Jets at Bruins|Winnipeg Jets at Boston Bruins|TD Garden|  1544|0.865|42.3653| -71.0618|Boston Bruins|Winnipeg Jets|NA|NA| 106|  224|205917|NHL|NHL Hockey
nhl|6066734|07:00 pm|2024-01-19|Sunrise, FL|Wild at Panthers|Minnesota Wild at Florida Panthers|Amerant Bank Arena|   126|0.940|26.1585| -80.3255|Florida Panthers|Minnesota Wild|NA|NA|  38|  115|  1036|NHL|NHL Hockey
nhl|6074304|07:00 pm|2024-01-20|Boston, MA|Canadiens at Bruins|Montreal Canadiens at Boston Bruins|TD Garden|  1544|0.891|42.3653| -71.0618|Boston Bruins|Montreal Canadiens|NA|NA| 231|  458|123504|NHL|NHL Hockey
nhl|6065317|07:00 pm|2024-01-17|Sunrise, FL|Red Wings at Panthers|Detroit Red Wings at Florida Panthers|Amerant Bank Arena|   126|0.902|26.1585| -80.3255|Florida Panthers|Detroit Red Wings|NA|NA|  30|   91|   945|NHL|NHL Hockey
nba|6119925|08:30 pm|2024-02-03|New York, NY|Lakers at Knicks|Los Angeles Lakers at New York Knicks|Madison Square Garden|    93|0.936|40.7509| -73.9943|New York Knicks|Los Angeles Lakers|NA|NA| 368|  902| 35229|NBA|NBA Basketball
nba|6114479|07:00 pm|2024-01-19|New Orleans, LA|Suns at Pelicans|Phoenix Suns at New Orleans Pelicans|Smoothie King Center|   184|0.940|29.9490| -90.0821|New Orleans Pelicans|Phoenix Suns|NA|NA|  33|  130|  2219|NBA|NBA Basketball
nba|6119839|07:00 pm|2024-01-27|Boston, MA|Clippers at Celtics|Los Angeles Clippers at Boston Celtics|TD Garden|  1544|0.903|42.3653| -71.0618|Boston Celtics|Los Angeles Clippers|NA|NA| 181|  463| 15873|NBA|NBA Basketball
nba|6120662|07:00 pm|2024-01-20|Washington, DC|Spurs at Wizards|San Antonio Spurs at Washington Wizards|Capital One Arena|   181|0.919|38.8981| -77.0209|Washington Wizards|San Antonio Spurs|NA|NA|  40|  210|  5471|NBA|NBA Basketball
nba|6113840|07:00 pm|2024-01-17|Salt Lake City, UT|Warriors at Jazz|Golden State Warriors at Utah Jazz|Delta Center|   188|0.915|40.7676|-111.9010|Utah Jazz|Golden State Warriors|NA|NA|  37|  107|  4311|NBA|NBA Basketball
nba|6119841|07:30 pm|2024-01-19|Boston, MA|Nuggets at Celtics|Denver Nuggets at Boston Celtics|TD Garden|  1544|0.928|42.3653| -71.0618|Boston Celtics|Denver Nuggets|NA|NA| 193|  460|150212|NBA|NBA Basketball
nba|6121818|07:00 pm|2024-01-23|Los Angeles, CA|Lakers at Clippers|Los Angeles Lakers at Los Angeles Clippers|Crypto.com Arena|   134|0.899|34.0430|-118.2670|Los Angeles Clippers|Los Angeles Lakers|NA|NA| 106|  322| 17425|NBA|NBA Basketball
nba|6121441|07:30 pm|2024-01-22|Dallas, TX|Celtics at Mavericks|Boston Celtics at Dallas Mavericks|American Airlines Center|   117|0.899|32.7904| -96.8103|Dallas Mavericks|Boston Celtics|NA|NA|  52|  325|  6861|NBA|NBA Basketball
nba|6120295|07:30 pm|2024-01-23|Brooklyn, NY|Knicks at Nets|New York Knicks at Brooklyn Nets|Barclays Center|  7546|0.894|40.6827| -73.9753|Brooklyn Nets|New York Knicks|NA|NA|  92|  226| 20193|NBA|NBA Basketball
nba|6119913|07:30 pm|2024-01-20|New York, NY|Raptors at Knicks|Toronto Raptors at New York Knicks|Madison Square Garden|    93|0.934|40.7509| -73.9943|New York Knicks|Toronto Raptors|NA|NA| 194|  469| 18797|NBA|NBA Basketball
nba|6120067|07:30 pm|2024-01-19|Los Angeles, CA|Nets at Lakers|Brooklyn Nets at Los Angeles Lakers|Crypto.com Arena|   134|0.893|34.0430|-118.2670|Los Angeles Lakers|Brooklyn Nets|NA|NA|  82|  291| 28700|NBA|NBA Basketball
nba|6119847|07:30 pm|2024-02-01|Boston, MA|Lakers at Celtics|Los Angeles Lakers at Boston Celtics|TD Garden|  1544|0.922|42.3653| -71.0618|Boston Celtics|Los Angeles Lakers|NA|NA| 286|  691| 17964|NBA|NBA Basketball
nba|6120904|07:00 pm|2024-01-22|Philadelphia, PA|Spurs at 76ers|San Antonio Spurs at Philadelphia 76ers|Wells Fargo Center|  3148|0.890|39.9012| -75.1720|Philadelphia 76ers|San Antonio Spurs|NA|NA|  35|  215| 20157|NBA|NBA Basketball
nba|6119915|07:30 pm|2024-01-25|New York, NY|Nuggets at Knicks|Denver Nuggets at New York Knicks|Madison Square Garden|    93|0.884|40.7509| -73.9943|New York Knicks|Denver Nuggets|NA|NA| 143|  310|  6457|NBA|NBA Basketball
nba|6119916|03:00 pm|2024-01-27|New York, NY|Heat at Knicks|Miami Heat at New York Knicks|Madison Square Garden|    93|0.914|40.7509| -73.9943|New York Knicks|Miami Heat|NA|NA| 192|  475| 15914|NBA|NBA Basketball
nba|6120663|06:00 pm|2024-01-21|Washington, DC|Nuggets at Wizards|Denver Nuggets at Washington Wizards|Capital One Arena|   181|0.881|38.8981| -77.0209|Washington Wizards|Denver Nuggets|NA|NA|  31|  169|  5396|NBA|NBA Basketball
nba|6121285|06:00 pm|2024-01-21|Houston, TX|Celtics at Rockets|Boston Celtics at Houston Rockets|Toyota Center|   129|0.902|29.7508| -95.3621|Houston Rockets|Boston Celtics|NA|NA|  34|  108|  1465|NBA|NBA Basketball
nba|6121745|06:00 pm|2024-01-21|Orlando, FL|Heat at Magic|Miami Heat at Orlando Magic|Kia Center|  2652|0.877|28.5392| -81.3839|Orlando Magic|Miami Heat|NA|NA|  86|  274|  8847|NBA|NBA Basketball
nba|6120750|03:30 pm|2024-01-27|Denver, CO|76ers at Nuggets|Philadelphia 76ers at Denver Nuggets|Ball Arena|   187|0.859|39.7487|-105.0080|Denver Nuggets|Philadelphia 76ers|NA|NA|  93|  291|214749|NBA|NBA Basketball
nba|6120001|05:30 pm|2024-01-27|San Francisco, CA|Lakers at Warriors|Los Angeles Lakers at Golden State Warriors|Chase Center|467029|0.873|37.7704|-122.3870|Golden State Warriors|Los Angeles Lakers|NA|NA| 311| 1044| 28698|NBA|NBA Basketball
nba|6119995|07:00 pm|2024-01-19|San Francisco, CA|Mavericks at Warriors|Dallas Mavericks at Golden State Warriors|Chase Center|467029|0.858|37.7704|-122.3870|Golden State Warriors|Dallas Mavericks|NA|NA|  83|  511| 20835|NBA|NBA Basketball
nba|6106043|07:30 pm|2024-01-17|Cleveland, OH|Bucks at Cavaliers|Milwaukee Bucks at Cleveland Cavaliers|Rocket Mortgage FieldHouse|   120|0.865|41.4971| -81.6884|Cleveland Cavaliers|Milwaukee Bucks|NA|NA|  19|  110|  4270|NBA|NBA Basketball
nba|6121052|07:30 pm|2024-01-25|Miami, FL|Celtics at Heat|Boston Celtics at Miami Heat|Kaseya Center|   183|0.893|25.7812| -80.1879|Miami Heat|Boston Celtics|NA|NA| 127|  351| 18325|NBA|NBA Basketball
nba|6120069|07:00 pm|2024-01-17|Los Angeles, CA|Mavericks at Lakers|Dallas Mavericks at Los Angeles Lakers|Crypto.com Arena|   134|0.864|34.0430|-118.2670|Los Angeles Lakers|Dallas Mavericks|NA|NA|  68|  262| 20155|NBA|NBA Basketball
nba|6119837|07:30 pm|2024-01-17|Boston, MA|Spurs at Celtics|San Antonio Spurs at Boston Celtics|TD Garden|  1544|0.864|42.3653| -71.0618|Boston Celtics|San Antonio Spurs|NA|NA|  93|  306|  7176|NBA|NBA Basketball
nba|6120443|07:00 pm|2024-01-20|Minneapolis, MN|Thunder at Timberwolves|Oklahoma City Thunder at Minnesota Timberwolves|Target Center|   135|0.859|44.9795| -93.2761|Minnesota Timberwolves|Oklahoma City Thunder|NA|NA|  73|  175|   705|NBA|NBA Basketball
nba|6120363|07:00 pm|2024-01-19|Charlotte, NC|Spurs at Hornets|San Antonio Spurs at Charlotte Hornets|Spectrum Center|   112|0.863|35.2248| -80.8403|Charlotte Hornets|San Antonio Spurs|NA|NA|  29|  118|  3207|NBA|NBA Basketball
nba|6120075|07:00 pm|2024-01-21|Los Angeles, CA|Trail Blazers at Lakers|Portland Trail Blazers at Los Angeles Lakers|Crypto.com Arena|   134|0.884|34.0430|-118.2670|Los Angeles Lakers|Portland Trail Blazers|NA|NA|  85|  281| 16425|NBA|NBA Basketball
nba|6120304|07:30 pm|2024-02-05|Brooklyn, NY|Warriors at Nets|Golden State Warriors at Brooklyn Nets|Barclays Center|  7546|0.860|40.6827| -73.9753|Brooklyn Nets|Golden State Warriors|NA|NA|  97|  321| 17352|NBA|NBA Basketball
nba|6121289|07:00 pm|2024-01-29|Houston, TX|Lakers at Rockets|Los Angeles Lakers at Houston Rockets|Toyota Center|   129|0.856|29.7508| -95.3621|Houston Rockets|Los Angeles Lakers|NA|NA|  70|  188|  5654|NBA|NBA Basketball
nba|6120365|07:00 pm|2024-01-20|Charlotte, NC|76ers at Hornets|Philadelphia 76ers at Charlotte Hornets|Spectrum Center|   112|0.857|35.2248| -80.8403|Charlotte Hornets|Philadelphia 76ers|NA|NA|  28|  145|  4427|NBA|NBA Basketball
nba|6120149|06:00 pm|2024-01-21|Phoenix, AZ|Pacers at Suns|Indiana Pacers at Phoenix Suns|Footprint Center|   130|0.857|33.4458|-112.0710|Phoenix Suns|Indiana Pacers|NA|NA|  32|  182|  5394|NBA|NBA Basketball
nba|6120525|07:30 pm|2024-01-30|Atlanta, GA|Lakers at Hawks|Los Angeles Lakers at Atlanta Hawks|State Farm Arena|   127|0.858|33.7566| -84.3969|Atlanta Hawks|Los Angeles Lakers|NA|NA| 158|  656| 17051|NBA|NBA Basketball
nba|6120529|07:30 pm|2024-02-03|Atlanta, GA|Warriors at Hawks|Golden State Warriors at Atlanta Hawks|State Farm Arena|   127|0.856|33.7566| -84.3969|Atlanta Hawks|Golden State Warriors|NA|NA| 167|  587|  7720|NBA|NBA Basketball
ncaa_basketball|6184294|12:30 pm|2024-01-27|Providence, RI|Georgetown at Providence|Georgetown Hoyas at Providence Friars Mens Basketball|Amica Mutual Pavilion|   805|0.863|41.8236| -71.4180|Providence Friars Mens Basketball|Georgetown Hoyas Mens Basketball|NA|NA| 122|  297|  8968|NCAA BB|College Basketball
ncaa_basketball|6202263|02:15 pm|2024-01-20|Chestnut Hill, MA|North Carolina at Boston College|North Carolina Tar Heels at Boston College Eagles Mens Basketball|Silvio O. Conte Forum|  3488|0.859|42.3351| -71.1677|Boston College Eagles Mens Basketball|North Carolina Tar Heels Mens Basketball|NA|NA|  91|  248| 23505|NCAA BB|College Basketball
ncaa_basketball|6202193|07:00 pm|2024-01-22|Chapel Hill, NC|Wake Forest at North Carolina|Wake Forest Demon Deacons at North Carolina Tar Heels Mens Basketball|Dean Smith Center|  3438|0.875|35.9004| -79.0432|North Carolina Tar Heels Mens Basketball|Wake Forest Demon Deacons Mens Basketball|NA|NA|  49|   93|   524|NCAA BB|College Basketball
ncaa_basketball|6202195|06:30 pm|2024-02-03|Chapel Hill, NC|Duke at North Carolina|Duke Blue Devils at North Carolina Tar Heels Mens Basketball|Dean Smith Center|  3438|0.940|35.9004| -79.0432|North Carolina Tar Heels Mens Basketball|Duke Blue Devils Mens Basketball|NA|NA| 642| 1165|  4188|NCAA BB|College Basketball