league|id|time|date|city|title|full|venue|ven_id|score|lat|long|t1|t2|t3|t4|low|med|high|name|xname
ncaa_basketball|5845646|07:05 pm|2023-01-19|Grand Forks, ND|Kansas City at North Dakota|Kansas City Roos at North Dakota Fighting Hawks Basketball|Betty Engelstad Sioux Center|  6673|0.333|47.9278| -97.0716|North Dakota Fighting Hawks Basketball|Kansas City Roos Basketball|NA|NA|  28|  41|    56|NCAA BB|College Basketball
ncaa_basketball|5833514|07:00 pm|2023-01-02|Lynchburg, VA|Lipscomb at Liberty|Lipscomb Bisons at Liberty Flames Basketball|Liberty Arena|518716|0.332|37.3531| -79.1770|Liberty Flames Basketball|Lipscomb Bisons Basketball|NA|NA|  41|  58|    95|NCAA BB|College Basketball
ncaa_basketball|5885487|07:00 pm|2022-12-13|Beaumont, TX|Southern Miss at Lamar|Southern Miss Golden Eagles at Lamar Cardinals Basketball|Montagne Center|  4204|0.332|30.0439| -94.0708|Lamar Cardinals Basketball|Southern Miss Golden Eagles Basketball|NA|NA|  18|  31|    52|NCAA BB|College Basketball
ncaa_basketball|5795659|07:00 pm|2022-12-14|Reno, NV|UC San Diego Tritons at Nevada Wolf Pack Basketball|UC San Diego Tritons at Nevada Wolf Pack Basketball|Lawlor Events Center|  4150|0.332|39.5459|-119.8190|Nevada Wolf Pack Basketball|UC San Diego Tritons Basketball|NA|NA|  23|  45|   161|NCAA BB|College Basketball
ncaa_basketball|5885369|02:00 pm|2022-12-18|Lewisburg, PA|Merrimack at Bucknell|Merrimack Warriors at Bucknell Bison Basketball|Sojka Pavilion|  4222|0.332|40.9570| -76.8849|Bucknell Bison Basketball|Merrimack Warriors Basketball|NA|NA|  35|  39|    44|NCAA BB|College Basketball
ncaa_basketball|5885511|06:00 pm|2022-12-29|Orem, UT|Sam Houston at Utah Valley|Sam Houston Bearkats at Utah Valley Wolverines Basketball|UCCU Center|   171|0.332|40.2790|-111.7160|Utah Valley Wolverines Basketball|Sam Houston Bearkats Basketball|NA|NA|  19|  49|    59|NCAA BB|College Basketball
ncaa_basketball|5885488|07:00 pm|2022-12-20|Beaumont, TX|Pacific at Lamar|Pacific Tigers at Lamar Cardinals Basketball|Montagne Center|  4204|0.332|30.0439| -94.0708|Lamar Cardinals Basketball|Pacific Tigers Basketball|NA|NA|  16|  29|    52|NCAA BB|College Basketball
ncaa_basketball|5773052|07:00 pm|2022-12-28|Waco, TX|Nicholls at Baylor|Nicholls State Colonels at Baylor Bears Basketball|Ferrell Center|  3471|0.332|31.5495| -97.1052|Baylor Bears Basketball|Nicholls State Colonels Basketball|NA|NA|   8|  14|   400|NCAA BB|College Basketball
ncaa_basketball|5846107|03:00 pm|2022-12-18|San Antonio, TX|Bethune-Cookman at UTSA|Bethune-Cookman Wildcats at UTSA Roadrunners Basketball|UTSA Convocation Center|  4145|0.332|29.5824| -98.6215|UTSA Roadrunners Basketball|Bethune-Cookman Wildcats Basketball|NA|NA|  31|  31|    53|NCAA BB|College Basketball
ncaa_basketball|5849255|07:00 pm|2023-01-18|Buies Creek, NC|Radford at Campbell|Radford Highlanders at Campbell Fighting Camels Basketball|John W Pope Convocation Center|  4198|0.331|35.4078| -78.7361|Campbell Fighting Camels Basketball|Radford Highlanders Basketball|NA|NA|  14|  32|    56|NCAA BB|College Basketball
ncaa_basketball|5811651|07:00 pm|2022-12-13|Murray, KY|Chicago State at Murray State|Chicago State Cougars at Murray State Racers Basketball|CFSB Center|  4142|0.331|36.6103| -88.3148|Murray State Racers Basketball|Chicago State Cougars Basketball|NA|NA|  38|  57|   219|NCAA BB|College Basketball
ncaa_basketball|5795503|03:30 am|2022-12-31|Fort Collins, CO|San Jose State at Colorado State|San Jose State Spartans at Colorado State Rams Basketball|Moby Arena|  4169|0.331|40.5756|-105.0840|Colorado State Rams Basketball|San Jose State Spartans Basketball|NA|NA|  51|  78|    84|NCAA BB|College Basketball
ncaa_basketball|5846109|07:00 pm|2023-01-05|San Antonio, TX|Middle Tennessee at UTSA|Middle Tennessee Blue Raiders at UTSA Roadrunners Basketball|UTSA Convocation Center|  4145|0.331|29.5824| -98.6215|UTSA Roadrunners Basketball|Middle Tennessee Blue Raiders Basketball|NA|NA|  30|  35|    52|NCAA BB|College Basketball
ncaa_basketball|5848450|02:00 pm|2022-12-17|Cheney, WA|UC Davis at Eastern Washington|UC Davis Aggies at Eastern Washington Eagles Basketball|Reese Court|  4183|0.331|47.4914|-117.5890|Eastern Washington Eagles Basketball|UC Davis Aggies Basketball|NA|NA|  18|  19|    74|NCAA BB|College Basketball
ncaa_basketball|5885870|07:00 pm|2022-12-14|Akron, OH|Wright State at Akron|Wright State Raiders at Akron Zips Basketball|James A. Rhodes Arena|  4141|0.331|41.0755| -81.5076|Akron Zips Basketball|Wright State Raiders Basketball|NA|NA|  29|  31|    46|NCAA BB|College Basketball
ncaa_basketball|5772306|08:30 pm|2022-12-22|University Park, PA|Quinnipiac at Penn State|Quinnipiac Bobcats at Penn State Nittany Lions Basketball|Bryce Jordan Center|   108|0.331|40.8099| -77.8562|Penn State Nittany Lions Basketball|Quinnipiac Bobcats Basketball|NA|NA|  14|  41|   306|NCAA BB|College Basketball
ncaa_basketball|5818009|06:00 pm|2023-01-18|West Point, NY|Bucknell at Army West Point|Bucknell Bison at Army Black Knights Basketball|Christl Arena|  5181|0.331|41.3863| -73.9657|Army Black Knights Basketball|Bucknell Bison Basketball|NA|NA|  30|  32|    36|NCAA BB|College Basketball
ncaa_basketball|5885811|07:00 pm|2022-12-29|Charleston, SC|Chattanooga at The Citadel|Chattanooga Mocs at The Citadel Bulldogs Basketball|McAlister Field House|  5173|0.330|32.7976| -79.9590|The Citadel Bulldogs Basketball|Chattanooga Mocs Basketball|NA|NA|  19|  35|    61|NCAA BB|College Basketball
ncaa_basketball|5853886|06:30 pm|2023-01-04|Nacogdoches, TX|New Mexico State at Stephen F. Austin|New Mexico State Aggies at Stephen F. Austin Lumberjacks Basketball|William R. Johnson Coliseum|  1878|0.330|31.6231| -94.6437|Stephen F. Austin Lumberjacks Basketball|New Mexico State Aggies Basketball|NA|NA|  31|  31|    65|NCAA BB|College Basketball
ncaa_basketball|5885443|07:00 pm|2022-12-13|Washington, DC|FIU at Howard|Florida International Panthers at Howard Bison Basketball|Burr Gymnasium|  4155|0.330|38.9240| -77.0216|Howard Bison Basketball|Florida International Panthers Basketball|NA|NA|  42|  43|    66|NCAA BB|College Basketball
ncaa_basketball|5841522|02:00 pm|2023-01-07|Ypsilanti, MI|Central Michigan Chippewas at Eastern Michigan Eagles Basketball|Central Michigan Chippewas at Eastern Michigan Eagles Basketball|George Gervin GameAbove Center|  3501|0.330|42.2542| -83.6472|Eastern Michigan Eagles Basketball|Central Michigan Chippewas Basketball|NA|NA|  27|  33|   181|NCAA BB|College Basketball
ncaa_basketball|5848546|06:00 pm|2023-01-16|Moscow, ID|Montana State at Idaho|Montana State Bobcats at Idaho Vandals Basketball|Idaho Central Credit Union Arena|519525|0.330|46.7320|-117.0070|Idaho Vandals Basketball|Montana State Bobcats Basketball|NA|NA|  15|  18|    64|NCAA BB|College Basketball
ncaa_basketball|5848522|03:00 pm|2023-01-14|Ruston, LA|UAB at Louisiana Tech|UAB Blazers at Louisiana Tech Bulldogs Basketball|Thomas Assembly Center|  4212|0.330|32.5310| -92.6584|Louisiana Tech Bulldogs Basketball|UAB Blazers Basketball|NA|NA|  18|  27|    50|NCAA BB|College Basketball
ncaa_basketball|5841435|02:00 pm|2022-12-31|Indianapolis, IN|Northern Kentucky Norse at IUPUI Jaguars Basketball|Northern Kentucky Norse at IUPUI Jaguars Basketball|Indiana Farmers Coliseum|  1607|0.329|39.8273| -86.1348|IUPUI Jaguars Basketball|Northern Kentucky Norse Basketball|NA|NA|  44|  47|   812|NCAA BB|College Basketball
ncaa_basketball|5868277|05:00 pm|2023-01-07|Bowling Green, OH|Ohio at Bowling Green|Ohio Bobcats at Bowling Green Falcons Basketball|Stroh Center|  7484|0.329|41.3752| -83.6262|Bowling Green Falcons Basketball|Ohio Bobcats Basketball|NA|NA|  18|  27|    41|NCAA BB|College Basketball
ncaa_basketball|5848505|06:00 pm|2022-12-21|Murfreesboro, TN|Murray State at Middle Tennessee|Murray State Racers at Middle Tennessee Blue Raiders Basketball|Murphy Center|  4203|0.329|35.8520| -86.3620|Middle Tennessee Blue Raiders Basketball|Murray State Racers Basketball|NA|NA|  22|  38|    64|NCAA BB|College Basketball
ncaa_basketball|5885686|07:00 pm|2022-12-29|Brookings, SD|Western Illinois at South Dakota State|Western Illinois Leathernecks at South Dakota State Jackrabbits Basketball|Frost Arena|  5186|0.329|44.3144| -96.7781|South Dakota State Jackrabbits Basketball|Western Illinois Leathernecks Basketball|NA|NA|  20|  39|    59|NCAA BB|College Basketball
ncaa_basketball|5885551|07:00 pm|2022-12-12|Easton, PA|Columbia at Lafayette|Columbia Lions at Lafayette Leopards Basketball|Kirby Sports Center|  4229|0.329|40.7019| -75.2097|Lafayette Leopards Basketball|Columbia Lions Basketball|NA|NA|  41|  41|    41|NCAA BB|College Basketball
ncaa_basketball|5811499|01:00 pm|2023-01-07|Evansville, IN|Illinois State at Evansville|Illinois State Redbirds at Evansville Purple Aces Basketball|Ford Center|  6370|0.329|37.9721| -87.5679|Evansville Purple Aces Basketball|Illinois State Redbirds Basketball|NA|NA|  38|  80|   883|NCAA BB|College Basketball
ncaa_basketball|5844027|07:05 pm|2023-01-12|Omaha, NE|North Dakota at Omaha|North Dakota Fighting Hawks at Omaha Mavericks Basketball|Baxter Arena| 78765|0.329|41.2362| -96.0129|Omaha Mavericks Basketball|North Dakota Fighting Hawks Basketball|NA|NA|  29|  44|   784|NCAA BB|College Basketball
ncaa_basketball|5818007|06:00 pm|2023-01-11|West Point, NY|American University at Army West Point|American University Eagles at Army Black Knights Basketball|Christl Arena|  5181|0.328|41.3863| -73.9657|Army Black Knights Basketball|American University Eagles Basketball|NA|NA|  30|  32|    36|NCAA BB|College Basketball
ncaa_basketball|5811524|01:00 pm|2022-12-18|Chicago, IL|Northeastern at UIC|Northeastern Huskies at UIC Flames Basketball|Credit Union 1 Arena at UIC|  1140|0.328|41.8749| -87.6561|UIC Flames Basketball|Northeastern Huskies Basketball|NA|NA|  34|  56|   270|NCAA BB|College Basketball
ncaa_basketball|5885620|07:00 pm|2022-12-20|Riverside, CA|San Diego at UC Riverside|San Diego Toreros at UC Riverside Highlanders Basketball|UC Riverside Student Recreation Center|  4152|0.327|33.9782|-117.3280|UC Riverside Highlanders Basketball|San Diego Toreros Basketball|NA|NA|  21|  21|    22|NCAA BB|College Basketball
ncaa_basketball|5800256|07:00 pm|2022-12-29|Phoenix, AZ|California Baptist at Grand Canyon|California Baptist Lancers at Grand Canyon Lopes Basketball|GCU Arena|171229|0.327|33.5126|-112.1270|Grand Canyon Lopes Basketball|California Baptist Lancers Basketball|NA|NA|  57|  57|    57|NCAA BB|College Basketball
ncaa_basketball|5844314|07:00 pm|2023-01-11|Denton, TX|Louisiana Tech at North Texas|Louisiana Tech Bulldogs at North Texas Mean Green Basketball|UNT Coliseum (Super Pit)|  4159|0.327|33.2086| -97.1541|North Texas Mean Green Basketball|Louisiana Tech Bulldogs Basketball|NA|NA|  23|  36|    77|NCAA BB|College Basketball
ncaa_basketball|5818006|07:00 pm|2023-01-09|West Point, NY|Colgate at Army West Point|Colgate Raiders at Army Black Knights Basketball|Christl Arena|  5181|0.327|41.3863| -73.9657|Army Black Knights Basketball|Colgate Raiders Basketball|NA|NA|  30|  32|    35|NCAA BB|College Basketball
ncaa_basketball|5825296|07:00 pm|2023-01-19|Greensboro, NC|The Citadel at UNCG|The Citadel Bulldogs at UNC Greensboro Spartans Basketball|Greensboro Coliseum Complex|  4318|0.326|36.0580| -79.8248|UNC Greensboro Spartans Basketball|The Citadel Bulldogs Basketball|NA|NA|  32|  41|    64|NCAA BB|College Basketball
ncaa_basketball|5833515|07:00 pm|2023-01-05|Lynchburg, VA|Jacksonville State at Liberty|Jacksonville State Gamecocks at Liberty Flames Basketball|Liberty Arena|518716|0.326|37.3531| -79.1770|Liberty Flames Basketball|Jacksonville State Gamecocks Basketball|NA|NA|  41|  55|    94|NCAA BB|College Basketball
ncaa_basketball|5885861|01:00 pm|2022-12-22|Washington, DC|Siena at American University|Siena Saints at American University Eagles Basketball|Bender Arena|  4279|0.326|38.9361| -77.0888|American University Eagles Basketball|Siena Saints Basketball|NA|NA|  28|  31|    62|NCAA BB|College Basketball
ncaa_basketball|5848749|07:00 pm|2023-01-19|Ogden, UT|Portland State at Weber State|Portland State Vikings at Weber State Wildcats Basketball|Dee Events Center|  4259|0.326|41.1831|-111.9490|Weber State Wildcats Basketball|Portland State Vikings Basketball|NA|NA|  18|  65|    66|NCAA BB|College Basketball
ncaa_basketball|5833516|07:00 pm|2023-01-12|Lynchburg, VA|North Alabama at Liberty|North Alabama Lions at Liberty Flames Basketball|Liberty Arena|518716|0.326|37.3531| -79.1770|Liberty Flames Basketball|North Alabama Lions Basketball|NA|NA|  40|  57|    94|NCAA BB|College Basketball
ncaa_basketball|5848451|06:00 pm|2023-01-05|Cheney, WA|Portland State at Eastern Washington|Portland State Vikings at Eastern Washington Eagles Basketball|Reese Court|  4183|0.326|47.4914|-117.5890|Eastern Washington Eagles Basketball|Portland State Vikings Basketball|NA|NA|  18|  28|    74|NCAA BB|College Basketball
ncaa_basketball|5751125|03:30 am|2023-01-05|Troy, AL|Old Dominion at Troy|Old Dominion Monarchs at Troy Trojans Basketball|Trojan Arena|  6462|0.326|31.8073| -85.9626|Troy Trojans Basketball|Old Dominion Monarchs Basketball|NA|NA|  18|  49|    64|NCAA BB|College Basketball
ncaa_basketball|5853013|07:00 pm|2023-01-19|Fort Myers, FL|Jacksonville State at FGCU|Jacksonville State Gamecocks at Florida Gulf Coast Eagles Basketball|Alico Arena|  4252|0.326|26.4618| -81.7759|Florida Gulf Coast Eagles Basketball|Jacksonville State Gamecocks Basketball|NA|NA|  60|  60|    64|NCAA BB|College Basketball
ncaa_basketball|5860922|07:00 pm|2023-01-19|Vermillion, SD|Denver at South Dakota|Denver Pioneers at South Dakota Coyotes Basketball|Sanford Coyote Sports Center|455132|0.326|42.7904| -96.9278|South Dakota Coyotes Basketball|Denver Pioneers Basketball|NA|NA|  24|  29|    79|NCAA BB|College Basketball
ncaa_basketball|5801406|07:00 pm|2022-12-16|Saint Bonaventure, NY|FGCU at St. Bonaventure|Florida Gulf Coast Eagles at St. Bonaventure Bonnies Basketball|Reilly Center|  3476|0.326|42.0806| -78.4829|St. Bonaventure Bonnies Basketball|Florida Gulf Coast Eagles Basketball|NA|NA|  46|  54|    99|NCAA BB|College Basketball
ncaa_basketball|5801538|01:00 pm|2022-12-18|Chicago, IL|Albany at Loyola Chicago|Albany Great Danes at Loyola Chicago Ramblers Basketball|Gentile Arena|  5183|0.325|42.0006| -87.6591|Loyola Chicago Ramblers Basketball|Albany Great Danes Basketball|NA|NA|  28|  28|    28|NCAA BB|College Basketball
ncaa_basketball|5817210|07:00 pm|2023-01-18|Tulsa, OK|SMU at Tulsa|SMU Mustangs at Tulsa Golden Hurricane Basketball|Reynolds Center|  3449|0.325|36.1490| -95.9421|Tulsa Golden Hurricane Basketball|SMU Mustangs Basketball|NA|NA|  32|  49|    88|NCAA BB|College Basketball
ncaa_basketball|5885801|07:00 pm|2022-12-14|Nashville, TN|Tennessee Tech at Lipscomb|Tennessee Tech Golden Eagles at Lipscomb Bisons Basketball|Allen Arena|  3552|0.325|36.1051| -86.7987|Lipscomb Bisons Basketball|Tennessee Tech Golden Eagles Basketball|NA|NA|  29|  44|    52|NCAA BB|College Basketball
ncaa_basketball|5885450|02:00 pm|2022-12-31|Kennesaw, GA|Central Arkansas at Kennesaw State|Central Arkansas Bears at Kennesaw State Owls Basketball|KSU Convocation Center|  4230|0.325|34.0321| -84.5811|Kennesaw State Owls Basketball|Central Arkansas Bears Basketball|NA|NA|  20|  65|    66|NCAA BB|College Basketball
ncaa_basketball|5828408|06:30 pm|2023-01-12|Louisville, KY|Stetson at Bellarmine|Stetson Hatters at Bellarmine Knights Basketball|Freedom Hall|   109|0.324|38.1996| -85.7417|Bellarmine Knights Basketball|Stetson Hatters Basketball|NA|NA|  24|  32|   799|NCAA BB|College Basketball
ncaa_basketball|5747498|04:00 pm|2023-01-14|Bozeman, MT|Weber State at Montana State|Weber State Wildcats at Montana State Bobcats Basketball|Brick Breeden Fieldhouse|   918|0.324|45.6650|-111.0510|Montana State Bobcats Basketball|Weber State Wildcats Basketball|NA|NA|  33|  79|   107|NCAA BB|College Basketball
ncaa_basketball|5751053|03:30 am|2023-01-12|Norfolk, VA|Coastal Carolina at Old Dominion|Coastal Carolina Chanticleers at Old Dominion Monarchs Basketball|Chartway Arena at the Ted Constant Convocation Center|  3692|0.324|36.8841| -76.3014|Old Dominion Monarchs Basketball|Coastal Carolina Chanticleers Basketball|NA|NA|  71| 104|   107|NCAA BB|College Basketball
ncaa_basketball|5800257|07:00 pm|2022-12-20|Phoenix, AZ|Idaho State at Grand Canyon|Idaho State Bengals at Grand Canyon Lopes Basketball|GCU Arena|171229|0.324|33.5126|-112.1270|Grand Canyon Lopes Basketball|Idaho State Bengals Basketball|NA|NA|  57|  57|    57|NCAA BB|College Basketball
ncaa_basketball|5849251|07:00 pm|2023-01-04|Buies Creek, NC|Gardner-Webb at Campbell|Gardner-Webb Runnin' Bulldogs at Campbell Fighting Camels Basketball|John W Pope Convocation Center|  4198|0.324|35.4078| -78.7361|Campbell Fighting Camels Basketball|Gardner-Webb Runnin' Bulldogs Basketball|NA|NA|  14|  33|    56|NCAA BB|College Basketball
ncaa_basketball|5801443|04:00 pm|2022-12-23|Fairfax, VA|Coppin State at George Mason|Coppin State Eagles at George Mason Patriots Basketball|EagleBank Arena|   804|0.323|38.8462| -77.3064|George Mason Patriots Basketball|Coppin State Eagles Basketball|NA|NA|  28|  57|   421|NCAA BB|College Basketball
ncaa_basketball|5873217|07:00 pm|2022-12-15|Santa Clara, CA|UC Irvine at Santa Clara|UC Irvine Anteaters at Santa Clara Broncos Basketball|Leavey Center|  4151|0.323|37.3517|-121.9370|Santa Clara Broncos Basketball|UC Irvine Anteaters Basketball|NA|NA|  12|  33|    76|NCAA BB|College Basketball
ncaa_basketball|5811627|07:00 pm|2022-12-22|Springfield, MO|Sam Houston at Missouri State|Sam Houston State Bearkats at Missouri State Bears Basketball|Great Southern Bank Arena|  2067|0.323|37.2021| -93.2831|Missouri State Bears Basketball|Sam Houston Bearkats Basketball|NA|NA|  37|  40|    94|NCAA BB|College Basketball
ncaa_basketball|5859579|07:30 pm|2023-01-09|Baltimore, MD|South Carolina State at Morgan State|South Carolina State Bulldogs at Morgan State Bears Basketball|Morgan State University|  3332|0.322|39.3448| -76.5842|Morgan State Bears Basketball|South Carolina State Bulldogs Basketball|NA|NA|  44|  61|    86|NCAA BB|College Basketball
ncaa_basketball|5825297|04:00 pm|2023-01-07|Greensboro, NC|Samford at UNCG|Samford Bulldogs at UNC Greensboro Spartans Basketball|Greensboro Coliseum Complex|  4318|0.322|36.0580| -79.8248|UNC Greensboro Spartans Basketball|Samford Bulldogs Basketball|NA|NA|  32|  43|   153|NCAA BB|College Basketball
ncaa_basketball|5814866|07:00 pm|2022-12-13|Boise, ID|New Orleans Privateers at Boise State Broncos Basketball|New Orleans Privateers at Boise State Broncos Basketball|ExtraMile Arena|   336|0.322|43.6050|-116.2070|Boise State Broncos Basketball|New Orleans Privateers Basketball|NA|NA|  13|  39|   230|NCAA BB|College Basketball
ncaa_basketball|5885461|06:00 pm|2022-12-28|Birmingham, AL|Mercer at Samford|Mercer Bears at Samford Bulldogs Basketball|Pete Hanna Center|  4192|0.322|33.4649| -86.7913|Samford Bulldogs Basketball|Mercer Bears Basketball|NA|NA|  32|  40|    73|NCAA BB|College Basketball
ncaa_basketball|5866605|06:00 pm|2022-12-21|Troy, AL|Mercer at Troy|Mercer Bears at Troy Trojans Basketball|Trojan Arena|  6462|0.322|31.8073| -85.9626|Troy Trojans Basketball|Mercer Bears Basketball|NA|NA|  18|  49|    64|NCAA BB|College Basketball
ncaa_basketball|5885840|04:00 pm|2022-12-18|Harrisonburg, VA|LIU at James Madison|LIU Sharks at James Madison Dukes Basketball|Atlantic Union Bank Center|518629|0.322|38.4304| -78.8611|James Madison Dukes Basketball|LIU Sharks Basketball|NA|NA|  49|  49|    49|NCAA BB|College Basketball
ncaa_basketball|5875172|02:00 pm|2023-01-16|Fairfield, CT|Saint Francis U at Sacred Heart|Saint Francis (PA) Red Flash at Sacred Heart Pioneers Basketball|William H Pitt Health And Recreation Center at Sacred Heart University|  4232|0.321|41.1400| -73.2400|Sacred Heart Pioneers Basketball|Saint Francis (PA) Red Flash Basketball|NA|NA|  17|  36|   121|NCAA BB|College Basketball
ncaa_basketball|5848542|06:00 pm|2023-01-05|Moscow, ID|Sacramento State at Idaho|Sacramento State Hornets at Idaho Vandals Basketball|Idaho Central Credit Union Arena|519525|0.321|46.7320|-117.0070|Idaho Vandals Basketball|Sacramento State Hornets Basketball|NA|NA|  16|  19|    64|NCAA BB|College Basketball
ncaa_basketball|5865837|05:00 pm|2023-01-16|Baltimore, MD|Hartford at UMBC|Hartford Hawks at UMBC Retrievers Basketball|Chesapeake Employers Insurance Arena|437845|0.321|39.2556| -76.7110|UMBC Retrievers Basketball|Hartford Hawks Basketball|NA|NA|  21|  40|    86|NCAA BB|College Basketball
ncaa_basketball|5848670|07:00 pm|2023-01-19|Pocatello, ID|Sacramento State at Idaho State|Sacramento State Hornets at Idaho State Bengals Basketball|Reed Gym|  6560|0.321|42.8627|-112.4330|Idaho State Bengals Basketball|Sacramento State Hornets Basketball|NA|NA|  24|  24|    63|NCAA BB|College Basketball
ncaa_basketball|5795604|04:00 pm|2023-01-14|Fresno, CA|Air Force at Fresno State|Air Force Falcons at Fresno State Bulldogs Basketball|Save Mart Center|    76|0.321|36.8099|-119.7390|Fresno State Bulldogs Basketball|Air Force Falcons Basketball|NA|NA|  63|  69|    79|NCAA BB|College Basketball
ncaa_basketball|5818940|02:45 pm|2022-12-31|Youngstown, OH|Purdue Fort Wayne at Youngstown State|Purdue Fort Wayne Mastodons at Youngstown State Penguins Basketball|Beeghly Center|  4253|0.320|41.1083| -80.6490|Youngstown State Penguins Basketball|Purdue Fort Wayne Mastodons Basketball|NA|NA|  59|  59|    73|NCAA BB|College Basketball
ncaa_basketball|5791354|07:00 pm|2022-12-22|Kingston, RI|Milwaukee at Rhode Island|Milwaukee Panthers at Rhode Island Rams Basketball|Ryan Center|  1313|0.320|41.4882| -71.5366|Rhode Island Rams Basketball|Milwaukee Panthers Basketball|NA|NA|  17|  50|   213|NCAA BB|College Basketball
ncaa_basketball|5866598|07:00 pm|2022-12-20|Fort Wayne, IN|Southern Indiana at Purdue Fort Wayne|Southern Indiana Screaming Eagles at Purdue Fort Wayne Mastodons Basketball|Allen County War Memorial Coliseum|   331|0.430|41.1157| -85.1242|Purdue Fort Wayne Mastodons Basketball|Southern Indiana Screaming Eagles Basketball|NA|NA|  31|  44|   167|NCAA BB|College Basketball
ncaa_basketball|5811410|08:00 pm|2023-01-17|Nashville, TN|Murray State at Belmont|Murray State Racers at Belmont Bruins Basketball|Curb Event Center|  5164|0.320|36.1331| -86.7954|Belmont Bruins Basketball|Murray State Racers Basketball|NA|NA|  24|  50|    60|NCAA BB|College Basketball
ncaa_basketball|5891212|04:00 pm|2023-01-14|Greenville, SC|UNCG at Furman|UNC Greensboro Spartans at Furman Paladins Basketball|Timmons Arena|  2310|0.320|34.9250| -82.4332|Furman Paladins Basketball|UNC Greensboro Spartans Basketball|NA|NA|  63|  80|   107|NCAA BB|College Basketball
ncaa_basketball|5885200|07:00 pm|2022-12-22|Teaneck, NJ|Queens Royals at Fairleigh Dickinson Knights Basketball|Queens Royals at Fairleigh Dickinson Knights Basketball|Rothman Center| 44283|0.319|40.8967| -74.0329|Fairleigh Dickinson Knights Basketball|Queens Royals Basketball|NA|NA|  28|  49|    59|NCAA BB|College Basketball
ncaa_basketball|5862066|02:00 pm|2022-12-29|Fairfield, CT|Stonehill at Sacred Heart Pioneers Basketball|Stonehill at Sacred Heart Pioneers Basketball|William H Pitt Health And Recreation Center at Sacred Heart University|  4232|0.319|41.1400| -73.2400|Sacred Heart Pioneers Basketball|Stonehill Men's Basketball|NA|NA|  17|  49|   121|NCAA BB|College Basketball
ncaa_basketball|5860926|07:00 pm|2022-12-29|Vermillion, SD|St. Thomas (MN) at South Dakota|St. Thomas Tommies at South Dakota Coyotes Basketball|Sanford Coyote Sports Center|455132|0.319|42.7904| -96.9278|South Dakota Coyotes Basketball|St. Thomas Tommies Basketball|NA|NA|  18|  19|    80|NCAA BB|College Basketball
ncaa_basketball|5848668|07:00 pm|2022-12-29|Pocatello, ID|Northern Arizona at Idaho State|Northern Arizona Lumberjacks at Idaho State Bengals Basketball|Reed Gym|  6560|0.319|42.8627|-112.4330|Idaho State Bengals Basketball|Northern Arizona Lumberjacks Basketball|NA|NA|  24|  24|    64|NCAA BB|College Basketball
ncaa_basketball|5885199|07:00 pm|2022-12-29|Teaneck, NJ|Merrimack at Fairleigh Dickinson|Merrimack Warriors at Fairleigh Dickinson Knights Basketball|Rothman Center| 44283|0.319|40.8967| -74.0329|Fairleigh Dickinson Knights Basketball|Merrimack Warriors Basketball|NA|NA|  28|  49|    59|NCAA BB|College Basketball
ncaa_basketball|5885692|07:00 pm|2022-12-22|Riverside, CA|Portland State at California Baptist|Portland State Vikings at California Baptist Lancers Basketball|CBU Events Center|490283|0.319|33.9268|-117.4220|California Baptist Lancers Basketball|Portland State Vikings Basketball|NA|NA|  38|  38|    42|NCAA BB|College Basketball
ncaa_basketball|5750922|07:00 pm|2022-12-29|Conway, SC|Louisiana at Coastal Carolina|Louisiana Ragin' Cajuns at Coastal Carolina Chanticleers Basketball|HTC Center|  6586|0.319|33.7951| -79.0145|Coastal Carolina Chanticleers Basketball|Louisiana Ragin' Cajuns Basketball|NA|NA|  14|  54|    86|NCAA BB|College Basketball
ncaa_basketball|5844505|07:00 pm|2022-12-21|San Francisco, CA|Arizona State at San Francisco|Arizona State Sun Devils at San Francisco Dons Basketball|War Memorial At The Sobrato Center| 39291|0.319|37.7766|-122.4510|San Francisco Dons Basketball|Arizona State Sun Devils Basketball|NA|NA|  37|  37|    50|NCAA BB|College Basketball
ncaa_basketball|5795665|07:30 pm|2023-01-04|Reno, NV|Colorado State at Nevada|Colorado State Rams at Nevada Wolf Pack Basketball|Lawlor Events Center|  4150|0.319|39.5459|-119.8190|Nevada Wolf Pack Basketball|Colorado State Rams Basketball|NA|NA|  36|  46|   179|NCAA BB|College Basketball
