league|id|time|date|city|title|full|venue|ven_id|score|lat|long|t1|t2|t3|t4|low|med|high|name|xname
mlb|5793862|12:05 pm|2023-03-25|Phoenix, AZ|Spring Training: Royals at Dodgers|Spring Training: Kansas City Royals at Los Angeles Dodgers|Camelback Ranch|   395|0.584|33.5132|-112.2950|Los Angeles Dodgers|Kansas City Royals|NA|NA|  38| 116|   529|MLB|MLB Baseball
mlb|5794498|01:05 pm|2023-03-02|Goodyear, AZ|Spring Training: Giants at Guardians|Spring Training: San Francisco Giants at Cleveland Guardians|Goodyear Ballpark|  3943|0.504|33.4285|-112.3900|Cleveland Guardians|San Francisco Giants|NA|NA|  15|  39|   257|MLB|MLB Baseball
mlb|5784932|01:35 pm|2023-04-02|Bronx, NY|Giants at Yankees|San Francisco Giants at New York Yankees|Yankee Stadium|     8|0.756|40.8296| -73.9262|New York Yankees|San Francisco Giants|NA|NA|  29| 114|  6255|MLB|MLB Baseball
mlb|5794338|01:05 pm|2023-03-11|Bradenton, FL|Spring Training: Yankees at Pirates|Spring Training: New York Yankees (Split Squad) at Pittsburgh Pirates|LECOM Park|  3941|0.608|27.4846| -82.5713|Pittsburgh Pirates|New York Yankees|NA|NA|  57|  93|   397|MLB|MLB Baseball
mlb|5789740|01:10 pm|2023-04-09|Saint Petersburg, FL|Athletics at Rays|Oakland Athletics at Tampa Bay Rays|Tropicana Field|     4|0.600|27.7682| -82.6534|Tampa Bay Rays|Oakland Athletics|NA|NA|  42| 142|   666|MLB|MLB Baseball
mlb|5794510|01:10 pm|2023-03-08|Phoenix, AZ|Exhibition: Great Britain at Milwaukee Brewers|Exhibition: Great Britain at Milwaukee Brewers|American Family Fields of Phoenix| 40909|0.396|33.4907|-112.1720|Milwaukee Brewers|NA|NA|NA|  20|  53|   397|MLB|MLB Baseball
mlb|5793788|01:05 pm|2023-03-02|Phoenix, AZ|Spring Training: Diamondbacks at Dodgers|Spring Training: Arizona Diamondbacks at Los Angeles Dodgers|Camelback Ranch|   395|0.547|33.5132|-112.2950|Los Angeles Dodgers|Arizona Diamondbacks|NA|NA|  10|  84|   311|MLB|MLB Baseball
mlb|5786749|06:40 pm|2023-04-03|Seattle, WA|Angels at Mariners|Los Angeles Angels at Seattle Mariners|T-Mobile Park|    13|0.599|47.5914|-122.3330|Seattle Mariners|Los Angeles Angels|NA|NA|  19|  89|  1374|MLB|MLB Baseball
mlb|5793874|01:05 pm|2023-03-05|West Palm Beach, FL|Spring Training: Braves at Astros|Spring Training: Washington Nationals at Houston Astros|The Ballpark of the Palm Beaches|419759|0.526|26.7579| -80.1169|Houston Astros|Atlanta Braves|NA|NA|  37|  66|   190|MLB|MLB Baseball
mlb|5793848|01:05 pm|2023-03-26|Mesa, AZ|Spring Training: Royals at Cubs|Spring Training: Kansas City Royals at Chicago Cubs|Sloan Park| 57343|0.599|33.4311|-111.8820|Chicago Cubs|Kansas City Royals|NA|NA|  46| 102|   397|MLB|MLB Baseball
mlb|5793832|06:05 pm|2023-03-15|Phoenix, AZ|Spring Training: Rockies at Dodgers|Spring Training: Colorado Rockies at Los Angeles Dodgers|Camelback Ranch|   395|0.532|33.5132|-112.2950|Los Angeles Dodgers|Colorado Rockies|NA|NA|  32| 102|   397|MLB|MLB Baseball
mlb|5787859|01:10 pm|2023-04-10|Minneapolis, MN|White Sox at Twins|Chicago White Sox at Minnesota Twins|Target Field|  3712|0.625|44.9817| -93.2776|Minnesota Twins|Chicago White Sox|NA|NA|  15|  61|  1124|MLB|MLB Baseball
mlb|5794680|01:05 pm|2023-03-24|Surprise, AZ|Spring Training: Giants at Royals|Spring Training: San Francisco Giants at Kansas City Royals|Surprise Stadium|  3930|0.550|33.6269|-112.3770|Kansas City Royals|San Francisco Giants|NA|NA|  30|  91|   397|MLB|MLB Baseball
mlb|5794635|01:07 pm|2023-03-22|Dunedin, FL|Spring Training: Orioles at Blue Jays|Spring Training: Baltimore Orioles at Toronto Blue Jays|TD Ballpark|  3936|0.464|28.0036| -82.7868|Toronto Blue Jays|Baltimore Orioles|NA|NA|  35|  64|   397|MLB|MLB Baseball
mlb|5794627|01:07 pm|2023-03-13|Dunedin, FL|Spring Training: Red Sox at Blue Jays|Spring Training: Boston Red Sox at Toronto Blue Jays|TD Ballpark|  3936|0.524|28.0036| -82.7868|Toronto Blue Jays|Boston Red Sox|NA|NA|  40|  82|   397|MLB|MLB Baseball
mlb|5793844|01:05 pm|2023-03-19|Phoenix, AZ|Spring Training: Athletics at Dodgers|Spring Training: Oakland Athletics at Los Angeles Dodgers|Camelback Ranch|   395|0.561|33.5132|-112.2950|Los Angeles Dodgers|Oakland Athletics|NA|NA|  40| 116|   445|MLB|MLB Baseball
mlb|5793901|01:10 pm|2023-03-15|Port St. Lucie, FL|Spring Training: Cardinals at Mets|Spring Training: St. Louis Cardinals at New York Mets|Clover Park|  3926|0.535|27.3248| -80.4048|New York Mets|St. Louis Cardinals|NA|NA|  41|  68|   397|MLB|MLB Baseball
mlb|5793958|01:10 pm|2023-03-18|Peoria, AZ|Spring Training: Brewers at Padres|Spring Training: Milwaukee Brewers at San Diego Padres|Peoria Sports Complex|  3924|0.517|33.6321|-112.2330|San Diego Padres|Milwaukee Brewers|NA|NA|  47|  89|   397|MLB|MLB Baseball
mlb|5794394|06:40 pm|2023-03-24|Peoria, AZ|Spring Training: Athletics at Mariners|Spring Training: Oakland Athletics (Split Squad) at Seattle Mariners |Peoria Sports Complex|  3924|0.510|33.6321|-112.2330|Seattle Mariners|Oakland Athletics|NA|NA|  45|  80|   397|MLB|MLB Baseball
mlb|5794652|06:40 pm|2023-03-08|Jupiter, FL|Exhibition: Israel at Miami Marlins|Exhibition: Israel at Miami Marlins|Roger Dean Stadium|  3927|0.434|26.8910| -80.1163|Miami Marlins|World Baseball Classic|NA|NA|  15|  46|   397|MLB|MLB Baseball
mlb|5793894|06:05 pm|2023-03-07|West Palm Beach, FL|Spring Training: Mets at Astros|Spring Training: New York Mets at Houston Astros|The Ballpark of the Palm Beaches|419759|0.489|26.7579| -80.1169|Houston Astros|New York Mets|NA|NA|  47|  85|   397|MLB|MLB Baseball
mlb|5793930|01:05 pm|2023-03-15|Surprise, AZ|Spring Training: Royals at Rangers|Spring Training: Kansas City Royals at Texas Rangers|Surprise Stadium|  3930|0.529|33.6269|-112.3770|Texas Rangers|Kansas City Royals|NA|NA|  18|  61|   397|MLB|MLB Baseball
mlb|5785192|02:10 pm|2023-03-30|Boston, MA|Orioles at Red Sox - Opening Day|Baltimore Orioles at Boston Red Sox - Opening Day|Fenway Park|    21|0.589|42.3456| -71.0983|Boston Red Sox|Baltimore Orioles|MLB Opening Day|NA| 106| 209|  2437|MLB|MLB Baseball
mlb|5794496|01:10 pm|2023-03-04|Phoenix, AZ|Spring Training: Giants at Brewers|Spring Training: San Francisco Giants (Split Squad) at Milwaukee Brewers|American Family Fields of Phoenix| 40909|0.520|33.4907|-112.1720|Milwaukee Brewers|San Francisco Giants|NA|NA|  22|  61|   188|MLB|MLB Baseball
mlb|5794366|01:10 pm|2023-03-06|Peoria, AZ|Spring Training: Cubs at Mariners|Spring Training: Chicago Cubs at Seattle Mariners|Peoria Sports Complex|  3924|0.519|33.6321|-112.2330|Seattle Mariners|Chicago Cubs|NA|NA|  47|  82|   391|MLB|MLB Baseball
mlb|5794130|01:05 pm|2023-03-18|West Palm Beach, FL|Spring Training: Marlins at Nationals|Spring Training: Miami Marlins at Washington Nationals|The Ballpark of the Palm Beaches|419759|0.520|26.7579| -80.1169|Washington Nationals|Miami Marlins|NA|NA|  34|  76|   397|MLB|MLB Baseball
mlb|5794012|01:10 pm|2023-03-06|Scottsdale, AZ|Spring Training: Rangers at Rockies|Spring Training: Texas Rangers at Colorado Rockies (Split Squad)|Salt River Fields at Talking Stick|  3931|0.508|33.5457|-111.8860|Colorado Rockies|Texas Rangers|NA|NA|  17|  62|   391|MLB|MLB Baseball
mlb|5794410|01:05 pm|2023-03-11|Fort Myers, FL|Spring Training: Red Sox at Twins|Spring Training: Boston Red Sox at Minnesota Twins|Hammond Stadium|  3944|0.596|26.5378| -81.8420|Minnesota Twins|Boston Red Sox|NA|NA|  32|  61|   397|MLB|MLB Baseball
mlb|5793917|01:05 pm|2023-03-14|West Palm Beach, FL|Spring Training: Cardinals at Astros|Spring Training: St. Louis Cardinals at Houston Astros (Split Squad)|The Ballpark of the Palm Beaches|419759|0.520|26.7579| -80.1169|Houston Astros|St. Louis Cardinals|NA|NA|  40|  81|   397|MLB|MLB Baseball
mlb|5794332|01:05 pm|2023-03-07|Bradenton, FL|Spring Training: Blue Jays at Pirates|Spring Training: Toronto Blue Jays at Pittsburgh Pirates|LECOM Park|  3941|0.496|27.4846| -82.5713|Pittsburgh Pirates|Toronto Blue Jays|NA|NA|  27|  61|   397|MLB|MLB Baseball
mlb|5794346|01:05 pm|2023-03-18|Bradenton, FL|Spring Training: Twins at Pirates|Spring Training: Minnesota Twins at Pittsburgh Pirates|LECOM Park|  3941|0.549|27.4846| -82.5713|Pittsburgh Pirates|Minnesota Twins|NA|NA|  32|  74|   630|MLB|MLB Baseball
mlb|5793915|01:05 pm|2023-03-12|West Palm Beach, FL|Spring Training: Marlins at Astros|Spring Training: Miami Marlins at Houston Astros|The Ballpark of the Palm Beaches|419759|0.521|26.7579| -80.1169|Houston Astros|Miami Marlins|NA|NA|  34|  67|   397|MLB|MLB Baseball
mlb|5794004|01:05 pm|2023-03-05|Jupiter, FL|Spring Training: Mets at Cardinals|Spring Training: New York Mets at St. Louis Cardinals|Roger Dean Stadium|  3927|0.576|26.8910| -80.1163|St. Louis Cardinals|New York Mets|NA|NA|  42|  98|   198|MLB|MLB Baseball
mlb|5789690|06:40 pm|2023-04-10|Chicago, IL|Mariners at Cubs|Seattle Mariners at Chicago Cubs|Wrigley Field|    11|0.669|41.9475| -87.6562|Chicago Cubs|Seattle Mariners|NA|NA|  19|  75|  1624|MLB|MLB Baseball
mlb|5794050|01:10 pm|2023-03-22|Scottsdale, AZ|Spring Training: Angels at Rockies|Spring Training: Los Angeles Angels at Colorado Rockies|Salt River Fields at Talking Stick|  3931|0.519|33.5457|-111.8860|Colorado Rockies|Los Angeles Angels|NA|NA|  29|  84|   397|MLB|MLB Baseball
mlb|5794554|01:05 pm|2023-03-21|Goodyear, AZ|Spring Training: Dodgers at Guardians|Spring Training: Los Angeles Dodgers (Split Squad) at Cleveland Guardians|Goodyear Ballpark|  3943|0.491|33.4285|-112.3900|Cleveland Guardians|Los Angeles Dodgers|NA|NA|  22|  64|   397|MLB|MLB Baseball
mlb|5794122|07:05 pm|2023-03-11|West Palm Beach, FL|Spring Training: Mets at Nationals|Spring Training: New York Mets at Washington Nationals|The Ballpark of the Palm Beaches|419759|0.538|26.7579| -80.1169|Washington Nationals|New York Mets|NA|NA|  37|  80|   397|MLB|MLB Baseball
mlb|5794255|06:40 pm|2023-03-15|Scottsdale, AZ|Spring Training: Brewers at Diamondbacks|Spring Training: Milwaukee Brewers at Arizona Diamondbacks (Split Squad) (Double Header)|Salt River Fields at Talking Stick|  3931|0.541|33.5457|-111.8860|Arizona Diamondbacks|Milwaukee Brewers|NA|NA|  20|  78|   397|MLB|MLB Baseball
mlb|5785200|04:10 pm|2023-04-01|Boston, MA|Orioles at Red Sox|Baltimore Orioles at Boston Red Sox|Fenway Park|    21|0.725|42.3456| -71.0983|Boston Red Sox|Baltimore Orioles|NA|NA|  47| 110|  1879|MLB|MLB Baseball
mlb|5786759|01:10 pm|2023-04-05|Seattle, WA|Angels at Mariners|Los Angeles Angels at Seattle Mariners|T-Mobile Park|    13|0.593|47.5914|-122.3330|Seattle Mariners|Los Angeles Angels|NA|NA|  20|  86|  1374|MLB|MLB Baseball
mlb|5789200|04:10 pm|2023-04-07|Cleveland, OH|Mariners at Guardians|Seattle Mariners at Cleveland Guardians|Progressive Field|     6|0.681|41.4962| -81.6852|Cleveland Guardians|Seattle Mariners|NA|NA| 109| 208|  2792|MLB|MLB Baseball
mlb|5794662|06:05 pm|2023-03-14|Surprise, AZ|Spring Training: Reds at Royals|Spring Training: Cincinnati Reds at Kansas City Royals (Split Squad)|Surprise Stadium|  3930|0.445|33.6269|-112.3770|Kansas City Royals|Cincinnati Reds|NA|NA|  15|  54|   397|MLB|MLB Baseball
mlb|5786753|06:40 pm|2023-04-04|Seattle, WA|Angels at Mariners|Los Angeles Angels at Seattle Mariners|T-Mobile Park|    13|0.592|47.5914|-122.3330|Seattle Mariners|Los Angeles Angels|NA|NA|  17|  81|  1374|MLB|MLB Baseball
mlb|5793816|01:05 pm|2023-03-17|Mesa, AZ|Spring Training: Dodgers at Cubs|Spring Training: Los Angeles Dodgers at Chicago Cubs (Split Squad)|Sloan Park| 57343|0.625|33.4311|-111.8820|Chicago Cubs|Los Angeles Dodgers|NA|NA|  54| 136|  4245|MLB|MLB Baseball
mlb|5793902|01:10 pm|2023-03-11|Peoria, AZ|Spring Training: White Sox at Padres|Spring Training: Chicago White Sox at San Diego Padres|Peoria Sports Complex|  3924|0.527|33.6321|-112.2330|San Diego Padres|Chicago White Sox|NA|NA|  47|  70|   397|MLB|MLB Baseball
mlb|5794536|01:05 pm|2023-03-11|Goodyear, AZ|Spring Training: Athletics at Guardians|Spring Training: Oakland Athletics at Cleveland Guardians|Goodyear Ballpark|  3943|0.489|33.4285|-112.3900|Cleveland Guardians|Oakland Athletics|NA|NA|  23|  54|   397|MLB|MLB Baseball
mlb|5793926|06:05 pm|2023-03-23|West Palm Beach, FL|Spring Training: Nationals at Astros|Spring Training: Washington Nationals at Houston Astros|The Ballpark of the Palm Beaches|419759|0.511|26.7579| -80.1169|Houston Astros|Washington Nationals|NA|NA|  40|  75|   397|MLB|MLB Baseball
mlb|5794298|01:05 pm|2023-03-06|Saint Petersburg, FL|Spring Training: Marlins at Rays|Spring Training: Miami Marlins at Tampa Bay Rays|Tropicana Field|     4|0.456|27.7682| -82.6534|Tampa Bay Rays|Miami Marlins|NA|NA|  17|  51|   116|MLB|MLB Baseball
mlb|5793808|01:05 pm|2023-03-10|Phoenix, AZ|Spring Training: Angels at Dodgers|Spring Training: Los Angeles Angels at Los Angeles Dodgers|Camelback Ranch|   395|0.594|33.5132|-112.2950|Los Angeles Dodgers|Los Angeles Angels|NA|NA|  82| 142|   393|MLB|MLB Baseball
mlb|5794378|01:10 pm|2023-03-14|Peoria, AZ|Spring Training: Royals at Mariners|Spring Training: Kansas City Royals (Split Squad) at Seattle Mariners|Peoria Sports Complex|  3924|0.462|33.6321|-112.2330|Seattle Mariners|Kansas City Royals|NA|NA|  34|  69|   397|MLB|MLB Baseball
mlb|5794528|01:10 pm|2023-03-24|Phoenix, AZ|Spring Training: Rockies at Brewers|Spring Training: Colorado Rockies at Milwaukee Brewers (Split Squad)|American Family Fields of Phoenix| 40909|0.448|33.4907|-112.1720|Milwaukee Brewers|Colorado Rockies|NA|NA|  20|  59|   397|MLB|MLB Baseball
mlb|5793954|06:40 pm|2023-03-17|Peoria, AZ|Spring Training: Mariners at Padres|Spring Training: Seattle Mariners at San Diego Padres|Peoria Sports Complex|  3924|0.513|33.6321|-112.2330|San Diego Padres|Seattle Mariners|NA|NA|  57| 114|   519|MLB|MLB Baseball
mlb|5797224|01:07 pm|2023-03-17|Dunedin, FL|Spring Training: Phillies at Blue Jays|Spring Training: Philadelphia Phillies (Split Squad) at Toronto Blue Jays (Split Squad)|TD Ballpark|  3936|0.513|28.0036| -82.7868|Toronto Blue Jays|Philadelphia Phillies|NA|NA|  34|  64|   397|MLB|MLB Baseball
mlb|5794330|01:05 pm|2023-03-05|Bradenton, FL|Spring Training: Twins at Pirates|Spring Training: Minnesota Twins (Split Squad) at Pittsburgh Pirates|LECOM Park|  3941|0.524|27.4846| -82.5713|Pittsburgh Pirates|Minnesota Twins|NA|NA|  24|  60|   252|MLB|MLB Baseball
mlb|5794046|01:05 pm|2023-03-20|Jupiter, FL|Spring Training: Marlins at Cardinals|Spring Training: Miami Marlins at St. Louis Cardinals|Roger Dean Stadium|  3927|0.542|26.8910| -80.1163|St. Louis Cardinals|Miami Marlins|NA|NA|  39|  71|   397|MLB|MLB Baseball
mlb|5794654|06:10 pm|2023-03-11|Jupiter, FL|Spring Training: Rays at Marlins|Spring Training: Tampa Bay Rays at Miami Marlins|Roger Dean Stadium|  3927|0.524|26.8910| -80.1163|Miami Marlins|Tampa Bay Rays|NA|NA|  31|  89|   397|MLB|MLB Baseball
mlb|5794136|06:05 pm|2023-03-24|West Palm Beach, FL|Spring Training: Cardinals at Nationals|Spring Training: St. Louis Cardinals at Washington Nationals|The Ballpark of the Palm Beaches|419759|0.548|26.7579| -80.1169|Washington Nationals|St. Louis Cardinals|NA|NA|  42|  81|   397|MLB|MLB Baseball
mlb|5794154|01:05 pm|2023-03-03|Clearwater, FL|Spring Training: Tigers at Phillies|Spring Training: Detroit Tigers (Split Squad) at Philadelphia Phillies|BayCare Ballpark|  3942|0.590|27.9709| -82.7317|Philadelphia Phillies|Detroit Tigers|NA|NA|  34|  94|   114|MLB|MLB Baseball
mlb|5950288|01:05 pm|2023-03-04|Las Vegas, NV|Spring Training: Reds at Athletics|Spring Training: Cincinnati Reds at Oakland Athletics (Split Squad)|Las Vegas Ballpark|458949|0.514|36.1528|-115.3300|Oakland Athletics|Cincinnati Reds|NA|NA|  35| 105|   497|MLB|MLB Baseball
mlb|5788569|04:10 pm|2023-03-30|Cincinnati, OH|Pirates at Reds - Opening Day|Pittsburgh Pirates at Cincinnati Reds - Opening Day|Great American Ball Park|    26|0.496|39.0974| -84.5071|Cincinnati Reds|Pittsburgh Pirates|MLB Opening Day|NA|  79| 143|   547|MLB|MLB Baseball
mlb|5793922|01:05 pm|2023-03-21|West Palm Beach, FL|Spring Training: Marlins at Astros|Spring Training: Miami Marlins at Houston Astros|The Ballpark of the Palm Beaches|419759|0.467|26.7579| -80.1169|Houston Astros|Miami Marlins|NA|NA|  38|  68|   397|MLB|MLB Baseball
mlb|5794690|01:05 pm|2023-03-03|Mesa, AZ|Spring Training: Royals at Athletics|Spring Training: Kansas City Royals at Oakland Athletics|Hohokam Stadium|  3933|0.485|33.4386|-111.8300|Oakland Athletics|Kansas City Royals|NA|NA|  17|  53|   239|MLB|MLB Baseball
mlb|5794406|01:05 pm|2023-03-07|Fort Myers, FL|Spring Training: Orioles at Twins|Spring Training: Baltimore Orioles at Minnesota Twins|Hammond Stadium|  3944|0.511|26.5378| -81.8420|Minnesota Twins|Baltimore Orioles|NA|NA|  31|  51|   397|MLB|MLB Baseball
mlb|5794490|01:05 pm|2023-03-16|Goodyear, AZ|Spring Training: White Sox at Guardians|Spring Training: Chicago White Sox at Cleveland Guardians|Goodyear Ballpark|  3943|0.448|33.4285|-112.3900|Cleveland Guardians|Chicago White Sox|NA|NA|  24|  57|   107|MLB|MLB Baseball
mlb|5793798|01:05 pm|2023-03-06|Phoenix, AZ|Spring Training: Padres at Dodgers|Spring Training: San Diego Padres at Los Angeles Dodgers|Camelback Ranch|   395|0.538|33.5132|-112.2950|Los Angeles Dodgers|San Diego Padres|NA|NA|  36| 103|   433|MLB|MLB Baseball
mlb|5872051|01:05 pm|2023-03-05|Las Vegas, NV|Spring Training: Reds at Athletics|Spring Training: Cincinnati Reds at Oakland Athletics (Split Squad)|Las Vegas Ballpark|458949|0.509|36.1528|-115.3300|Oakland Athletics|Cincinnati Reds|NA|NA|  39|  87|   528|MLB|MLB Baseball
mlb|5794391|06:40 pm|2023-03-22|Peoria, AZ|Spring Training: Dodgers at Mariners|Spring Training: Los Angeles Dodgers at Seattle Mariners |Peoria Sports Complex|  3924|0.505|33.6321|-112.2330|Seattle Mariners|Los Angeles Dodgers|NA|NA|  55|  95|   397|MLB|MLB Baseball
mlb|5794316|01:05 pm|2023-03-24|Saint Petersburg, FL|Spring Training: Mets at Rays|Spring Training: New York Mets at Tampa Bay Rays|Tropicana Field|     4|0.513|27.7682| -82.6534|Tampa Bay Rays|New York Mets|NA|NA|  30|  61|   164|MLB|MLB Baseball
mlb|5793948|01:10 pm|2023-03-13|Peoria, AZ|Spring Training: Giants at Padres|Spring Training: San Francisco Giants at San Diego Padres|Peoria Sports Complex|  3924|0.512|33.6321|-112.2330|San Diego Padres|San Francisco Giants|NA|NA|  47|  68|   397|MLB|MLB Baseball
mlb|5793794|01:05 pm|2023-03-08|Mesa, AZ|Exhibition: WBC (Split Squad) at Chicago Cubs|Exhibition: WBC (Split Squad) at Chicago Cubs|Sloan Park| 57343|0.540|33.4311|-111.8820|Chicago Cubs|World Baseball Classic|NA|NA|  20|  60| 12504|MLB|MLB Baseball
mlb|5793821|01:05 pm|2023-03-19|Mesa, AZ|Spring Training: Padres at Cubs|Spring Training: San Diego Padres at Chicago Cubs|Sloan Park| 57343|0.595|33.4311|-111.8820|Chicago Cubs|San Diego Padres|NA|NA|  59| 125|   416|MLB|MLB Baseball
mlb|5794248|06:05 pm|2023-03-23|Sarasota, FL|Spring Training: Tigers at Orioles|Spring Training: Detroit Tigers (Split Squad) at Baltimore Orioles|Ed Smith Stadium|  3923|0.520|27.3482| -82.5176|Baltimore Orioles|Detroit Tigers|NA|NA|  36|  70|   397|MLB|MLB Baseball
mlb|5794304|01:05 pm|2023-03-13|Saint Petersburg, FL|Spring Training: Tigers at Rays|Spring Training: Detroit Tigers (Split Squad) at Tampa Bay Rays|Tropicana Field|     4|0.496|27.7682| -82.6534|Tampa Bay Rays|Detroit Tigers|NA|NA|  17|  52|   117|MLB|MLB Baseball
mlb|5794436|01:05 pm|2023-03-27|Fort Myers, FL|Spring Training: Pirates at Twins|Spring Training: Pittsburgh Pirates at Minnesota Twins|Hammond Stadium|  3944|0.522|26.5378| -81.8420|Minnesota Twins|Pittsburgh Pirates|NA|NA|  37|  60|  5560|MLB|MLB Baseball
mlb|5833964|06:05 pm|2023-03-23|Scottsdale, AZ|Spring Training: Guardians at Giants|Spring Training: Cleveland Guardians at San Francisco Giants|Scottsdale Stadium|  3925|0.600|33.4893|-111.9210|San Francisco Giants|Cleveland Guardians|NA|NA|  40| 107|   635|MLB|MLB Baseball
mlb|5794180|01:05 pm|2023-03-14|Clearwater, FL|Spring Training: Braves at Phillies|Spring Training: Atlanta Braves at Philadelphia Phillies|BayCare Ballpark|  3942|0.558|27.9709| -82.7317|Philadelphia Phillies|Atlanta Braves|NA|NA|  43| 137|   393|MLB|MLB Baseball
mlb|5794034|01:05 pm|2023-03-16|Jupiter, FL|Spring Training: Astros at Cardinals|Spring Training: Houston Astros at St. Louis Cardinals|Roger Dean Stadium|  3927|0.548|26.8910| -80.1163|St. Louis Cardinals|Houston Astros|NA|NA|  40|  76|   397|MLB|MLB Baseball
mlb|5794602|06:05 pm|2023-03-08|Surprise, AZ|Spring Training: White Sox at Royals|Spring Training: Chicago White Sox at Kansas City Royals|Surprise Stadium|  3930|0.469|33.6269|-112.3770|Kansas City Royals|Chicago White Sox|NA|NA|  19|  49|   397|MLB|MLB Baseball
mlb|5789228|06:40 pm|2023-04-03|Miami, FL|Twins at Marlins|Minnesota Twins at Miami Marlins|loanDepot park|  6371|0.585|25.7617| -80.1918|Miami Marlins|Minnesota Twins|NA|NA|  11|  48|  1124|MLB|MLB Baseball
mlb|5794036|01:10 pm|2023-03-16|Scottsdale, AZ|Spring Training: Padres at Rockies|Spring Training: San Diego Padres at Colorado Rockies|Salt River Fields at Talking Stick|  3931|0.506|33.5457|-111.8860|Colorado Rockies|San Diego Padres|NA|NA|  30|  85|   397|MLB|MLB Baseball
mlb|5788912|06:40 pm|2023-04-03|Kansas City, MO|Blue Jays at Royals|Toronto Blue Jays at Kansas City Royals|Kauffman Stadium|  3714|0.587|39.0515| -94.4803|Kansas City Royals|Toronto Blue Jays|NA|NA|  15|  58|  2499|MLB|MLB Baseball
mlb|5793962|01:05 pm|2023-03-28|Arlington, TX|Spring Training: Royals at Rangers|Spring Training: Kansas City Royals at Texas Rangers|Globe Life Field|487468|0.502|32.7472| -97.0838|Texas Rangers|Kansas City Royals|NA|NA|  16|  55|   285|MLB|MLB Baseball
mlb|5793720|01:05 pm|2023-03-05|Fort Myers, FL|Spring Training: Marlins at Red Sox|Spring Training: Miami Marlins at Boston Red Sox|JetBlue Park|  6992|0.595|26.5487| -81.7612|Boston Red Sox|Miami Marlins|NA|NA|  29|  71|   343|MLB|MLB Baseball
mlb|5794010|01:05 pm|2023-03-06|Jupiter, FL|Spring Training: Astros at Cardinals|Spring Training: Houston Astros at St. Louis Cardinals|Roger Dean Stadium|  3927|0.540|26.8910| -80.1163|St. Louis Cardinals|Houston Astros|NA|NA|  31|  59|   397|MLB|MLB Baseball
mlb|5789072|07:07 pm|2023-03-30|Oakland, CA|Angels at Athletics - Opening Day|Los Angeles Angels at Oakland Athletics - Opening Day|RingCentral Coliseum|    14|0.457|37.7514|-122.2010|Oakland Athletics|Los Angeles Angels|MLB Opening Day|NA|  34| 124| 12504|MLB|MLB Baseball
mlb|5794614|01:07 pm|2023-03-02|Dunedin, FL|Spring Training: Pirates at Blue Jays|Spring Training: Pittsburgh Pirates (Split Squad) at Toronto Blue Jays|TD Ballpark|  3936|0.458|28.0036| -82.7868|Toronto Blue Jays|Pittsburgh Pirates|NA|NA|  23|  59|   284|MLB|MLB Baseball
mlb|5794504|01:05 pm|2023-03-05|Goodyear, AZ|Spring Training: Diamondbacks at Guardians|Spring Training: Arizona Diamondbacks at Cleveland Guardians|Goodyear Ballpark|  3943|0.477|33.4285|-112.3900|Cleveland Guardians|Arizona Diamondbacks|NA|NA|  27|  60|  4228|MLB|MLB Baseball
mlb|5794064|01:10 pm|2023-03-26|Scottsdale, AZ|Spring Training: Reds at Rockies|Spring Training: Cincinnati Reds (Split Squad) at Colorado Rockies (Split Squad)|Salt River Fields at Talking Stick|  3931|0.522|33.5457|-111.8860|Colorado Rockies|Cincinnati Reds|NA|NA|  24|  83|   397|MLB|MLB Baseball
mlb|5794431|06:05 pm|2023-03-21|Fort Myers, FL|Spring Training: Rays at Twins|Spring Training: Tampa Bay Rays at Minnesota Twins|Hammond Stadium|  3944|0.520|26.5378| -81.8420|Minnesota Twins|Tampa Bay Rays|NA|NA|  34|  61|   397|MLB|MLB Baseball
mlb|5794564|01:05 pm|2023-03-26|Goodyear, AZ|Spring Training: Reds at Guardians|Spring Training: Cincinnati Reds (Split Squad) at Cleveland Guardians|Goodyear Ballpark|  3943|0.469|33.4285|-112.3900|Cleveland Guardians|Cincinnati Reds|NA|NA|  18|  49|   397|MLB|MLB Baseball
mlb|5794426|01:05 pm|2023-03-17|Fort Myers, FL|Spring Training: Orioles at Twins|Spring Training: Baltimore Orioles at Minnesota Twins|Hammond Stadium|  3944|0.548|26.5378| -81.8420|Minnesota Twins|Baltimore Orioles|NA|NA|  32|  61|   397|MLB|MLB Baseball
mlb|5793886|06:40 pm|2023-03-03|Peoria, AZ|Spring Training: Cubs at Padres|Spring Training: Chicago Cubs at San Diego Padres|Peoria Sports Complex|  3924|0.540|33.6321|-112.2330|San Diego Padres|Chicago Cubs|NA|NA|  49|  75|   357|MLB|MLB Baseball
mlb|5794619|01:07 pm|2023-03-05|Dunedin, FL|Spring Training: Phillies at Blue Jays|Spring Training: Philadelphia Phillies at Toronto Blue Jays|TD Ballpark|  3936|0.520|28.0036| -82.7868|Toronto Blue Jays|Philadelphia Phillies|NA|NA|  39|  70|   230|MLB|MLB Baseball
nhl|5740412|07:00 pm|2023-03-09|Washington, DC|Devils at Capitals|New Jersey Devils at Washington Capitals|Capital One Arena|   181|0.679|38.8981| -77.0209|Washington Capitals|New Jersey Devils|NA|NA|  48| 143|  1431|NHL|NHL Hockey
nhl|5742845|07:00 pm|2023-03-21|Buffalo, NY|Predators at Sabres|Nashville Predators at Buffalo Sabres|KeyBank Center|   212|0.623|42.8759| -78.8767|Buffalo Sabres|Nashville Predators|NA|NA|  38| 155|   609|NHL|NHL Hockey
nhl|5742359|06:00 pm|2023-04-02|Raleigh, NC|Islanders at Hurricanes|New York Islanders at Carolina Hurricanes|PNC Arena|  1430|0.620|35.8033| -78.7218|Carolina Hurricanes|New York Islanders|NA|NA|  58| 177|  1270|NHL|NHL Hockey
nhl|5740280|07:00 pm|2023-03-21|Saint Louis, MO|Red Wings at Blues|Detroit Red Wings at St. Louis Blues|Enterprise Center|   186|0.683|38.6268| -90.2026|St. Louis Blues|Detroit Red Wings|NA|NA|  33| 151|  1816|NHL|NHL Hockey
nhl|5742551|07:30 pm|2023-04-10|Los Angeles, CA|Canucks at Kings|Vancouver Canucks at Los Angeles Kings|Crypto.com Arena|   134|0.679|34.0430|-118.2670|Los Angeles Kings|Vancouver Canucks|NA|NA|  41| 151|  4914|NHL|NHL Hockey
nhl|5740657|07:30 pm|2023-03-27|Elmont, NY|Devils at Islanders|New Jersey Devils at New York Islanders|UBS Arena|518722|0.645|40.7095| -73.7204|New York Islanders|New Jersey Devils|NA|NA|  46| 153|  1356|NHL|NHL Hockey
nhl|5740069|07:00 pm|2023-04-01|Denver, CO|Stars at Avalanche|Dallas Stars at Colorado Avalanche|Ball Arena|   187|0.657|39.7487|-105.0080|Colorado Avalanche|Dallas Stars|NA|NA|  94| 240|  2123|NHL|NHL Hockey
