league|id|time|date|city|title|full|venue|ven_id|score|lat|long|t1|t2|t3|t4|low|med|high|name|xname
ncaa_basketball|5878842|07:00 pm|2023-03-07|Indianapolis, IN|Horizon League Basketball Championship - Mens Finals|Horizon League Basketball Championship - Mens Finals|Indiana Farmers Coliseum|  1607|0.341|39.8273| -86.1348|Horizon League Basketball Tournament|NA|NA|NA|  51|  80|   393|NCAA BB|College Basketball
ncaa_basketball|5817979|06:00 pm|2023-02-04|Philadelphia, PA|Cornell at Penn|Cornell Big Red at Pennsylvania Quakers Basketball|The Palestra|  3490|0.475|39.9514| -75.1887|Pennsylvania Quakers Basketball|Cornell Big Red Basketball|NA|NA|  33|  45|    75|NCAA BB|College Basketball
ncaa_basketball|5800905|03:00 pm|2023-02-04|Baton Rouge, LA|Alabama Crimson Tide at LSU Tigers Basketball|Alabama Crimson Tide at LSU Tigers Basketball|Pete Maravich Assembly Center|  3480|0.552|30.4173| -91.1856|LSU Tigers Basketball|Alabama Crimson Tide Basketball|NA|NA|  13|  47|   253|NCAA BB|College Basketball
ncaa_basketball|5848715|06:00 pm|2023-02-11|Greeley, CO|Sacramento State at Northern Colorado|Sacramento State Hornets at Northern Colorado Bears Basketball|Bank of Colorado Arena|  4227|0.340|40.4022|-104.7030|Northern Colorado Bears Basketball|Sacramento State Hornets Basketball|NA|NA|  25|  25|    60|NCAA BB|College Basketball
ncaa_basketball|5805242|12:00 pm|2023-02-05|Newark, NJ|DePaul at Seton Hall|DePaul Blue Demons at Seton Hall Pirates Basketball|Prudential Center|  1500|0.474|40.7332| -74.1717|Seton Hall Pirates Basketball|DePaul Blue Demons Basketball|NA|NA|  31|  95|  1143|NCAA BB|College Basketball
ncaa_basketball|5841438|12:00 pm|2023-02-04|Indianapolis, IN|Green Bay at IUPUI|Green Bay Phoenix at IUPUI Jaguars Basketball|Indiana Farmers Coliseum|  1607|0.307|39.8273| -86.1348|IUPUI Jaguars Basketball|Green Bay Phoenix Basketball|NA|NA|  36|  38|    93|NCAA BB|College Basketball
ncaa_basketball|5805055|08:00 pm|2023-02-08|Providence, RI|Georgetown at Providence|Georgetown Hoyas at Providence Friars Basketball|Amica Mutual Pavilion|   805|0.525|41.8236| -71.4180|Providence Friars Basketball|Georgetown Hoyas Basketball|NA|NA|  29|  85| 18348|NCAA BB|College Basketball
ncaa_basketball|5805272|07:30 pm|2023-02-21|Omaha, NE|Marquette Golden Eagles at Creighton Bluejays Basketball|Marquette Golden Eagles at Creighton Bluejays Basketball|CHI Health Center Omaha|   107|0.473|41.2631| -95.9292|Creighton Bluejays Basketball|Marquette Golden Eagles Basketball|NA|NA|  10|  60|   625|NCAA BB|College Basketball
ncaa_basketball|5812413|06:00 pm|2023-02-09|Corvallis, OR|UCLA at Oregon State|UCLA Bruins at Oregon State Beavers Basketball|Gill Coliseum|  3465|0.473|44.5613|-123.2810|Oregon State Beavers Basketball|UCLA Bruins Basketball|NA|NA|  14|  40|   136|NCAA BB|College Basketball
ncaa_basketball|5817342|06:00 pm|2023-02-23|Wichita, KS|Memphis at Wichita State|Memphis Tigers at Wichita State Shockers Basketball|Charles Koch Arena|  5140|0.550|37.7215| -97.2862|Wichita State Shockers Basketball|Memphis Tigers Basketball|NA|NA|  29| 121|   399|NCAA BB|College Basketball
ncaa_basketball|5921074|03:30 am|2023-02-18|Macon, GA|Western Carolina at Mercer|Western Carolina Catamounts at Mercer Bears Basketball|Hawkins Arena|  4153|0.337|32.8290| -83.6523|Mercer Bears Basketball|Western Carolina Catamounts Basketball|NA|NA|  30|  59|    91|NCAA BB|College Basketball
ncaa_basketball|5807670|07:00 pm|2023-02-08|Blacksburg, VA|Boston College at Virginia Tech|Boston College Eagles at Virginia Tech Hokies Basketball|Cassell Coliseum|  3460|0.472|37.2230| -80.4196|Virginia Tech Hokies Basketball|Boston College Eagles Basketball|NA|NA|  18|  26|    62|NCAA BB|College Basketball
ncaa_basketball|5803362|07:00 pm|2023-03-01|Columbus, OH|Maryland at Ohio State|Maryland Terrapins at Ohio State Buckeyes Basketball|Value City Arena at Schottenstein Center|    99|0.550|40.0077| -83.0251|Ohio State Buckeyes Basketball|Maryland Terrapins Basketball|NA|NA|  24|  69|   588|NCAA BB|College Basketball
ncaa_basketball|5805246|06:30 pm|2023-02-08|Newark, NJ|Creighton at Seton Hall|Creighton Bluejays at Seton Hall Pirates Basketball|Prudential Center|  1500|0.471|40.7332| -74.1717|Seton Hall Pirates Basketball|Creighton Bluejays Basketball|NA|NA|  20|  79|   890|NCAA BB|College Basketball
ncaa_basketball|5926409|07:00 pm|2023-02-08|Chattanooga, TN|The Citadel at Chattanooga|The Citadel Bulldogs at Chattanooga Mocs Basketball|McKenzie Arena|  2454|0.337|35.0479| -85.2983|Chattanooga Mocs Basketball|The Citadel Bulldogs Basketball|NA|NA|  22|  58|    76|NCAA BB|College Basketball
ncaa_basketball|5844462|07:00 pm|2023-03-02|El Paso, TX|Western Kentucky at UTEP|Western Kentucky Hilltoppers at UTEP Miners Basketball|Don Haskins Center|   691|0.337|31.7778|-106.5060|UTEP Miners Basketball|Western Kentucky Hilltoppers Basketball|NA|NA|  31|  49|    90|NCAA BB|College Basketball
ncaa_basketball|5801033|06:00 pm|2023-02-11|Knoxville, TN|Missouri at Tennessee|Missouri Tigers at Tennessee Volunteers Basketball|Thompson-Boling Arena|   461|0.549|35.9507| -83.9252|Tennessee Volunteers Basketball|Missouri Tigers Basketball|NA|NA|  44| 166|  1143|NCAA BB|College Basketball
ncaa_basketball|5846144|02:00 pm|2023-02-25|Boca Raton, FL|UTEP at Florida Atlantic|UTEP Miners at Florida Atlantic Owls Basketball|Abessinio Court at FAU Arena|  6050|0.336|26.3738| -80.1019|Florida Atlantic Owls Basketball|UTEP Miners Basketball|NA|NA|  86| 117|   177|NCAA BB|College Basketball
ncaa_basketball|5801073|07:30 pm|2023-03-04|Nashville, TN|Mississippi State at Vanderbilt|Mississippi State Bulldogs at Vanderbilt Commodores Basketball|Memorial Gym|  3432|0.522|36.1446| -86.8073|Vanderbilt Commodores Basketball|Mississippi State Bulldogs Basketball|NA|NA|  32|  67|   260|NCAA BB|College Basketball
ncaa_basketball|5801057|06:00 pm|2023-02-07|College Station, TX|Auburn at Texas A&M|Auburn Tigers at Texas A&M Aggies Basketball|Reed Arena|  1879|0.469|30.6056| -96.3469|Texas A&M Aggies Basketball|Auburn Tigers Basketball|NA|NA|  10|  61|   406|NCAA BB|College Basketball
ncaa_basketball|5751083|03:00 pm|2023-02-18|Mobile, AL|University of Louisiana Monroe at South Alabama|Louisiana Monroe Warhawks at South Alabama Jaguars Basketball|Mitchell Center|  3993|0.335|30.6922| -88.1796|South Alabama Jaguars Basketball|Louisiana Monroe Warhawks Basketball|NA|NA|  21|  37|    62|NCAA BB|College Basketball
ncaa_basketball|5751065|03:30 am|2023-02-24|Norfolk, VA|Marshall at Old Dominion|Marshall Thundering Herd at Old Dominion Monarchs Basketball|Chartway Arena at the Ted Constant Convocation Center|  3692|0.335|36.8841| -76.3014|Old Dominion Monarchs Basketball|Marshall Thundering Herd Basketball|NA|NA|  37|  71|   107|NCAA BB|College Basketball
ncaa_basketball|5811484|03:30 am|2023-02-19|Des Moines, IA|Belmont at Drake|Belmont Bruins at Drake Bulldogs Basketball|Drake Knapp Center|  5165|0.469|41.6041| -93.6516|Drake Bulldogs Basketball|Belmont Bruins Basketball|NA|NA|  24|  36|    64|NCAA BB|College Basketball
ncaa_basketball|5817368|08:00 pm|2023-02-18|Tampa, FL|Tulane at South Florida|Tulane Green Wave at South Florida Bulls Basketball|Yuengling Center|   223|0.416|28.0592| -82.4066|South Florida Bulls Basketball|Tulane Green Wave Basketball|NA|NA|  15|  79|   403|NCAA BB|College Basketball
ncaa_basketball|5853879|06:30 pm|2023-03-01|Nacogdoches, TX|Sam Houston at Stephen F. Austin|Sam Houston Bearkats at Stephen F. Austin Lumberjacks Basketball|William R. Johnson Coliseum|  1878|0.334|31.6231| -94.6437|Stephen F. Austin Lumberjacks Basketball|Sam Houston Bearkats Basketball|NA|NA|  39|  39|    64|NCAA BB|College Basketball
ncaa_basketball|5848717|06:00 pm|2023-02-27|Greeley, CO|Idaho State at Northern Colorado|Idaho State Bengals at Northern Colorado Bears Basketball|Bank of Colorado Arena|  4227|0.303|40.4022|-104.7030|Northern Colorado Bears Basketball|Idaho State Bengals Basketball|NA|NA|  25|  25|    59|NCAA BB|College Basketball
ncaa_basketball|5811737|03:30 am|2023-02-11|Cedar Falls, IA|Indiana State at UNI|Indiana State Sycamores at Northern Iowa Panthers Basketball|McLeod Center|  1877|0.416|42.5144| -92.4673|Northern Iowa Panthers Basketball|Indiana State Sycamores Basketball|NA|NA|  13|  43|   103|NCAA BB|College Basketball
ncaa_basketball|5803274|07:00 pm|2023-02-14|University Park, PA|Illinois at Penn State|Illinois Fighting Illini at Penn State Nittany Lions Basketball|Bryce Jordan Center|   108|0.468|40.8099| -77.8562|Penn State Nittany Lions Basketball|Illinois Fighting Illini Basketball|NA|NA|  27|  52|   394|NCAA BB|College Basketball
ncaa_basketball|5801061|08:00 pm|2023-02-15|College Station, TX|Arkansas at Texas A&M|Arkansas Razorbacks at Texas A&M Aggies Basketball|Reed Arena|  1879|0.467|30.6056| -96.3469|Texas A&M Aggies Basketball|Arkansas Razorbacks Basketball|NA|NA|   8|  62|   406|NCAA BB|College Basketball
ncaa_basketball|5759743|12:00 pm|2023-03-11|Nashville, TN|SEC Mens Basketball Tournament - Session 6|SEC Mens Basketball Tournament - Session 6|Bridgestone Arena|  2195|0.466|36.1591| -86.7785|SEC Men's Basketball Tournament|NA|NA|NA| 340| 605|  2091|NCAA BB|College Basketball
ncaa_basketball|5849265|02:00 pm|2023-02-18|Buies Creek, NC|Presbyterian at Campbell|Presbyterian Blue Hose at Campbell Fighting Camels Basketball|John W Pope Convocation Center|  4198|0.333|35.4078| -78.7361|Campbell Fighting Camels Basketball|Presbyterian Blue Hose Basketball|NA|NA|  14|  27|    56|NCAA BB|College Basketball
ncaa_basketball|5805252|08:30 pm|2023-02-28|Newark, NJ|Villanova at Seton Hall|Villanova Wildcats at Seton Hall Pirates Basketball|Prudential Center|  1500|0.544|40.7332| -74.1717|Seton Hall Pirates Basketball|Villanova Wildcats Basketball|NA|NA|  61| 107|  1161|NCAA BB|College Basketball
ncaa_basketball|5801340|02:30 pm|2023-03-04|Amherst, MA|St. Bonaventure at Massachusetts|St. Bonaventure Bonnies at UMass Minutemen Basketball|Mullins Center|  1352|0.413|42.3732| -72.5199|UMass Minutemen Basketball|St. Bonaventure Bonnies Basketball|NA|NA|  24|  63|   167|NCAA BB|College Basketball
ncaa_basketball|5888031|07:00 pm|2023-02-14|Kalamazoo, MI|Kent State at Western Michigan|Kent State Golden Flashes at Western Michigan Broncos Basketball|University Arena (WMU)|  4213|0.332|42.2841| -85.6170|Western Michigan Broncos Basketball|Kent State Golden Flashes Basketball|NA|NA|  33|  33|    60|NCAA BB|College Basketball
ncaa_basketball|5803270|08:30 pm|2023-02-08|University Park, PA|Wisconsin at Penn State|Wisconsin Badgers at Penn State Nittany Lions Basketball|Bryce Jordan Center|   108|0.465|40.8099| -77.8562|Penn State Nittany Lions Basketball|Wisconsin Badgers Basketball|NA|NA|  21|  51|   533|NCAA BB|College Basketball
ncaa_basketball|5847214|07:00 pm|2023-02-21|Muncie, IN|Kent State at Ball State|Kent State Golden Flashes at Ball State Cardinals Basketball|John E. Worthen Arena|  3904|0.332|40.2015| -85.4072|Ball State Cardinals Basketball|Kent State Golden Flashes Basketball|NA|NA|  36|  55|   187|NCAA BB|College Basketball
ncaa_basketball|5768126|06:00 pm|2023-02-16|San Diego, CA|Saint Mary's at San Diego|Saint Mary's Gaels at San Diego Toreros Basketball|Jenny Craig Pavilion|  4154|0.331|32.7717|-117.1850|San Diego Toreros Basketball|Saint Mary's Gaels Basketball|NA|NA|  72|  72|    72|NCAA BB|College Basketball
ncaa_basketball|5801457|02:00 pm|2023-02-11|Fairfax, VA|Rhode Island at George Mason|Rhode Island Rams at George Mason Patriots Basketball|EagleBank Arena|   804|0.409|38.8462| -77.3064|George Mason Patriots Basketball|Rhode Island Rams Basketball|NA|NA|  30|  52|   403|NCAA BB|College Basketball
ncaa_basketball|5691507|03:30 am|2023-03-08|Las Vegas, NV|Pac-12 Mens Basketball Tournament - All Sessions|Pac-12 Mens Basketball Tournament - All Sessions|T-Mobile Arena|161601|0.624|36.1029|-115.1780|Pac-12 Men's Basketball Tournament|NA|NA|NA| 511| 867| 10535|NCAA BB|College Basketball
ncaa_basketball|5812421|06:00 pm|2023-03-02|Corvallis, OR|Stanford at Oregon State|Stanford Cardinal at Oregon State Beavers Basketball|Gill Coliseum|  3465|0.463|44.5613|-123.2810|Oregon State Beavers Basketball|Stanford Cardinal Basketball|NA|NA|  20|  41|   134|NCAA BB|College Basketball
ncaa_basketball|5767922|07:00 pm|2023-02-04|Provo, UT|Pacific at BYU|Pacific Tigers at BYU Cougars Basketball|Marriott Center|  4134|0.463|40.2541|-111.6490|BYU Cougars Basketball|Pacific Tigers Basketball|NA|NA|  12|  20|   406|NCAA BB|College Basketball
ncaa_basketball|5812352|03:30 am|2023-02-18|Los Angeles, CA|Stanford at USC|Stanford Cardinal at USC Trojans Basketball|Galen Center|  3451|0.518|34.0208|-118.2800|USC Trojans Basketball|Stanford Cardinal Basketball|NA|NA|  41|  70|   528|NCAA BB|College Basketball
ncaa_basketball|5812499|05:00 pm|2023-02-05|Boulder, CO|Stanford at Colorado|Stanford Cardinal at Colorado Buffaloes Basketball|CU Events Center|  3427|0.518|40.0048|-105.2620|Colorado Buffaloes Basketball|Stanford Cardinal Basketball|NA|NA|  39|  75|   444|NCAA BB|College Basketball
ncaa_basketball|5805206|05:00 pm|2023-02-04|Cincinnati, OH|St. John's at Xavier|St. John's Red Storm at Xavier Musketeers Basketball|Cintas Center|  3431|0.542|39.1504| -84.4719|Xavier Musketeers Basketball|St. John's Red Storm Basketball|NA|NA|  73| 105|   268|NCAA BB|College Basketball
ncaa_basketball|5801548|08:00 pm|2023-02-08|Chicago, IL|Saint Josephs at Loyola Chicago|Saint Josephs Hawks at Loyola Chicago Ramblers Basketball|Gentile Arena|  5183|0.330|42.0006| -87.6591|Loyola Chicago Ramblers Basketball|Saint Josephs Hawks Basketball|NA|NA|  49|  50|    51|NCAA BB|College Basketball
ncaa_basketball|5807592|12:00 pm|2023-02-11|Tallahassee, FL|Pittsburgh at Florida State|Pittsburgh Panthers at Florida State Seminoles Basketball|Donald L. Tucker Civic Center|   354|0.517|30.4378| -84.2867|Florida State Seminoles Basketball|Pittsburgh Panthers Basketball|NA|NA|   9|  18|   385|NCAA BB|College Basketball
ncaa_basketball|5750936|07:00 pm|2023-02-16|Conway, SC|Georgia State at Coastal Carolina|Georgia State Panthers at Coastal Carolina Chanticleers Basketball|HTC Center|  6586|0.407|33.7951| -79.0145|Coastal Carolina Chanticleers Basketball|Georgia State Panthers Basketball|NA|NA|  14|  41|   113|NCAA BB|College Basketball
ncaa_basketball|5805065|03:30 am|2023-03-04|Providence, RI|Seton Hall at Providence|Seton Hall Pirates at Providence Friars Basketball|Amica Mutual Pavilion|   805|0.541|41.8236| -71.4180|Providence Friars Basketball|Seton Hall Pirates Basketball|NA|NA|  77| 154| 17623|NCAA BB|College Basketball
ncaa_basketball|5801253|07:00 pm|2023-02-21|Philadelphia, PA|VCU at Saint Josephs|VCU Rams at Saint Josephs Hawks Basketball|Michael J. Hagan '85 Arena|  3478|0.459|39.9957| -75.2351|Saint Josephs Hawks Basketball|VCU Rams Basketball|NA|NA|  47|  87|   300|NCAA BB|College Basketball
ncaa_basketball|5751079|05:00 pm|2023-02-11|Mobile, AL|Appalachian State at South Alabama|Appalachian State Mountaineers at South Alabama Jaguars Basketball|Mitchell Center|  3993|0.294|30.6922| -88.1796|South Alabama Jaguars Basketball|Appalachian State Mountaineers Basketball|NA|NA|  18|  28|    62|NCAA BB|College Basketball
ncaa_basketball|5768132|05:00 pm|2023-02-04|Malibu, CA|Portland at Pepperdine|Portland Pilots at Pepperdine Waves Basketball|Firestone Fieldhouse|  5187|0.328|34.0347|-118.7040|Pepperdine Waves Basketball|Portland Pilots Basketball|NA|NA|  24|  24|    65|NCAA BB|College Basketball
ncaa_basketball|5854038|09:00 pm|2023-02-17|Phoenix, AZ|Abilene Christian at Grand Canyon|Abilene Christian Wildcats at Grand Canyon Lopes Basketball|Grand Canyon University Arena|  6281|0.328|33.5095|-112.1300|Grand Canyon Lopes Basketball|Abilene Christian Wildcats Basketball|NA|NA|  14|  40|    75|NCAA BB|College Basketball
ncaa_basketball|5801147|07:00 pm|2023-02-28|Dayton, OH|La Salle at Dayton|La Salle Explorers at Dayton Flyers Basketball|University of Dayton Arena|  3463|0.458|39.7355| -84.1995|Dayton Flyers Basketball|La Salle Explorers Basketball|NA|NA|  10|  96|   408|NCAA BB|College Basketball
ncaa_basketball|5817790|02:00 pm|2023-03-04|Norman, OK|TCU at Oklahoma|TCU Horned Frogs at Oklahoma Sooners Basketball|Lloyd Noble Center|  3426|0.539|35.1873| -97.4443|Oklahoma Sooners Basketball|TCU Horned Frogs Basketball|NA|NA|  27|  47|   261|NCAA BB|College Basketball
ncaa_basketball|5903512|12:00 pm|2023-03-02|Saint Louis, MO|Missouri Valley Conference Mens Basketball Tournament - Session 1|Missouri Valley Conference Mens Basketball Tournament - Session 1|Enterprise Center|   186|0.457|38.6268| -90.2026|Missouri Valley Conference Basketball Tournament|NA|NA|NA|  78|  97|   131|NCAA BB|College Basketball
ncaa_basketball|5800909|07:30 pm|2023-02-11|Baton Rouge, LA|Texas A&M Aggies at LSU Tigers Basketball|Texas A&M Aggies at LSU Tigers Basketball|Pete Maravich Assembly Center|  3480|0.539|30.4173| -91.1856|LSU Tigers Basketball|Texas A&M Aggies Basketball|NA|NA|   8|  36|   334|NCAA BB|College Basketball
ncaa_basketball|5849299|05:30 pm|2023-02-18|Charleston, SC|Winthrop at Charleston Southern|Winthrop Eagles at Charleston Southern Buccaneers Basketball|Buccaneer Fieldhouse| 38905|0.327|32.9773| -80.0704|Charleston Southern Buccaneers Basketball|Winthrop Eagles Basketball|NA|NA|  18|  30|    57|NCAA BB|College Basketball
ncaa_basketball|5801519|02:00 pm|2023-02-11|Philadelphia, PA|Massachusetts at La Salle|UMass Minutemen at La Salle Explorers Basketball|Tom Gola Arena|  4224|0.291|40.0399| -75.1566|La Salle Explorers Basketball|UMass Minutemen Basketball|NA|NA|  26|  29|    99|NCAA BB|College Basketball
ncaa_basketball|5803278|06:30 pm|2023-02-26|University Park, PA|Rutgers at Penn State|Rutgers Scarlet Knights at Penn State Nittany Lions Basketball|Bryce Jordan Center|   108|0.456|40.8099| -77.8562|Penn State Nittany Lions Basketball|Rutgers Scarlet Knights Basketball|NA|NA|  41|  55|   349|NCAA BB|College Basketball
ncaa_basketball|5860924|07:00 pm|2023-02-02|Vermillion, SD|North Dakota State at South Dakota|North Dakota State Bison at South Dakota Coyotes Basketball|Sanford Coyote Sports Center|455132|0.326|42.7904| -96.9278|South Dakota Coyotes Basketball|North Dakota State Bison Basketball|NA|NA|  10|  10|    63|NCAA BB|College Basketball
ncaa_basketball|5807752|05:00 pm|2023-02-11|Winston-Salem, NC|Georgia Tech at Wake Forest|Georgia Tech Yellow Jackets at Wake Forest Demon Deacons Basketball|Lawrence Joel Veterans Memorial Coliseum|  1515|0.514|36.1277| -80.2575|Wake Forest Demon Deacons Basketball|Georgia Tech Yellow Jackets Basketball|NA|NA|  27|  54|   179|NCAA BB|College Basketball
ncaa_basketball|5831988|07:00 pm|2023-02-15|Phoenix, AZ|UT Rio Grande Valley at Grand Canyon|UT Rio Grande Valley Vaqueros at Grand Canyon Lopes Basketball|Grand Canyon University Arena|  6281|0.288|33.5095|-112.1300|Grand Canyon Lopes Basketball|UT Rio Grande Valley Vaqueros Basketball|NA|NA|  16|  25|    88|NCAA BB|College Basketball
ncaa_basketball|5751103|02:00 pm|2023-02-18|Hattiesburg, MS|Georgia Southern at Southern Miss|Georgia Southern Eagles at Southern Miss Golden Eagles Basketball|Reed Green Coliseum|  3474|0.324|31.3319| -89.3373|Southern Miss Golden Eagles Basketball|Georgia Southern Eagles Basketball|NA|NA|  24|  34|    60|NCAA BB|College Basketball
ncaa_basketball|5801108|12:30 pm|2023-02-18|Davidson, NC|Saint Josephs at Davidson|Saint Josephs Hawks at Davidson Wildcats Basketball|Belk Arena|  4247|0.324|35.4993| -80.8405|Davidson Wildcats Basketball|Saint Josephs Hawks Basketball|NA|NA|  30|  64|   157|NCAA BB|College Basketball
ncaa_basketball|5830174|07:00 pm|2023-02-18|Moon Township, PA|Milwaukee at Robert Morris|Milwaukee Panthers at Robert Morris Colonials Basketball|UPMC Events Center|464768|0.323|40.5191| -80.2124|Robert Morris Colonials Basketball|Milwaukee Panthers Basketball|NA|NA|  33|  52|   235|NCAA BB|College Basketball
ncaa_basketball|5817792|08:00 pm|2023-02-15|Ames, IA|TCU at Iowa State|TCU Horned Frogs at Iowa State Cyclones Basketball|Hilton Coliseum|  3458|0.537|42.0210| -93.6348|Iowa State Cyclones Basketball|TCU Horned Frogs Basketball|NA|NA|  50|  96|  1007|NCAA BB|College Basketball
ncaa_basketball|5860923|07:00 pm|2023-02-23|Vermillion, SD|Oral Roberts at South Dakota|Oral Roberts Golden Eagles at South Dakota Coyotes Basketball|Sanford Coyote Sports Center|455132|0.323|42.7904| -96.9278|South Dakota Coyotes Basketball|Oral Roberts Golden Eagles Basketball|NA|NA|  14|  15|    79|NCAA BB|College Basketball
ncaa_basketball|5739332|02:00 pm|2023-03-07|Greensboro, NC|ACC Mens Basketball Tournament - Session 1|ACC Mens Basketball Tournament - Session 1|Greensboro Coliseum Complex|  4318|0.618|36.0580| -79.8248|ACC Men's Basketball Tournament|NA|NA|NA|  12|  22|   506|NCAA BB|College Basketball
ncaa_basketball|5817220|11:00 am|2023-03-05|Memphis, TN|Houston at Memphis|Houston Cougars at Memphis Tigers Basketball|FedExForum|  1243|0.452|35.1383| -90.0522|Memphis Tigers Basketball|Houston Cougars Basketball|NA|NA|  24| 108|   448|NCAA BB|College Basketball
ncaa_basketball|5817978|07:00 pm|2023-02-03|Philadelphia, PA|Columbia at Penn|Columbia Lions at Pennsylvania Quakers Basketball|The Palestra|  3490|0.452|39.9514| -75.1887|Pennsylvania Quakers Basketball|Columbia Lions Basketball|NA|NA|  29|  58|    71|NCAA BB|College Basketball
ncaa_basketball|5844305|07:00 pm|2023-03-02|Denton, TX|Middle Tennessee at North Texas|Middle Tennessee Blue Raiders at North Texas Mean Green Basketball|UNT Coliseum (Super Pit)|  4159|0.323|33.2086| -97.1541|North Texas Mean Green Basketball|Middle Tennessee Blue Raiders Basketball|NA|NA|  21|  34|    65|NCAA BB|College Basketball
ncaa_basketball|5812356|08:00 pm|2023-03-04|Los Angeles, CA|Arizona State at USC|Arizona State Sun Devils at USC Trojans Basketball|Galen Center|  3451|0.512|34.0208|-118.2800|USC Trojans Basketball|Arizona State Sun Devils Basketball|NA|NA|  38|  63|   442|NCAA BB|College Basketball
ncaa_basketball|5846048|04:00 pm|2023-02-25|Annapolis, MD|Colgate at Navy|Colgate Raiders at Navy Midshipmen Basketball|Alumni Hall - Navy|  4146|0.451|38.9836| -76.4878|Navy Midshipmen Basketball|Colgate Raiders Basketball|NA|NA|  27|  36|    66|NCAA BB|College Basketball
ncaa_basketball|5768122|07:00 pm|2023-02-02|San Diego, CA|Portland at San Diego|Portland Pilots at San Diego Toreros Basketball|Jenny Craig Pavilion|  4154|0.283|32.7717|-117.1850|San Diego Toreros Basketball|Portland Pilots Basketball|NA|NA|  13|  27|    71|NCAA BB|College Basketball
ncaa_basketball|5849262|07:00 pm|2023-02-08|Buies Creek, NC|High Point at Campbell|High Point Panthers at Campbell Fighting Camels Basketball|John W Pope Convocation Center|  4198|0.322|35.4078| -78.7361|Campbell Fighting Camels Basketball|High Point Panthers Basketball|NA|NA|  14|  30|    56|NCAA BB|College Basketball
ncaa_basketball|5800863|07:00 pm|2023-02-07|Athens, GA|Ole Miss at Georgia|Ole Miss Rebels at Georgia Bulldogs Basketball|Stegeman Coliseum|  3482|0.450|33.9425| -83.3779|Georgia Bulldogs Basketball|Ole Miss Rebels Basketball|NA|NA|  13|  28|   103|NCAA BB|College Basketball
ncaa_basketball|5795777|07:30 pm|2023-02-17|San Jose, CA|New Mexico at San Jose State|New Mexico Lobos at San Jose State Spartans Basketball|Provident Credit Union Event Center|   897|0.351|37.3351|-121.8810|San Jose State Spartans Basketball|New Mexico Lobos Basketball|NA|NA|  37|  59|   108|NCAA BB|College Basketball
ncaa_basketball|5888030|02:30 pm|2023-02-18|Kalamazoo, MI|Ball State at Western Michigan|Ball State Cardinals at Western Michigan Broncos Basketball|University Arena (WMU)|  4213|0.393|42.2841| -85.6170|Western Michigan Broncos Basketball|Ball State Cardinals Basketball|NA|NA|  33|  33|    60|NCAA BB|College Basketball
ncaa_basketball|5901927|07:00 pm|2023-02-13|Charleston, SC|Northeastern at Charleston|Northeastern Huskies Basketball at College of Charleston Cougars Basketball	|TD Arena|  3257|0.320|32.7850| -79.9337|College of Charleston Cougars Basketball|Northeastern Huskies Basketball|NA|NA|  56| 113|   208|NCAA BB|College Basketball
ncaa_basketball|5795773|07:00 pm|2023-02-04|San Jose, CA|Wyoming at San Jose State|Wyoming Cowboys at San Jose State Spartans Basketball|Provident Credit Union Event Center|   897|0.282|37.3351|-121.8810|San Jose State Spartans Basketball|Wyoming Cowboys Basketball|NA|NA|  18|  36|    88|NCAA BB|College Basketball
ncaa_basketball|5817826|07:00 pm|2023-02-20|Morgantown, WV|Oklahoma State at West Virginia|Oklahoma State Cowboys at West Virginia Mountaineers Basketball|WVU Coliseum|  3288|0.533|39.6493| -79.9815|West Virginia Mountaineers Basketball|Oklahoma State Cowboys Basketball|NA|NA|  10|  38|   525|NCAA BB|College Basketball
ncaa_basketball|5805063|06:30 pm|2023-03-01|Providence, RI|Xavier at Providence|Xavier Musketeers at Providence Friars Basketball|Amica Mutual Pavilion|   805|0.533|41.8236| -71.4180|Providence Friars Basketball|Xavier Musketeers Basketball|NA|NA|  71| 147| 17623|NCAA BB|College Basketball
ncaa_basketball|5817213|11:00 am|2023-02-12|Memphis, TN|Temple at Memphis|Temple Owls at Memphis Tigers Basketball|FedExForum|  1243|0.445|35.1383| -90.0522|Memphis Tigers Basketball|Temple Owls Basketball|NA|NA|  12| 111|   283|NCAA BB|College Basketball
ncaa_basketball|5848529|02:00 pm|2023-03-04|Ruston, LA|Florida Atlantic at Louisiana Tech|Florida Atlantic Owls at Louisiana Tech Bulldogs Basketball|Thomas Assembly Center|  4212|0.279|32.5310| -92.6584|Louisiana Tech Bulldogs Basketball|Florida Atlantic Owls Basketball|NA|NA|  17|  24|    50|NCAA BB|College Basketball
ncaa_basketball|5812519|04:00 pm|2023-02-19|Pullman, WA|Oregon at Washington State|Oregon Ducks at Washington State Cougars Basketball|Beasley Coliseum|  3481|0.445|46.7352|-117.1580|Washington State Cougars Basketball|Oregon Ducks Basketball|NA|NA|  21|  55|   266|NCAA BB|College Basketball
