league|id|time|date|city|title|full|venue|ven_id|score|lat|long|t1|t2|t3|t4|low|med|high|name|xname
ncaa_basketball|5811542|03:30 am|2023-02-26|Chicago, IL|Southern Illinois at UIC|Southern Illinois Salukis at UIC Flames Basketball|Credit Union 1 Arena at UIC|  1140|0.303|41.8749| -87.6561|UIC Flames Basketball|Southern Illinois Salukis Basketball|NA|NA|  38|  54|   111|NCAA BB|College Basketball
ncaa_basketball|5849454|03:30 am|2023-02-25|Farmville, VA|UNC Asheville at Longwood|UNC Asheville Bulldogs at Longwood Lancers Basketball|Willett Hall - Longwood| 42091|0.286|37.3016| -78.3944|Longwood Lancers Basketball|UNC Asheville Bulldogs Basketball|NA|NA|  24|  25|    49|NCAA BB|College Basketball
ncaa_basketball|5801067|06:00 pm|2023-02-21|College Station, TX|Tennessee at Texas A&M|Tennessee Volunteers at Texas A&M Aggies Basketball|Reed Arena|  1879|0.452|30.6056| -96.3469|Texas A&M Aggies Basketball|Tennessee Volunteers Basketball|NA|NA|  15|  84|   482|NCAA BB|College Basketball
ncaa_basketball|5853029|04:00 pm|2023-02-18|Towson, MD|North Carolina A&T at Towson|North Carolina A&T Aggies at Towson Tigers Basketball|SECU Arena|  4258|0.323|39.3936| -76.6071|Towson Tigers Basketball|North Carolina A&T Aggies Basketball|NA|NA|  43|  52|   170|NCAA BB|College Basketball
ncaa_basketball|5848729|07:00 pm|2023-02-27|Portland, OR|Sacramento State at Portland State|Sacramento State Hornets at Portland State Vikings Basketball|Viking Pavilion|441097|0.267|45.5117|-122.6840|Portland State Vikings Basketball|Sacramento State Hornets Basketball|NA|NA|  16|  27|    88|NCAA BB|College Basketball
ncaa_basketball|5795574|07:00 pm|2023-02-21|Laramie, WY|Utah State at Wyoming|Utah State Aggies at Wyoming Cowboys Basketball|Arena-Auditorium|  4193|0.267|41.3133|-105.5690|Wyoming Cowboys Basketball|Utah State Aggies Basketball|NA|NA|  24|  36|   219|NCAA BB|College Basketball
ncaa_basketball|5858427|12:00 pm|2023-03-08|Norfolk, VA|MEAC Mens & Womens Basketball Tournament - Session 1|MEAC Mens & Womens Basketball Tournament - Session 1|Scope Arena|  4608|0.311|36.8528| -76.2867|MEAC Basketball Tournament|MEAC Womens Basketball Tournament|NA|NA| 222| 237|   244|NCAA BB|College Basketball
ncaa_basketball|5852994|12:00 pm|2023-03-05|Wilmington, DE|Session 7|Session 7|Chase Fieldhouse|460642|0.395|39.7276| -75.5544| Atlantic 10 Women's Basketball Championship|NA|NA|NA|  17|  17|    17|NCAA BB|College Basketball
ncaa_basketball|5849446|03:30 am|2023-02-04|Farmville, VA|Campbell at Longwood|Campbell Fighting Camels at Longwood Lancers Basketball|Willett Hall - Longwood| 42091|0.264|37.3016| -78.3944|Longwood Lancers Basketball|Campbell Fighting Camels Basketball|NA|NA|  25|  41|    50|NCAA BB|College Basketball
ncaa_basketball|5811600|07:00 pm|2023-02-08|Terre Haute, IN|Valparaiso at Indiana State|Valparaiso Beacons at Indiana State Sycamores Basketball|Hulman Center|  4220|0.228|39.4685| -87.4057|Indiana State Sycamores Basketball|Valparaiso Beacons Basketball|NA|NA|  24|  41|   219|NCAA BB|College Basketball
ncaa_basketball|5846114|03:00 pm|2023-02-18|San Antonio, TX|UAB at UTSA|UAB Blazers at UTSA Roadrunners Basketball|UTSA Convocation Center|  4145|0.410|29.5824| -98.6215|UTSA Roadrunners Basketball|UAB Blazers Basketball|NA|NA|  31|  39|    54|NCAA BB|College Basketball
ncaa_basketball|5751099|07:30 pm|2023-02-09|Hattiesburg, MS|Louisiana at Southern Miss|Louisiana Ragin' Cajuns at Southern Miss Golden Eagles Basketball|Reed Green Coliseum|  3474|0.299|31.3319| -89.3373|Southern Miss Golden Eagles Basketball|Louisiana Ragin' Cajuns Basketball|NA|NA|  20|  35|    60|NCAA BB|College Basketball
ncaa_basketball|5801112|07:00 pm|2023-03-01|Davidson, NC|George Washington at Davidson|George Washington Colonials at Davidson Wildcats Basketball|Belk Arena|  4247|0.283|35.4993| -80.8405|Davidson Wildcats Basketball|George Washington Colonials Basketball|NA|NA|  28|  47|   118|NCAA BB|College Basketball
ncaa_basketball|5795640|07:00 pm|2023-02-14|Logan, UT|Air Force at Utah State|Air Force Falcons at Utah State Aggies Basketball|Dee Glen Smith Spectrum|  4172|0.262|41.7529|-111.8070|Utah State Aggies Basketball|Air Force Falcons Basketball|NA|NA|  33|  86|   101|NCAA BB|College Basketball
ncaa_basketball|5828404|07:30 pm|2023-02-02|Louisville, KY|Kennesaw State at Bellarmine|Kennesaw State Owls at Bellarmine Knights Basketball|Freedom Hall|   109|0.298|38.1996| -85.7417|Bellarmine Knights Basketball|Kennesaw State Owls Basketball|NA|NA|  22|  33|   233|NCAA BB|College Basketball
ncaa_basketball|5922639|07:30 pm|2023-03-11|Atlantic City, NJ|MAAC Men's Basketball Tournament - Saturday|MAAC Men's Basketball Tournament - Saturday|Boardwalk Hall|    88|0.392|39.3549| -74.4384|MAAC Men's Basketball Tournament|NA|NA|NA|  44|  63|   129|NCAA BB|College Basketball
ncaa_basketball|5801552|08:00 pm|2023-02-22|Chicago, IL|Fordham at Loyola Chicago|Fordham Rams at Loyola Chicago Ramblers Basketball|Gentile Arena|  5183|0.280|42.0006| -87.6591|Loyola Chicago Ramblers Basketball|Fordham Rams Basketball|NA|NA| 132| 131|   132|NCAA BB|College Basketball
ncaa_basketball|5811641|06:00 pm|2023-02-08|Springfield, MO|Belmont at Missouri State|Belmont Bruins at Missouri State Bears Basketball|Great Southern Bank Arena|  2067|0.309|37.2021| -93.2831|Missouri State Bears Basketball|Belmont Bruins Basketball|NA|NA|  28|  38|    60|NCAA BB|College Basketball
ncaa_basketball|5849524|07:00 pm|2023-02-08|Radford, VA|Gardner-Webb at Radford|Gardner-Webb Runnin' Bulldogs at Radford Highlanders Basketball|Dedmon Center|  6589|0.308|37.1385| -80.5416|Radford Highlanders Basketball|Gardner-Webb Runnin' Bulldogs Basketball|NA|NA|  13|  14|    42|NCAA BB|College Basketball
ncaa_basketball|5848704|06:00 pm|2023-02-27|Flagstaff, AZ|Weber State at Northern Arizona|Weber State Wildcats at Northern Arizona Lumberjacks Basketball|Walkup Skydome|  5903|0.279|35.1805|-111.6530|Northern Arizona Lumberjacks Basketball|Weber State Wildcats Basketball|NA|NA|  17|  49|    61|NCAA BB|College Basketball
ncaa_basketball|5830168|07:00 pm|2023-02-16|Moon Township, PA|Green Bay at Robert Morris|Green Bay Phoenix at Robert Morris Colonials Basketball|UPMC Events Center|464768|0.257|40.5191| -80.2124|Robert Morris Colonials Basketball|Green Bay Phoenix Basketball|NA|NA|  32|  52|   235|NCAA BB|College Basketball
ncaa_basketball|5819101|02:00 pm|2023-02-12|Albany, NY|Marist at Siena|Marist Red Foxes at Siena Saints Basketball|MVP Arena|   153|0.279|42.6482| -73.7538|Siena Saints Basketball|Marist Red Foxes Basketball|NA|NA|  37|  64|   113|NCAA BB|College Basketball
ncaa_basketball|5812457|08:00 pm|2023-02-09|Eugene, OR|USC at Oregon|USC Trojans at Oregon Ducks Basketball|Matthew Knight Arena|  3454|0.501|44.0449|-123.0660|Oregon Ducks Basketball|USC Trojans Basketball|NA|NA|  14|  62|  1814|NCAA BB|College Basketball
ncaa_basketball|5751009|07:30 pm|2023-02-22|Lafayette, LA|Arkansas State at Louisiana|Arkansas State Red Wolves at Louisiana Ragin' Cajuns Basketball|Cajundome|   113|0.294|30.2184| -92.0389|Louisiana Ragin' Cajuns Basketball|Arkansas State Red Wolves Basketball|NA|NA|  29|  55|   133|NCAA BB|College Basketball
ncaa_basketball|5800917|06:00 pm|2023-02-14|Auburn, AL|Missouri at Auburn|Missouri Tigers at Auburn Tigers Basketball|Neville Arena|  3455|0.500|32.6028| -85.4925|Auburn Tigers Basketball|Missouri Tigers Basketball|NA|NA|  55| 153|   651|NCAA BB|College Basketball
ncaa_basketball|5795515|03:30 am|2023-02-15|Fort Collins, CO|Boise State Broncos at Colorado State Rams Basketball|Boise State Broncos at Colorado State Rams Basketball|Moby Arena|  4169|0.348|40.5756|-105.0840|Colorado State Rams Basketball|Boise State Broncos Basketball|NA|NA|  28|  53|    64|NCAA BB|College Basketball
ncaa_basketball|5842152|07:00 pm|2023-02-14|Ypsilanti, MI|Akron at Eastern Michigan|Akron Zips at Eastern Michigan Eagles Basketball|George Gervin GameAbove Center|  3501|0.252|42.2542| -83.6472|Eastern Michigan Eagles Basketball|Akron Zips Basketball|NA|NA|  18|  31|    66|NCAA BB|College Basketball
ncaa_basketball|5853032|07:00 pm|2023-02-16|Towson, MD|Delaware at Towson|Delaware Blue Hens at Towson Tigers Basketball|SECU Arena|  4258|0.316|39.3936| -76.6071|Towson Tigers Basketball|Delaware Blue Hens Basketball|NA|NA|  42|  54|   197|NCAA BB|College Basketball
ncaa_basketball|5801554|08:00 pm|2023-03-01|Chicago, IL|Rhode Island at Loyola Chicago|Rhode Island Rams at Loyola Chicago Ramblers Basketball|Gentile Arena|  5183|0.315|42.0006| -87.6591|Loyola Chicago Ramblers Basketball|Rhode Island Rams Basketball|NA|NA| 130| 131|   132|NCAA BB|College Basketball
ncaa_basketball|5750971|07:00 pm|2023-02-09|Atlanta, GA|Old Dominion at Georgia State|Old Dominion Monarchs at Georgia State Panthers Basketball|GSU Convocation Center|520616|0.307|33.7423| -84.3882|Georgia State Panthers Basketball|Old Dominion Monarchs Basketball|NA|NA|  17|  20|    64|NCAA BB|College Basketball
ncaa_basketball|5868270|07:00 pm|2023-02-28|Bowling Green, OH|Eastern Michigan at Bowling Green|Eastern Michigan Eagles at Bowling Green Falcons Basketball|Stroh Center|  7484|0.251|41.3752| -83.6262|Bowling Green Falcons Basketball|Eastern Michigan Eagles Basketball|NA|NA|  14|  22|    40|NCAA BB|College Basketball
ncaa_basketball|5850656|07:00 pm|2023-02-23|Fairfield, CT|St. Francis Brooklyn at Sacred Heart|St. Francis (NY) Terriers at Sacred Heart Pioneers Basketball|William H Pitt Health And Recreation Center at Sacred Heart University|  4232|0.292|41.1400| -73.2400|Sacred Heart Pioneers Basketball|St. Francis (NY) Terriers Basketball|NA|NA|  17|  44|   117|NCAA BB|College Basketball
ncaa_basketball|5848701|06:00 pm|2023-02-09|Flagstaff, AZ|Sacramento State at Northern Arizona|Sacramento State Hornets at Northern Arizona Lumberjacks Basketball|Walkup Skydome|  5903|0.250|35.1805|-111.6530|Northern Arizona Lumberjacks Basketball|Sacramento State Hornets Basketball|NA|NA|  17|  27|    61|NCAA BB|College Basketball
ncaa_basketball|5860920|03:30 am|2023-02-04|Vermillion, SD|North Dakota at South Dakota|North Dakota Fighting Hawks at South Dakota Coyotes Basketball|Sanford Coyote Sports Center|455132|0.365|42.7904| -96.9278|South Dakota Coyotes Basketball|North Dakota Fighting Hawks Basketball|NA|NA|  13|  13|   103|NCAA BB|College Basketball
ncaa_basketball|5848496|07:00 pm|2023-02-02|Charlotte, NC|FIU at Charlotte|Florida International Panthers at Charlotte 49ers Basketball|Halton Arena|  3442|0.249|35.3063| -80.7344|Charlotte 49ers Basketball|Florida International Panthers Basketball|NA|NA|  13|  20|    55|NCAA BB|College Basketball
ncaa_basketball|5747504|07:00 pm|2023-02-18|Bozeman, MT|Montana at Montana State|Montana Grizzlies at Montana State Bobcats Basketball|Brick Breeden Fieldhouse|   918|0.368|45.6650|-111.0510|Montana State Bobcats Basketball|Montana Grizzlies Basketball|NA|NA|  37|  66|   253|NCAA BB|College Basketball
ncaa_basketball|5909664|12:00 pm|2023-03-06|Indianapolis, IN|Horizon League Basketball Champs-Ticket Package-Good For Any 1 Session|Horizon League Basketball Champs-Ticket Package-Good For Any 1 Session|Indiana Farmers Coliseum|  1607|0.342|39.8273| -86.1348|Horizon League Basketball Tournament|NA|NA|NA|  55|  70|    92|NCAA BB|College Basketball
ncaa_basketball|5812529|04:00 pm|2023-02-05|Salt Lake City, UT|California Golden Bears at Utah Utes Basketball|California Golden Bears at Utah Utes Basketball|Jon M. Huntsman Center|  4255|0.434|40.7621|-111.8390|Utah Utes Basketball|California Golden Bears Basketball|NA|NA|   8|  50|   255|NCAA BB|College Basketball
ncaa_basketball|5849578|07:00 pm|2023-02-08|Spartanburg, SC|Charleston Southern at USC Upstate|Charleston Southern Buccaneers at USC Upstate Spartans Basketball|G.B. Hodge Center|  5179|0.312|34.9439| -81.9289|USC Upstate Spartans Basketball|Charleston Southern Buccaneers Basketball|NA|NA|  26|  26|    62|NCAA BB|College Basketball
ncaa_basketball|5841491|07:00 pm|2023-02-21|Athens, OH|Northern Illinois at Ohio|Northern Illinois Huskies at Ohio Bobcats Basketball|Ohio University|  4254|0.271|39.3292| -82.1013|Ohio Bobcats Basketball|Northern Illinois Huskies Basketball|NA|NA|  25|  37|    79|NCAA BB|College Basketball
ncaa_basketball|5845667|07:00 pm|2023-02-08|Dayton, OH|IUPUI at Wright State|IUPUI Jaguars at Wright State Raiders Basketball|Wright State University Nutter Center|  1622|0.223|39.7747| -84.0797|Wright State Raiders Basketball|IUPUI Jaguars Basketball|NA|NA|  24|  60|   380|NCAA BB|College Basketball
ncaa_basketball|5801359|08:00 pm|2023-03-04|Kingston, RI|Davidson at Rhode Island|Davidson Wildcats at Rhode Island Rams Basketball|Ryan Center|  1313|0.383|41.4882| -71.5366|Rhode Island Rams Basketball|Davidson Wildcats Basketball|NA|NA|   9|  72|  6912|NCAA BB|College Basketball
ncaa_basketball|5849264|07:00 pm|2023-02-15|Buies Creek, NC|Charleston Southern at Campbell|Charleston Southern Buccaneers at Campbell Fighting Camels Basketball|John W Pope Convocation Center|  4198|0.312|35.4078| -78.7361|Campbell Fighting Camels Basketball|Charleston Southern Buccaneers Basketball|NA|NA|  14|  33|    56|NCAA BB|College Basketball
ncaa_basketball|5844307|05:00 pm|2023-02-11|Denton, TX|Charlotte at North Texas|Charlotte 49ers at North Texas Mean Green Basketball|UNT Coliseum (Super Pit)|  4159|0.382|33.2086| -97.1541|North Texas Mean Green Basketball|Charlotte 49ers Basketball|NA|NA|  21|  34|    64|NCAA BB|College Basketball
ncaa_basketball|5922632|07:00 pm|2023-03-08|Atlantic City, NJ|MAAC Men's Basketball Tournament - Wednesday|MAAC Men's Basketball Tournament - Wednesday|Boardwalk Hall|    88|0.414|39.3549| -74.4384|MAAC Men's Basketball Tournament|NA|NA|NA|  46|  63|   129|NCAA BB|College Basketball
ncaa_basketball|5811691|01:00 pm|2023-02-05|Carbondale, IL|Missouri State at Southern Illinois|Missouri State Bears at Southern Illinois Salukis Basketball|Banterra Center|  4095|0.235|37.7251| -89.2167|Southern Illinois Salukis Basketball|Missouri State Bears Basketball|NA|NA|  32|  59|    85|NCAA BB|College Basketball
ncaa_basketball|5801110|07:00 pm|2023-02-22|Davidson, NC|St. Bonaventure at Davidson|St. Bonaventure Bonnies at Davidson Wildcats Basketball|Belk Arena|  4247|0.255|35.4993| -80.8405|Davidson Wildcats Basketball|St. Bonaventure Bonnies Basketball|NA|NA|  30|  47|    64|NCAA BB|College Basketball
ncaa_basketball|5848700|06:00 pm|2023-02-06|Flagstaff, AZ|Idaho State at Northern Arizona|Idaho State Bengals at Northern Arizona Lumberjacks Basketball|Walkup Skydome|  5903|0.265|35.1805|-111.6530|Northern Arizona Lumberjacks Basketball|Idaho State Bengals Basketball|NA|NA|  17|  42|    61|NCAA BB|College Basketball
ncaa_basketball|5841513|03:30 pm|2023-02-11|Oxford, OH|Central Michigan Chippewas at Miami (OH) RedHawks Basketball|Central Michigan Chippewas at Miami (OH) RedHawks Basketball|Millett Hall|  4176|0.363|39.5171| -84.7346|Miami (OH) RedHawks Basketball|Central Michigan Chippewas Basketball|NA|NA|  24|  29|    76|NCAA BB|College Basketball
ncaa_basketball|5849025|07:00 pm|2023-02-23|Ogden, UT|Eastern Washington at Weber State|Eastern Washington Eagles at Weber State Wildcats Basketball|Dee Events Center|  4259|0.333|41.1831|-111.9490|Weber State Wildcats Basketball|Eastern Washington Eagles Basketball|NA|NA|  18|  65|    66|NCAA BB|College Basketball
ncaa_basketball|5801175|07:00 pm|2023-02-08|Pittsburgh, PA|George Mason at Duquesne|George Mason Patriots at Duquesne Dukes Basketball|UPMC Cooper Fieldhouse|  3441|0.231|40.4378| -79.9881|Duquesne Dukes Basketball|George Mason Patriots Basketball|NA|NA|  21|  36|    60|NCAA BB|College Basketball
ncaa_basketball|5811695|03:30 am|2023-02-19|Carbondale, IL|Bradley at Southern Illinois|Bradley Braves at Southern Illinois Salukis Basketball|Banterra Center|  4095|0.263|37.7251| -89.2167|Southern Illinois Salukis Basketball|Bradley Braves Basketball|NA|NA|  42|  45|    86|NCAA BB|College Basketball
ncaa_basketball|5868271|05:00 pm|2023-02-25|Bowling Green, OH|Kent State at Bowling Green|Kent State Golden Flashes at Bowling Green Falcons Basketball|Stroh Center|  7484|0.310|41.3752| -83.6262|Bowling Green Falcons Basketball|Kent State Golden Flashes Basketball|NA|NA|  16|  25|    43|NCAA BB|College Basketball
ncaa_basketball|5828402|04:00 pm|2023-02-18|Louisville, KY|Central Arkansas at Bellarmine|Central Arkansas Bears at Bellarmine Knights Basketball|Freedom Hall|   109|0.310|38.1996| -85.7417|Bellarmine Knights Basketball|Central Arkansas Bears Basketball|NA|NA|  33|  34|    83|NCAA BB|College Basketball
ncaa_basketball|5852989|11:00 am|2023-03-02|Wilmington, DE|Session 2 (11am & 1:30pm)|Session 2 (11am & 1:30pm)|Chase Fieldhouse|460642|0.375|39.7276| -75.5544| Atlantic 10 Women's Basketball Championship|NA|NA|NA|  17|  17|    17|NCAA BB|College Basketball
ncaa_basketball|5751119|04:00 pm|2023-02-11|San Marcos, TX|Old Dominion at Texas State|Old Dominion Monarchs at Texas State Bobcats Basketball|Strahan Arena at the University Events Center|  4260|0.341|29.8887| -97.9374|Texas State Bobcats Basketball|Old Dominion Monarchs Basketball|NA|NA|  37|  53|   149|NCAA BB|College Basketball
ncaa_basketball|5817180|07:00 pm|2023-02-15|Greenville, NC|Cincinnati at East Carolina|Cincinnati Bearcats at East Carolina Pirates Basketball|Williams Arena at Minges Coliseum|  3428|0.282|35.5975| -77.3673|East Carolina Pirates Basketball|Cincinnati Bearcats Basketball|NA|NA|  18|  28|    86|NCAA BB|College Basketball
ncaa_basketball|5853016|07:00 pm|2023-02-02|Fort Myers, FL|Central Arkansas at FGCU|Central Arkansas Bears at Florida Gulf Coast Eagles Basketball|Alico Arena|  4252|0.296|26.4618| -81.7759|Florida Gulf Coast Eagles Basketball|Central Arkansas Bears Basketball|NA|NA|  28|  61|    72|NCAA BB|College Basketball
ncaa_basketball|5768012|03:00 pm|2023-02-11|Portland, OR|Saint Marys at Portland|Saint Marys Rattlers at Portland Pilots Basketball|Chiles Center|  5169|0.302|45.5736|-122.7280|Portland Pilots Basketball|Saint Marys Rattlers Basketball|NA|NA|  10|  37|    72|NCAA BB|College Basketball
ncaa_basketball|5817244|07:00 pm|2023-02-15|Tulsa, OK|South Florida at Tulsa|South Florida Bulls at Tulsa Golden Hurricane Basketball|Reynolds Center|  3449|0.291|36.1490| -95.9421|Tulsa Golden Hurricane Basketball|South Florida Bulls Basketball|NA|NA|  80| 104|   200|NCAA BB|College Basketball
ncaa_basketball|5849581|03:00 pm|2023-02-25|Spartanburg, SC|Gardner-Webb at USC Upstate|Gardner-Webb Runnin' Bulldogs at USC Upstate Spartans Basketball|G.B. Hodge Center|  5179|0.360|34.9439| -81.9289|USC Upstate Spartans Basketball|Gardner-Webb Runnin' Bulldogs Basketball|NA|NA|  64|  64|    64|NCAA BB|College Basketball
ncaa_basketball|5801177|12:30 pm|2023-02-11|Pittsburgh, PA|St. Bonaventure at Duquesne|St. Bonaventure Bonnies at Duquesne Dukes Basketball|UPMC Cooper Fieldhouse|  3441|0.295|40.4378| -79.9881|Duquesne Dukes Basketball|St. Bonaventure Bonnies Basketball|NA|NA|  30|  29|    60|NCAA BB|College Basketball
ncaa_basketball|5817358|07:00 pm|2023-02-22|Orlando, FL|South Florida at UCF|South Florida Bulls at UCF Knights Basketball|Addition Financial Arena|  5595|0.329|28.6072| -81.1974|UCF Knights Basketball|South Florida Bulls Basketball|NA|NA|  12|  60|  1231|NCAA BB|College Basketball
ncaa_basketball|5817372|07:00 pm|2023-03-01|Tampa, FL|Tulsa at South Florida|Tulsa Golden Hurricane at South Florida Bulls Basketball|Yuengling Center|   223|0.372|28.0592| -82.4066|South Florida Bulls Basketball|Tulsa Golden Hurricane Basketball|NA|NA|  14|  64|   403|NCAA BB|College Basketball
ncaa_basketball|5849593|07:00 pm|2023-02-22|Rock Hill, SC|Campbell at Winthrop|Campbell Fighting Camels at Winthrop Eagles Basketball|Winthrop Coliseum|  6596|0.242|34.9481| -81.0149|Winthrop Eagles Basketball|Campbell Fighting Camels Basketball|NA|NA|  16|  18|    59|NCAA BB|College Basketball
ncaa_basketball|5833521|07:00 pm|2023-02-11|Lynchburg, VA|Eastern Kentucky at Liberty|Eastern Kentucky Colonels at Liberty Flames Basketball|Liberty Arena|518716|0.371|37.3531| -79.1770|Liberty Flames Basketball|Eastern Kentucky Colonels Basketball|NA|NA|  80|  95|   100|NCAA BB|College Basketball
ncaa_basketball|5801251|01:00 pm|2023-02-11|Philadelphia, PA|George Washington at Saint Josephs|George Washington Colonials at Saint Josephs Hawks Basketball|Michael J. Hagan '85 Arena|  3478|0.421|39.9957| -75.2351|Saint Josephs Hawks Basketball|George Washington Colonials Basketball|NA|NA|  37|  74|   252|NCAA BB|College Basketball
ncaa_basketball|5811511|01:00 pm|2023-02-12|Evansville, IN|Missouri State at Evansville|Missouri State Bears at Evansville Purple Aces Basketball|Ford Center|  6370|0.293|37.9721| -87.5679|Evansville Purple Aces Basketball|Missouri State Bears Basketball|NA|NA|  40|  86|   366|NCAA BB|College Basketball
ncaa_basketball|5750951|07:00 pm|2023-02-09|Statesboro, GA|James Madison at Georgia Southern|James Madison Dukes at Georgia Southern Eagles Basketball|Hanner Fieldhouse|  4216|0.293|32.4272| -81.7799|Georgia Southern Eagles Basketball|James Madison Dukes Basketball|NA|NA|  17|  36|    60|NCAA BB|College Basketball
ncaa_basketball|5848485|07:00 pm|2023-02-23|Miami, FL|UTEP at FIU|UTEP Miners at Florida International Panthers Basketball|Ocean Bank Convocation Center|  4250|0.251|25.7569| -80.3796|Florida International Panthers Basketball|UTEP Miners Basketball|NA|NA|  28|  57|    67|NCAA BB|College Basketball
ncaa_basketball|5926407|07:00 pm|2023-02-22|Chattanooga, TN|Samford at Chattanooga|Samford Bulldogs at Chattanooga Mocs Basketball|McKenzie Arena|  2454|0.269|35.0479| -85.2983|Chattanooga Mocs Basketball|Samford Bulldogs Basketball|NA|NA|  21|  51|    58|NCAA BB|College Basketball
ncaa_basketball|5844318|07:00 pm|2023-03-02|Houston, TX|Florida Atlantic at Rice|Florida Atlantic Owls at Rice Owls Basketball|Tudor Fieldhouse|  3434|0.196|29.7163| -95.4049|Rice Owls Basketball|Florida Atlantic Owls Basketball|NA|NA|  31|  63|   277|NCAA BB|College Basketball
ncaa_basketball|5848499|03:30 am|2023-02-23|Charlotte, NC|North Texas at Charlotte|North Texas Mean Green at Charlotte 49ers Basketball|Halton Arena|  3442|0.234|35.3063| -80.7344|Charlotte 49ers Basketball|North Texas Mean Green Basketball|NA|NA|  25|  32|    57|NCAA BB|College Basketball
ncaa_basketball|5750952|03:00 pm|2023-02-11|Statesboro, GA|Arkansas State at Georgia Southern|Arkansas State Red Wolves at Georgia Southern Eagles Basketball|Hanner Fieldhouse|  4216|0.314|32.4272| -81.7799|Georgia Southern Eagles Basketball|Arkansas State Red Wolves Basketball|NA|NA|  16|  35|    57|NCAA BB|College Basketball
ncaa_basketball|5747506|03:30 am|2023-02-23|Bozeman, MT|Sacramento State at Montana State|Sacramento State Hornets at Montana State Bobcats Basketball|Brick Breeden Fieldhouse|   918|0.247|45.6650|-111.0510|Montana State Bobcats Basketball|Sacramento State Hornets Basketball|NA|NA|  33| 104|   138|NCAA BB|College Basketball
ncaa_basketball|5811697|07:00 pm|2023-02-22|Carbondale, IL|UNI at Southern Illinois|Northern Iowa Panthers at Southern Illinois Salukis Basketball|Banterra Center|  4095|0.246|37.7251| -89.2167|Southern Illinois Salukis Basketball|Northern Iowa Panthers Basketball|NA|NA|  33|  49|    86|NCAA BB|College Basketball
ncaa_basketball|5844463|07:00 pm|2023-02-16|El Paso, TX|UAB at UTEP|UAB Blazers at UTEP Miners Basketball|Don Haskins Center|   691|0.305|31.7778|-106.5060|UTEP Miners Basketball|UAB Blazers Basketball|NA|NA|  34|  50|    90|NCAA BB|College Basketball
ncaa_basketball|5848528|06:00 pm|2023-03-02|Ruston, LA|FIU at Louisiana Tech|Florida International Panthers at Louisiana Tech Bulldogs Basketball|Thomas Assembly Center|  4212|0.301|32.5310| -92.6584|Louisiana Tech Bulldogs Basketball|Florida International Panthers Basketball|NA|NA|  16|  25|    49|NCAA BB|College Basketball
ncaa_basketball|5801489|06:00 pm|2023-02-25|Washington, DC|La Salle at George Washington|La Salle Explorers at George Washington Colonials Basketball|Charles E. Smith Center|  3350|0.378|38.8978| -77.0493|George Washington Colonials Basketball|La Salle Explorers Basketball|NA|NA|  28|  49|   110|NCAA BB|College Basketball
ncaa_basketball|5844320|07:00 pm|2023-02-18|Houston, TX|Western Kentucky at Rice|Western Kentucky Hilltoppers at Rice Owls Basketball|Tudor Fieldhouse|  3434|0.287|29.7163| -95.4049|Rice Owls Basketball|Western Kentucky Hilltoppers Basketball|NA|NA|  35|  63|    95|NCAA BB|College Basketball
ncaa_basketball|5800972|08:00 pm|2023-02-28|Starkville, MS|South Carolina at Mississippi State|South Carolina Gamecocks at Mississippi State Bulldogs Basketball|Humphrey Coliseum|  3433|0.362|33.4595| -88.7896|Mississippi State Bulldogs Basketball|South Carolina Gamecocks Basketball|NA|NA|  18|  47|   222|NCAA BB|College Basketball
ncaa_basketball|5922633|07:00 pm|2023-03-09|Atlantic City, NJ|MAAC Men's Basketball Tournament - Thursday|MAAC Men's Basketball Tournament - Thursday|Boardwalk Hall|    88|0.416|39.3549| -74.4384|MAAC Men's Basketball Tournament|NA|NA|NA|  44|  62|   128|NCAA BB|College Basketball
ncaa_basketball|5848726|07:00 pm|2023-02-04|Portland, OR|Eastern Washington at Portland State|Eastern Washington Eagles at Portland State Vikings Basketball|Viking Pavilion|441097|0.285|45.5117|-122.6840|Portland State Vikings Basketball|Eastern Washington Eagles Basketball|NA|NA|  17|  26|    88|NCAA BB|College Basketball
ncaa_basketball|5849575|03:00 pm|2023-02-04|Spartanburg, SC|UNC Asheville at USC Upstate|UNC Asheville Bulldogs at USC Upstate Spartans Basketball|G.B. Hodge Center|  5179|0.374|34.9439| -81.9289|USC Upstate Spartans Basketball|UNC Asheville Bulldogs Basketball|NA|NA|  63|  63|    64|NCAA BB|College Basketball
ncaa_basketball|5848675|07:00 pm|2023-02-23|Pocatello, ID|Idaho at Idaho State|Idaho Vandals at Idaho State Bengals Basketball|Reed Gym|  6560|0.307|42.8627|-112.4330|Idaho State Bengals Basketball|Idaho Vandals Basketball|NA|NA|  24|  24|    64|NCAA BB|College Basketball
