league|id|time|date|city|title|full|venue|ven_id|score|lat|long|t1|t2|t3|t4|low|med|high|name|xname
mlb|5785214|01:35 pm|2023-04-02|Boston, MA|Orioles at Red Sox|Baltimore Orioles at Boston Red Sox|Fenway Park|    21|0.713|42.3456| -71.0983|Boston Red Sox|Baltimore Orioles|NA|NA|  47| 114|  1879|MLB|MLB Baseball
mlb|5794648|01:10 pm|2023-03-04|Jupiter, FL|Spring Training: Mets at Marlins|Spring Training: New York Mets at Miami Marlins|Roger Dean Stadium|  3927|0.542|26.8910| -80.1163|Miami Marlins|New York Mets|NA|NA|  59|  97|   198|MLB|MLB Baseball
mlb|5787973|04:12 pm|2023-04-07|Pittsburgh, PA|White Sox at Pirates|Chicago White Sox at Pittsburgh Pirates|PNC Park|    10|0.657|40.4472| -80.0064|Pittsburgh Pirates|Chicago White Sox|NA|NA|  70| 162|   969|MLB|MLB Baseball
mlb|5785566|01:05 pm|2023-04-05|Arlington, TX|Orioles at Rangers|Baltimore Orioles at Texas Rangers|Globe Life Field|487468|0.657|32.7472| -97.0838|Texas Rangers|Baltimore Orioles|NA|NA|  24|  71|126004|MLB|MLB Baseball
mlb|5794599|06:05 pm|2023-03-04|Surprise, AZ|Spring Training: Dodgers at Royals|Spring Training: Los Angeles Dodgers at Kansas City Royals (Split Squad)|Surprise Stadium|  3930|0.542|33.6269|-112.3770|Kansas City Royals|Los Angeles Dodgers|NA|NA|  26|  85|  4230|MLB|MLB Baseball
mlb|5794162|01:05 pm|2023-03-07|Phoenix, AZ|Spring Training: Brewers at White Sox|Spring Training: Milwaukee Brewers at Chicago White Sox|Camelback Ranch|   395|0.471|33.5132|-112.2950|Chicago White Sox|Milwaukee Brewers|NA|NA|  13|  67|   397|MLB|MLB Baseball
mlb|5794464|01:05 pm|2023-03-17|Lakeland, FL|Spring Training: Yankees at Tigers|Spring Training: New York Yankees at Detroit Tigers|Publix Field at Joker Marchant Stadium|  3929|0.637|28.0745| -81.9510|Detroit Tigers|New York Yankees|NA|NA|  44| 112|   462|MLB|MLB Baseball
mlb|5797221|01:05 pm|2023-03-13|North Port, FL|Spring Training: Orioles at Braves|Spring Training: Baltimore Orioles (Split Squad) at Atlanta Braves|CoolToday Park|462490|0.541|27.0328| -82.3200|Atlanta Braves|Baltimore Orioles|NA|NA|  28|  94|   431|MLB|MLB Baseball
mlb|5786508|06:40 pm|2023-04-10|Denver, CO|Cardinals at Rockies|St. Louis Cardinals at Colorado Rockies|Coors Field|     7|0.619|39.7557|-104.9940|Colorado Rockies|St. Louis Cardinals|NA|NA|  18|  64|   451|MLB|MLB Baseball
mlb|5789678|01:20 pm|2023-03-30|Chicago, IL|Milwaukee Brewers at Chicago Cubs - Opening Day|Milwaukee Brewers at Chicago Cubs - Opening Day|Wrigley Field|    11|0.541|41.9475| -87.6562|Chicago Cubs|Milwaukee Brewers|MLB Opening Day|NA|  77| 177|  6125|MLB|MLB Baseball
mlb|5794674|06:05 pm|2023-03-21|Surprise, AZ|Spring Training: Cubs at Royals|Spring Training: Chicago Cubs at Kansas City Royals|Surprise Stadium|  3930|0.513|33.6269|-112.3770|Kansas City Royals|Chicago Cubs|NA|NA|  30|  82|   397|MLB|MLB Baseball
mlb|5794109|06:07 pm|2023-03-28|Anaheim, CA|Spring Training: Dodgers at Angels|Spring Training: Los Angeles Dodgers at Los Angeles Angels|Angel Stadium of Anaheim|    28|0.566|33.8003|-117.8830|Los Angeles Angels|Los Angeles Dodgers|NA|NA|  17|  50|  3755|MLB|MLB Baseball
mlb|5794022|01:10 pm|2023-03-10|Scottsdale, AZ|Spring Training: Giants at Rockies|Spring Training: San Francisco Giants at Colorado Rockies|Salt River Fields at Talking Stick|  3931|0.566|33.5457|-111.8860|Colorado Rockies|San Francisco Giants|NA|NA|  38|  86|   532|MLB|MLB Baseball
mlb|5788251|07:10 pm|2023-04-07|Milwaukee, WI|Cardinals at Brewers|St. Louis Cardinals at Milwaukee Brewers|American Family Field|    15|0.675|43.0296| -87.9725|Milwaukee Brewers|St. Louis Cardinals|NA|NA|  27|  82| 13254|MLB|MLB Baseball
mlb|5787446|04:10 pm|2023-04-08|Saint Petersburg, FL|Athletics at Rays|Oakland Athletics at Tampa Bay Rays|Tropicana Field|     4|0.618|27.7682| -82.6534|Tampa Bay Rays|Oakland Athletics|NA|NA|  41| 156|   647|MLB|MLB Baseball
mlb|5793762|06:05 pm|2023-03-24|Fort Myers, FL|Spring Training: Braves at Red Sox|Spring Training: Atlanta Braves at Boston Red Sox|JetBlue Park|  6992|0.618|26.5487| -81.7612|Boston Red Sox|Atlanta Braves|NA|NA|  26| 111|   614|MLB|MLB Baseball
mlb|5794082|01:05 pm|2023-03-25|Scottsdale, AZ|Spring Training: Mariners at Giants|Spring Training: Seattle Mariners (Split Squad) at San Francisco Giants|Scottsdale Stadium|  3925|0.636|33.4893|-111.9210|San Francisco Giants|Seattle Mariners|NA|NA|  61| 122|   538|MLB|MLB Baseball
mlb|5794250|01:10 pm|2023-03-15|Scottsdale, AZ|Spring Training: Giants at Diamondbacks|Spring Training: San Francisco Giants (Split Squad) at Arizona Diamondbacks (Double Header)|Salt River Fields at Talking Stick|  3931|0.564|33.5457|-111.8860|Arizona Diamondbacks|San Francisco Giants|NA|NA|  24|  83|   397|MLB|MLB Baseball
mlb|5788233|01:10 pm|2023-04-03|Milwaukee, WI|Mets at Brewers|New York Mets at Milwaukee Brewers|American Family Field|    15|0.674|43.0296| -87.9725|Milwaukee Brewers|New York Mets|NA|NA|  41|  92| 13254|MLB|MLB Baseball
mlb|5892987|01:10 pm|2023-03-25|Peoria, AZ|Spring Training - Arizona Diamondbacks at Seattle Mariners (Split Squad)|Spring Training - Arizona Diamondbacks at Seattle Mariners (Split Squad)|Peoria Sports Complex|  3924|0.479|33.6321|-112.2330|Seattle Mariners|NA|NA|NA|  43|  86|   397|MLB|MLB Baseball
mlb|5793714|01:05 pm|2023-03-04|Fort Myers, FL|Spring Training: Astros at Red Sox|Spring Training: Houston Astros at Boston Red Sox|JetBlue Park|  6992|0.617|26.5487| -81.7612|Boston Red Sox|Houston Astros|NA|NA|  23|  74|   245|MLB|MLB Baseball
mlb|5785606|07:08 pm|2023-04-09|Atlanta, GA|Padres at Braves|San Diego Padres at Atlanta Braves|Truist Park|418889|0.654|33.8897| -84.4654|Atlanta Braves|San Diego Padres|NA|NA|  29|  67|  1880|MLB|MLB Baseball
mlb|5794656|01:10 pm|2023-03-13|Jupiter, FL|Spring Training: Mets at Marlins|Spring Training: New York Mets at Miami Marlins|Roger Dean Stadium|  3927|0.511|26.8910| -80.1163|Miami Marlins|New York Mets|NA|NA|  50|  89|   397|MLB|MLB Baseball
mlb|5784908|01:40 pm|2023-04-09|Flushing, NY|Marlins at Mets|Miami Marlins at New York Mets|Citi Field|     3|0.646|40.7564| -73.8459|New York Mets|Miami Marlins|NA|NA|  24|  64| 12504|MLB|MLB Baseball
mlb|5787843|01:10 pm|2023-04-09|Minneapolis, MN|Astros at Twins|Houston Astros at Minnesota Twins|Target Field|  3712|0.634|44.9817| -93.2776|Minnesota Twins|Houston Astros|NA|NA|  19|  67|  1124|MLB|MLB Baseball
mlb|5793910|01:05 pm|2023-03-11|West Palm Beach, FL|Spring Training: Cardinals at Astros|Spring Training: St. Louis Cardinals at Houston Astros|The Ballpark of the Palm Beaches|419759|0.563|26.7579| -80.1169|Houston Astros|St. Louis Cardinals|NA|NA|  39|  99|   397|MLB|MLB Baseball
mlb|5794500|01:05 pm|2023-03-03|Goodyear, AZ|Spring Training: Brewers at Guardians|Spring Training: Milwaukee Brewers at Cleveland Guardians|Goodyear Ballpark|  3943|0.477|33.4285|-112.3900|Cleveland Guardians|Milwaukee Brewers|NA|NA|  17|  47|   121|MLB|MLB Baseball
mlb|5794672|01:05 pm|2023-03-18|Surprise, AZ|Spring Training: Rockies at Royals|Spring Training: Colorado Rockies at Kansas City Royals|Surprise Stadium|  3930|0.510|33.6269|-112.3770|Kansas City Royals|Colorado Rockies|NA|NA|  24|  71|   397|MLB|MLB Baseball
mlb|5794360|01:05 pm|2023-03-28|Bradenton, FL|Spring Training: Twins at Pirates|Spring Training: Minnesota Twins at Pittsburgh Pirates|LECOM Park|  3941|0.502|27.4846| -82.5713|Pittsburgh Pirates|Minnesota Twins|NA|NA|  27|  64|   475|MLB|MLB Baseball
mlb|5793710|01:05 pm|2023-03-11|North Port, FL|Spring Training: Tigers at Braves|Spring Training: Detroit Tigers at Atlanta Braves|CoolToday Park|462490|0.591|27.0328| -82.3200|Atlanta Braves|Detroit Tigers|NA|NA|  55| 114|   404|MLB|MLB Baseball
mlb|5794548|01:05 pm|2023-03-19|Goodyear, AZ|Spring Training: Rockies at Guardians|Spring Training: Colorado Rockies at Cleveland Guardians|Goodyear Ballpark|  3943|0.476|33.4285|-112.3900|Cleveland Guardians|Colorado Rockies|NA|NA|  24|  55|   397|MLB|MLB Baseball
mlb|5786983|03:10 pm|2023-04-03|Chicago, IL|Giants at White Sox|San Francisco Giants at Chicago White Sox|Guaranteed Rate Field|  3715|0.672|41.8299| -87.6338|Chicago White Sox|San Francisco Giants|NA|NA|  61| 126|156574|MLB|MLB Baseball
mlb|5794452|06:05 pm|2023-03-24|Lakeland, FL|Spring Training: Pirates at Tigers|Spring Training: Pittsburgh Pirates at Detroit Tigers|Publix Field at Joker Marchant Stadium|  3929|0.561|28.0745| -81.9510|Detroit Tigers|Pittsburgh Pirates|NA|NA|  26|  76|   397|MLB|MLB Baseball
mlb|5794211|06:05 pm|2023-03-16|Sarasota, FL|Spring Training: Blue Jays at Orioles|Spring Training: Toronto Blue Jays at Baltimore Orioles|Ed Smith Stadium|  3923|0.510|27.3482| -82.5176|Baltimore Orioles|Toronto Blue Jays|NA|NA|  50|  70|   397|MLB|MLB Baseball
mlb|5794184|01:05 pm|2023-03-19|Clearwater, FL|Spring Training: Red Sox at Phillies|Spring Training: Boston Red Sox at Philadelphia Phillies|BayCare Ballpark|  3942|0.615|27.9709| -82.7317|Philadelphia Phillies|Boston Red Sox|NA|NA|  48| 119|   397|MLB|MLB Baseball
mlb|5949576|01:35 pm|2023-04-02|Bronx, NY|Giants at Yankees|San Francisco Giants at New York Yankees - Premium Seating|Yankee Stadium|     8|0.727|40.8296| -73.9262|New York Yankees|San Francisco Giants|NA|NA| 727| 727|   769|MLB|MLB Baseball
mlb|5789224|01:40 pm|2023-04-02|Miami, FL|Mets at Marlins|New York Mets at Miami Marlins|loanDepot park|  6371|0.615|25.7617| -80.1918|Miami Marlins|New York Mets|NA|NA|  27|  74|  1124|MLB|MLB Baseball
mlb|5793732|01:05 pm|2023-03-23|North Port, FL|Spring Training: Mets at Braves|Spring Training: New York Mets at Atlanta Braves|CoolToday Park|462490|0.560|27.0328| -82.3200|Atlanta Braves|New York Mets|NA|NA|  55| 114|   431|MLB|MLB Baseball
mlb|5793970|01:10 pm|2023-03-26|Peoria, AZ|Spring Training: Mariners at Padres|Spring Training: Seattle Mariners at San Diego Padres|Peoria Sports Complex|  3924|0.509|33.6321|-112.2330|San Diego Padres|Seattle Mariners|NA|NA|  49|  70|   397|MLB|MLB Baseball
mlb|5794580|06:05 pm|2023-03-17|Goodyear, AZ|Spring Training: Guardians at Reds|Spring Training: Cleveland Guardians at Cincinnati Reds|Goodyear Ballpark|  3943|0.460|33.4285|-112.3900|Cincinnati Reds|Cleveland Guardians|NA|NA|  23|  61|   397|MLB|MLB Baseball
mlb|5793859|01:05 pm|2023-03-03|West Palm Beach, FL|Spring Training: Braves at Astros|Spring Training: Atlanta Braves at Houston Astros|The Ballpark of the Palm Beaches|419759|0.531|26.7579| -80.1169|Houston Astros|Atlanta Braves|NA|NA|  35|  78|   136|MLB|MLB Baseball
mlb|5794252|06:05 pm|2023-03-24|Sarasota, FL|Spring Training: Yankees at Orioles|Spring Training: New York Yankees (Split Squad) at Baltimore Orioles|Ed Smith Stadium|  3923|0.588|27.3482| -82.5176|Baltimore Orioles|New York Yankees|NA|NA|  52|  93|  1268|MLB|MLB Baseball
mlb|5794176|01:05 pm|2023-03-17|Clearwater, FL|Spring Training: Blue Jays at Phillies|Spring Training: Toronto Blue Jays (Split Squad) at Philadelphia Phillies (Split Squad)|BayCare Ballpark|  3942|0.588|27.9709| -82.7317|Philadelphia Phillies|Toronto Blue Jays|NA|NA|  58| 114|   397|MLB|MLB Baseball
mlb|5788916|06:40 pm|2023-04-04|Kansas City, MO|Blue Jays at Royals|Toronto Blue Jays at Kansas City Royals|Kauffman Stadium|  3714|0.612|39.0515| -94.4803|Kansas City Royals|Toronto Blue Jays|NA|NA|  15|  57|  2499|MLB|MLB Baseball
mlb|5794702|01:05 pm|2023-03-15|Mesa, AZ|Spring Training: Mariners at Athletics|Spring Training: Seattle Mariners at Oakland Athletics|Hohokam Stadium|  3933|0.472|33.4386|-111.8300|Oakland Athletics|Seattle Mariners|NA|NA|  27|  80|   397|MLB|MLB Baseball
mlb|5788575|06:40 pm|2023-04-03|Cincinnati, OH|Cubs at Reds|Chicago Cubs at Cincinnati Reds|Great American Ball Park|    26|0.650|39.0974| -84.5071|Cincinnati Reds|Chicago Cubs|NA|NA|  24|  93|  2230|MLB|MLB Baseball
mlb|5919858|01:05 pm|2023-03-09|Saint Petersburg, FL|Spring Training: Toronto Blue Jays (Split Squad) at Tampa Bay Rays|Spring Training: Toronto Blue Jays (Split Squad) at Tampa Bay Rays|Tropicana Field|     4|0.408|27.7682| -82.6534|Tampa Bay Rays|NA|NA|NA|  17|  52|   117|MLB|MLB Baseball
mlb|5794246|01:05 pm|2023-03-13|Sarasota, FL|Spring Training: Tigers at Orioles|Spring Training: Detroit Tigers (Split Squad) at Baltimore Orioles (Split Squad)|Ed Smith Stadium|  3923|0.507|27.3482| -82.5176|Baltimore Orioles|Detroit Tigers|NA|NA|  37|  71|   397|MLB|MLB Baseball
mlb|5788257|06:10 pm|2023-04-08|Milwaukee, WI|Cardinals at Brewers|St. Louis Cardinals at Milwaukee Brewers|American Family Field|    15|0.688|43.0296| -87.9725|Milwaukee Brewers|St. Louis Cardinals|NA|NA|  38|  87| 13254|MLB|MLB Baseball
mlb|5786987|01:10 pm|2023-04-05|Chicago, IL|Giants at White Sox|San Francisco Giants at Chicago White Sox|Guaranteed Rate Field|  3715|0.610|41.8299| -87.6338|Chicago White Sox|San Francisco Giants|NA|NA|  10|  97| 12504|MLB|MLB Baseball
mlb|5794508|01:10 pm|2023-03-05|Phoenix, AZ|Spring Training: Mariners at Brewers|Spring Training: Seattle Mariners at Milwaukee Brewers|American Family Fields of Phoenix| 40909|0.470|33.4907|-112.1720|Milwaukee Brewers|Seattle Mariners|NA|NA|  28|  63|   293|MLB|MLB Baseball
mlb|5793828|01:05 pm|2023-03-24|Mesa, AZ|Spring Training: Rangers at Cubs|Spring Training: Texas Rangers at Chicago Cubs (Split Squad)|Sloan Park| 57343|0.586|33.4311|-111.8820|Chicago Cubs|Texas Rangers|NA|NA|  38|  93|   440|MLB|MLB Baseball
mlb|5787679|07:05 pm|2023-04-08|Baltimore, MD|Yankees at Orioles|New York Yankees at Baltimore Orioles|Oriole Park at Camden Yards|    25|0.721|39.2840| -76.6199|Baltimore Orioles|New York Yankees|NA|NA|  54| 124|  6380|MLB|MLB Baseball
mlb|5784962|01:05 pm|2023-04-05|Bronx, NY|Phillies at Yankees|Philadelphia Phillies at New York Yankees|Yankee Stadium|     8|0.720|40.8296| -73.9262|New York Yankees|Philadelphia Phillies|NA|NA|  12|  96|  6255|MLB|MLB Baseball
mlb|5794134|01:05 pm|2023-03-22|West Palm Beach, FL|Spring Training: Yankees at Nationals|Spring Training: New York Yankees at Washington Nationals|The Ballpark of the Palm Beaches|419759|0.556|26.7579| -80.1169|Washington Nationals|New York Yankees|NA|NA|  60| 160|   385|MLB|MLB Baseball
mlb|5794414|01:05 pm|2023-03-13|Fort Myers, FL|Spring Training: Yankees at Twins|Spring Training: New York Yankees at Minnesota Twins|Hammond Stadium|  3944|0.584|26.5378| -81.8420|Minnesota Twins|New York Yankees|NA|NA|  36| 102|   397|MLB|MLB Baseball
mlb|5788237|06:40 pm|2023-04-04|Milwaukee, WI|Mets at Brewers|New York Mets at Milwaukee Brewers|American Family Field|    15|0.609|43.0296| -87.9725|Milwaukee Brewers|New York Mets|NA|NA|  21|  64| 13254|MLB|MLB Baseball
mlb|5793896|01:10 pm|2023-03-08|Peoria, AZ|Spring Training: Reds at Padres|Spring Training: Cincinnati Reds at San Diego Padres|Peoria Sports Complex|  3924|0.467|33.6321|-112.2330|San Diego Padres|Cincinnati Reds|NA|NA|  24|  58|   397|MLB|MLB Baseball
mlb|5793924|01:05 pm|2023-03-11|Surprise, AZ|Spring Training: Reds at Rangers|Spring Training: Cincinnati Reds at Texas Rangers|Surprise Stadium|  3930|0.555|33.6269|-112.3770|Texas Rangers|Cincinnati Reds|NA|NA|  20|  62|   397|MLB|MLB Baseball
mlb|5785301|01:10 pm|2023-04-02|Houston, TX|White Sox at Astros|Chicago White Sox at Houston Astros|Minute Maid Park|    20|0.608|29.7562| -95.3557|Houston Astros|Chicago White Sox|NA|NA|  51| 137|  4282|MLB|MLB Baseball
mlb|5794676|01:10 pm|2023-03-22|Jupiter, FL|Spring Training: Cardinals at Marlins|Spring Training: St. Louis Cardinals at Miami Marlins|Roger Dean Stadium|  3927|0.527|26.8910| -80.1163|Miami Marlins|St. Louis Cardinals|NA|NA|  47| 107|   397|MLB|MLB Baseball
mlb|5793718|06:35 pm|2023-03-14|Tampa, FL|Spring Training: Blue Jays at Yankees|Spring Training: Toronto Blue Jays at New York Yankees |George M. Steinbrenner Field|  3937|0.583|27.9798| -82.5072|New York Yankees|Toronto Blue Jays|NA|NA|  56| 106|   726|MLB|MLB Baseball
mlb|5793754|01:05 pm|2023-03-19|Tampa, FL|Spring Training: Orioles at Yankees|Spring Training: Baltimore Orioles (Split Squad) at New York Yankees |George M. Steinbrenner Field|  3937|0.607|27.9798| -82.5072|New York Yankees|Baltimore Orioles|NA|NA|  50| 104|   717|MLB|MLB Baseball
mlb|5793952|06:40 pm|2023-03-15|Peoria, AZ|Spring Training: Guardians at Padres|Spring Training: Cleveland Guardians at San Diego Padres|Peoria Sports Complex|  3924|0.466|33.6321|-112.2330|San Diego Padres|Cleveland Guardians|NA|NA|  27|  60|  1292|MLB|MLB Baseball
mlb|5794384|01:10 pm|2023-03-19|Peoria, AZ|Spring Training: White Sox at Mariners|Spring Training: Chicago White Sox at Seattle Mariners (Split Squad)|Peoria Sports Complex|  3924|0.503|33.6321|-112.2330|Seattle Mariners|Chicago White Sox|NA|NA|  42|  80|   397|MLB|MLB Baseball
mlb|5793692|06:35 pm|2023-03-06|Tampa, FL|Spring Training: Pirates at Yankees|Spring Training: Pittsburgh Pirates at New York Yankees|George M. Steinbrenner Field|  3937|0.583|27.9798| -82.5072|New York Yankees|Pittsburgh Pirates|NA|NA|  22|  85| 12304|MLB|MLB Baseball
mlb|5794710|01:05 pm|2023-03-24|Mesa, AZ|Spring Training: White Sox at Athletics|Spring Training: Chicago White Sox at Oakland Athletics (Split Squad)|Hohokam Stadium|  3933|0.503|33.4386|-111.8300|Oakland Athletics|Chicago White Sox|NA|NA|  22|  69|   397|MLB|MLB Baseball
mlb|5794092|01:10 pm|2023-03-11|Tempe, AZ|Spring Training: Diamondbacks at Angels|Spring Training: Arizona Diamond Backs at Los Angeles Angels|Tempe Diablo Stadium|  3939|0.552|33.4009|-111.9700|Los Angeles Angels|Arizona Diamondbacks|NA|NA|  39|  75|   397|MLB|MLB Baseball
mlb|5794125|01:05 pm|2023-03-13|West Palm Beach, FL|Spring Training: Astros at Nationals|Spring Training: Houston Astros at Washington Nationals|The Ballpark of the Palm Beaches|419759|0.490|26.7579| -80.1169|Washington Nationals|Houston Astros|NA|NA|  40|  73|   397|MLB|MLB Baseball
mlb|5794258|01:10 pm|2023-03-18|Scottsdale, AZ|Spring Training: Guardians at Diamondbacks|Spring Training: Cleveland Guardians (Split Squad) at Arizona Diamondbacks|Salt River Fields at Talking Stick|  3931|0.582|33.5457|-111.8860|Arizona Diamondbacks|Cleveland Guardians|NA|NA|  37|  84|   397|MLB|MLB Baseball
mlb|5793702|01:05 pm|2023-03-08|Tampa, FL|Spring Training: Cardinals at Yankees|Spring Training: St. Louis Cardinals at New York Yankees|George M. Steinbrenner Field|  3937|0.606|27.9798| -82.5072|New York Yankees|St. Louis Cardinals|NA|NA|  63| 125|   836|MLB|MLB Baseball
mlb|5794220|01:05 pm|2023-03-04|Sarasota, FL|Spring Training: Braves at Orioles|Spring Training: Atlanta Braves (Split Squad) at Baltimore Orioles|Ed Smith Stadium|  3923|0.551|27.3482| -82.5176|Baltimore Orioles|Atlanta Braves|NA|NA|  39|  82|   173|MLB|MLB Baseball
mlb|5794402|01:10 pm|2023-03-27|Peoria, AZ|Spring Training: Padres at Mariners|Spring Training: San Diego Padres at Seattle Mariners|Peoria Sports Complex|  3924|0.463|33.6321|-112.2330|Seattle Mariners|San Diego Padres|NA|NA|  44|  66|   397|MLB|MLB Baseball
mlb|5886674|01:10 pm|2023-03-21|Tempe, AZ|Spring Training - Oakland Athletics at Los Angeles Angels (Split Squad)|Spring Training - Oakland Athletics at Los Angeles Angels (Split Squad)|Tempe Diablo Stadium|  3939|0.462|33.4009|-111.9700|Los Angeles Angels|NA|NA|NA|  17|  64|   720|MLB|MLB Baseball
mlb|5793682|01:05 pm|2023-03-04|North Port, FL|Spring Training: Twins at Braves|Spring Training: Minnesota Twins at Atlanta Braves (Split Squad)|CoolToday Park|462490|0.582|27.0328| -82.3200|Atlanta Braves|Minnesota Twins|NA|NA|  36|  96|   398|MLB|MLB Baseball
mlb|5787835|01:10 pm|2023-04-08|Minneapolis, MN|Astros at Twins|Houston Astros at Minnesota Twins|Target Field|  3712|0.658|44.9817| -93.2776|Minnesota Twins|Houston Astros|NA|NA|  16|  77|  1124|MLB|MLB Baseball
mlb|5794530|01:10 pm|2023-03-26|Phoenix, AZ|Spring Training: Diamondbacks at Brewers|Spring Training: Arizona Diamondbacks at Milwaukee Brewers|American Family Fields of Phoenix| 40909|0.462|33.4907|-112.1720|Milwaukee Brewers|Arizona Diamondbacks|NA|NA|  30|  68|   397|MLB|MLB Baseball
mlb|5794009|07:05 pm|2023-03-08|Scottsdale, AZ|Exhibition: United States at San Francisco Giants|Exhibition: United States at San Francisco Giants|Scottsdale Stadium|  3925|0.581|33.4893|-111.9210|San Francisco Giants|World Baseball Classic|NA|NA|  67| 137|   563|MLB|MLB Baseball
mlb|5794090|01:10 pm|2023-03-09|Tempe, AZ|Exhibition: United States at Los Angeles Angels|Exhibition: United States at Los Angeles Angels|Tempe Diablo Stadium|  3939|0.499|33.4009|-111.9700|Los Angeles Angels|World Baseball Classic|NA|NA|  27|  69|   397|MLB|MLB Baseball
mlb|5793932|01:05 pm|2023-03-17|Surprise, AZ|Spring Training: Brewers at Rangers|Spring Training: Milwaukee Brewers at Texas Rangers|Surprise Stadium|  3930|0.543|33.6269|-112.3770|Texas Rangers|Milwaukee Brewers|NA|NA|  24|  68|   397|MLB|MLB Baseball
mlb|5785321|07:10 pm|2023-04-04|Houston, TX|Tigers at Astros|Detroit Tigers at Houston Astros|Minute Maid Park|    20|0.580|29.7562| -95.3557|Houston Astros|Detroit Tigers|NA|NA|  32| 150|  4161|MLB|MLB Baseball
mlb|5793929|01:05 pm|2023-03-13|Surprise, AZ|Spring Training: Diamondbacks at Rangers|Spring Training: Arizona Diamondbacks at Texas Rangers|Surprise Stadium|  3930|0.522|33.6269|-112.3770|Texas Rangers|Arizona Diamondbacks|NA|NA|  25|  61|   397|MLB|MLB Baseball
mlb|5785762|01:10 pm|2023-03-30|San Diego, CA|Rockies at Padres - Opening Day|Colorado Rockies at San Diego Padres - Opening Day|Petco Park|    24|0.498|32.7076|-117.1570|San Diego Padres|Colorado Rockies|MLB Opening Day|NA| 146| 365|  2315|MLB|MLB Baseball
mlb|5794704|01:05 pm|2023-03-17|Mesa, AZ|Spring Training: Giants at Athletics|Spring Training: San Francisco Giants at Oakland Athletics|Hohokam Stadium|  3933|0.549|33.4386|-111.8300|Oakland Athletics|San Francisco Giants|NA|NA|  60|  96|   397|MLB|MLB Baseball
mlb|5795714|01:10 pm|2023-03-09|Port St. Lucie, FL|Spring Training: Venezuela at New York Mets|Spring Training: Venezuela at New York Mets|Clover Park|  3926|0.486|27.3248| -80.4048|New York Mets|NA|NA|NA|  35|  61|   397|MLB|MLB Baseball
mlb|5794714|03:30 am|2023-03-26|Oakland, CA|Spring Training: Giants at Athletics|Spring Training: San Francisco Giants at Oakland Athletics|RingCentral Coliseum|    14|0.578|37.7514|-122.2010|Oakland Athletics|San Francisco Giants|NA|NA|  36|  81|   541|MLB|MLB Baseball
mlb|5793824|01:05 pm|2023-03-23|Mesa, AZ|Spring Training: Diamondbacks at Cubs|Spring Training: Arizona Diamondbacks (Split Squad) at Chicago Cubs|Sloan Park| 57343|0.578|33.4311|-111.8820|Chicago Cubs|Arizona Diamondbacks|NA|NA|  33|  89|   397|MLB|MLB Baseball
mlb|5786318|06:07 pm|2023-04-08|Anaheim, CA|Blue Jays at Angels|Toronto Blue Jays at Los Angeles Angels|Angel Stadium of Anaheim|    28|0.682|33.8003|-117.8830|Los Angeles Angels|Toronto Blue Jays|NA|NA|  31|  69|  3447|MLB|MLB Baseball
mlb|5794682|01:10 pm|2023-03-26|Jupiter, FL|Spring Training: Nationals at Marlins|Spring Training: Washington Nationals at Miami Marlins (Split Squad)|Roger Dean Stadium|  3927|0.496|26.8910| -80.1163|Miami Marlins|Washington Nationals|NA|NA|  19|  67|   397|MLB|MLB Baseball
mlb|5793786|01:05 pm|2023-03-02|Mesa, AZ|Spring Training: Athletics at Cubs|Spring Training: Oakland Athletics at Chicago Cubs|Sloan Park| 57343|0.578|33.4311|-111.8820|Chicago Cubs|Oakland Athletics|NA|NA|  12|  41|   311|MLB|MLB Baseball
mlb|5799407|01:05 pm|2023-03-22|Phoenix, AZ|Spring Training: Royals at White Sox|Spring Training: Kansas City Royals at Chicago White Sox (Split Squad)|Camelback Ranch|   395|0.455|33.5132|-112.2950|Chicago White Sox|Kansas City Royals|NA|NA|  13|  74|   397|MLB|MLB Baseball
mlb|5794594|01:05 pm|2023-03-02|Surprise, AZ|Spring Training: Angels at Royals|Spring Training: Los Angeles Angels at Kansas City Royals|Surprise Stadium|  3930|0.484|33.6269|-112.3770|Kansas City Royals|Los Angeles Angels|NA|NA|   9|  57|   333|MLB|MLB Baseball
mlb|5794570|01:05 pm|2023-03-12|Goodyear, AZ|Spring Training: Dodgers at Reds|Spring Training: Los Angeles Dodgers at Cincinnati Reds|Goodyear Ballpark|  3943|0.494|33.4285|-112.3900|Cincinnati Reds|Los Angeles Dodgers|NA|NA|  24|  76|   397|MLB|MLB Baseball
mlb|5794058|01:10 pm|2023-03-03|Tempe, AZ|Spring Training: Dodgers at Angels|Spring Training: Los Angeles Dodgers at Los Angeles Angels|Tempe Diablo Stadium|  3939|0.577|33.4009|-111.9700|Los Angeles Angels|Los Angeles Dodgers|NA|NA|  41|  93|   159|MLB|MLB Baseball
mlb|5786169|06:45 pm|2023-04-10|San Francisco, CA|Dodgers at Giants|Los Angeles Dodgers at San Francisco Giants|Oracle Park|    22|0.764|37.7786|-122.3890|San Francisco Giants|Los Angeles Dodgers|NA|NA|  41| 165|  1319|MLB|MLB Baseball
mlb|5794052|01:05 pm|2023-03-21|Jupiter, FL|Spring Training: Nationals at Cardinals|Spring Training: Washington Nationals at St. Louis Cardinals|Roger Dean Stadium|  3927|0.548|26.8910| -80.1163|St. Louis Cardinals|Washington Nationals|NA|NA|  41|  74|   397|MLB|MLB Baseball
mlb|5794700|01:05 pm|2023-03-12|Mesa, AZ|Spring Training: Padres at Athletics|Spring Training: San Diego Padres at Oakland Athletics (Split Squad)|Hohokam Stadium|  3933|0.493|33.4386|-111.8300|Oakland Athletics|San Diego Padres|NA|NA|  35| 102|   180|MLB|MLB Baseball
mlb|5794270|06:40 pm|2023-03-27|Phoenix, AZ|Spring Training: Guardians at Diamondbacks|Spring Training: Cleveland Guardians at Arizona Diamondbacks|Chase Field|    30|0.547|33.4453|-112.0670|Arizona Diamondbacks|Cleveland Guardians|NA|NA|  25|  58|   825|MLB|MLB Baseball
mlb|5794474|01:05 pm|2023-03-26|Lakeland, FL|Spring Training: Rays at Tigers|Spring Training: Tampa Bay Rays at Detroit Tigers|Publix Field at Joker Marchant Stadium|  3929|0.576|28.0745| -81.9510|Detroit Tigers|Tampa Bay Rays|NA|NA|  37|  89|   397|MLB|MLB Baseball
mlb|5794622|01:07 pm|2023-03-09|Dunedin, FL|Spring Training: Braves at Blue Jays|Spring Training: Atlanta Braves (Split Squad) at Toronto Blue Jays (Split Squad)|TD Ballpark|  3936|0.492|28.0036| -82.7868|Toronto Blue Jays|Atlanta Braves|NA|NA|  34|  63|   397|MLB|MLB Baseball
