league|id|time|date|city|title|full|venue|ven_id|score|lat|long|t1|t2|t3|t4|low|med|high|name|xname
mlb|5794224|01:05 pm|2023-03-06|Sarasota, FL|Spring Training: Phillies at Orioles|Spring Training: Philadelphia Phillies at Baltimore Orioles|Ed Smith Stadium|  3923|0.527|27.3482| -82.5176|Baltimore Orioles|Philadelphia Phillies|NA|NA|  48|  80|   397|MLB|MLB Baseball
mlb|5794270|06:40 pm|2023-03-27|Phoenix, AZ|Spring Training: Guardians at Diamondbacks|Spring Training: Cleveland Guardians at Arizona Diamondbacks|Chase Field|    30|0.540|33.4453|-112.0670|Arizona Diamondbacks|Cleveland Guardians|NA|NA|  23|  47|   202|MLB|MLB Baseball
mlb|5794688|01:05 pm|2023-02-28|Mesa, AZ|Spring Training: Angels at Athletics|Spring Training: Los Angeles Angels at Oakland Athletics|Hohokam Stadium|  3933|0.447|33.4386|-111.8300|Oakland Athletics|Los Angeles Angels|NA|NA|  15|  63|   397|MLB|MLB Baseball
mlb|5794298|01:05 pm|2023-03-06|Saint Petersburg, FL|Spring Training: Marlins at Rays|Spring Training: Miami Marlins at Tampa Bay Rays|Tropicana Field|     4|0.460|27.7682| -82.6534|Tampa Bay Rays|Miami Marlins|NA|NA|  17|  50|   117|MLB|MLB Baseball
mlb|5794205|01:05 pm|2023-02-27|Sarasota, FL|Spring Training: Rays at Orioles|Spring Training: Tampa Bay Rays at Baltimore Orioles|Ed Smith Stadium|  3923|0.499|27.3482| -82.5176|Baltimore Orioles|Tampa Bay Rays|NA|NA|  43|  68|   397|MLB|MLB Baseball
mlb|5784895|06:10 pm|2023-04-01|Los Angeles, CA|Diamondbacks at Dodgers|Arizona Diamondbacks at Los Angeles Dodgers|Dodger Stadium|     1|0.738|34.0718|-118.2460|Los Angeles Dodgers|Arizona Diamondbacks|NA|NA|  81| 274|  2312|MLB|MLB Baseball
mlb|5793819|01:05 pm|2023-02-25|West Palm Beach, FL|Spring Training: Mets at Astros|Spring Training: New York Mets (Split Squad) at Houston Astros|The Ballpark of the Palm Beaches|419759|0.539|26.7579| -80.1169|Houston Astros|New York Mets|NA|NA|  38|  95|   392|MLB|MLB Baseball
mlb|5789204|06:40 pm|2023-03-31|Miami, FL|Mets at Marlins|New York Mets at Miami Marlins|loanDepot park|  6371|0.534|25.7617| -80.1918|Miami Marlins|New York Mets|NA|NA|  27|  73|  1124|MLB|MLB Baseball
mlb|5794136|06:05 pm|2023-03-24|West Palm Beach, FL|Spring Training: Cardinals at Nationals|Spring Training: St. Louis Cardinals at Washington Nationals|The Ballpark of the Palm Beaches|419759|0.547|26.7579| -80.1169|Washington Nationals|St. Louis Cardinals|NA|NA|  42|  76|   380|MLB|MLB Baseball
mlb|5794479|01:05 pm|2023-02-26|Goodyear, AZ|Spring Training: Rangers at Guardians|Spring Training: Texas Rangers at Cleveland Guardians|Goodyear Ballpark|  3943|0.471|33.4285|-112.3900|Cleveland Guardians|Texas Rangers|NA|NA|  23|  41|   397|MLB|MLB Baseball
mlb|5794152|01:05 pm|2023-02-28|Clearwater, FL|Spring Training: Blue Jays at Phillies|Spring Training: Toronto Blue Jays (Split Squad) at Philadelphia Phillies|BayCare Ballpark|  3942|0.533|27.9709| -82.7317|Philadelphia Phillies|Toronto Blue Jays|NA|NA|  36|  77|   397|MLB|MLB Baseball
mlb|5794306|01:05 pm|2023-03-14|Saint Petersburg, FL|Spring Training: Twins at Rays|Spring Training: Minnesota Twins (Split Squad) at Tampa Bay Rays|Tropicana Field|     4|0.459|27.7682| -82.6534|Tampa Bay Rays|Minnesota Twins|NA|NA|  17|  34|   111|MLB|MLB Baseball
mlb|5794562|01:05 pm|2023-03-06|Goodyear, AZ|Spring Training: Rockies at Reds|Spring Training: Colorado Rockies (Split Squad) at Cincinnati Reds|Goodyear Ballpark|  3943|0.427|33.4285|-112.3900|Cincinnati Reds|Colorado Rockies|NA|NA|  23|  40|   380|MLB|MLB Baseball
mlb|5799406|01:05 pm|2023-03-14|Bradenton, FL|Spring Training: Orioles at Pirates|Spring Training: Baltimore Orioles (Split Squad) at Pittsburgh Pirates (Double Header)|LECOM Park|  3941|0.506|27.4846| -82.5713|Pittsburgh Pirates|Baltimore Orioles|NA|NA|  22|  58|   605|MLB|MLB Baseball
mlb|5793778|01:05 pm|2023-02-27|Mesa, AZ|Spring Training: Guardians at Cubs|Spring Training: Cleveland Guardians at Chicago Cubs (Split Squad)|Sloan Park| 57343|0.553|33.4311|-111.8820|Chicago Cubs|Cleveland Guardians|NA|NA|  20|  58|   399|MLB|MLB Baseball
mlb|5794444|01:05 pm|2023-02-25|Lakeland, FL|Spring Training: Phillies at Tigers|Spring Training: Philadelphia Phillies (Split Squad) at Detroit Tigers|Publix Field at Joker Marchant Stadium|  3929|0.586|28.0745| -81.9510|Detroit Tigers|Philadelphia Phillies|NA|NA|  23|  52|   610|MLB|MLB Baseball
mlb|5794160|01:05 pm|2023-03-07|Clearwater, FL|Spring Training: Rays at Phillies|Spring Training: Tampa Bay Rays at Philadelphia Phillies|BayCare Ballpark|  3942|0.545|27.9709| -82.7317|Philadelphia Phillies|Tampa Bay Rays|NA|NA|  36|  82|   397|MLB|MLB Baseball
mlb|5794353|01:10 pm|2023-02-25|Peoria, AZ|Spring Training: Angels at Mariners|Spring Training: Los Angeles Angels at Seattle Mariners|Peoria Sports Complex|  3924|0.523|33.6321|-112.2330|Seattle Mariners|Los Angeles Angels|NA|NA|  44|  75|   237|MLB|MLB Baseball
mlb|5794490|01:05 pm|2023-03-16|Goodyear, AZ|Spring Training: White Sox at Guardians|Spring Training: Chicago White Sox at Cleveland Guardians|Goodyear Ballpark|  3943|0.423|33.4285|-112.3900|Cleveland Guardians|Chicago White Sox|NA|NA|  37|  54|   107|MLB|MLB Baseball
mlb|5793896|01:10 pm|2023-03-08|Peoria, AZ|Spring Training: Reds at Padres|Spring Training: Cincinnati Reds at San Diego Padres|Peoria Sports Complex|  3924|0.467|33.6321|-112.2330|San Diego Padres|Cincinnati Reds|NA|NA|  34|  56|   397|MLB|MLB Baseball
mlb|5793870|01:10 pm|2023-02-24|Peoria, AZ|Spring Training: Mariners at Padres|Spring Training: Seattle Mariners at San Diego Padres|Peoria Sports Complex|  3924|0.505|33.6321|-112.2330|San Diego Padres|Seattle Mariners|NA|NA|  45|  57|   278|MLB|MLB Baseball
mlb|5794174|01:05 pm|2023-03-12|Clearwater, FL|Spring Training: Blue Jays at Phillies|Spring Training: Toronto Blue Jays at Philadelphia Phillies|BayCare Ballpark|  3942|0.585|27.9709| -82.7317|Philadelphia Phillies|Toronto Blue Jays|NA|NA|  41|  89|   397|MLB|MLB Baseball
mlb|5794088|01:10 pm|2023-03-08|Tempe, AZ|Spring Training: Rockies at Angels|Spring Training: Colorado Rockies at Los Angeles Angels|Tempe Diablo Stadium|  3939|0.496|33.4009|-111.9700|Los Angeles Angels|Colorado Rockies|NA|NA|  17|  73|   397|MLB|MLB Baseball
mlb|5793946|06:05 pm|2023-03-23|Surprise, AZ|Spring Training: Athletics at Rangers|Spring Training: Oakland Athletics at Texas Rangers|Surprise Stadium|  3930|0.517|33.6269|-112.3770|Texas Rangers|Oakland Athletics|NA|NA|  20|  54|   380|MLB|MLB Baseball
mlb|5794209|01:05 pm|2023-03-01|Sarasota, FL|Spring Training: Blue Jays at Orioles|Spring Training: Toronto Blue Jays at Baltimore Orioles|Ed Smith Stadium|  3923|0.495|27.3482| -82.5176|Baltimore Orioles|Toronto Blue Jays|NA|NA|  24|  67|   380|MLB|MLB Baseball
mlb|5793917|01:05 pm|2023-03-14|West Palm Beach, FL|Spring Training: Cardinals at Astros|Spring Training: St. Louis Cardinals at Houston Astros (Split Squad)|The Ballpark of the Palm Beaches|419759|0.510|26.7579| -80.1169|Houston Astros|St. Louis Cardinals|NA|NA|  38|  78|   397|MLB|MLB Baseball
mlb|5789682|01:20 pm|2023-04-02|Chicago, IL|Brewers at Cubs|Milwaukee Brewers at Chicago Cubs|Wrigley Field|    11|0.670|41.9475| -87.6562|Chicago Cubs|Milwaukee Brewers|NA|NA|  31| 109|  1624|MLB|MLB Baseball
mlb|5908532|01:10 pm|2023-03-18|Las Vegas, NV|Spring Training: Royals at Rockies|Spring Training: Kansas City Royals at Colorado Rockies|Las Vegas Ballpark|458949|0.544|36.1528|-115.3300|Colorado Rockies|Kansas City Royals|NA|NA|  36|  82|   503|MLB|MLB Baseball
mlb|5794150|01:05 pm|2023-03-03|Phoenix, AZ|Spring Training: Reds at White Sox|Spring Training: Cincinnati Reds at Chicago White Sox|Camelback Ranch|   395|0.495|33.5132|-112.2950|Chicago White Sox|Cincinnati Reds|NA|NA|  19|  78|   587|MLB|MLB Baseball
mlb|5793942|01:05 pm|2023-03-22|Surprise, AZ|Spring Training: White Sox at Rangers|Spring Training: Chicago White Sox (Split Squad) at Texas Rangers (Split Squad)|Surprise Stadium|  3930|0.495|33.6269|-112.3770|Texas Rangers|Chicago White Sox|NA|NA|  15|  50|   380|MLB|MLB Baseball
mlb|5794014|01:10 pm|2023-02-27|Tempe, AZ|Spring Training: Giants at Angels|Spring Training: San Fransisco Giants at Los Angeles Angels|Tempe Diablo Stadium|  3939|0.540|33.4009|-111.9700|Los Angeles Angels|San Francisco Giants|NA|NA|  21|  73|   397|MLB|MLB Baseball
mlb|5793798|01:05 pm|2023-03-06|Phoenix, AZ|Spring Training: Padres at Dodgers|Spring Training: San Diego Padres at Los Angeles Dodgers|Camelback Ranch|   395|0.536|33.5132|-112.2950|Los Angeles Dodgers|San Diego Padres|NA|NA|  31| 103|   505|MLB|MLB Baseball
mlb|5794486|01:10 pm|2023-02-25|Phoenix, AZ|Spring Training: Dodgers at Brewers|Spring Training: Los Angeles Dodgers at Milwaukee Brewers|American Family Fields of Phoenix| 40909|0.515|33.4907|-112.1720|Milwaukee Brewers|Los Angeles Dodgers|NA|NA|  34|  66|   271|MLB|MLB Baseball
mlb|5794556|01:05 pm|2023-03-01|Goodyear, AZ|Spring Training: Athletics at Reds|Spring Training: Oakland Athletics at Cincinnati Reds|Goodyear Ballpark|  3943|0.417|33.4285|-112.3900|Cincinnati Reds|Oakland Athletics|NA|NA|  13|  40|   397|MLB|MLB Baseball
mlb|5794238|01:10 pm|2023-03-07|Scottsdale, AZ|Spring Training: Athletics at Diamondbacks|Spring Training: Oakland Athletics at Arizona Diamondbacks|Salt River Fields at Talking Stick|  3931|0.528|33.5457|-111.8860|Arizona Diamondbacks|Oakland Athletics|NA|NA|  19|  64|   397|MLB|MLB Baseball
mlb|5794046|01:05 pm|2023-03-20|Jupiter, FL|Spring Training: Marlins at Cardinals|Spring Training: Miami Marlins at St. Louis Cardinals|Roger Dean Stadium|  3927|0.535|26.8910| -80.1163|St. Louis Cardinals|Miami Marlins|NA|NA|  34|  65|   397|MLB|MLB Baseball
mlb|5793704|01:05 pm|2023-03-09|Tampa, FL|Spring Training: Red Sox at Yankees|Spring Training: Boston Red Sox at New York Yankees|George M. Steinbrenner Field|  3937|0.628|27.9798| -82.5072|New York Yankees|Boston Red Sox|NA|NA|  72| 143|   922|MLB|MLB Baseball
mlb|5794619|01:07 pm|2023-03-05|Dunedin, FL|Spring Training: Phillies at Blue Jays|Spring Training: Philadelphia Phillies at Toronto Blue Jays|TD Ballpark|  3936|0.520|28.0036| -82.7868|Toronto Blue Jays|Philadelphia Phillies|NA|NA|  33|  70|   397|MLB|MLB Baseball
mlb|5794255|06:40 pm|2023-03-15|Scottsdale, AZ|Spring Training: Brewers at Diamondbacks|Spring Training: Milwaukee Brewers at Arizona Diamondbacks (Split Squad) (Double Header)|Salt River Fields at Talking Stick|  3931|0.541|33.5457|-111.8860|Arizona Diamondbacks|Milwaukee Brewers|NA|NA|  20|  78|   397|MLB|MLB Baseball
mlb|5794624|01:07 pm|2023-03-11|Dunedin, FL|Spring Training: Orioles at Blue Jays|Spring Training: Baltimore Orioles at Toronto Blue Jays|TD Ballpark|  3936|0.508|28.0036| -82.7868|Toronto Blue Jays|Baltimore Orioles|NA|NA|  38|  75|   397|MLB|MLB Baseball
mlb|5793848|01:05 pm|2023-03-26|Mesa, AZ|Spring Training: Royals at Cubs|Spring Training: Kansas City Royals at Chicago Cubs|Sloan Park| 57343|0.589|33.4311|-111.8820|Chicago Cubs|Kansas City Royals|NA|NA|  36|  95|   397|MLB|MLB Baseball
mlb|5793784|01:05 pm|2023-02-28|Phoenix, AZ|Spring Training: Reds at Dodgers|Spring Training: Cincinnati Reds at Los Angeles Dodgers|Camelback Ranch|   395|0.520|33.5132|-112.2950|Los Angeles Dodgers|Cincinnati Reds|NA|NA|  15|  59|   397|MLB|MLB Baseball
mlb|5794370|01:10 pm|2023-03-09|Peoria, AZ|Exhibition: Canada at Seattle Mariners|Exhibition: Canada at Seattle Mariners|Peoria Sports Complex|  3924|0.431|33.6321|-112.2330|Seattle Mariners|NA|NA|NA|  33|  52|   380|MLB|MLB Baseball
mlb|5794196|01:05 pm|2023-03-23|Phoenix, AZ|Spring Training: Giants at White Sox|Spring Training: San Francisco Giants (Split Squad) at Chicago White Sox|Camelback Ranch|   395|0.505|33.5132|-112.2950|Chicago White Sox|San Francisco Giants|NA|NA|  23|  69|   397|MLB|MLB Baseball
mlb|5794180|01:05 pm|2023-03-14|Clearwater, FL|Spring Training: Braves at Phillies|Spring Training: Atlanta Braves at Philadelphia Phillies|BayCare Ballpark|  3942|0.555|27.9709| -82.7317|Philadelphia Phillies|Atlanta Braves|NA|NA|  41| 117|   397|MLB|MLB Baseball
mlb|5794640|01:07 pm|2023-03-27|Dunedin, FL|Spring Training: Phillies at Blue Jays|Spring Training: Philadelphia Phillies at Toronto Blue Jays|TD Ballpark|  3936|0.493|28.0036| -82.7868|Toronto Blue Jays|Philadelphia Phillies|NA|NA|  33|  65|   397|MLB|MLB Baseball
mlb|5786739|01:10 pm|2023-04-02|Seattle, WA|Guardians at Mariners|Cleveland Guardians at Seattle Mariners|T-Mobile Park|    13|0.605|47.5914|-122.3330|Seattle Mariners|Cleveland Guardians|NA|NA|  19| 117|  1374|MLB|MLB Baseball
mlb|5794654|06:10 pm|2023-03-11|Jupiter, FL|Spring Training: Rays at Marlins|Spring Training: Tampa Bay Rays at Miami Marlins|Roger Dean Stadium|  3927|0.513|26.8910| -80.1163|Miami Marlins|Tampa Bay Rays|NA|NA|  34|  83|   397|MLB|MLB Baseball
mlb|5793718|06:35 pm|2023-03-14|Tampa, FL|Spring Training: Blue Jays at Yankees|Spring Training: Toronto Blue Jays at New York Yankees |George M. Steinbrenner Field|  3937|0.575|27.9798| -82.5072|New York Yankees|Toronto Blue Jays|NA|NA|  54|  89|   784|MLB|MLB Baseball
mlb|5908531|01:10 pm|2023-03-19|Las Vegas, NV|Spring Training: Rockies at Royals|Spring Training: Colorado Rockies at Kansas City Royals|Las Vegas Ballpark|458949|0.492|36.1528|-115.3300|Kansas City Royals|Colorado Rockies|NA|NA|  36|  79|   511|MLB|MLB Baseball
mlb|5794156|01:05 pm|2023-03-04|Phoenix, AZ|Spring Training: Rangers at White Sox|Spring Training: Texas Rangers at Chicago White Sox|Camelback Ranch|   395|0.518|33.5132|-112.2950|Chicago White Sox|Texas Rangers|NA|NA|  22|  82|   615|MLB|MLB Baseball
mlb|5794684|01:05 pm|2023-02-25|Mesa, AZ|Spring Training: Diamondbacks at Athletics|Spring Training: Arizona Diamondbacks (Split Squad) at Oakland Athletics|Hohokam Stadium|  3933|0.494|33.4386|-111.8300|Oakland Athletics|Arizona Diamondbacks|NA|NA|  16|  73|   303|MLB|MLB Baseball
mlb|5794362|01:10 pm|2023-03-02|Peoria, AZ|Spring Training: Padres at Mariners|Spring Training: San Diego Padres at Seattle Mariners|Peoria Sports Complex|  3924|0.459|33.6321|-112.2330|Seattle Mariners|San Diego Padres|NA|NA|  38|  66|   397|MLB|MLB Baseball
mlb|5793861|01:05 pm|2023-03-24|Phoenix, AZ|Spring Training: Brewers at Dodgers|Spring Training: Milwaukee Brewers (Split Squad) at Los Angeles Dodgers|Camelback Ranch|   395|0.561|33.5132|-112.2950|Los Angeles Dodgers|Milwaukee Brewers|NA|NA|  33|  88|   397|MLB|MLB Baseball
mlb|5793859|01:05 pm|2023-03-03|West Palm Beach, FL|Spring Training: Braves at Astros|Spring Training: Atlanta Braves at Houston Astros|The Ballpark of the Palm Beaches|419759|0.524|26.7579| -80.1169|Houston Astros|Atlanta Braves|NA|NA|  36|  77|   397|MLB|MLB Baseball
mlb|5793722|01:05 pm|2023-03-06|Fort Myers, FL|Spring Training: Tigers at Red Sox|Spring Training: Detroit Tigers at Boston Red Sox|JetBlue Park|  6992|0.595|26.5487| -81.7612|Boston Red Sox|Detroit Tigers|NA|NA|  31|  88|   614|MLB|MLB Baseball
mlb|5794113|01:05 pm|2023-02-28|West Palm Beach, FL|Spring Training: Cardinals at Nationals|Spring Training: St. Louis Cardinals at Washington Nationals|The Ballpark of the Palm Beaches|419759|0.491|26.7579| -80.1169|Washington Nationals|St. Louis Cardinals|NA|NA|  19|  55|   397|MLB|MLB Baseball
mlb|5789072|07:07 pm|2023-03-30|Oakland, CA|Angels at Athletics - Opening Day|Los Angeles Angels at Oakland Athletics - Opening Day|RingCentral Coliseum|    14|0.542|37.7514|-122.2010|Oakland Athletics|Los Angeles Angels|MLB Opening Day|NA|  24|  94| 12504|MLB|MLB Baseball
mlb|5794158|01:05 pm|2023-03-04|Clearwater, FL|Spring Training: Pirates at Phillies|Spring Training: Pittsburgh Pirates at Philadelphia Phillies|BayCare Ballpark|  3942|0.594|27.9709| -82.7317|Philadelphia Phillies|Pittsburgh Pirates|NA|NA|  41|  87|   397|MLB|MLB Baseball
mlb|5794706|01:05 pm|2023-03-22|Mesa, AZ|Spring Training: Cubs at Athletics|Spring Training: Chicago Cubs at Oakland Athletics|Hohokam Stadium|  3933|0.510|33.4386|-111.8300|Oakland Athletics|Chicago Cubs|NA|NA|  36|  99|   397|MLB|MLB Baseball
mlb|5794578|01:05 pm|2023-03-15|Goodyear, AZ|Spring Training: Cubs at Reds|Spring Training: Chicago Cubs at Cincinnati Reds|Goodyear Ballpark|  3943|0.477|33.4285|-112.3900|Cincinnati Reds|Chicago Cubs|NA|NA|  20|  60|   397|MLB|MLB Baseball
mlb|5794686|01:05 pm|2023-02-27|Mesa, AZ|Spring Training: Rockies at Athletics|Spring Training: Colorado Rockies at Oakland Athletics|Hohokam Stadium|  3933|0.467|33.4386|-111.8300|Oakland Athletics|Colorado Rockies|NA|NA|  13|  66|   397|MLB|MLB Baseball
mlb|5794172|01:05 pm|2023-03-14|Phoenix, AZ|Spring Training: Athletics at White Sox|Spring Training: Oakland Athletics at Chicago White Sox|Camelback Ranch|   395|0.467|33.5132|-112.2950|Chicago White Sox|Oakland Athletics|NA|NA|  22|  63|   397|MLB|MLB Baseball
mlb|5799407|01:05 pm|2023-03-22|Phoenix, AZ|Spring Training: Royals at White Sox|Spring Training: Kansas City Royals at Chicago White Sox (Split Squad)|Camelback Ranch|   395|0.440|33.5132|-112.2950|Chicago White Sox|Kansas City Royals|NA|NA|  13|  69|   397|MLB|MLB Baseball
mlb|5794294|01:05 pm|2023-03-02|Saint Petersburg, FL|Spring Training: Twins at Rays|Spring Training: Minnesota Twins at Tampa Bay Rays|Tropicana Field|     4|0.478|27.7682| -82.6534|Tampa Bay Rays|Minnesota Twins|NA|NA|  17|  50|   117|MLB|MLB Baseball
mlb|5793885|01:05 pm|2023-02-28|Surprise, AZ|Spring Training: Rockies at Rangers|Spring Training: Colorado Rockies at Texas Rangers|Surprise Stadium|  3930|0.476|33.6269|-112.3770|Texas Rangers|Colorado Rockies|NA|NA|  12|  52|   397|MLB|MLB Baseball
mlb|5794308|01:05 pm|2023-03-16|Saint Petersburg, FL|Spring Training: Braves at Rays|Spring Training: Atlanta Braves at Tampa Bay Rays (Split Squad)|Tropicana Field|     4|0.479|27.7682| -82.6534|Tampa Bay Rays|Atlanta Braves|NA|NA|  17|  45|   117|MLB|MLB Baseball
mlb|5794348|01:05 pm|2023-03-21|Bradenton, FL|Spring Training: Phillies at Pirates|Spring Training: Philadelphia Phillies at Pittsburgh Pirates|LECOM Park|  3941|0.514|27.4846| -82.5713|Pittsburgh Pirates|Philadelphia Phillies|NA|NA|  34|  71|   475|MLB|MLB Baseball
mlb|5794424|01:05 pm|2023-03-16|Fort Myers, FL|Spring Training: Rays at Twins|Spring Training: Tampa Bay Rays (Split Squad) at Minnesota Twins|Hammond Stadium|  3944|0.529|26.5378| -81.8420|Minnesota Twins|Tampa Bay Rays|NA|NA|  33|  53|   397|MLB|MLB Baseball
mlb|5794652|06:40 pm|2023-03-08|Jupiter, FL|Exhibition: Israel at Miami Marlins|Exhibition: Israel at Miami Marlins|Roger Dean Stadium|  3927|0.446|26.8910| -80.1163|Miami Marlins|World Baseball Classic|NA|NA|  21|  42|   397|MLB|MLB Baseball
mlb|5794710|01:05 pm|2023-03-24|Mesa, AZ|Spring Training: White Sox at Athletics|Spring Training: Chicago White Sox at Oakland Athletics (Split Squad)|Hohokam Stadium|  3933|0.495|33.4386|-111.8300|Oakland Athletics|Chicago White Sox|NA|NA|  22|  63|   397|MLB|MLB Baseball
mlb|5794646|01:10 pm|2023-03-01|Jupiter, FL|Spring Training: Mets at Marlins|Spring Training: New York Mets at Miami Marlins|Roger Dean Stadium|  3927|0.484|26.8910| -80.1163|Miami Marlins|New York Mets|NA|NA|  32|  76|   397|MLB|MLB Baseball
mlb|5794102|01:10 pm|2023-03-24|Tempe, AZ|Spring Training: Padres at Angels|Spring Training: San Diego Padres at Los Angeles Angels|Tempe Diablo Stadium|  3939|0.541|33.4009|-111.9700|Los Angeles Angels|San Diego Padres|NA|NA|  33|  80|   397|MLB|MLB Baseball
mlb|5794016|01:05 pm|2023-03-09|Jupiter, FL|Exhibition: WBC (Split Squad) at St. Louis Cardinals|Exhibition: WBC (Split Squad) at St. Louis Cardinals|Roger Dean Stadium|  3927|0.486|26.8910| -80.1163|St. Louis Cardinals|NA|NA|NA|  13|  38|   380|MLB|MLB Baseball
mlb|5793782|01:05 pm|2023-03-01|Mesa, AZ|Spring Training: Mariners at Cubs|Spring Training: Seattle Mariners at Chicago Cubs|Sloan Park| 57343|0.556|33.4311|-111.8820|Chicago Cubs|Seattle Mariners|NA|NA|  23|  65|   850|MLB|MLB Baseball
mlb|5789196|04:10 pm|2023-03-30|Miami, FL|Mets at Marlins|New York Mets at Miami Marlins|loanDepot park|  6371|0.529|25.7617| -80.1918|Miami Marlins|New York Mets|NA|NA|  46| 140|  1079|MLB|MLB Baseball
mlb|5794402|01:10 pm|2023-03-27|Peoria, AZ|Spring Training: Padres at Mariners|Spring Training: San Diego Padres at Seattle Mariners|Peoria Sports Complex|  3924|0.456|33.6321|-112.2330|Seattle Mariners|San Diego Padres|NA|NA|  31|  57|   380|MLB|MLB Baseball
mlb|5793866|06:10 pm|2023-03-08|Port St. Lucie, FL|Exhibition: Nicaragua at New York Mets|Exhibition: Nicaragua at New York Mets|Clover Park|  3926|0.484|27.3248| -80.4048|New York Mets|World Baseball Classic|NA|NA|  16|  45|   397|MLB|MLB Baseball
mlb|5793672|01:05 pm|2023-03-01|North Port, FL|Spring Training: Rays at Braves|Spring Training: Tampa Bay Rays at Atlanta Braves|CoolToday Park|462490|0.521|27.0328| -82.3200|Atlanta Braves|Tampa Bay Rays|NA|NA|  33|  93|   429|MLB|MLB Baseball
mlb|5794036|01:10 pm|2023-03-16|Scottsdale, AZ|Spring Training: Padres at Rockies|Spring Training: San Diego Padres at Colorado Rockies|Salt River Fields at Talking Stick|  3931|0.500|33.5457|-111.8860|Colorado Rockies|San Diego Padres|NA|NA|  26|  85|   397|MLB|MLB Baseball
mlb|5794226|01:05 pm|2023-03-26|Sarasota, FL|Spring Training: Phillies at Orioles|Spring Training: Philadelphia Phillies at Baltimore Orioles|Ed Smith Stadium|  3923|0.538|27.3482| -82.5176|Baltimore Orioles|Philadelphia Phillies|NA|NA|  50|  79|   380|MLB|MLB Baseball
mlb|5789088|01:07 pm|2023-04-01|Oakland, CA|Angels at Athletics|Los Angeles Angels at Oakland Athletics|RingCentral Coliseum|    14|0.620|37.7514|-122.2010|Oakland Athletics|Los Angeles Angels|NA|NA|  38| 121|  1111|MLB|MLB Baseball
mlb|5794576|01:05 pm|2023-02-26|Surprise, AZ|Spring Training: Mariners at Royals|Spring Training: Seattle Mariners at Kansas City Royals|Surprise Stadium|  3930|0.490|33.6269|-112.3770|Kansas City Royals|Seattle Mariners|NA|NA|  22|  80|   391|MLB|MLB Baseball
mlb|5794594|01:05 pm|2023-03-02|Surprise, AZ|Spring Training: Angels at Royals|Spring Training: Los Angeles Angels at Kansas City Royals|Surprise Stadium|  3930|0.477|33.6269|-112.3770|Kansas City Royals|Los Angeles Angels|NA|NA|  16|  65|   397|MLB|MLB Baseball
mlb|5794322|01:05 pm|2023-02-27|Bradenton, FL|Spring Training: Phillies at Pirates|Spring Training: Philadelphia Phillies at Pittsburgh Pirates|LECOM Park|  3941|0.520|27.4846| -82.5713|Pittsburgh Pirates|Philadelphia Phillies|NA|NA|  31|  72|   397|MLB|MLB Baseball
mlb|5794592|06:05 pm|2023-03-25|Goodyear, AZ|Spring Training: White Sox at Reds|Spring Training: Chicago White Sox at Cincinnati Reds|Goodyear Ballpark|  3943|0.465|33.4285|-112.3900|Cincinnati Reds|Chicago White Sox|NA|NA|  27|  50|   380|MLB|MLB Baseball
nhl|5740087|07:00 pm|2023-03-23|Sunrise, FL|Maple Leafs at Panthers|Toronto Maple Leafs at Florida Panthers|FLA Live Arena|   126|0.655|26.1585| -80.3255|Florida Panthers|Toronto Maple Leafs|NA|NA|  74| 186|  2213|NHL|NHL Hockey
nhl|5742821|07:00 pm|2023-02-24|Toronto, Canada|Wild at Maple Leafs|Minnesota Wild at Toronto Maple Leafs|Scotiabank Arena|    91|0.652|43.6435| -79.3791|Toronto Maple Leafs|Minnesota Wild|NA|NA| 126| 435|  2213|NHL|NHL Hockey
nhl|5739945|08:00 pm|2023-03-18|New York, NY|Penguins at Rangers|Pittsburgh Penguins at New York Rangers|Madison Square Garden|    93|0.770|40.7509| -73.9943|New York Rangers|Pittsburgh Penguins|NA|NA| 197| 476| 19087|NHL|NHL Hockey
nhl|5742513|07:00 pm|2023-03-18|Los Angeles, CA|Canucks at Kings|Vancouver Canucks at Los Angeles Kings|Crypto.com Arena|   134|0.703|34.0430|-118.2670|Los Angeles Kings|Vancouver Canucks|NA|NA|  56| 168|  6358|NHL|NHL Hockey
nhl|5742166|07:00 pm|2023-03-01|Anaheim, CA|Capitals at Ducks|Washington Capitals at Anaheim Ducks|Honda Center|   133|0.640|33.8078|-117.8760|Anaheim Ducks|Washington Capitals|NA|NA|  38| 135|  1053|NHL|NHL Hockey
nhl|5744059|07:30 pm|2023-03-01|Philadelphia, PA|Rangers at Flyers|New York Rangers at Philadelphia Flyers|Wells Fargo Center|  3148|0.706|39.9012| -75.1720|Philadelphia Flyers|New York Rangers|NA|NA|  29| 152|   587|NHL|NHL Hockey
nhl|5739898|07:00 pm|2023-03-21|Boston, MA|Senators at Bruins|Ottawa Senators at Boston Bruins|TD Garden|  1544|0.688|42.3653| -71.0618|Boston Bruins|Ottawa Senators|NA|NA|  39| 314| 11177|NHL|NHL Hockey
nhl|5739939|07:00 pm|2023-03-16|New York, NY|Penguins at Rangers|Pittsburgh Penguins at New York Rangers|Madison Square Garden|    93|0.747|40.7509| -73.9943|New York Rangers|Pittsburgh Penguins|NA|NA| 139| 376| 19087|NHL|NHL Hockey
nhl|5742374|07:30 pm|2023-03-11|San Jose, CA|Wild at Sharks|Minnesota Wild at San Jose Sharks|SAP Center at San Jose|   157|0.650|37.3322|-121.9020|San Jose Sharks|Minnesota Wild|NA|NA|  42| 143|  1341|NHL|NHL Hockey
nhl|5743316|07:00 pm|2023-03-21|Montreal, Canada|Lightning at Canadiens|Tampa Bay Lightning at Montreal Canadiens|Centre Bell|   139|0.641|45.4960| -73.5693|Montreal Canadiens|Tampa Bay Lightning|NA|NA|  47| 204|  2151|NHL|NHL Hockey
nhl|5739865|01:00 pm|2023-03-04|Boston, MA|Rangers at Bruins|New York Rangers at Boston Bruins|TD Garden|  1544|0.758|42.3653| -71.0618|Boston Bruins|New York Rangers|NA|NA| 274| 600| 11404|NHL|NHL Hockey
nhl|5740029|07:00 pm|2023-03-02|Tampa, FL|Penguins at Lightning|Pittsburgh Penguins at Tampa Bay Lightning|Amalie Arena|   182|0.691|27.9427| -82.4517|Tampa Bay Lightning|Pittsburgh Penguins|NA|NA|  94| 252|  2352|NHL|NHL Hockey
nhl|5739618|07:00 pm|2023-03-16|Newark, NJ|Lightning at Devils|Tampa Bay Lightning at New Jersey Devils|Prudential Center|  1500|0.644|40.7332| -74.1717|New Jersey Devils|Tampa Bay Lightning|NA|NA|  43| 109| 20718|NHL|NHL Hockey
nhl|5740643|05:00 pm|2023-03-25|Elmont, NY|Sabres at Islanders|Buffalo Sabres at New York Islanders|UBS Arena|518722|0.680|40.7095| -73.7204|New York Islanders|Buffalo Sabres|NA|NA|  58| 174|  1282|NHL|NHL Hockey
nhl|5743056|07:30 pm|2023-03-20|Edmonton, Canada|Sharks at Oilers|San Jose Sharks at Edmonton Oilers|Rogers Place| 75884|0.578|53.5470|-113.4980|Edmonton Oilers|San Jose Sharks|NA|NA|  46| 178|  1120|NHL|NHL Hockey
