league|id|time|date|city|title|full|venue|ven_id|score|lat|long|t1|t2|t3|t4|low|med|high|name|xname
mlb|5794588|06:05 pm|2023-03-23|Goodyear, AZ|Spring Training: Mariners at Reds|Spring Training: Seattle Mariners at Cincinnati Reds|Goodyear Ballpark|  3943|0.446|33.4285|-112.3900|Cincinnati Reds|Seattle Mariners|NA|NA|  28|  61|    90|MLB|MLB Baseball
mlb|5794044|06:40 pm|2023-03-20|Scottsdale, AZ|Spring Training: Dodgers at Rockies|Spring Training: Los Angeles Dodgers at Colorado Rockies|Salt River Fields at Talking Stick|  3931|0.547|33.5457|-111.8860|Colorado Rockies|Los Angeles Dodgers|NA|NA|  38|  99|   314|MLB|MLB Baseball
mlb|5789228|06:40 pm|2023-04-03|Miami, FL|Twins at Marlins|Minnesota Twins at Miami Marlins|loanDepot park|  6371|0.582|25.7617| -80.1918|Miami Marlins|Minnesota Twins|NA|NA|  13|  43|  1124|MLB|MLB Baseball
mlb|5794638|06:07 pm|2023-03-25|Dunedin, FL|Spring Training: Tigers at Blue Jays|Spring Training: Detroit Tigers at Toronto Blue Jays|TD Ballpark|  3936|0.526|28.0036| -82.7868|Toronto Blue Jays|Detroit Tigers|NA|NA|  38|  70|   121|MLB|MLB Baseball
mlb|5789096|06:40 pm|2023-04-04|Oakland, CA|Guardians at Athletics|Cleveland Guardians at Oakland Athletics|RingCentral Coliseum|    14|0.546|37.7514|-122.2010|Oakland Athletics|Cleveland Guardians|NA|NA|  30| 130|   863|MLB|MLB Baseball
mlb|5793828|01:05 pm|2023-03-24|Mesa, AZ|Spring Training: Rangers at Cubs|Spring Training: Texas Rangers at Chicago Cubs (Split Squad)|Sloan Park| 57343|0.581|33.4311|-111.8820|Chicago Cubs|Texas Rangers|NA|NA|  28|  81|   309|MLB|MLB Baseball
mlb|5787496|06:40 pm|2023-04-24|Saint Petersburg, FL|Astros at Rays|Houston Astros at Tampa Bay Rays|Tropicana Field|     4|0.573|27.7682| -82.6534|Tampa Bay Rays|Houston Astros|NA|NA|  30|  82|   379|MLB|MLB Baseball
mlb|5794272|12:40 pm|2023-03-28|Phoenix, AZ|Spring Training: Guardians at Diamondbacks|Spring Training: Cleveland Guardians at Arizona Diamondbacks|Chase Field|    30|0.514|33.4453|-112.0670|Arizona Diamondbacks|Cleveland Guardians|NA|NA|  17|  60|   263|MLB|MLB Baseball
mlb|5794554|01:05 pm|2023-03-21|Goodyear, AZ|Spring Training: Dodgers at Guardians|Spring Training: Los Angeles Dodgers (Split Squad) at Cleveland Guardians|Goodyear Ballpark|  3943|0.487|33.4285|-112.3900|Cleveland Guardians|Los Angeles Dodgers|NA|NA|  11|  43|   116|MLB|MLB Baseball
mlb|5794184|01:05 pm|2023-03-19|Clearwater, FL|Spring Training: Red Sox at Phillies|Spring Training: Boston Red Sox at Philadelphia Phillies|BayCare Ballpark|  3942|0.623|27.9709| -82.7317|Philadelphia Phillies|Boston Red Sox|NA|NA|  45|  85|   251|MLB|MLB Baseball
mlb|5794128|06:05 pm|2023-03-20|West Palm Beach, FL|Spring Training: Mets at Nationals|Spring Training: New York Mets at Washington Nationals|The Ballpark of the Palm Beaches|419759|0.507|26.7579| -80.1169|Washington Nationals|New York Mets|NA|NA|  48|  75|   183|MLB|MLB Baseball
mlb|5785276|06:08 pm|2023-03-30|Houston, TX|White Sox at Astros - Opening Day|Chicago White Sox at Houston Astros - Opening Day|Minute Maid Park|    20|0.561|29.7562| -95.3557|Houston Astros|Chicago White Sox|MLB Opening Day|NA| 129| 219|  1479|MLB|MLB Baseball
mlb|5787460|06:40 pm|2023-04-11|Saint Petersburg, FL|Red Sox at Rays|Boston Red Sox at Tampa Bay Rays|Tropicana Field|     4|0.615|27.7682| -82.6534|Tampa Bay Rays|Boston Red Sox|NA|NA|  61| 145|   374|MLB|MLB Baseball
mlb|5788912|06:40 pm|2023-04-03|Kansas City, MO|Blue Jays at Royals|Toronto Blue Jays at Kansas City Royals|Kauffman Stadium|  3714|0.589|39.0515| -94.4803|Kansas City Royals|Toronto Blue Jays|NA|NA|  12|  57|  2499|MLB|MLB Baseball
mlb|5793968|01:10 pm|2023-03-23|Peoria, AZ|Spring Training: Royals at Padres|Spring Training: Kansas City Royals at San Diego Padres (Split Squad)|Peoria Sports Complex|  3924|0.496|33.6321|-112.2330|San Diego Padres|Kansas City Royals|NA|NA|  29|  58|   224|MLB|MLB Baseball
mlb|5794348|01:05 pm|2023-03-21|Bradenton, FL|Spring Training: Phillies at Pirates|Spring Training: Philadelphia Phillies at Pittsburgh Pirates|LECOM Park|  3941|0.515|27.4846| -82.5713|Pittsburgh Pirates|Philadelphia Phillies|NA|NA|  25|  46|   154|MLB|MLB Baseball
nba|5776163|07:30 pm|2023-03-31|Phoenix, AZ|Nuggets at Suns|Denver Nuggets at Phoenix Suns|Footprint Center|   130|0.673|33.4458|-112.0710|Phoenix Suns|Denver Nuggets|NA|NA| 136| 387|  7091|NBA|NBA Basketball
nba|5775761|07:00 pm|2023-03-28|San Francisco, CA|Pelicans at Warriors|New Orleans Pelicans at Golden State Warriors|Chase Center|467029|0.709|37.7704|-122.3870|Golden State Warriors|New Orleans Pelicans|NA|NA| 108| 332|214749|NBA|NBA Basketball
nba|5958488|03:30 am|2023-04-17|Boston, MA|E Conf 1st Rnd - Home Gm 2: TBD at Celtics|Eastern Conference First Round: TBD at Boston Celtics - Home Game 2|TD Garden|  1544|0.619|42.3653| -71.0618|Boston Celtics|NBA Playoffs|NA|NA| 247| 460|  3171|NBA|NBA Basketball
nba|5777065|07:00 pm|2023-04-04|Houston, TX|Nuggets at Rockets|Denver Nuggets at Houston Rockets|Toyota Center|   129|0.609|29.7508| -95.3621|Houston Rockets|Denver Nuggets|NA|NA|  12|  44| 12454|NBA|NBA Basketball
nba|5776167|07:00 pm|2023-04-06|Phoenix, AZ|Nuggets at Suns|Denver Nuggets at Phoenix Suns|Footprint Center|   130|0.652|33.4458|-112.0710|Phoenix Suns|Denver Nuggets|NA|NA| 115| 313| 10936|NBA|NBA Basketball
nba|5776739|01:00 pm|2023-04-09|Chicago, IL|Pistons at Bulls|Detroit Pistons at Chicago Bulls|United Center|   136|0.724|41.8806| -87.6740|Chicago Bulls|Detroit Pistons|NA|NA|  68| 208|  3725|NBA|NBA Basketball
nba|5958745|03:30 am|2023-04-17|Denver, CO|W Conf 1st Rnd - Home Gm 2: TBD at Nuggets|Western Conference First Round: TBD at Denver Nuggets - Home Game 2|Ball Arena|   187|0.567|39.7487|-105.0080|Denver Nuggets|NBA Playoffs|NA|NA| 151| 291|  1525|NBA|NBA Basketball
nba|5958520|03:30 am|2023-04-17|Milwaukee, WI|E Conf 1st Rnd - Home Gm 2: TBD at Bucks|Eastern Conference First Round: TBD at Milwaukee Bucks - Home Game 2|Fiserv Forum|435592|0.443|43.0417| -87.9162|Milwaukee Bucks|NBA Playoffs|NA|NA| 376| 413|   461|NBA|NBA Basketball
nba|5775763|07:00 pm|2023-03-31|San Francisco, CA|Spurs at Warriors|San Antonio Spurs at Golden State Warriors|Chase Center|467029|0.742|37.7704|-122.3870|Golden State Warriors|San Antonio Spurs|NA|NA| 136| 456| 16010|NBA|NBA Basketball
nba|5776405|12:30 pm|2023-03-26|Los Angeles, CA|Bulls at Lakers|Chicago Bulls at Los Angeles Lakers|Crypto.com Arena|   134|0.764|34.0430|-118.2670|Los Angeles Lakers|Chicago Bulls|NA|NA| 153| 467| 18815|NBA|NBA Basketball
nba|5776165|07:00 pm|2023-04-04|Phoenix, AZ|Spurs at Suns|San Antonio Spurs at Phoenix Suns|Footprint Center|   130|0.662|33.4458|-112.0710|Phoenix Suns|San Antonio Spurs|NA|NA|  82| 256|  3877|NBA|NBA Basketball
nba|5776983|02:30 pm|2023-04-09|Dallas, TX|Spurs at Mavericks|San Antonio Spurs at Dallas Mavericks|American Airlines Center|   117|0.731|32.7904| -96.8103|Dallas Mavericks|San Antonio Spurs|NA|NA|  68| 301|  8630|NBA|NBA Basketball
nba|5775685|07:30 pm|2023-04-07|Boston, MA|Raptors at Celtics|Toronto Raptors at Boston Celtics|TD Garden|  1544|0.717|42.3653| -71.0618|Boston Celtics|Toronto Raptors|NA|NA| 134| 346|  5700|NBA|NBA Basketball
nba|5776737|08:00 pm|2023-04-04|Chicago, IL|Hawks at Bulls|Atlanta Hawks at Chicago Bulls|United Center|   136|0.720|41.8806| -87.6740|Chicago Bulls|Atlanta Hawks|NA|NA|  59| 195|  2962|NBA|NBA Basketball
nba|5775755|07:00 pm|2023-03-24|San Francisco, CA|76ers at Warriors|Philadelphia 76ers at Golden State Warriors|Chase Center|467029|0.747|37.7704|-122.3870|Golden State Warriors|Philadelphia 76ers|NA|NA| 178| 550| 13724|NBA|NBA Basketball
nba|5776491|07:30 pm|2023-03-27|Los Angeles, CA|Bulls at Clippers|Chicago Bulls at Los Angeles Clippers|Crypto.com Arena|   134|0.721|34.0430|-118.2670|Los Angeles Clippers|Chicago Bulls|NA|NA|  38| 129|  9765|NBA|NBA Basketball
nba|5775683|01:00 pm|2023-04-09|Boston, MA|Hawks at Celtics|Atlanta Hawks at Boston Celtics|TD Garden|  1544|0.709|42.3653| -71.0618|Boston Celtics|Atlanta Hawks|NA|NA| 133| 373|  5700|NBA|NBA Basketball
nba|5776407|07:30 pm|2023-04-07|Los Angeles, CA|Suns at Lakers|Phoenix Suns at Los Angeles Lakers|Crypto.com Arena|   134|0.738|34.0430|-118.2670|Los Angeles Lakers|Phoenix Suns|NA|NA| 204| 646| 57005|NBA|NBA Basketball
nba|5776329|06:00 pm|2023-04-02|New York, NY|Wizards at Knicks|Washington Wizards at New York Knicks|Madison Square Garden|    93|0.754|40.7509| -73.9943|New York Knicks|Washington Wizards|NA|NA| 216| 520|  8812|NBA|NBA Basketball
nba|5776243|01:00 pm|2023-03-26|Charlotte, NC|Mavericks at Hornets|Dallas Mavericks at Charlotte Hornets|Spectrum Center|   112|0.674|35.2248| -80.8403|Charlotte Hornets|Dallas Mavericks|NA|NA|  68| 169|  4795|NBA|NBA Basketball
nba|5776001|07:00 pm|2023-03-31|Philadelphia, PA|Raptors at 76ers|Toronto Raptors at Philadelphia 76ers|Wells Fargo Center|  3148|0.705|39.9012| -75.1720|Philadelphia 76ers|Toronto Raptors|NA|NA|  89| 240| 11404|NBA|NBA Basketball
nba|5758257|07:00 pm|2023-04-04|New Orleans, LA|Kings at Pelicans|Sacramento Kings at New Orleans Pelicans|Smoothie King Center|   184|0.618|29.9490| -90.0821|New Orleans Pelicans|Sacramento Kings|NA|NA|  10|  36|  3000|NBA|NBA Basketball
nba|5777141|07:00 pm|2023-03-31|Washington, DC|Magic at Wizards|Orlando Magic at Washington Wizards|Capital One Arena|   181|0.673|38.8981| -77.0209|Washington Wizards|Orlando Magic|NA|NA|  23| 125|  2414|NBA|NBA Basketball
nba|5777707|07:00 pm|2023-03-22|Salt Lake City, UT|Trail Blazers at Jazz|Portland Trail Blazers at Utah Jazz|Vivint Arena|   188|0.588|40.7676|-111.9010|Utah Jazz|Portland Trail Blazers|NA|NA|  19| 125|  2724|NBA|NBA Basketball
nba|5776003|08:00 pm|2023-04-04|Philadelphia, PA|Celtics at 76ers|Boston Celtics at Philadelphia 76ers|Wells Fargo Center|  3148|0.716|39.9012| -75.1720|Philadelphia 76ers|Boston Celtics|NA|NA| 102| 338| 10547|NBA|NBA Basketball
nba|5775997|07:00 pm|2023-03-20|Philadelphia, PA|Bulls at 76ers|Chicago Bulls at Philadelphia 76ers|Wells Fargo Center|  3148|0.706|39.9012| -75.1720|Philadelphia 76ers|Chicago Bulls|NA|NA|  58| 229|  8032|NBA|NBA Basketball
nba|5777145|07:00 pm|2023-04-07|Washington, DC|Heat at Wizards|Miami Heat at Washington Wizards|Capital One Arena|   181|0.721|38.8981| -77.0209|Washington Wizards|Miami Heat|NA|NA|  34| 144| 12660|NBA|NBA Basketball
nba|5775759|05:30 pm|2023-03-26|San Francisco, CA|Timberwolves at Warriors|Minnesota Timberwolves at Golden State Warriors|Chase Center|467029|0.735|37.7704|-122.3870|Golden State Warriors|Minnesota Timberwolves|NA|NA| 152| 496| 77959|NBA|NBA Basketball
nba|5757781|07:00 pm|2023-03-21|New Orleans, LA|Spurs at Pelicans|San Antonio Spurs at New Orleans Pelicans|Smoothie King Center|   184|0.622|29.9490| -90.0821|New Orleans Pelicans|San Antonio Spurs|NA|NA|  12|  40| 12354|NBA|NBA Basketball
nba|5775675|07:00 pm|2023-03-24|Boston, MA|Pacers at Celtics|Indiana Pacers at Boston Celtics|TD Garden|  1544|0.723|42.3653| -71.0618|Boston Celtics|Indiana Pacers|NA|NA| 145| 419| 11404|NBA|NBA Basketball
nba|5776735|03:30 pm|2023-04-02|Chicago, IL|Grizzlies at Bulls|Memphis Grizzlies at Chicago Bulls|United Center|   136|0.744|41.8806| -87.6740|Chicago Bulls|Memphis Grizzlies|NA|NA|  92| 317|  4585|NBA|NBA Basketball
nba|5777061|07:00 pm|2023-03-31|Houston, TX|Pistons at Rockets|Detroit Pistons at Houston Rockets|Toyota Center|   129|0.631|29.7508| -95.3621|Houston Rockets|Detroit Pistons|NA|NA|  10|  46|  6044|NBA|NBA Basketball
nba|5777465|06:00 pm|2023-04-02|Orlando, FL|Pistons at Magic|Detroit Pistons at Orlando Magic|Amway Center|  2652|0.633|28.5392| -81.3839|Orlando Magic|Detroit Pistons|NA|NA|  25|  95|  2184|NBA|NBA Basketball
nba|5777633|07:00 pm|2023-03-31|Minneapolis, MN|Lakers at Timberwolves|Los Angeles Lakers at Minnesota Timberwolves|Target Center|   135|0.648|44.9795| -93.2761|Minnesota Timberwolves|Los Angeles Lakers|NA|NA|  66| 310|  1544|NBA|NBA Basketball
nba|5775677|06:00 pm|2023-03-26|Boston, MA|Spurs at Celtics|San Antonio Spurs at Boston Celtics|TD Garden|  1544|0.726|42.3653| -71.0618|Boston Celtics|San Antonio Spurs|NA|NA| 117| 314| 11404|NBA|NBA Basketball
nba|5776819|06:30 pm|2023-04-05|Milwaukee, WI|Bulls at Bucks|Chicago Bulls at Milwaukee Bucks|Fiserv Forum|435592|0.658|43.0417| -87.9162|Milwaukee Bucks|Chicago Bulls|NA|NA|  62| 195|  3593|NBA|NBA Basketball
nba|5777147|01:00 pm|2023-04-09|Washington, DC|Rockets at Wizards|Houston Rockets at Washington Wizards|Capital One Arena|   181|0.671|38.8981| -77.0209|Washington Wizards|Houston Rockets|NA|NA|  24| 112|  3710|NBA|NBA Basketball
nba|5958519|03:30 am|2023-04-15|Milwaukee, WI|E Conf 1st Rnd - Home Gm 1: TBD at Bucks|Eastern Conference First Round: TBD at Milwaukee Bucks - Home Game 1|Fiserv Forum|435592|0.567|43.0417| -87.9162|Milwaukee Bucks|NBA Playoffs|NA|NA| 197| 276|  1052|NBA|NBA Basketball
nba|5776903|07:00 pm|2023-04-07|Indianapolis, IN|Pistons at Pacers|Detroit Pistons at Indiana Pacers|Gainbridge Fieldhouse|   121|0.630|39.7640| -86.1556|Indiana Pacers|Detroit Pistons|NA|NA|  21| 114|  2187|NBA|NBA Basketball
nba|5776575|07:00 pm|2023-03-31|Portland, OR|Kings at Trail Blazers|Sacramento Kings at Portland Trail Blazers|Moda Center|   256|0.648|45.5316|-122.6670|Portland Trail Blazers|Sacramento Kings|NA|NA|  16| 124|  4151|NBA|NBA Basketball
nba|5958583|03:30 am|2023-04-15|New York, NY|E Conf 1st Rnd - Home Gm 1: TBD at Knicks|Eastern Conference First Round: TBD at New York Knicks - Home Game 1|Madison Square Garden|    93|0.685|40.7509| -73.9943|New York Knicks|NBA Playoffs|NA|NA| 350| 927| 19599|NBA|NBA Basketball
nba|5777133|08:00 pm|2023-03-18|Washington, DC|Kings at Wizards|Sacramento Kings at Washington Wizards|Capital One Arena|   181|0.677|38.8981| -77.0209|Washington Wizards|Sacramento Kings|NA|NA|  32| 162|  1801|NBA|NBA Basketball
nba|5776571|07:00 pm|2023-03-27|Portland, OR|Pelicans at Trail Blazers|New Orleans Pelicans at Portland Trail Blazers|Moda Center|   256|0.629|45.5316|-122.6670|Portland Trail Blazers|New Orleans Pelicans|NA|NA|  15| 173|  4032|NBA|NBA Basketball
nba|5776655|06:30 pm|2023-04-02|Denver, CO|Warriors at Nuggets|Golden State Warriors at Denver Nuggets|Ball Arena|   187|0.685|39.7487|-105.0080|Denver Nuggets|Golden State Warriors|NA|NA|  81| 272| 12030|NBA|NBA Basketball
nba|5776821|07:00 pm|2023-04-07|Milwaukee, WI|Grizzlies at Bucks|Memphis Grizzlies at Milwaukee Bucks|Fiserv Forum|435592|0.643|43.0417| -87.9162|Milwaukee Bucks|Memphis Grizzlies|NA|NA|  78| 256|  5178|NBA|NBA Basketball
nba|5777223|07:00 pm|2023-03-31|Memphis, TN|Clippers at Grizzlies|Los Angeles Clippers at Memphis Grizzlies|FedExForum|  1243|0.682|35.1383| -90.0522|Memphis Grizzlies|Los Angeles Clippers|NA|NA|  39| 233|  4710|NBA|NBA Basketball
nba|5775915|07:00 pm|2023-03-24|Sacramento, CA|Suns at Kings|Phoenix Suns at Sacramento Kings|Golden 1 Center|177304|0.620|38.5161|-121.4170|Sacramento Kings|Phoenix Suns|NA|NA| 110| 273|114004|NBA|NBA Basketball
nba|5757784|07:00 pm|2023-04-07|New Orleans, LA|Knicks at Pelicans|New York Knicks at New Orleans Pelicans|Smoothie King Center|   184|0.679|29.9490| -90.0821|New Orleans Pelicans|New York Knicks|NA|NA|  20|  55| 11999|NBA|NBA Basketball
nba|5777703|07:00 pm|2023-03-18|Salt Lake City, UT|Celtics at Jazz|Boston Celtics at Utah Jazz|Vivint Arena|   188|0.650|40.7676|-111.9010|Utah Jazz|Boston Celtics|NA|NA|  63| 268|  4045|NBA|NBA Basketball
nba|5775923|03:00 pm|2023-04-02|Sacramento, CA|Spurs at Kings|San Antonio Spurs at Sacramento Kings|Golden 1 Center|177304|0.634|38.5161|-121.4170|Sacramento Kings|San Antonio Spurs|NA|NA|  80| 254| 13748|NBA|NBA Basketball
nba|5958746|03:30 am|2023-04-24|Denver, CO|W Conf 1st Rnd - Home Gm 3: TBD at Nuggets|Western Conference First Round: TBD at Denver Nuggets - Home Game 3|Ball Arena|   187|0.481|39.7487|-105.0080|Denver Nuggets|NBA Playoffs|NA|NA| 221| 373|  1487|NBA|NBA Basketball
nba|5776323|07:30 pm|2023-03-20|New York, NY|Timberwolves at Knicks|Minnesota Timberwolves at New York Knicks|Madison Square Garden|    93|0.739|40.7509| -73.9943|New York Knicks|Minnesota Timberwolves|NA|NA| 161| 390| 62227|NBA|NBA Basketball
nba|5777221|07:00 pm|2023-03-28|Memphis, TN|Magic at Grizzlies|Orlando Magic at Memphis Grizzlies|FedExForum|  1243|0.614|35.1383| -90.0522|Memphis Grizzlies|Orlando Magic|NA|NA|  12|  96|  3730|NBA|NBA Basketball
nba|5777706|07:00 pm|2023-03-20|Salt Lake City, UT|Kings at Jazz|Sacramento Kings at Utah Jazz|Vivint Arena|   188|0.580|40.7676|-111.9010|Utah Jazz|Sacramento Kings|NA|NA|  21| 120|  1521|NBA|NBA Basketball
nba|5776327|07:30 pm|2023-03-29|New York, NY|Heat at Knicks|Miami Heat at New York Knicks|Madison Square Garden|    93|0.777|40.7509| -73.9943|New York Knicks|Miami Heat|NA|NA| 154| 419| 11404|NBA|NBA Basketball
nba|5776567|07:00 pm|2023-03-24|Portland, OR|Bulls at Trail Blazers|Chicago Bulls at Portland Trail Blazers|Moda Center|   256|0.691|45.5316|-122.6670|Portland Trail Blazers|Chicago Bulls|NA|NA|  30| 168|  3272|NBA|NBA Basketball
nba|5761858|03:30 pm|2023-03-19|Brooklyn, NY|Nuggets at Nets|Denver Nuggets at Brooklyn Nets|Barclays Center|  7546|0.727|40.6827| -73.9753|Brooklyn Nets|Denver Nuggets|NA|NA|  58| 234|  7673|NBA|NBA Basketball
nba|5777227|07:00 pm|2023-04-04|Memphis, TN|Trail Blazers at Grizzlies|Portland Trail Blazers at Memphis Grizzlies|FedExForum|  1243|0.630|35.1383| -90.0522|Memphis Grizzlies|Portland Trail Blazers|NA|NA|  14| 111|  3823|NBA|NBA Basketball
nba|5761884|07:30 pm|2023-04-04|Brooklyn, NY|Timberwolves at Nets|Minnesota Timberwolves at Brooklyn Nets|Barclays Center|  7546|0.719|40.6827| -73.9753|Brooklyn Nets|Minnesota Timberwolves|NA|NA|  49| 149| 11902|NBA|NBA Basketball
nba|5775999|07:30 pm|2023-03-29|Philadelphia, PA|Mavericks at 76ers|Dallas Mavericks at Philadelphia 76ers|Wells Fargo Center|  3148|0.707|39.9012| -75.1720|Philadelphia 76ers|Dallas Mavericks|NA|NA| 100| 340|  9737|NBA|NBA Basketball
nba|5776483|12:00 pm|2023-03-18|Los Angeles, CA|Magic at Clippers|Orlando Magic at Los Angeles Clippers|Crypto.com Arena|   134|0.707|34.0430|-118.2670|Los Angeles Clippers|Orlando Magic|NA|NA|  22|  77|  3347|NBA|NBA Basketball
nba|5777461|07:00 pm|2023-03-21|Orlando, FL|Wizards at Magic|Washington Wizards at Orlando Magic|Amway Center|  2652|0.627|28.5392| -81.3839|Orlando Magic|Washington Wizards|NA|NA|  21|  90|  3722|NBA|NBA Basketball
nba|5776251|07:00 pm|2023-04-07|Charlotte, NC|Rockets at Hornets|Houston Rockets at Charlotte Hornets|Spectrum Center|   112|0.684|35.2248| -80.8403|Charlotte Hornets|Houston Rockets|NA|NA|  28| 102|  2537|NBA|NBA Basketball
nba|5958969|03:30 am|2023-04-17|San Francisco, CA|W Conf 1st Rnd - Home Gm 2: TBD at Warriors|Western Conference First Round: TBD at Golden State Warriors - Home Game 2|Chase Center|467029|0.547|37.7704|-122.3870|Golden State Warriors|NBA Playoffs|NA|NA| 279|1201|  5272|NBA|NBA Basketball
nba|5776817|07:00 pm|2023-04-02|Milwaukee, WI|76ers at Bucks|Philadelphia 76ers at Milwaukee Bucks|Fiserv Forum|435592|0.639|43.0417| -87.9162|Milwaukee Bucks|Philadelphia 76ers|NA|NA|  61| 216| 12262|NBA|NBA Basketball
nba|5761943|01:00 pm|2023-04-09|Cleveland, OH|Hornets at Cavaliers|Charlotte Hornets at Cleveland Cavaliers|Rocket Mortgage FieldHouse|   120|0.603|41.4971| -81.6884|Cleveland Cavaliers|Charlotte Hornets|NA|NA|  32|  74|  3037|NBA|NBA Basketball
nba|5958584|03:30 am|2023-04-17|New York, NY|E Conf 1st Rnd - Home Gm 2: TBD at Knicks|Eastern Conference First Round: TBD at New York Knicks - Home Game 2|Madison Square Garden|    93|0.575|40.7509| -73.9943|New York Knicks|NBA Playoffs|NA|NA| 350|1042| 19599|NBA|NBA Basketball
nba|5776399|06:30 pm|2023-03-19|Los Angeles, CA|Magic at Lakers|Orlando Magic at Los Angeles Lakers|Crypto.com Arena|   134|0.723|34.0430|-118.2670|Los Angeles Lakers|Orlando Magic|NA|NA| 101| 270| 22405|NBA|NBA Basketball
nba|5776159|07:00 pm|2023-03-25|Phoenix, AZ|76ers at Suns|Philadelphia 76ers at Phoenix Suns|Footprint Center|   130|0.679|33.4458|-112.0710|Phoenix Suns|Philadelphia 76ers|NA|NA| 120| 373|  9999|NBA|NBA Basketball
nba|5761861|07:30 pm|2023-03-29|Brooklyn, NY|Rockets at Nets|Houston Rockets at Brooklyn Nets|Barclays Center|  7546|0.700|40.6827| -73.9753|Brooklyn Nets|Houston Rockets|NA|NA|  34| 105|  3000|NBA|NBA Basketball
nba|5777387|07:00 pm|2023-03-27|Detroit, MI|Bucks at Pistons|Milwaukee Bucks at Detroit Pistons|Little Caesars Arena|420444|0.605|42.3400| -83.0574|Detroit Pistons|Milwaukee Bucks|NA|NA|  34|  91| 12354|NBA|NBA Basketball
nba|5958902|03:30 am|2023-04-15|Dallas, TX|W Conf 1st Rnd - Home Gm 1: TBD at Mavericks|Western Conference First Round: TBD at Dallas Mavericks - Home Game 1|American Airlines Center|   117|0.546|32.7904| -96.8103|Dallas Mavericks|NBA Playoffs|NA|NA| 575| 638|  1007|NBA|NBA Basketball
nba|5958710|03:30 am|2023-04-15|Toronto, Canada|E Conf 1st Rnd - Home Gm 1: TBD at Raptors|Eastern Conference First Round: TBD at Toronto Raptors - Home Game 1|Scotiabank Arena|    91|0.492|43.6435| -79.3791|Toronto Raptors|NBA Playoffs|NA|NA| 194| 368|  8554|NBA|NBA Basketball
nba|5776815|06:30 pm|2023-03-30|Milwaukee, WI|Celtics at Bucks|Boston Celtics at Milwaukee Bucks|Fiserv Forum|435592|0.656|43.0417| -87.9162|Milwaukee Bucks|Boston Celtics|NA|NA| 102| 289| 12103|NBA|NBA Basketball
nba|5777063|06:00 pm|2023-04-02|Houston, TX|Lakers at Rockets|Los Angeles Lakers at Houston Rockets|Toyota Center|   129|0.703|29.7508| -95.3621|Houston Rockets|Los Angeles Lakers|NA|NA|  54| 143| 11954|NBA|NBA Basketball
nba|5776403|07:30 pm|2023-03-24|Los Angeles, CA|Thunder at Lakers|Oklahoma City Thunder at Los Angeles Lakers|Crypto.com Arena|   134|0.753|34.0430|-118.2670|Los Angeles Lakers|Oklahoma City Thunder|NA|NA|  94| 302| 17105|NBA|NBA Basketball
nba|5776897|07:00 pm|2023-03-29|Indianapolis, IN|Bucks at Pacers|Milwaukee Bucks at Indiana Pacers|Gainbridge Fieldhouse|   121|0.616|39.7640| -86.1556|Indiana Pacers|Milwaukee Bucks|NA|NA|  27| 134|  2053|NBA|NBA Basketball
nba|5761910|07:30 pm|2023-04-07|Brooklyn, NY|Magic at Nets|Orlando Magic at Brooklyn Nets|Barclays Center|  7546|0.725|40.6827| -73.9753|Brooklyn Nets|Orlando Magic|NA|NA|  54| 165|  3900|NBA|NBA Basketball
nba|5776325|07:30 pm|2023-03-27|New York, NY|Rockets at Knicks|Houston Rockets at New York Knicks|Madison Square Garden|    93|0.748|40.7509| -73.9943|New York Knicks|Houston Rockets|NA|NA| 124| 281|  9768|NBA|NBA Basketball
nba|5777143|07:00 pm|2023-04-04|Washington, DC|Bucks at Wizards|Milwaukee Bucks at Washington Wizards|Capital One Arena|   181|0.662|38.8981| -77.0209|Washington Wizards|Milwaukee Bucks|NA|NA|  40| 128|  7529|NBA|NBA Basketball
nba|5958939|03:30 am|2023-04-24|Minneapolis, MN|W Conf 1st Rnd - Home Gm 3: TBD at Timberwolves|Western Conference First Round: TBD at Minnesota Timberwolves - Home Game 3|Target Center|   135|0.424|44.9795| -93.2761|Minnesota Timberwolves|NBA Playoffs|NA|NA| 194| 345|   814|NBA|NBA Basketball
nba|5776083|06:00 pm|2023-04-02|Atlanta, GA|Mavericks at Hawks|Dallas Mavericks at Atlanta Hawks|State Farm Arena|   127|0.675|33.7566| -84.3969|Atlanta Hawks|Dallas Mavericks|NA|NA|  74| 250|  6435|NBA|NBA Basketball
nba|5776489|07:30 pm|2023-03-25|Los Angeles, CA|Pelicans at Clippers|New Orleans Pelicans at Los Angeles Clippers|Crypto.com Arena|   134|0.708|34.0430|-118.2670|Los Angeles Clippers|New Orleans Pelicans|NA|NA|  26| 112|  6798|NBA|NBA Basketball
nba|5958491|03:30 am|2023-04-24|Boston, MA|E Conf 1st Rnd - Home Gm 3: TBD at Celtics|Eastern Conference First Round: TBD at Boston Celtics - Home Game 3|TD Garden|  1544|0.545|42.3653| -71.0618|Boston Celtics|NBA Playoffs|NA|NA| 259| 493|  3575|NBA|NBA Basketball
nba|5776241|07:00 pm|2023-03-20|Charlotte, NC|Pacers at Hornets|Indiana Pacers at Charlotte Hornets|Spectrum Center|   112|0.625|35.2248| -80.8403|Charlotte Hornets|Indiana Pacers|NA|NA|  12| 106|  2484|NBA|NBA Basketball
nba|5776653|08:00 pm|2023-03-30|Denver, CO|Pelicans at Nuggets|New Orleans Pelicans at Denver Nuggets|Ball Arena|   187|0.635|39.7487|-105.0080|Denver Nuggets|New Orleans Pelicans|NA|NA|  35| 127| 12204|NBA|NBA Basketball
nba|5777307|07:30 pm|2023-03-28|Toronto, Canada|Heat at Raptors|Miami Heat at Toronto Raptors|Scotiabank Arena|    91|0.711|43.6435| -79.3791|Toronto Raptors|Miami Heat|NA|NA|  68| 266|  7067|NBA|NBA Basketball
nba|5777383|06:00 pm|2023-03-19|Detroit, MI|Heat at Pistons|Miami Heat at Detroit Pistons|Little Caesars Arena|420444|0.667|42.3400| -83.0574|Detroit Pistons|Miami Heat|NA|NA|  33|  95|  4629|NBA|NBA Basketball
nba|5776087|08:00 pm|2023-04-05|Atlanta, GA|Wizards at Hawks|Washington Wizards at Atlanta Hawks|State Farm Arena|   127|0.646|33.7566| -84.3969|Atlanta Hawks|Washington Wizards|NA|NA|  34| 131|  5231|NBA|NBA Basketball
nba|5777797|07:00 pm|2023-04-06|Austin, TX|Trail Blazers at Spurs|Portland Trail Blazers at San Antonio Spurs|Moody Center ATX|518721|0.641|30.2805| -97.7318|San Antonio Spurs|Portland Trail Blazers|NA|NA|  66| 239| 11655|NBA|NBA Basketball
nba|5776245|07:00 pm|2023-03-31|Charlotte, NC|Bulls at Hornets|Chicago Bulls at Charlotte Hornets|Spectrum Center|   112|0.696|35.2248| -80.8403|Charlotte Hornets|Chicago Bulls|NA|NA|  33| 124|  4494|NBA|NBA Basketball
nba|5776169|12:30 pm|2023-04-09|Phoenix, AZ|Clippers at Suns|Los Angeles Clippers at Phoenix Suns|Footprint Center|   130|0.679|33.4458|-112.0710|Phoenix Suns|Los Angeles Clippers|NA|NA| 127| 317|  8334|NBA|NBA Basketball
nba|5757783|07:00 pm|2023-04-05|New Orleans, LA|Grizzlies at Pelicans|Memphis Grizzlies at New Orleans Pelicans|Smoothie King Center|   184|0.641|29.9490| -90.0821|New Orleans Pelicans|Memphis Grizzlies|NA|NA|  12|  46|  3360|NBA|NBA Basketball
nba|5777391|07:00 pm|2023-04-05|Detroit, MI|Nets at Pistons|Brooklyn Nets at Detroit Pistons|Little Caesars Arena|420444|0.625|42.3400| -83.0574|Detroit Pistons|Brooklyn Nets|NA|NA|  24| 102|  3614|NBA|NBA Basketball
