league|id|time|date|city|title|full|venue|ven_id|score|lat|long|t1|t2|t3|t4|low|med|high|name|xname
nba|5777137|07:00 pm|2023-03-24|Washington, DC|Spurs at Wizards|San Antonio Spurs at Washington Wizards|Capital One Arena|   181|0.685|38.8981| -77.0209|Washington Wizards|San Antonio Spurs|NA|NA|  22| 125|  5836|NBA|NBA Basketball
nba|5776471|07:30 pm|2023-02-24|Los Angeles, CA|Kings at Clippers|Sacramento Kings at Los Angeles Clippers|Crypto.com Arena|   134|0.694|34.0430|-118.2670|Los Angeles Clippers|Sacramento Kings|NA|NA|  35| 135|  4805|NBA|NBA Basketball
nba|5776735|03:30 pm|2023-04-02|Chicago, IL|Grizzlies at Bulls|Memphis Grizzlies at Chicago Bulls|United Center|   136|0.744|41.8806| -87.6740|Chicago Bulls|Memphis Grizzlies|NA|NA| 100| 381|  8231|NBA|NBA Basketball
nba|5776649|07:00 pm|2023-03-25|Denver, CO|Bucks at Nuggets|Milwaukee Bucks at Denver Nuggets|Ball Arena|   187|0.662|39.7487|-105.0080|Denver Nuggets|Milwaukee Bucks|NA|NA|  81| 235| 11654|NBA|NBA Basketball
nba|5777459|07:00 pm|2023-03-11|Orlando, FL|Heat at Magic|Miami Heat at Orlando Magic|Amway Center|  2652|0.694|28.5392| -81.3839|Orlando Magic|Miami Heat|NA|NA|  70| 250| 11654|NBA|NBA Basketball
nba|5776067|07:30 pm|2023-03-03|Atlanta, GA|Trail Blazers at Hawks|Portland Trail Blazers at Atlanta Hawks|State Farm Arena|   127|0.669|33.7566| -84.3969|Atlanta Hawks|Portland Trail Blazers|NA|NA|  44| 150|  6615|NBA|NBA Basketball
nba|5777541|07:00 pm|2023-03-07|Oklahoma City, OK|Warriors at Thunder|Golden State Warriors at Oklahoma City Thunder|Paycom Center|   208|0.678|35.4634| -97.5151|Oklahoma City Thunder|Golden State Warriors|NA|NA|  34| 190|118504|NBA|NBA Basketball
nba|5777205|07:00 pm|2023-02-25|Memphis, TN|Nuggets at Grizzlies|Denver Nuggets at Memphis Grizzlies|FedExForum|  1243|0.651|35.1383| -90.0522|Memphis Grizzlies|Denver Nuggets|NA|NA|  80| 304|  6580|NBA|NBA Basketball
nba|5757782|07:00 pm|2023-03-23|New Orleans, LA|Hornets at Pelicans|Charlotte Hornets at New Orleans Pelicans|Smoothie King Center|   184|0.635|29.9490| -90.0821|New Orleans Pelicans|Charlotte Hornets|NA|NA|  18|  50|  2400|NBA|NBA Basketball
nba|5776571|07:00 pm|2023-03-27|Portland, OR|Pelicans at Trail Blazers|New Orleans Pelicans at Portland Trail Blazers|Moda Center|   256|0.633|45.5316|-122.6670|Portland Trail Blazers|New Orleans Pelicans|NA|NA|  21| 199|  2773|NBA|NBA Basketball
nba|5777461|07:00 pm|2023-03-21|Orlando, FL|Wizards at Magic|Washington Wizards at Orlando Magic|Amway Center|  2652|0.613|28.5392| -81.3839|Orlando Magic|Washington Wizards|NA|NA|  22| 108| 12354|NBA|NBA Basketball
nba|5761938|06:00 pm|2023-03-26|Cleveland, OH|Rockets at Cavaliers|Houston Rockets at Cleveland Cavaliers|Rocket Mortgage FieldHouse|   120|0.616|41.4971| -81.6884|Cleveland Cavaliers|Houston Rockets|NA|NA|  28| 110|  2000|NBA|NBA Basketball
nba|5776475|07:00 pm|2023-03-05|Los Angeles, CA|Grizzlies at Clippers|Memphis Grizzlies at Los Angeles Clippers|Crypto.com Arena|   134|0.703|34.0430|-118.2670|Los Angeles Clippers|Memphis Grizzlies|NA|NA|  39| 159|  8300|NBA|NBA Basketball
nba|5777545|07:00 pm|2023-03-28|Oklahoma City, OK|Hornets at Thunder|Charlotte Hornets at Oklahoma City Thunder|Paycom Center|   208|0.635|35.4634| -97.5151|Oklahoma City Thunder|Charlotte Hornets|NA|NA|  15| 157|  1231|NBA|NBA Basketball
nba|5777041|07:00 pm|2023-02-28|Houston, TX|Nuggets at Rockets|Denver Nuggets at Houston Rockets|Toyota Center|   129|0.608|29.7508| -95.3621|Houston Rockets|Denver Nuggets|NA|NA|  12|  46| 12454|NBA|NBA Basketball
nba|5777706|07:00 pm|2023-03-20|Salt Lake City, UT|Kings at Jazz|Sacramento Kings at Utah Jazz|Vivint Arena|   188|0.580|40.7676|-111.9010|Utah Jazz|Sacramento Kings|NA|NA|  15| 113| 12355|NBA|NBA Basketball
nba|5776081|07:30 pm|2023-03-28|Atlanta, GA|Cavaliers at Hawks|Cleveland Cavaliers at Atlanta Hawks|State Farm Arena|   127|0.659|33.7566| -84.3969|Atlanta Hawks|Cleveland Cavaliers|NA|NA|  36|  91| 12354|NBA|NBA Basketball
nba|5776149|07:00 pm|2023-02-24|Phoenix, AZ|Thunder at Suns|Oklahoma City Thunder at Phoenix Suns|Footprint Center|   130|0.679|33.4458|-112.0710|Phoenix Suns|Oklahoma City Thunder|NA|NA| 145| 649| 16044|NBA|NBA Basketball
nba|5776491|07:30 pm|2023-03-27|Los Angeles, CA|Bulls at Clippers|Chicago Bulls at Los Angeles Clippers|Crypto.com Arena|   134|0.723|34.0430|-118.2670|Los Angeles Clippers|Chicago Bulls|NA|NA|  44| 161|  9485|NBA|NBA Basketball
nba|5777463|07:00 pm|2023-03-23|Orlando, FL|Knicks at Magic|New York Knicks at Orlando Magic|Amway Center|  2652|0.662|28.5392| -81.3839|Orlando Magic|New York Knicks|NA|NA|  38| 154| 11854|NBA|NBA Basketball
nba|5777061|07:00 pm|2023-03-31|Houston, TX|Pistons at Rockets|Detroit Pistons at Houston Rockets|Toyota Center|   129|0.645|29.7508| -95.3621|Houston Rockets|Detroit Pistons|NA|NA|  14|  63|  6044|NBA|NBA Basketball
nba|5777385|07:00 pm|2023-03-16|Detroit, MI|Nuggets at Pistons|Denver Nuggets at Detroit Pistons|Little Caesars Arena|420444|0.621|42.3400| -83.0574|Detroit Pistons|Denver Nuggets|NA|NA|  41| 101|  5599|NBA|NBA Basketball
nba|5776645|07:00 pm|2023-03-08|Denver, CO|Bulls at Nuggets|Chicago Bulls at Denver Nuggets|Ball Arena|   187|0.658|39.7487|-105.0080|Denver Nuggets|Chicago Bulls|NA|NA|  34| 133| 12204|NBA|NBA Basketball
nba|5777633|07:00 pm|2023-03-31|Minneapolis, MN|Lakers at Timberwolves|Los Angeles Lakers at Minnesota Timberwolves|Target Center|   135|0.654|44.9795| -93.2761|Minnesota Timberwolves|Los Angeles Lakers|NA|NA|  68| 228|  3151|NBA|NBA Basketball
nba|5777788|07:30 pm|2023-03-15|San Antonio, TX|Mavericks at Spurs|Dallas Mavericks at San Antonio Spurs|AT&T Center|   185|0.653|29.4271| -98.4374|San Antonio Spurs|Dallas Mavericks|NA|NA|  38| 188|  4309|NBA|NBA Basketball
nba|5775993|07:00 pm|2023-03-10|Philadelphia, PA|Trail Blazers at 76ers|Portland Trail Blazers at Philadelphia 76ers|Wells Fargo Center|  3148|0.699|39.9012| -75.1720|Philadelphia 76ers|Portland Trail Blazers|NA|NA|  79| 258|  8010|NBA|NBA Basketball
nba|5777621|07:00 pm|2023-02-24|Minneapolis, MN|Hornets at Timberwolves|Charlotte Hornets at Minnesota Timberwolves|Target Center|   135|0.580|44.9795| -93.2761|Minnesota Timberwolves|Charlotte Hornets|NA|NA|  35| 110|   583|NBA|NBA Basketball
nba|5776235|05:00 pm|2023-03-12|Charlotte, NC|Cavaliers at Hornets|Cleveland Cavaliers at Charlotte Hornets|Spectrum Center|   112|0.670|35.2248| -80.8403|Charlotte Hornets|Cleveland Cavaliers|NA|NA|  26| 100|  3258|NBA|NBA Basketball
nba|5777371|12:00 pm|2023-02-25|Detroit, MI|Raptors at Pistons|Toronto Raptors at Detroit Pistons|Little Caesars Arena|420444|0.634|42.3400| -83.0574|Detroit Pistons|Toronto Raptors|NA|NA|  34| 177|  3008|NBA|NBA Basketball
nba|5776485|07:30 pm|2023-03-21|Los Angeles, CA|Thunder at Clippers|Oklahoma City Thunder at Los Angeles Clippers|Crypto.com Arena|   134|0.710|34.0430|-118.2670|Los Angeles Clippers|Oklahoma City Thunder|NA|NA|  18|  80|  7415|NBA|NBA Basketball
nba|5777063|06:00 pm|2023-04-02|Houston, TX|Lakers at Rockets|Los Angeles Lakers at Houston Rockets|Toyota Center|   129|0.709|29.7508| -95.3621|Houston Rockets|Los Angeles Lakers|NA|NA|  61| 164| 11954|NBA|NBA Basketball
nba|5777467|06:00 pm|2023-03-26|Orlando, FL|Nets at Magic|Brooklyn Nets at Orlando Magic|Amway Center|  2652|0.648|28.5392| -81.3839|Orlando Magic|Brooklyn Nets|NA|NA|  42| 182| 11854|NBA|NBA Basketball
nba|5776233|07:00 pm|2023-03-11|Charlotte, NC|Jazz at Hornets|Utah Jazz at Charlotte Hornets|Spectrum Center|   112|0.655|35.2248| -80.8403|Charlotte Hornets|Utah Jazz|NA|NA|  23| 106|  3259|NBA|NBA Basketball
nba|5777125|07:30 pm|2023-03-05|Washington, DC|Bucks at Wizards|Milwaukee Bucks at Washington Wizards (Rescheduled from 3/6/23)|Capital One Arena|   181|0.678|38.8981| -77.0209|Washington Wizards|Milwaukee Bucks|NA|NA|  37| 138|  7824|NBA|NBA Basketball
nba|5776573|07:00 pm|2023-03-29|Portland, OR|Kings at Trail Blazers|Sacramento Kings at Portland Trail Blazers|Moda Center|   256|0.637|45.5316|-122.6670|Portland Trail Blazers|Sacramento Kings|NA|NA|  17| 123|  2939|NBA|NBA Basketball
nba|5776805|07:30 pm|2023-03-04|Milwaukee, WI|76ers at Bucks|Philadelphia 76ers at Milwaukee Bucks|Fiserv Forum|435592|0.655|43.0417| -87.9162|Milwaukee Bucks|Philadelphia 76ers|NA|NA|  91| 295| 12209|NBA|NBA Basketball
nba|5776241|07:00 pm|2023-03-20|Charlotte, NC|Pacers at Hornets|Indiana Pacers at Charlotte Hornets|Spectrum Center|   112|0.628|35.2248| -80.8403|Charlotte Hornets|Indiana Pacers|NA|NA|  16|  92|  2537|NBA|NBA Basketball
nba|5775905|07:00 pm|2023-03-04|Sacramento, CA|Timberwolves at Kings|Minnesota Timberwolves at Sacramento Kings|Golden 1 Center|177304|0.620|38.5161|-121.4170|Sacramento Kings|Minnesota Timberwolves|NA|NA|  60| 228| 11654|NBA|NBA Basketball
nba|5776803|07:00 pm|2023-03-01|Milwaukee, WI|Magic at Bucks|Orlando Magic at Milwaukee Bucks|Fiserv Forum|435592|0.601|43.0417| -87.9162|Milwaukee Bucks|Orlando Magic|NA|NA|  27| 138| 12585|NBA|NBA Basketball
nba|5777119|07:00 pm|2023-02-24|Washington, DC|Knicks at Wizards|New York Knicks at Washington Wizards|Capital One Arena|   181|0.699|38.8981| -77.0209|Washington Wizards|New York Knicks|NA|NA|  64| 169|  6784|NBA|NBA Basketball
nba|5777547|02:30 pm|2023-03-19|Oklahoma City, OK|Suns at Thunder|Phoenix Suns at Oklahoma City Thunder|Paycom Center|   208|0.658|35.4634| -97.5151|Oklahoma City Thunder|Phoenix Suns|NA|NA|  40| 199|  4582|NBA|NBA Basketball
nba|5775743|07:00 pm|2023-02-24|San Francisco, CA|Rockets at Warriors|Houston Rockets at Golden State Warriors|Chase Center|467029|0.743|37.7704|-122.3870|Golden State Warriors|Houston Rockets|NA|NA| 122| 402| 18043|NBA|NBA Basketball
nba|5777549|07:00 pm|2023-03-29|Oklahoma City, OK|Pistons at Thunder|Detroit Pistons at Oklahoma City Thunder|Paycom Center|   208|0.639|35.4634| -97.5151|Oklahoma City Thunder|Detroit Pistons|NA|NA|  12| 117|   908|NBA|NBA Basketball
mlb|5793902|01:10 pm|2023-03-11|Peoria, AZ|Spring Training: White Sox at Padres|Spring Training: Chicago White Sox at San Diego Padres|Peoria Sports Complex|  3924|0.517|33.6321|-112.2330|San Diego Padres|Chicago White Sox|NA|NA|  43|  69|   397|MLB|MLB Baseball
mlb|5793750|06:35 pm|2023-03-16|Tampa, FL|Spring Training: Pirates at Yankees|Spring Training: Pittsburgh Pirates at New York Yankees |George M. Steinbrenner Field|  3937|0.583|27.9798| -82.5072|New York Yankees|Pittsburgh Pirates|NA|NA|  47|  88|   784|MLB|MLB Baseball
mlb|5793794|01:05 pm|2023-03-08|Mesa, AZ|Exhibition: WBC (Split Squad) at Chicago Cubs|Exhibition: WBC (Split Squad) at Chicago Cubs|Sloan Park| 57343|0.539|33.4311|-111.8820|Chicago Cubs|World Baseball Classic|NA|NA|  22|  73|   399|MLB|MLB Baseball
mlb|5784929|04:05 pm|2023-04-01|Bronx, NY|Giants at Yankees|San Francisco Giants at New York Yankees|Yankee Stadium|     8|0.775|40.8296| -73.9262|New York Yankees|San Francisco Giants|NA|NA|  49| 152|  6005|MLB|MLB Baseball
mlb|5794326|01:05 pm|2023-03-02|Bradenton, FL|Spring Training: Yankees at Pirates|Spring Training: New York Yankees at Pittsburgh Pirates (Split Squad)|LECOM Park|  3941|0.573|27.4846| -82.5713|Pittsburgh Pirates|New York Yankees|NA|NA|  27|  68|   842|MLB|MLB Baseball
mlb|5793708|01:05 pm|2023-03-11|Tampa, FL|Spring Training: Phillies at Yankees|Spring Training: Philadelphia Phillies at New York Yankees (Split Squad)|George M. Steinbrenner Field|  3937|0.620|27.9798| -82.5072|New York Yankees|Philadelphia Phillies|NA|NA|  61| 118|   842|MLB|MLB Baseball
mlb|5794062|01:05 pm|2023-03-23|Jupiter, FL|Spring Training: Yankees at Cardinals|Spring Training: New York Yankees at St. Louis Cardinals|Roger Dean Stadium|  3927|0.609|26.8910| -80.1163|St. Louis Cardinals|New York Yankees|NA|NA|  47| 175|   443|MLB|MLB Baseball
mlb|5794000|01:10 pm|2023-02-26|Tempe, AZ|Spring Training: White Sox at Angels|Spring Training: Chicago White Sox at Los Angeles Angels|Tempe Diablo Stadium|  3939|0.519|33.4009|-111.9700|Los Angeles Angels|Chicago White Sox|NA|NA|  34|  73|   391|MLB|MLB Baseball
mlb|5794176|01:05 pm|2023-03-17|Clearwater, FL|Spring Training: Blue Jays at Phillies|Spring Training: Toronto Blue Jays (Split Squad) at Philadelphia Phillies (Split Squad)|BayCare Ballpark|  3942|0.583|27.9709| -82.7317|Philadelphia Phillies|Toronto Blue Jays|NA|NA|  51| 101|   397|MLB|MLB Baseball
mlb|5786725|07:10 pm|2023-03-30|Seattle, WA|Guardians at Mariners|Cleveland Guardians at Seattle Mariners|T-Mobile Park|    13|0.539|47.5914|-122.3330|Seattle Mariners|Cleveland Guardians|NA|NA|  44|  96|  1374|MLB|MLB Baseball
mlb|5794410|01:05 pm|2023-03-11|Fort Myers, FL|Spring Training: Red Sox at Twins|Spring Training: Boston Red Sox at Minnesota Twins|Hammond Stadium|  3944|0.594|26.5378| -81.8420|Minnesota Twins|Boston Red Sox|NA|NA|  30|  59|   397|MLB|MLB Baseball
mlb|5794154|01:05 pm|2023-03-03|Clearwater, FL|Spring Training: Tigers at Phillies|Spring Training: Detroit Tigers (Split Squad) at Philadelphia Phillies|BayCare Ballpark|  3942|0.585|27.9709| -82.7317|Philadelphia Phillies|Detroit Tigers|NA|NA|  38|  76|   397|MLB|MLB Baseball
mlb|5793846|01:05 pm|2023-03-01|West Palm Beach, FL|Spring Training: Red Sox at Astros|Spring Training: Boston Red Sox at Houston Astros|The Ballpark of the Palm Beaches|419759|0.522|26.7579| -80.1169|Houston Astros|Boston Red Sox|NA|NA|  47|  94|   397|MLB|MLB Baseball
mlb|5794432|01:05 pm|2023-03-23|Fort Myers, FL|Spring Training: Blue Jays at Twins|Spring Training: Toronto Blue Jays at Minnesota Twins|Hammond Stadium|  3944|0.531|26.5378| -81.8420|Minnesota Twins|Toronto Blue Jays|NA|NA|  36|  58|   397|MLB|MLB Baseball
mlb|5794632|01:07 pm|2023-03-18|Dunedin, FL|Spring Training: Yankees at Blue Jays|Spring Training: New York Yankees at Toronto Blue Jays|TD Ballpark|  3936|0.574|28.0036| -82.7868|Toronto Blue Jays|New York Yankees|NA|NA|  38|  91|   397|MLB|MLB Baseball
mlb|5793978|01:05 pm|2023-02-28|Scottsdale, AZ|Spring Training: Padres at Giants|Spring Training: San Diego Padres at San Francisco Giants|Scottsdale Stadium|  3925|0.569|33.4893|-111.9210|San Francisco Giants|San Diego Padres|NA|NA|  23|  59|   397|MLB|MLB Baseball
mlb|5794416|01:05 pm|2023-03-14|Fort Myers, FL|Spring Training: Pirates at Twins|Spring Training: Pittsburgh Pirates (Split Squad) at Minnesota Twins (Split Squad)|Hammond Stadium|  3944|0.517|26.5378| -81.8420|Minnesota Twins|Pittsburgh Pirates|NA|NA|  29|  41|   374|MLB|MLB Baseball
mlb|5785192|02:10 pm|2023-03-30|Boston, MA|Orioles at Red Sox|Baltimore Orioles at Boston Red Sox|Fenway Park|    21|0.666|42.3456| -71.0983|Boston Red Sox|Baltimore Orioles|NA|NA| 101| 215|  2525|MLB|MLB Baseball
mlb|5794336|01:05 pm|2023-03-09|Bradenton, FL|Spring Training: Tigers at Pirates|Spring Training: Detroit Tigers at Pittsburgh Pirates|LECOM Park|  3941|0.517|27.4846| -82.5713|Pittsburgh Pirates|Detroit Tigers|NA|NA|  31|  68|   630|MLB|MLB Baseball
mlb|5793908|01:05 pm|2023-03-05|Surprise, AZ|Spring Training: Angels at Rangers|Spring Training: Los Angeles Angels (Split Squad) at Texas Rangers|Surprise Stadium|  3930|0.560|33.6269|-112.3770|Texas Rangers|Los Angeles Angels|NA|NA|  17|  55|   397|MLB|MLB Baseball
mlb|5793740|01:05 pm|2023-03-27|North Port, FL|Spring Training: Red Sox at Braves|Spring Training: Boston Red Sox at Atlanta Braves|CoolToday Park|462490|0.570|27.0328| -82.3200|Atlanta Braves|Boston Red Sox|NA|NA|  39|  94|   692|MLB|MLB Baseball
mlb|5793790|01:05 pm|2023-03-05|Phoenix, AZ|Spring Training: White Sox at Dodgers|Spring Training: Chicago White Sox at Los Angeles Dodgers|Camelback Ranch|   395|0.566|33.5132|-112.2950|Los Angeles Dodgers|Chicago White Sox|NA|NA|  31|  79|   397|MLB|MLB Baseball
mlb|5786432|01:15 pm|2023-04-01|St. Louis, MO|Blue Jays at Cardinals|Toronto Blue Jays at St. Louis Cardinals|Busch Stadium|    27|0.714|38.6226| -90.1928|St. Louis Cardinals|Toronto Blue Jays|NA|NA|  34| 143| 27892|MLB|MLB Baseball
mlb|5784893|07:10 pm|2023-03-31|Los Angeles, CA|Diamondbacks at Dodgers|Arizona Diamondbacks at Los Angeles Dodgers|Dodger Stadium|     1|0.681|34.0718|-118.2460|Los Angeles Dodgers|Arizona Diamondbacks|NA|NA|  49| 247|  2312|MLB|MLB Baseball
mlb|5787410|03:10 pm|2023-03-30|Saint Petersburg, FL|Detroit Tigers at Tampa Bay Rays - Opening Day|Detroit Tigers at Tampa Bay Rays - Opening Day|Tropicana Field|     4|0.423|27.7682| -82.6534|Tampa Bay Rays|Detroit Tigers|MLB Opening Day|NA|  40| 134|  7071|MLB|MLB Baseball
mlb|5793924|01:05 pm|2023-03-11|Surprise, AZ|Spring Training: Reds at Rangers|Spring Training: Cincinnati Reds at Texas Rangers|Surprise Stadium|  3930|0.552|33.6269|-112.3770|Texas Rangers|Cincinnati Reds|NA|NA|  20|  60|   397|MLB|MLB Baseball
mlb|5785214|01:35 pm|2023-04-02|Boston, MA|Orioles at Red Sox|Baltimore Orioles at Boston Red Sox|Fenway Park|    21|0.716|42.3456| -71.0983|Boston Red Sox|Baltimore Orioles|NA|NA|  45| 107|  1879|MLB|MLB Baseball
mlb|5793764|01:05 pm|2023-03-26|Fort Myers, FL|Spring Training: Twins at Red Sox|Spring Training: Minnesota Twins at Boston Red Sox|JetBlue Park|  6992|0.612|26.5487| -81.7612|Boston Red Sox|Minnesota Twins|NA|NA|  20|  85|   614|MLB|MLB Baseball
mlb|5797223|01:10 pm|2023-03-04|Scottsdale, AZ|Spring Training: Padres at Diamondbacks|Spring Training: San Diego Padres at Arizona Diamondbacks (Split Squad)|Salt River Fields at Talking Stick|  3931|0.574|33.5457|-111.8860|Arizona Diamondbacks|San Diego Padres|NA|NA|  37|  91|   397|MLB|MLB Baseball
mlb|5787398|01:35 pm|2023-04-02|Washington, DC|Braves at Nationals|Atlanta Braves at Washington Nationals|Nationals Park|  3713|0.672|38.8719| -77.0093|Washington Nationals|Atlanta Braves|NA|NA|  37| 100|   672|MLB|MLB Baseball
mlb|5793754|01:05 pm|2023-03-19|Tampa, FL|Spring Training: Orioles at Yankees|Spring Training: Baltimore Orioles (Split Squad) at New York Yankees |George M. Steinbrenner Field|  3937|0.603|27.9798| -82.5072|New York Yankees|Baltimore Orioles|NA|NA|  45|  94|   717|MLB|MLB Baseball
mlb|5793852|01:05 pm|2023-03-27|Mesa, AZ|Spring Training: White Sox at Cubs|Spring Training: Chicago White Sox at Chicago Cubs|Sloan Park| 57343|0.587|33.4311|-111.8820|Chicago Cubs|Chicago White Sox|NA|NA|  52| 110|   397|MLB|MLB Baseball
mlb|5793824|01:05 pm|2023-03-23|Mesa, AZ|Spring Training: Diamondbacks at Cubs|Spring Training: Arizona Diamondbacks (Split Squad) at Chicago Cubs|Sloan Park| 57343|0.573|33.4311|-111.8820|Chicago Cubs|Arizona Diamondbacks|NA|NA|  32|  82|   397|MLB|MLB Baseball
mlb|5784889|07:10 pm|2023-03-30|Los Angeles, CA|Diamondbacks at Dodgers - Opening Day|Arizona Diamondbacks at Los Angeles Dodgers - Opening Day|Dodger Stadium|     1|0.692|34.0718|-118.2460|Los Angeles Dodgers|Arizona Diamondbacks|MLB Opening Day|NA| 177| 408|  4478|MLB|MLB Baseball
mlb|5785546|03:05 pm|2023-04-01|Arlington, TX|Phillies at Rangers|Philadelphia Phillies at Texas Rangers|Globe Life Field|487468|0.708|32.7472| -97.0838|Texas Rangers|Philadelphia Phillies|NA|NA|  48| 149|121004|MLB|MLB Baseball
mlb|5797224|01:07 pm|2023-03-17|Dunedin, FL|Spring Training: Phillies at Blue Jays|Spring Training: Philadelphia Phillies (Split Squad) at Toronto Blue Jays (Split Squad)|TD Ballpark|  3936|0.514|28.0036| -82.7868|Toronto Blue Jays|Philadelphia Phillies|NA|NA|  29|  64|   397|MLB|MLB Baseball
mlb|5794208|01:10 pm|2023-02-28|Scottsdale, AZ|Spring Training: White Sox at Diamondbacks|Spring Training: Chicago White Sox at Arizona Diamondbacks|Salt River Fields at Talking Stick|  3931|0.519|33.5457|-111.8860|Arizona Diamondbacks|Chicago White Sox|NA|NA|  17|  67|   397|MLB|MLB Baseball
mlb|5799107|01:05 pm|2023-03-05|Fort Myers, FL|Spring Training: Tigers at Twins|Spring Training: Detroit Tigers at Minnesota Twins|Hammond Stadium|  3944|0.557|26.5378| -81.8420|Minnesota Twins|Detroit Tigers|NA|NA|  31|  63|   397|MLB|MLB Baseball
mlb|5797221|01:05 pm|2023-03-13|North Port, FL|Spring Training: Orioles at Braves|Spring Training: Baltimore Orioles (Split Squad) at Atlanta Braves|CoolToday Park|462490|0.536|27.0328| -82.3200|Atlanta Braves|Baltimore Orioles|NA|NA|  27|  96|   407|MLB|MLB Baseball
mlb|5794034|01:05 pm|2023-03-16|Jupiter, FL|Spring Training: Astros at Cardinals|Spring Training: Houston Astros at St. Louis Cardinals|Roger Dean Stadium|  3927|0.544|26.8910| -80.1163|St. Louis Cardinals|Houston Astros|NA|NA|  38|  71|   397|MLB|MLB Baseball
mlb|5793980|01:05 pm|2023-03-01|Scottsdale, AZ|Spring Training: Diamondbacks at Giants|Spring Training: Arizona Diamondbacks at San Francisco Giants|Scottsdale Stadium|  3925|0.584|33.4893|-111.9210|San Francisco Giants|Arizona Diamondbacks|NA|NA|  29|  66|   423|MLB|MLB Baseball
mlb|5793706|01:05 pm|2023-03-08|North Port, FL|Exhibition: Dominican Republic at Atlanta Braves|Exhibition: Dominican Republic at Atlanta Braves|CoolToday Park|462490|0.498|27.0328| -82.3200|Atlanta Braves|World Baseball Classic|NA|NA|  32|  98|   401|MLB|MLB Baseball
mlb|5793690|01:05 pm|2023-03-04|Tampa, FL|Spring Training: Rays at Yankees|Spring Training: Tampa Bay Rays at New York Yankees|George M. Steinbrenner Field|  3937|0.631|27.9798| -82.5072|New York Yankees|Tampa Bay Rays|NA|NA|  69| 132|  9228|MLB|MLB Baseball
mlb|5794350|01:05 pm|2023-03-23|Bradenton, FL|Spring Training: Red Sox at Pirates|Spring Training: Boston Red Sox at Pittsburgh Pirates|LECOM Park|  3941|0.554|27.4846| -82.5713|Pittsburgh Pirates|Boston Red Sox|NA|NA|  36|  77|  1409|MLB|MLB Baseball
mlb|5794134|01:05 pm|2023-03-22|West Palm Beach, FL|Spring Training: Yankees at Nationals|Spring Training: New York Yankees at Washington Nationals|The Ballpark of the Palm Beaches|419759|0.551|26.7579| -80.1169|Washington Nationals|New York Yankees|NA|NA|  58| 141|   385|MLB|MLB Baseball
mlb|5794070|12:10 pm|2023-03-28|Scottsdale, AZ|Spring Training: Brewers at Rockies|Spring Training: Milwaukee Brewers at Colorado Rockies|Salt River Fields at Talking Stick|  3931|0.497|33.5457|-111.8860|Colorado Rockies|Milwaukee Brewers|NA|NA|  25|  88|   380|MLB|MLB Baseball
mlb|5794324|01:05 pm|2023-02-28|Bradenton, FL|Spring Training: Orioles at Pirates|Spring Training: Baltimore Orioles at Pittsburgh Pirates|LECOM Park|  3941|0.488|27.4846| -82.5713|Pittsburgh Pirates|Baltimore Orioles|NA|NA|  17|  44|   397|MLB|MLB Baseball
mlb|5794190|01:05 pm|2023-03-23|Clearwater, FL|Spring Training: Tigers at Phillies|Spring Training: Detroit Tigers (Split Squad) at Philadelphia Phillies|BayCare Ballpark|  3942|0.563|27.9709| -82.7317|Philadelphia Phillies|Detroit Tigers|NA|NA|  36|  83|   397|MLB|MLB Baseball
mlb|5794614|01:07 pm|2023-03-02|Dunedin, FL|Spring Training: Pirates at Blue Jays|Spring Training: Pittsburgh Pirates (Split Squad) at Toronto Blue Jays|TD Ballpark|  3936|0.461|28.0036| -82.7868|Toronto Blue Jays|Pittsburgh Pirates|NA|NA|  29|  62|   380|MLB|MLB Baseball
mlb|5784932|01:35 pm|2023-04-02|Bronx, NY|Giants at Yankees|San Francisco Giants at New York Yankees|Yankee Stadium|     8|0.753|40.8296| -73.9262|New York Yankees|San Francisco Giants|NA|NA|  30| 112|  6255|MLB|MLB Baseball
mlb|5785782|05:40 pm|2023-04-01|San Diego, CA|Rockies at Padres|Colorado Rockies at San Diego Padres|Petco Park|    24|0.632|32.7071|-117.1560|San Diego Padres|Colorado Rockies|NA|NA|  36| 119|  1032|MLB|MLB Baseball
mlb|5794072|01:05 pm|2023-03-25|Jupiter, FL|Spring Training: Marlins at Cardinals|Spring Training: Miami Marlins at St. Louis Cardinals (Split Squad)|Roger Dean Stadium|  3927|0.562|26.8910| -80.1163|St. Louis Cardinals|Miami Marlins|NA|NA|  14|  61|   397|MLB|MLB Baseball
mlb|5793760|01:05 pm|2023-03-21|Tampa, FL|Spring Training: Tigers at Yankees|Spring Training: Detroit Tigers at New York Yankees |George M. Steinbrenner Field|  3937|0.576|27.9798| -82.5072|New York Yankees|Detroit Tigers|NA|NA|  46|  88|   717|MLB|MLB Baseball
mlb|5793883|01:05 pm|2023-02-25|Surprise, AZ|Spring Training: Royals at Rangers|Spring Training: Kansas City Royals at Texas Rangers|Surprise Stadium|  3930|0.561|33.6269|-112.3770|Texas Rangers|Kansas City Royals|NA|NA|  14|  59|   111|MLB|MLB Baseball
mlb|5794038|01:05 pm|2023-03-18|Jupiter, FL|Spring Training: Tigers at Cardinals|Spring Training: Detroit Tigers at St. Louis Cardinals|Roger Dean Stadium|  3927|0.593|26.8910| -80.1163|St. Louis Cardinals|Detroit Tigers|NA|NA|  44|  92|   374|MLB|MLB Baseball
mlb|5794462|01:05 pm|2023-03-10|Lakeland, FL|Spring Training: Yankees at Tigers|Spring Training: New York Yankees at Detroit Tigers|Publix Field at Joker Marchant Stadium|  3929|0.624|28.0745| -81.9510|Detroit Tigers|New York Yankees|NA|NA|  42|  93|   462|MLB|MLB Baseball
mlb|5793840|06:05 pm|2023-03-16|Phoenix, AZ|Spring Training: Rangers at Dodgers|Spring Training: Texas Rangers at Los Angeles Dodgers|Camelback Ranch|   395|0.551|33.5132|-112.2950|Los Angeles Dodgers|Texas Rangers|NA|NA|  35|  89|   397|MLB|MLB Baseball
mlb|5793788|01:05 pm|2023-03-02|Phoenix, AZ|Spring Training: Diamondbacks at Dodgers|Spring Training: Arizona Diamondbacks at Los Angeles Dodgers|Camelback Ranch|   395|0.546|33.5132|-112.2950|Los Angeles Dodgers|Arizona Diamondbacks|NA|NA|  22|  71|   397|MLB|MLB Baseball
mlb|5794700|01:05 pm|2023-03-12|Mesa, AZ|Spring Training: Padres at Athletics|Spring Training: San Diego Padres at Oakland Athletics (Split Squad)|Hohokam Stadium|  3933|0.488|33.4386|-111.8300|Oakland Athletics|San Diego Padres|NA|NA|  37|  98|   366|MLB|MLB Baseball
mlb|5794384|01:10 pm|2023-03-19|Peoria, AZ|Spring Training: White Sox at Mariners|Spring Training: Chicago White Sox at Seattle Mariners (Split Squad)|Peoria Sports Complex|  3924|0.493|33.6321|-112.2330|Seattle Mariners|Chicago White Sox|NA|NA|  41|  72|   397|MLB|MLB Baseball
mlb|5793738|06:05 pm|2023-03-08|Fort Myers, FL|Exhibition: Puerto Rico at Boston Red Sox|Exhibition: Puerto Rico at Boston Red Sox|JetBlue Park|  6992|0.568|26.5487| -81.7612|Boston Red Sox|World Baseball Classic|NA|NA|  24|  74|   614|MLB|MLB Baseball
