league|id|time|date|city|title|full|venue|ven_id|score|lat|long|t1|t2|t3|t4|low|med|high|name|xname
mlb|5789232|07:10 pm|2023-04-21|Cleveland, OH|Marlins at Guardians|Miami Marlins at Cleveland Guardians|Progressive Field|     6|0.626|41.4962| -81.6852|Cleveland Guardians|Miami Marlins|NA|NA|  31|  81|  1249|MLB|MLB Baseball
mlb|5788974|01:10 pm|2023-04-19|Kansas City, MO|Rangers at Royals|Texas Rangers at Kansas City Royals|Kauffman Stadium|  3714|0.626|39.0515| -94.4803|Kansas City Royals|Texas Rangers|NA|NA|  12|  56|  2499|MLB|MLB Baseball
mlb|5788257|06:10 pm|2023-04-08|Milwaukee, WI|Cardinals at Brewers|St. Louis Cardinals at Milwaukee Brewers|American Family Field|    15|0.681|43.0296| -87.9725|Milwaukee Brewers|St. Louis Cardinals|NA|NA|  29|  70| 13254|MLB|MLB Baseball
mlb|5794060|01:05 pm|2023-03-18|Scottsdale, AZ|Spring Training: Cubs at Giants|Spring Training: Chicago Cubs at San Francisco Giants|Scottsdale Stadium|  3925|0.681|33.4893|-111.9210|San Francisco Giants|Chicago Cubs|NA|NA|  86| 128|   325|MLB|MLB Baseball
mlb|5785646|01:30 pm|2023-04-23|Atlanta, GA|Astros at Braves|Houston Astros at Atlanta Braves|Truist Park|418889|0.681|33.8897| -84.4654|Atlanta Braves|Houston Astros|NA|NA|  33| 144|  1805|MLB|MLB Baseball
mlb|5788276|01:10 pm|2023-04-23|Milwaukee, WI|Red Sox at Brewers|Boston Red Sox at Milwaukee Brewers|American Family Field|    15|0.681|43.0296| -87.9725|Milwaukee Brewers|Boston Red Sox|NA|NA|  27|  79| 13254|MLB|MLB Baseball
mlb|5788900|01:10 pm|2023-04-02|Kansas City, MO|Twins at Royals|Minnesota Twins at Kansas City Royals|Kauffman Stadium|  3714|0.625|39.0515| -94.4803|Kansas City Royals|Minnesota Twins|NA|NA|  24| 100|  2499|MLB|MLB Baseball
mlb|5794346|01:05 pm|2023-03-18|Bradenton, FL|Spring Training: Twins at Pirates|Spring Training: Minnesota Twins at Pittsburgh Pirates|LECOM Park|  3941|0.543|27.4846| -82.5713|Pittsburgh Pirates|Minnesota Twins|NA|NA|  21|  39|   427|MLB|MLB Baseball
mlb|5787920|01:10 pm|2023-04-23|Minneapolis, MN|Nationals at Twins|Washington Nationals at Minnesota Twins|Target Field|  3712|0.661|44.9817| -93.2776|Minnesota Twins|Washington Nationals|NA|NA|  15|  62|  1124|MLB|MLB Baseball
mlb|5785858|06:40 pm|2023-04-17|San Diego, CA|Braves at Padres|Atlanta Braves at San Diego Padres|Petco Park|    24|0.625|32.7076|-117.1570|San Diego Padres|Atlanta Braves|NA|NA|  28|  84|  1005|MLB|MLB Baseball
mlb|5785234|01:35 pm|2023-04-05|Boston, MA|Pirates at Red Sox|Pittsburgh Pirates at Boston Red Sox|Fenway Park|    21|0.680|42.3456| -71.0983|Boston Red Sox|Pittsburgh Pirates|NA|NA|  17|  60|  1879|MLB|MLB Baseball
mlb|5785600|07:20 pm|2023-04-08|Atlanta, GA|Padres at Braves|San Diego Padres at Atlanta Braves|Truist Park|418889|0.680|33.8897| -84.4654|Atlanta Braves|San Diego Padres|NA|NA|  36| 130|  6303|MLB|MLB Baseball
mlb|5833954|01:05 pm|2023-03-27|Sarasota, FL|Spring Training: Cardinals at Orioles|Spring Training: St. Louis Cardinals at Baltimore Orioles|Ed Smith Stadium|  3923|0.541|27.3482| -82.5176|Baltimore Orioles|St. Louis Cardinals|NA|NA|  58|  77|   254|MLB|MLB Baseball
mlb|5787835|01:10 pm|2023-04-08|Minneapolis, MN|Astros at Twins|Houston Astros at Minnesota Twins|Target Field|  3712|0.661|44.9817| -93.2776|Minnesota Twins|Houston Astros|NA|NA|  18|  75|  1124|MLB|MLB Baseball
mlb|5787743|06:35 pm|2023-04-24|Baltimore, MD|Red Sox at Orioles|Boston Red Sox at Baltimore Orioles|Oriole Park at Camden Yards|    25|0.661|39.2840| -76.6199|Baltimore Orioles|Boston Red Sox|NA|NA|  34|  79|   624|MLB|MLB Baseball
mlb|5785576|07:05 pm|2023-04-11|Arlington, TX|Kansas City Royals at Texas Rangers|Kansas City Royals at Texas Rangers|Globe Life Field|487468|0.661|32.7472| -97.0838|Texas Rangers|Kansas City Royals|NA|NA|  17|  51|  1259|MLB|MLB Baseball
mlb|5794046|01:05 pm|2023-03-20|Jupiter, FL|Spring Training: Marlins at Cardinals|Spring Training: Miami Marlins at St. Louis Cardinals|Roger Dean Stadium|  3927|0.538|26.8910| -80.1163|St. Louis Cardinals|Miami Marlins|NA|NA|  31|  53|   269|MLB|MLB Baseball
mlb|5785786|01:10 pm|2023-04-02|San Diego, CA|Rockies at Padres|Colorado Rockies at San Diego Padres|Petco Park|    24|0.624|32.7076|-117.1570|San Diego Padres|Colorado Rockies|NA|NA|  52|  91|   874|MLB|MLB Baseball
mlb|5787480|06:40 pm|2023-04-21|Saint Petersburg, FL|White Sox at Rays|Chicago White Sox at Tampa Bay Rays|Tropicana Field|     4|0.607|27.7682| -82.6534|Tampa Bay Rays|Chicago White Sox|NA|NA|  45| 115|   379|MLB|MLB Baseball
mlb|5785226|07:10 pm|2023-04-04|Boston, MA|Pirates at Red Sox|Pittsburgh Pirates at Boston Red Sox|Fenway Park|    21|0.679|42.3456| -71.0983|Boston Red Sox|Pittsburgh Pirates|NA|NA|  17|  67|  1879|MLB|MLB Baseball
mlb|5785606|07:08 pm|2023-04-09|Atlanta, GA|Padres at Braves|San Diego Padres at Atlanta Braves|Truist Park|418889|0.660|33.8897| -84.4654|Atlanta Braves|San Diego Padres|NA|NA|  20|  81|  1505|MLB|MLB Baseball
mlb|5789196|04:10 pm|2023-03-30|Miami, FL|Mets at Marlins - Opening Day|New York Mets at Miami Marlins - Opening Day|loanDepot park|  6371|0.538|25.7617| -80.1918|Miami Marlins|New York Mets|MLB Opening Day|NA|  44| 116|  1013|MLB|MLB Baseball
mlb|5789200|04:10 pm|2023-04-07|Cleveland, OH|Mariners at Guardians - Guardians Home Opener|Seattle Mariners at Cleveland Guardians - Guardians Home Opener|Progressive Field|     6|0.679|41.4962| -81.6852|Cleveland Guardians|Seattle Mariners|NA|NA|  76| 204|  1169|MLB|MLB Baseball
mlb|5787334|01:05 pm|2023-03-30|Washington, DC|Braves at Nationals - Opening Day|Atlanta Braves at Washington Nationals - Opening Day|Nationals Park|  3713|0.606|38.8719| -77.0093|Washington Nationals|Atlanta Braves|MLB Opening Day|NA|  51|  97|   873|MLB|MLB Baseball
mlb|5787358|06:40 pm|2023-04-24|Phoenix, AZ|Royals at Diamondbacks|Kansas City Royals at Arizona Diamondbacks|Chase Field|    30|0.606|33.4453|-112.0670|Arizona Diamondbacks|Kansas City Royals|NA|NA|  30|  89|   874|MLB|MLB Baseball
mlb|5793726|06:05 pm|2023-03-18|North Port, FL|Spring Training: Phillies at Braves|Spring Training: Philadelphia Phillies at Atlanta Braves|CoolToday Park|462490|0.605|27.0328| -82.3200|Atlanta Braves|Philadelphia Phillies|NA|NA|  81| 145|   302|MLB|MLB Baseball
mlb|5949599|04:05 pm|2023-04-20|Bronx, NY|Angels at Yankees - Premium Seating|Los Angeles Angels at New York Yankees - Premium Seating|Yankee Stadium|     8|0.678|40.8296| -73.9262|New York Yankees|Los Angeles Angels|NA|NA| 593| 669|  1102|MLB|MLB Baseball
mlb|5787927|06:40 pm|2023-04-24|Minneapolis, MN|Yankees at Twins|New York Yankees at Minnesota Twins|Target Field|  3712|0.678|44.9817| -93.2776|Minnesota Twins|New York Yankees|NA|NA|  15|  84|  1124|MLB|MLB Baseball
mlb|5794432|01:05 pm|2023-03-23|Fort Myers, FL|Spring Training: Blue Jays at Twins|Spring Training: Toronto Blue Jays at Minnesota Twins|Hammond Stadium|  3944|0.534|26.5400| -81.8400|Minnesota Twins|Toronto Blue Jays|NA|NA|  24|  49|    95|MLB|MLB Baseball
mlb|5789072|07:07 pm|2023-03-30|Oakland, CA|Angels at Athletics - Opening Day|Los Angeles Angels at Oakland Athletics - Opening Day|RingCentral Coliseum|    14|0.534|37.7514|-122.2010|Oakland Athletics|Los Angeles Angels|MLB Opening Day|NA|  40|  96| 13754|MLB|MLB Baseball
mlb|5789208|06:10 pm|2023-04-08|Cleveland, OH|Mariners at Guardians|Seattle Mariners at Cleveland Guardians|Progressive Field|     6|0.658|41.4962| -81.6852|Cleveland Guardians|Seattle Mariners|NA|NA|  40|  84|  1249|MLB|MLB Baseball
mlb|5787312|05:10 pm|2023-04-08|Phoenix, AZ|Dodgers at Diamondbacks|Los Angeles Dodgers at Arizona Diamondbacks|Chase Field|    30|0.677|33.4453|-112.0670|Arizona Diamondbacks|Los Angeles Dodgers|NA|NA|  50| 127|   874|MLB|MLB Baseball
mlb|5793770|01:05 pm|2023-03-26|Tampa, FL|Spring Training: Blue Jays at Yankees|Spring Training: Toronto Blue Jays at New York Yankees |George M. Steinbrenner Field|  3937|0.622|27.9798| -82.5072|New York Yankees|Toronto Blue Jays|NA|NA|  64| 128|   691|MLB|MLB Baseball
mlb|5788558|01:10 pm|2023-04-19|Detroit, MI|Guardians at Tigers|Cleveland Guardians at Detroit Tigers|Comerica Park|    12|0.622|42.3390| -83.0485|Detroit Tigers|Cleveland Guardians|NA|NA|  10|  46|  1379|MLB|MLB Baseball
mlb|5833964|06:05 pm|2023-03-23|Scottsdale, AZ|Spring Training: Guardians at Giants|Spring Training: Cleveland Guardians at San Francisco Giants|Scottsdale Stadium|  3925|0.603|33.4893|-111.9210|San Francisco Giants|Cleveland Guardians|NA|NA|  37|  90|   635|MLB|MLB Baseball
mlb|5794260|01:10 pm|2023-03-19|Scottsdale, AZ|Spring Training: Royals at Diamondbacks|Spring Training: Kansas City Royals at Arizona Diamondbacks|Salt River Fields at Talking Stick|  3931|0.571|33.5457|-111.8860|Arizona Diamondbacks|Kansas City Royals|NA|NA|  41|  79|   158|MLB|MLB Baseball
mlb|5949589|07:05 pm|2023-04-14|Bronx, NY|Twins at Yankees - Premium Seating|Minnesota Twins at New York Yankees - Premium Seating|Yankee Stadium|     8|0.677|40.8296| -73.9262|New York Yankees|Minnesota Twins|NA|NA| 593| 646|   918|MLB|MLB Baseball
mlb|5787430|01:10 pm|2023-04-02|Saint Petersburg, FL|Tigers at Rays|Detroit Tigers at Tampa Bay Rays|Tropicana Field|     4|0.621|27.7682| -82.6534|Tampa Bay Rays|Detroit Tigers|NA|NA|  61| 144|  8286|MLB|MLB Baseball
mlb|5784893|07:10 pm|2023-03-31|Los Angeles, CA|Diamondbacks at Dodgers|Arizona Diamondbacks at Los Angeles Dodgers|Dodger Stadium|     1|0.677|34.0718|-118.2460|Los Angeles Dodgers|Arizona Diamondbacks|NA|NA|  60| 143|  1761|MLB|MLB Baseball
mlb|5789258|04:10 pm|2023-04-15|Miami, FL|Diamondbacks at Marlins|Arizona Diamondbacks at Miami Marlins|loanDepot park|  6371|0.603|25.7617| -80.1918|Miami Marlins|Arizona Diamondbacks|NA|NA|  20|  51|  1124|MLB|MLB Baseball
mlb|5787352|01:10 pm|2023-04-23|Phoenix, AZ|Padres at Diamondbacks|San Diego Padres at Arizona Diamondbacks|Chase Field|    30|0.621|33.4453|-112.0670|Arizona Diamondbacks|San Diego Padres|NA|NA|  40| 106|   874|MLB|MLB Baseball
mlb|5787989|12:35 pm|2023-04-12|Pittsburgh, PA|Astros at Pirates|Houston Astros at Pittsburgh Pirates|PNC Park|    10|0.602|40.4472| -80.0064|Pittsburgh Pirates|Houston Astros|NA|NA|  26|  80|   874|MLB|MLB Baseball
mlb|5787446|04:10 pm|2023-04-08|Saint Petersburg, FL|Athletics at Rays|Oakland Athletics at Tampa Bay Rays|Tropicana Field|     4|0.621|27.7682| -82.6534|Tampa Bay Rays|Oakland Athletics|NA|NA|  61| 122|   379|MLB|MLB Baseball
mlb|5785329|03:30 am|2023-04-05|Houston, TX|Tigers at Astros|Detroit Tigers at Houston Astros|Minute Maid Park|    20|0.600|29.7562| -95.3557|Houston Astros|Detroit Tigers|NA|NA|  31| 102|  1133|MLB|MLB Baseball
mlb|5793940|07:10 pm|2023-03-28|Houston, TX|Spring Training: Sugar Land Space Cowboys at Houston Astros|Spring Training: Sugar Land Space Cowboys at Houston Astros|Minute Maid Park|    20|0.446|29.7562| -95.3557|Houston Astros|Sugar Land Space Cowboys|NA|NA|  19| 105|   519|MLB|MLB Baseball
mlb|5794062|01:05 pm|2023-03-23|Jupiter, FL|Spring Training: Yankees at Cardinals|Spring Training: New York Yankees at St. Louis Cardinals|Roger Dean Stadium|  3927|0.621|26.8910| -80.1163|St. Louis Cardinals|New York Yankees|NA|NA| 100| 198|   315|MLB|MLB Baseball
mlb|5794248|06:05 pm|2023-03-23|Sarasota, FL|Spring Training: Tigers at Orioles|Spring Training: Detroit Tigers (Split Squad) at Baltimore Orioles|Ed Smith Stadium|  3923|0.527|27.3482| -82.5176|Baltimore Orioles|Detroit Tigers|NA|NA|  50|  68|   220|MLB|MLB Baseball
mlb|5788916|06:40 pm|2023-04-04|Kansas City, MO|Blue Jays at Royals|Toronto Blue Jays at Kansas City Royals|Kauffman Stadium|  3714|0.600|39.0515| -94.4803|Kansas City Royals|Toronto Blue Jays|NA|NA|  12|  56|  2499|MLB|MLB Baseball
mlb|5789224|01:40 pm|2023-04-02|Miami, FL|Mets at Marlins|New York Mets at Miami Marlins|loanDepot park|  6371|0.621|25.7617| -80.1918|Miami Marlins|New York Mets|NA|NA|  29|  79|  1124|MLB|MLB Baseball
mlb|5789110|01:07 pm|2023-04-15|Oakland, CA|Mets at Athletics|New York Mets at Oakland Athletics|RingCentral Coliseum|    14|0.620|37.7514|-122.2010|Oakland Athletics|New York Mets|NA|NA|  36| 145|   863|MLB|MLB Baseball
mlb|5787146|06:40 pm|2023-04-25|Philadelphia, PA|Mariners at Phillies|Seattle Mariners at Philadelphia Phillies|Citizens Bank Park|    18|0.636|39.9055| -75.1666|Philadelphia Phillies|Seattle Mariners|NA|NA|  21|  68|  1499|MLB|MLB Baseball
mlb|5788585|04:10 pm|2023-04-15|Cincinnati, OH|Phillies at Reds|Philadelphia Phillies at Cincinnati Reds|Great American Ball Park|    26|0.675|39.0974| -84.5071|Cincinnati Reds|Philadelphia Phillies|NA|NA|  28|  84|  2230|MLB|MLB Baseball
mlb|5788552|01:10 pm|2023-04-16|Detroit, MI|Giants at Tigers|San Francisco Giants at Detroit Tigers|Comerica Park|    12|0.674|42.3390| -83.0485|Detroit Tigers|San Francisco Giants|NA|NA|  16|  76|  1379|MLB|MLB Baseball
mlb|5793956|01:10 pm|2023-03-19|Port St. Lucie, FL|Spring Training: Cardinals at Mets|Spring Training: St. Louis Cardinals at New York Mets|Clover Park|  3926|0.565|27.3248| -80.4048|New York Mets|St. Louis Cardinals|NA|NA|  48|  95|   172|MLB|MLB Baseball
mlb|5788251|07:10 pm|2023-04-07|Milwaukee, WI|Cardinals at Brewers|St. Louis Cardinals at Milwaukee Brewers|American Family Field|    15|0.674|43.0296| -87.9725|Milwaukee Brewers|St. Louis Cardinals|NA|NA|  21|  60| 13254|MLB|MLB Baseball
mlb|5912523|12:05 pm|2023-03-28|Washington, DC|Spring Training: Yankees at Nationals|Exhibition Game: New York Yankees at Washington Nationals|Nationals Park|  3713|0.615|38.8719| -77.0093|Washington Nationals|New York Yankees|NA|NA|  42| 107|   606|MLB|MLB Baseball
mlb|5784904|01:10 pm|2023-04-06|Flushing, NY|Marlins at Mets - Mets Home Opener|Miami Marlins at New York Mets - Mets Home Opener|Citi Field|     3|0.674|40.7564| -73.8459|New York Mets|Miami Marlins|NA|NA|  94| 300|  3295|MLB|MLB Baseball
mlb|5949578|07:05 pm|2023-04-03|Bronx, NY|Phillies at Yankees - Premium Seating|Philadelphia Phillies at New York Yankees - Premium Seating|Yankee Stadium|     8|0.673|40.8296| -73.9262|New York Yankees|Philadelphia Phillies|NA|NA| 644| 669|   710|MLB|MLB Baseball
mlb|5787134|12:05 pm|2023-04-23|Philadelphia, PA|Rockies at Phillies|Colorado Rockies at Philadelphia Phillies|Citizens Bank Park|    18|0.673|39.9055| -75.1666|Philadelphia Phillies|Colorado Rockies|NA|NA|  34| 104|  1499|MLB|MLB Baseball
mlb|5788571|04:10 pm|2023-04-01|Cincinnati, OH|Pirates at Reds|Pittsburgh Pirates at Cincinnati Reds|Great American Ball Park|    26|0.673|39.0974| -84.5071|Cincinnati Reds|Pittsburgh Pirates|NA|NA|  25|  81|  2230|MLB|MLB Baseball
mlb|5785360|07:10 pm|2023-04-17|Houston, TX|Blue Jays at Astros|Toronto Blue Jays at Houston Astros|Minute Maid Park|    20|0.597|29.7562| -95.3557|Houston Astros|Toronto Blue Jays|NA|NA|  24| 107|  1265|MLB|MLB Baseball
mlb|5785192|02:10 pm|2023-03-30|Boston, MA|Orioles at Red Sox - Opening Day|Baltimore Orioles at Boston Red Sox - Opening Day|Fenway Park|    21|0.666|42.3456| -71.0983|Boston Red Sox|Baltimore Orioles|MLB Opening Day|NA|  85| 180| 12004|MLB|MLB Baseball
mlb|5794708|01:05 pm|2023-03-18|Mesa, AZ|Spring Training: Reds at Athletics|Spring Training: Cincinnati Reds at Oakland Athletics|Hohokam Stadium|  3933|0.503|33.4386|-111.8300|Oakland Athletics|Cincinnati Reds|NA|NA|  25|  47|   114|MLB|MLB Baseball
mlb|5949577|07:05 pm|2023-04-03|Bronx, NY|Phillies at Yankees - Pinstripe Pass|Philadelphia Phillies at New York Yankees - Pinstripe Pass|Yankee Stadium|     8|0.673|40.8296| -73.9262|New York Yankees|Philadelphia Phillies|NA|NA|  59|  59|    59|MLB|MLB Baseball
mlb|5788261|01:10 pm|2023-04-09|Milwaukee, WI|Cardinals at Brewers|St. Louis Cardinals at Milwaukee Brewers|American Family Field|    15|0.673|43.0296| -87.9725|Milwaukee Brewers|St. Louis Cardinals|NA|NA|  18|  56| 13254|MLB|MLB Baseball
mlb|5794132|01:05 pm|2023-03-19|West Palm Beach, FL|Spring Training: Tigers at Nationals|Spring Training: Detroit Tigers at Washington Nationals|The Ballpark of the Palm Beaches|419759|0.519|26.7579| -80.1169|Washington Nationals|Detroit Tigers|NA|NA|  39|  63|   122|MLB|MLB Baseball
mlb|5787859|01:10 pm|2023-04-10|Minneapolis, MN|White Sox at Twins|Chicago White Sox at Minnesota Twins|Target Field|  3712|0.618|44.9817| -93.2776|Minnesota Twins|Chicago White Sox|NA|NA|  12|  55|  1124|MLB|MLB Baseball
mlb|5785353|06:08 pm|2023-04-16|Houston, TX|Rangers at Astros|Texas Rangers at Houston Astros|Minute Maid Park|    20|0.618|29.7562| -95.3557|Houston Astros|Texas Rangers|NA|NA|  27|  93|  1265|MLB|MLB Baseball
mlb|5789088|01:07 pm|2023-04-01|Oakland, CA|Angels at Athletics|Los Angeles Angels at Oakland Athletics|RingCentral Coliseum|    14|0.618|37.7514|-122.2010|Oakland Athletics|Los Angeles Angels|NA|NA|  36| 124|  2283|MLB|MLB Baseball
mlb|5787843|01:10 pm|2023-04-09|Minneapolis, MN|Astros at Twins|Houston Astros at Minnesota Twins|Target Field|  3712|0.633|44.9817| -93.2776|Minnesota Twins|Houston Astros|NA|NA|  17|  57|  1124|MLB|MLB Baseball
mlb|5784912|07:10 pm|2023-04-11|Flushing, NY|Padres at Mets|San Diego Padres at New York Mets|Citi Field|     3|0.618|40.7564| -73.8459|New York Mets|San Diego Padres|NA|NA|  17|  54|  1191|MLB|MLB Baseball
mlb|5949579|07:05 pm|2023-04-04|Bronx, NY|Phillies at Yankees - Pinstripe Pass|Philadelphia Phillies at New York Yankees - Pinstripe Pass|Yankee Stadium|     8|0.671|40.8296| -73.9262|New York Yankees|Philadelphia Phillies|NA|NA|  59|  59|    59|MLB|MLB Baseball
mlb|5788668|03:07 pm|2023-04-15|Toronto, Canada|Rays at Blue Jays|Tampa Bay Rays at Toronto Blue Jays|Rogers Centre|    17|0.618|43.6422| -79.3909|Toronto Blue Jays|Tampa Bay Rays|NA|NA|  35| 127|  1417|MLB|MLB Baseball
mlb|5787622|07:05 pm|2023-04-19|Washington, DC|Orioles at Nationals|Baltimore Orioles at Washington Nationals|Nationals Park|  3713|0.632|38.8719| -77.0093|Washington Nationals|Baltimore Orioles|NA|NA|  30|  89|   832|MLB|MLB Baseball
mlb|5787398|01:35 pm|2023-04-02|Washington, DC|Braves at Nationals|Atlanta Braves at Washington Nationals|Nationals Park|  3713|0.671|38.8719| -77.0093|Washington Nationals|Atlanta Braves|NA|NA|  24|  71|   413|MLB|MLB Baseball
mlb|5787122|07:05 pm|2023-04-21|Philadelphia, PA|Rockies at Phillies|Colorado Rockies at Philadelphia Phillies|Citizens Bank Park|    18|0.671|39.9055| -75.1666|Philadelphia Phillies|Colorado Rockies|NA|NA|  30|  88|  1499|MLB|MLB Baseball
mlb|5789124|06:40 pm|2023-04-17|Oakland, CA|Cubs at Athletics|Chicago Cubs at Oakland Athletics|RingCentral Coliseum|    14|0.617|37.7514|-122.2010|Oakland Athletics|Chicago Cubs|NA|NA|  36| 137|   863|MLB|MLB Baseball
mlb|5794130|01:05 pm|2023-03-18|West Palm Beach, FL|Spring Training: Marlins at Nationals|Spring Training: Miami Marlins at Washington Nationals|The Ballpark of the Palm Beaches|419759|0.514|26.7579| -80.1169|Washington Nationals|Miami Marlins|NA|NA|  21|  41|   114|MLB|MLB Baseball
mlb|5785294|07:10 pm|2023-04-18|Boston, MA|Twins at Red Sox|Minnesota Twins at Boston Red Sox|Fenway Park|    21|0.670|42.3456| -71.0983|Boston Red Sox|Minnesota Twins|NA|NA|  17|  70|  1879|MLB|MLB Baseball
mlb|5789246|01:40 pm|2023-04-23|Cleveland, OH|Marlins at Guardians|Miami Marlins at Cleveland Guardians|Progressive Field|     6|0.616|41.4962| -81.6852|Cleveland Guardians|Miami Marlins|NA|NA|  30|  80|  1249|MLB|MLB Baseball
mlb|5787717|06:35 pm|2023-04-10|Baltimore, MD|Athletics at Orioles|Oakland Athletics at Baltimore Orioles|Oriole Park at Camden Yards|    25|0.616|39.2840| -76.6199|Baltimore Orioles|Oakland Athletics|NA|NA|  22|  68|  1005|MLB|MLB Baseball
mlb|5786514|06:40 pm|2023-04-11|Denver, CO|Cardinals at Rockies|St. Louis Cardinals at Colorado Rockies|Coors Field|     7|0.616|39.7557|-104.9940|Colorado Rockies|St. Louis Cardinals|NA|NA|  18|  58|   374|MLB|MLB Baseball
mlb|5793938|01:05 pm|2023-03-20|Surprise, AZ|Spring Training: Guardians at Rangers|Spring Training: Cleveland Guardians at Texas Rangers|Surprise Stadium|  3930|0.513|33.6269|-112.3770|Texas Rangers|Cleveland Guardians|NA|NA|  12|  36|   103|MLB|MLB Baseball
mlb|5793950|01:05 pm|2023-03-25|Surprise, AZ|Spring Training: Padres at Rangers|Spring Training: San Diego Padres at Texas Rangers|Surprise Stadium|  3930|0.558|33.6269|-112.3770|Texas Rangers|San Diego Padres|NA|NA|  24|  57|   153|MLB|MLB Baseball
mlb|5794104|01:10 pm|2023-03-25|Tempe, AZ|Spring Training: Cubs at Angels|Spring Training: Chicago Cubs at Los Angeles Angels|Tempe Diablo Stadium|  3939|0.591|33.4009|-111.9700|Los Angeles Angels|Chicago Cubs|NA|NA|  34|  76|   224|MLB|MLB Baseball
mlb|5949597|07:05 pm|2023-04-19|Bronx, NY|Angels at Yankees - Premium Seating|Los Angeles Angels at New York Yankees - Premium Seating|Yankee Stadium|     8|0.668|40.8296| -73.9262|New York Yankees|Los Angeles Angels|NA|NA| 593| 669|  1041|MLB|MLB Baseball
mlb|5787745|06:35 pm|2023-04-25|Baltimore, MD|Red Sox at Orioles|Boston Red Sox at Baltimore Orioles|Oriole Park at Camden Yards|    25|0.648|39.2840| -76.6199|Baltimore Orioles|Boston Red Sox|NA|NA|  34|  84|   624|MLB|MLB Baseball
mlb|5787362|06:40 pm|2023-04-25|Phoenix, AZ|Royals at Diamondbacks|Kansas City Royals at Arizona Diamondbacks|Chase Field|    30|0.616|33.4453|-112.0670|Arizona Diamondbacks|Kansas City Royals|NA|NA|  30|  87|   874|MLB|MLB Baseball
mlb|5787987|06:35 pm|2023-04-11|Pittsburgh, PA|Astros at Pirates|Houston Astros at Pittsburgh Pirates|PNC Park|    10|0.591|40.4472| -80.0064|Pittsburgh Pirates|Houston Astros|NA|NA|  29|  91|   874|MLB|MLB Baseball
mlb|5794316|01:05 pm|2023-03-24|Saint Petersburg, FL|Spring Training: Mets at Rays|Spring Training: New York Mets at Tampa Bay Rays|Tropicana Field|     4|0.510|27.7682| -82.6534|Tampa Bay Rays|New York Mets|NA|NA|  24|  42|    74|MLB|MLB Baseball
mlb|5794265|01:10 pm|2023-03-21|Scottsdale, AZ|Spring Training: Angels at Diamondbacks|Spring Training: Los Angeles Angels (Split Squad) at Arizona Diamondbacks|Salt River Fields at Talking Stick|  3931|0.556|33.5457|-111.8860|Arizona Diamondbacks|Los Angeles Angels|NA|NA|  31|  79|   172|MLB|MLB Baseball
mlb|5794456|01:05 pm|2023-03-20|Lakeland, FL|Spring Training: Blue Jays at Tigers|Spring Training: Toronto Blue Jays at Detroit Tigers|Publix Field at Joker Marchant Stadium|  3929|0.554|28.0745| -81.9510|Detroit Tigers|Toronto Blue Jays|NA|NA|  25|  72|   129|MLB|MLB Baseball
mlb|5787735|07:05 pm|2023-04-22|Baltimore, MD|Tigers at Orioles|Detroit Tigers at Baltimore Orioles|Oriole Park at Camden Yards|    25|0.667|39.2840| -76.6199|Baltimore Orioles|Detroit Tigers|NA|NA|  36|  75|  1005|MLB|MLB Baseball
mlb|5789690|06:40 pm|2023-04-10|Chicago, IL|Mariners at Cubs|Seattle Mariners at Chicago Cubs|Wrigley Field|    11|0.667|41.9475| -87.6562|Chicago Cubs|Seattle Mariners|NA|NA|   6|  39|  1800|MLB|MLB Baseball
mlb|5949595|07:05 pm|2023-04-18|Bronx, NY|Angels at Yankees - Premium Seating|Los Angeles Angels at New York Yankees - Premium Seating|Yankee Stadium|     8|0.667|40.8296| -73.9262|New York Yankees|Los Angeles Angels|NA|NA| 593| 669|  1041|MLB|MLB Baseball
mlb|5794270|06:40 pm|2023-03-27|Phoenix, AZ|Spring Training: Guardians at Diamondbacks|Spring Training: Cleveland Guardians at Arizona Diamondbacks|Chase Field|    30|0.540|33.4453|-112.0670|Arizona Diamondbacks|Cleveland Guardians|NA|NA|  17|  57|   263|MLB|MLB Baseball
mlb|5787013|01:10 pm|2023-04-16|Chicago, IL|Orioles at White Sox|Baltimore Orioles at Chicago White Sox|Guaranteed Rate Field|  3715|0.614|41.8299| -87.6338|Chicago White Sox|Baltimore Orioles|NA|NA|  12|  70| 13754|MLB|MLB Baseball
mlb|5785321|07:10 pm|2023-04-04|Houston, TX|Tigers at Astros|Detroit Tigers at Houston Astros|Minute Maid Park|    20|0.589|29.7562| -95.3557|Houston Astros|Detroit Tigers|NA|NA|  16| 103|  1133|MLB|MLB Baseball
mlb|5785616|07:20 pm|2023-04-10|Atlanta, GA|Reds at Braves|Cincinnati Reds at Atlanta Braves|Truist Park|418889|0.646|33.8897| -84.4654|Atlanta Braves|Cincinnati Reds|NA|NA|  17|  73|   749|MLB|MLB Baseball
mlb|5788660|07:07 pm|2023-04-13|Toronto, Canada|Tigers at Blue Jays|Detroit Tigers at Toronto Blue Jays|Rogers Centre|    17|0.614|43.6422| -79.3909|Toronto Blue Jays|Detroit Tigers|NA|NA|  20|  84|  4379|MLB|MLB Baseball
mlb|5786324|01:07 pm|2023-04-09|Anaheim, CA|Blue Jays at Angels|Toronto Blue Jays at Los Angeles Angels|Angel Stadium of Anaheim|    28|0.666|33.8003|-117.8830|Los Angeles Angels|Toronto Blue Jays|NA|NA|  17|  50|  3442|MLB|MLB Baseball
mlb|5794268|01:10 pm|2023-03-24|Scottsdale, AZ|Spring Training: Reds at Diamondbacks|Spring Training: Cincinnati Reds at Arizona Diamondbacks|Salt River Fields at Talking Stick|  3931|0.576|33.5457|-111.8860|Arizona Diamondbacks|Cincinnati Reds|NA|NA|  32|  75|   170|MLB|MLB Baseball
mlb|5787739|01:35 pm|2023-04-23|Baltimore, MD|Tigers at Orioles|Detroit Tigers at Baltimore Orioles|Oriole Park at Camden Yards|    25|0.660|39.2840| -76.6199|Baltimore Orioles|Detroit Tigers|NA|NA|  35|  88|  1005|MLB|MLB Baseball
mlb|5793764|01:05 pm|2023-03-26|Fort Myers, FL|Spring Training: Twins at Red Sox|Spring Training: Minnesota Twins at Boston Red Sox|JetBlue Park|  6992|0.613|26.5487| -81.7612|Boston Red Sox|Minnesota Twins|NA|NA|  19|  87|   349|MLB|MLB Baseball
mlb|5786993|01:10 pm|2023-04-06|Chicago, IL|Giants at White Sox|San Francisco Giants at Chicago White Sox|Guaranteed Rate Field|  3715|0.629|41.8299| -87.6338|Chicago White Sox|San Francisco Giants|NA|NA|   9|  62| 13754|MLB|MLB Baseball
mlb|5794070|12:10 pm|2023-03-28|Scottsdale, AZ|Spring Training: Brewers at Rockies|Spring Training: Milwaukee Brewers at Colorado Rockies|Salt River Fields at Talking Stick|  3931|0.502|33.5457|-111.8860|Colorado Rockies|Milwaukee Brewers|NA|NA|  35|  92|   192|MLB|MLB Baseball
mlb|5786987|01:10 pm|2023-04-05|Chicago, IL|Giants at White Sox|San Francisco Giants at Chicago White Sox|Guaranteed Rate Field|  3715|0.613|41.8299| -87.6338|Chicago White Sox|San Francisco Giants|NA|NA|   9|  60| 13754|MLB|MLB Baseball
