league|id|time|date|city|title|full|venue|ven_id|score|lat|long|t1|t2|t3|t4|low|med|high|name|xname
ncaa_basketball|5803110|03:30 am|2023-01-22|Bloomington, IN|Michigan State at Indiana|Michigan State Spartans at Indiana Hoosiers Basketball|Simon Skjodt Assembly Hall|  3466|0.707|39.1809| -86.5221|Indiana Hoosiers Basketball|Michigan State Spartans Basketball|NA|NA| 178| 371|  1852|NCAA BB|College Basketball
ncaa_basketball|5817124|01:00 pm|2023-01-22|Cincinnati, OH|Memphis at Cincinnati|Memphis Tigers at Cincinnati Bearcats Basketball|Fifth Third Arena|  3457|0.530|39.1312| -84.5141|Cincinnati Bearcats Basketball|Memphis Tigers Basketball|NA|NA|  27|  57|   400|NCAA BB|College Basketball
ncaa_basketball|5803152|03:30 am|2023-01-22|West Lafayette, IN|Maryland at Purdue|Maryland Terrapins at Purdue Boilermakers Basketball|Mackey Arena|  3486|0.645|40.4259| -86.9081|Purdue Boilermakers Basketball|Maryland Terrapins Basketball|NA|NA| 173| 229|   893|NCAA BB|College Basketball
ncaa_basketball|5817838|06:00 pm|2023-01-17|Manhattan, KS|Kansas at Kansas State|Kansas Jayhawks at Kansas State Wildcats Basketball|Bramlage Coliseum|  3464|0.578|39.2004| -96.5938|Kansas State Wildcats Basketball|Kansas Jayhawks Basketball|NA|NA| 175| 236|  5930|NCAA BB|College Basketball
ncaa_basketball|5803300|01:00 pm|2023-02-05|Ann Arbor, MI|Ohio State at Michigan|Ohio State Buckeyes at Michigan Wolverines Basketball|Crisler Center|  3450|0.677|42.2650| -83.7467|Michigan Wolverines Basketball|Ohio State Buckeyes Basketball|NA|NA|  82| 140|  1385|NCAA BB|College Basketball
ncaa_basketball|5803144|09:00 pm|2023-01-31|College Park, MD|Indiana at Maryland|Indiana Hoosiers at Maryland Terrapins Basketball|Xfinity Center - MD|  3422|0.630|38.9897| -76.9378|Maryland Terrapins Basketball|Indiana Hoosiers Basketball|NA|NA|  53| 109|   621|NCAA BB|College Basketball
ncaa_basketball|5801332|04:00 pm|2023-01-28|Amherst, MA|Duquesne at Massachusetts|Duquesne Dukes at UMass Minutemen Basketball|Mullins Center|  1352|0.431|42.3732| -72.5199|UMass Minutemen Basketball|Duquesne Dukes Basketball|NA|NA|  35|  61|   139|NCAA BB|College Basketball
ncaa_basketball|5807730|02:00 pm|2023-02-04|Louisville, KY|Florida State at Louisville|Florida State Seminoles at Louisville Cardinals Basketball|KFC Yum! Center|  4353|0.630|38.2572| -85.7540|Louisville Cardinals Basketball|Florida State Seminoles Basketball|NA|NA|  45| 104|  1004|NCAA BB|College Basketball
ncaa_basketball|5807490|09:00 pm|2023-01-11|Clemson, SC|Louisville at Clemson|Louisville Cardinals at Clemson Tigers Basketball|Littlejohn Coliseum|  3443|0.528|34.6804| -82.8464|Clemson Tigers Basketball|Louisville Cardinals Basketball|NA|NA|  13|  44|   199|NCAA BB|College Basketball
ncaa_basketball|5805093|12:00 pm|2023-01-29|Philadelphia, PA|Providence at Villanova|Providence Friars at Villanova Wildcats Basketball|Wells Fargo Center|  3148|0.630|39.9012| -75.1720|Villanova Wildcats Basketball|Providence Friars Basketball|NA|NA|  85| 153|   701|NCAA BB|College Basketball
ncaa_basketball|5817734|08:00 pm|2023-01-30|Austin, TX|Baylor at Texas|Baylor Bears at Texas Longhorns Basketball|Moody Center ATX|518721|0.649|30.2805| -97.7318|Texas Longhorns Basketball|Baylor Bears Basketball|NA|NA| 163| 301|  1008|NCAA BB|College Basketball
ncaa_basketball|5807658|07:00 pm|2023-02-07|Pittsburgh, PA|Louisville at Pittsburgh|Louisville Cardinals at Pittsburgh Panthers Basketball|Petersen Events Center|  1658|0.588|40.4432| -79.9616|Pittsburgh Panthers Basketball|Louisville Cardinals Basketball|NA|NA|  15|  67|   174|NCAA BB|College Basketball
ncaa_basketball|5803264|01:30 pm|2023-02-04|Iowa City, IA|Illinois at Iowa|Illinois Fighting Illini at Iowa Hawkeyes Basketball|Carver-Hawkeye Arena|  3467|0.629|41.6639| -91.5545|Iowa Hawkeyes Basketball|Illinois Fighting Illini Basketball|NA|NA|  70| 131|  1292|NCAA BB|College Basketball
ncaa_basketball|5801043|07:30 pm|2023-01-11|College Station, TX|Missouri at Texas A&M|Missouri Tigers at Texas A&M Aggies Basketball|Reed Arena|  1879|0.435|30.6056| -96.3469|Texas A&M Aggies Basketball|Missouri Tigers Basketball|NA|NA|   8|  35|   255|NCAA BB|College Basketball
ncaa_basketball|5800909|07:30 pm|2023-02-11|Baton Rouge, LA|Texas A&M Aggies at LSU Tigers Basketball|Texas A&M Aggies at LSU Tigers Basketball|Pete Maravich Assembly Center|  3480|0.483|30.4173| -91.1856|LSU Tigers Basketball|Texas A&M Aggies Basketball|NA|NA|  14|  49|   334|NCAA BB|College Basketball
ncaa_basketball|5803180|07:00 pm|2023-02-09|West Lafayette, IN|Iowa at Purdue|Iowa Hawkeyes at Purdue Boilermakers Basketball|Mackey Arena|  3486|0.629|40.4259| -86.9081|Purdue Boilermakers Basketball|Iowa Hawkeyes Basketball|NA|NA| 118| 170|  1008|NCAA BB|College Basketball
ncaa_basketball|5803258|02:15 pm|2023-01-21|University Park, PA|Nebraska at Penn State|Nebraska Cornhuskers at Penn State Nittany Lions Basketball|Bryce Jordan Center|   108|0.465|40.8099| -77.8562|Penn State Nittany Lions Basketball|Nebraska Cornhuskers Basketball|NA|NA|  47|  74|   528|NCAA BB|College Basketball
ncaa_basketball|5803206|12:00 pm|2023-01-08|Piscataway, NJ|Iowa at Rutgers|Iowa Hawkeyes at Rutgers Scarlet Knights Basketball|Jersey Mike's Arena|  3447|0.538|40.5252| -74.4414|Rutgers Scarlet Knights Basketball|Iowa Hawkeyes Basketball|NA|NA|  57|  67|    82|NCAA BB|College Basketball
ncaa_basketball|5800820|06:00 pm|2023-01-11|Fayetteville, AR|Alabama at Arkansas|Alabama Crimson Tide at Arkansas Razorbacks Basketball|Bud Walton Arena|  3475|0.586|36.0616| -94.1780|Arkansas Razorbacks Basketball|Alabama Crimson Tide Basketball|NA|NA| 100| 116|   995|NCAA BB|College Basketball
ncaa_basketball|5811480|08:00 pm|2023-02-01|Des Moines, IA|UNI at Drake|Northern Iowa Panthers at Drake Bulldogs Basketball|Drake Knapp Center|  5165|0.525|41.6041| -93.6516|Drake Bulldogs Basketball|Northern Iowa Panthers Basketball|NA|NA|  23|  41|    64|NCAA BB|College Basketball
ncaa_basketball|5805206|05:00 pm|2023-02-04|Cincinnati, OH|St. John's at Xavier|St. John's Red Storm at Xavier Musketeers Basketball|Cintas Center|  3431|0.537|39.1504| -84.4719|Xavier Musketeers Basketball|St. John's Red Storm Basketball|NA|NA|  62|  92|   451|NCAA BB|College Basketball
ncaa_basketball|5807496|05:00 pm|2023-01-14|Clemson, SC|Duke at Clemson|Duke Blue Devils at Clemson Tigers Basketball|Littlejohn Coliseum|  3443|0.628|34.6804| -82.8464|Clemson Tigers Basketball|Duke Blue Devils Basketball|NA|NA|  72| 157|   891|NCAA BB|College Basketball
ncaa_basketball|5812471|07:00 pm|2023-01-18|Berkeley, CA|Oregon at California|Oregon Ducks at California Golden Bears Basketball|Haas Pavilion|  3436|0.523|37.8694|-122.2620|California Golden Bears Basketball|Oregon Ducks Basketball|NA|NA|  45|  90|   180|NCAA BB|College Basketball
ncaa_basketball|5803124|06:30 pm|2023-02-07|Bloomington, IN|Rutgers at Indiana|Rutgers Scarlet Knights at Indiana Hoosiers Basketball|Simon Skjodt Assembly Hall|  3466|0.628|39.1809| -86.5221|Indiana Hoosiers Basketball|Rutgers Scarlet Knights Basketball|NA|NA|  63| 212|  1226|NCAA BB|College Basketball
ncaa_basketball|5803094|08:00 pm|2023-01-13|Champaign, IL|Michigan State at Illinois|Michigan State Spartans at Illinois Fighting Illini Basketball|State Farm Center|   921|0.633|40.0962| -88.2359|Illinois Fighting Illini Basketball|Michigan State Spartans Basketball|NA|NA|  84| 140|  1292|NCAA BB|College Basketball
ncaa_basketball|5807740|07:00 pm|2023-01-30|Syracuse, NY|Virginia at Syracuse|Virginia Cavaliers at Syracuse Orange Basketball|JMA Wireless Dome|  1620|0.671|43.0362| -76.1363|Syracuse Orange Basketball|Virginia Cavaliers Basketball|NA|NA|  22| 135|   828|NCAA BB|College Basketball
ncaa_basketball|5805234|06:30 pm|2023-01-18|Newark, NJ|UConn at Seton Hall|UConn Huskies at Seton Hall Pirates Basketball|Prudential Center|  1500|0.527|40.7332| -74.1717|Seton Hall Pirates Basketball|UConn Huskies Basketball|NA|NA|  46| 124|  3607|NCAA BB|College Basketball
ncaa_basketball|5807414|05:00 pm|2023-01-21|Chapel Hill, NC|North Carolina State at North Carolina|NC State Wolfpack at North Carolina Tar Heels Basketball|Dean Smith Center|  3438|0.708|35.9004| -79.0432|North Carolina Tar Heels Basketball|NC State Wolfpack Basketball|NA|NA| 127| 228|  5013|NCAA BB|College Basketball
ncaa_basketball|5805232|12:00 pm|2023-02-04|Washington, DC|UConn at Georgetown|UConn Huskies Basketball at Georgetown Hoyas Basketball|Capital One Arena|   181|0.639|38.8981| -77.0209|Georgetown Hoyas Basketball|UConn Huskies Basketball|NA|NA|  54| 115|  3800|NCAA BB|College Basketball
ncaa_basketball|5812405|01:00 pm|2023-01-14|Corvallis, OR|Arizona State at Oregon State|Arizona State Sun Devils at Oregon State Beavers Basketball|Gill Coliseum|  3465|0.439|44.5613|-123.2810|Oregon State Beavers Basketball|Arizona State Sun Devils Basketball|NA|NA|  23|  41|   119|NCAA BB|College Basketball
ncaa_basketball|5817334|07:00 pm|2023-02-08|Wichita, KS|UCF at Wichita State|UCF Knights at Wichita State Shockers Basketball|Charles Koch Arena|  5140|0.521|37.7215| -97.2862|Wichita State Shockers Basketball|UCF Knights Basketball|NA|NA|  29|  78|   149|NCAA BB|College Basketball
ncaa_basketball|5812366|03:30 am|2023-01-14|Los Angeles, CA|Colorado at UCLA|Colorado Buffaloes at UCLA Bruins Basketball|Pauley Pavilion|  3483|0.567|34.0703|-118.4470|UCLA Bruins Basketball|Colorado Buffaloes Basketball|NA|NA|  25| 104|   615|NCAA BB|College Basketball
ncaa_basketball|5860921|06:00 pm|2023-01-14|Vermillion, SD|South Dakota State at South Dakota|South Dakota State Jackrabbits at South Dakota Coyotes Basketball|Sanford Coyote Sports Center|455132|0.370|42.7904| -96.9278|South Dakota Coyotes Basketball|South Dakota State Jackrabbits Basketball|NA|NA|  40|  48|    99|NCAA BB|College Basketball
ncaa_basketball|5812391|07:00 pm|2023-01-28|Stanford, CA|California at Stanford|California Golden Bears at Stanford Cardinal Basketball|Maples Pavilion|  3468|0.520|37.4296|-122.1610|Stanford Cardinal Basketball|California Golden Bears Basketball|NA|NA|  49|  59|   129|NCAA BB|College Basketball
ncaa_basketball|5819105|07:00 pm|2023-01-20|Albany, NY|Mount St. Mary's at Siena|Mount St. Mary's Mountaineers at Siena Saints Basketball|MVP Arena|   153|0.369|42.6482| -73.7538|Siena Saints Basketball|Mount St. Mary's Mountaineers Basketball|NA|NA|  36|  60|    95|NCAA BB|College Basketball
ncaa_basketball|5803112|01:00 pm|2023-02-11|Champaign, IL|Rutgers at Illinois|Rutgers Scarlet Knights at Illinois Fighting Illini Basketball|State Farm Center|   921|0.600|40.0962| -88.2359|Illinois Fighting Illini Basketball|Rutgers Scarlet Knights Basketball|NA|NA| 129| 202|   576|NCAA BB|College Basketball
ncaa_basketball|5817326|03:00 pm|2023-01-14|Wichita, KS|Tulsa at Wichita State|Tulsa Golden Hurricane at Wichita State Shockers Basketball|Charles Koch Arena|  5140|0.520|37.7215| -97.2862|Wichita State Shockers Basketball|Tulsa Golden Hurricane Basketball|NA|NA|  34| 112|   144|NCAA BB|College Basketball
ncaa_basketball|5800907|06:00 pm|2023-02-01|Auburn, AL|Georgia at Auburn|Georgia Bulldogs at Auburn Tigers Basketball|Neville Arena|  3455|0.565|32.6028| -85.4925|Auburn Tigers Basketball|Georgia Bulldogs Basketball|NA|NA|  85| 209|   598|NCAA BB|College Basketball
ncaa_basketball|5817778|12:00 pm|2023-02-11|Norman, OK|Kansas at Oklahoma|Kansas Jayhawks at Oklahoma Sooners Basketball|Lloyd Noble Center|  3426|0.625|35.1873| -97.4443|Oklahoma Sooners Basketball|Kansas Jayhawks Basketball|NA|NA|  67|  91|   491|NCAA BB|College Basketball
ncaa_basketball|5805117|12:00 pm|2023-02-11|New York, NY|Providence at St. John's|Providence Friars at St. John's Red Storm Basketball|Madison Square Garden|    93|0.625|40.7509| -73.9943|St. John's Red Storm Basketball|Providence Friars Basketball|NA|NA|  82| 135|  2318|NCAA BB|College Basketball
ncaa_basketball|5807624|12:00 pm|2023-01-21|Atlanta, GA|Syracuse at Georgia Tech|Syracuse Orange at Georgia Tech Yellow Jackets Basketball|McCamish Pavilion|  3425|0.624|33.7807| -84.3936|Georgia Tech Yellow Jackets Basketball|Syracuse Orange Basketball|NA|NA|  41|  91|  7735|NCAA BB|College Basketball
ncaa_basketball|5801053|07:30 pm|2023-02-04|College Station, TX|Georgia at Texas A&M|Georgia Bulldogs at Texas A&M Aggies Basketball|Reed Arena|  1879|0.515|30.6056| -96.3469|Texas A&M Aggies Basketball|Georgia Bulldogs Basketball|NA|NA|   9|  42|   419|NCAA BB|College Basketball
ncaa_basketball|5819106|02:00 pm|2023-01-08|Albany, NY|Rider at Siena|Rider Broncs at Siena Saints Basketball|MVP Arena|   153|0.367|42.6482| -73.7538|Siena Saints Basketball|Rider Broncs Basketball|NA|NA|  35|  58|   117|NCAA BB|College Basketball
ncaa_basketball|5805107|06:30 pm|2023-01-10|Jamaica, NY|Butler at St. John's|Butler Bulldogs at St. John's Red Storm Basketball|Carnesecca Arena|  3479|0.515|40.7256| -73.7916|St. John's Red Storm Basketball|Butler Bulldogs Basketball|NA|NA|  19|  78|   166|NCAA BB|College Basketball
ncaa_basketball|5807582|07:00 pm|2023-02-08|Tallahassee, FL|Syracuse at Florida State|Syracuse Orange at Florida State Seminoles Basketball|Donald L. Tucker Civic Center|   354|0.562|30.4378| -84.2867|Florida State Seminoles Basketball|Syracuse Orange Basketball|NA|NA|  15|  38|  1024|NCAA BB|College Basketball
ncaa_basketball|5807492|07:00 pm|2023-01-11|Durham, NC|Pittsburgh at Duke|Pittsburgh Panthers at Duke Blue Devils Basketball|Cameron Indoor Stadium|  3437|0.624|35.9975| -78.9422|Duke Blue Devils Basketball|Pittsburgh Panthers Basketball|NA|NA| 109| 202|   517|NCAA BB|College Basketball
ncaa_basketball|5811731|07:00 pm|2023-01-18|Cedar Falls, IA|Illinois State at UNI|Illinois State Redbirds at Northern Iowa Panthers Basketball|McLeod Center|  1877|0.366|42.5144| -92.4673|Northern Iowa Panthers Basketball|Illinois State Redbirds Basketball|NA|NA|  13|  21|    60|NCAA BB|College Basketball
ncaa_basketball|5803138|04:30 pm|2023-01-28|College Park, MD|Nebraska at Maryland|Nebraska Cornhuskers at Maryland Terrapins Basketball|Xfinity Center - MD|  3422|0.623|38.9897| -76.9378|Maryland Terrapins Basketball|Nebraska Cornhuskers Basketball|NA|NA|  36|  95|   621|NCAA BB|College Basketball
ncaa_basketball|5817732|08:00 pm|2023-01-24|Austin, TX|Oklahoma State at Texas|Oklahoma State Cowboys at Texas Longhorns Basketball|Moody Center ATX|518721|0.596|30.2805| -97.7318|Texas Longhorns Basketball|Oklahoma State Cowboys Basketball|NA|NA|  64| 135|   697|NCAA BB|College Basketball
ncaa_basketball|5812478|05:00 pm|2023-02-11|Berkeley, CA|Arizona State at California|Arizona State Sun Devils at California Golden Bears Basketball|Haas Pavilion|  3436|0.514|37.8694|-122.2620|California Golden Bears Basketball|Arizona State Sun Devils Basketball|NA|NA|  37|  60|   165|NCAA BB|College Basketball
ncaa_basketball|5800903|03:00 pm|2023-01-21|Baton Rouge, LA|Tennessee Volunteers at LSU Tigers Basketball|Tennessee Volunteers at LSU Tigers Basketball|Pete Maravich Assembly Center|  3480|0.559|30.4173| -91.1856|LSU Tigers Basketball|Tennessee Volunteers Basketball|NA|NA|  28| 112|   385|NCAA BB|College Basketball
ncaa_basketball|5844021|02:05 pm|2023-02-04|Omaha, NE|Western Illinois at Omaha|Western Illinois Leathernecks at Omaha Mavericks Basketball|Baxter Arena| 78765|0.364|41.2362| -96.0129|Omaha Mavericks Basketball|Western Illinois Leathernecks Basketball|NA|NA|  29|  48|   169|NCAA BB|College Basketball
ncaa_basketball|5812543|08:30 pm|2023-01-19|Tempe, AZ|UCLA at Arizona State|UCLA Bruins at Arizona State Sun Devils Basketball|Desert Financial Arena|  5150|0.513|33.4246|-111.9310|Arizona State Sun Devils Basketball|UCLA Bruins Basketball|NA|NA|  15|  66|  1223|NCAA BB|College Basketball
ncaa_basketball|5800989|03:30 pm|2023-01-21|Columbia, SC|Auburn at South Carolina|Auburn Tigers at South Carolina Gamecocks Basketball|Colonial Life Arena|  1429|0.513|33.9947| -81.0370|South Carolina Gamecocks Basketball|Auburn Tigers Basketball|NA|NA|  36|  71|   673|NCAA BB|College Basketball
ncaa_basketball|5817120|03:00 pm|2023-01-08|Cincinnati, OH|Houston at Cincinnati|Houston Cougars at Cincinnati Bearcats Basketball|Fifth Third Arena|  3457|0.512|39.1312| -84.5141|Cincinnati Bearcats Basketball|Houston Cougars Basketball|NA|NA|  21|  29|   199|NCAA BB|College Basketball
ncaa_basketball|5817228|02:00 pm|2023-01-22|Dallas, TX|Wichita State at SMU|Wichita State Shockers at SMU Mustangs Basketball|Moody Coliseum|  3452|0.512|32.8420| -96.7825|SMU Mustangs Basketball|Wichita State Shockers Basketball|NA|NA|  13|  63|   436|NCAA BB|College Basketball
ncaa_basketball|5807662|12:00 pm|2023-02-04|Blacksburg, VA|Virginia at Virginia Tech|Virginia Cavaliers at Virginia Tech Hokies Basketball|Cassell Coliseum|  3460|0.634|37.2230| -80.4196|Virginia Tech Hokies Basketball|Virginia Cavaliers Basketball|NA|NA| 258| 340|   500|NCAA BB|College Basketball
ncaa_basketball|5800826|06:00 pm|2023-01-31|Fayetteville, AR|Texas A&M at Arkansas|Texas A&M Aggies at Arkansas Razorbacks Basketball|Bud Walton Arena|  3475|0.572|36.0616| -94.1780|Arkansas Razorbacks Basketball|Texas A&M Aggies Basketball|NA|NA|  64| 125|   656|NCAA BB|College Basketball
ncaa_basketball|5803106|01:00 pm|2023-01-14|Bloomington, IN|Wisconsin at Indiana|Wisconsin Badgers at Indiana Hoosiers Basketball|Simon Skjodt Assembly Hall|  3466|0.698|39.1809| -86.5221|Indiana Hoosiers Basketball|Wisconsin Badgers Basketball|NA|NA| 169| 489|  1209|NCAA BB|College Basketball
ncaa_basketball|5803184|08:00 pm|2023-02-14|Madison, WI|Michigan at Wisconsin|Michigan Wolverines at Wisconsin Badgers Basketball|Kohl Center|  1349|0.641|43.0695| -89.3970|Wisconsin Badgers Basketball|Michigan Wolverines Basketball|NA|NA|  30|  90|   596|NCAA BB|College Basketball
ncaa_basketball|5807670|07:00 pm|2023-02-08|Blacksburg, VA|Boston College at Virginia Tech|Boston College Eagles at Virginia Tech Hokies Basketball|Cassell Coliseum|  3460|0.524|37.2230| -80.4196|Virginia Tech Hokies Basketball|Boston College Eagles Basketball|NA|NA|  18|  33|    83|NCAA BB|College Basketball
ncaa_basketball|5891211|07:00 pm|2023-01-11|Macon, GA|Furman at Mercer|Furman Paladins at Mercer Bears Basketball|Hawkins Arena|  4153|0.363|32.8290| -83.6523|Mercer Bears Basketball|Furman Paladins Basketball|NA|NA|  28|  57|    91|NCAA BB|College Basketball
ncaa_basketball|5803350|01:00 pm|2023-02-12|Columbus, OH|Michigan State at Ohio State|Michigan State Spartans at Ohio State Buckeyes Basketball|Value City Arena at Schottenstein Center|    99|0.620|40.0077| -83.0251|Ohio State Buckeyes Basketball|Michigan State Spartans Basketball|NA|NA|  36|  77|  1178|NCAA BB|College Basketball
ncaa_basketball|5841515|03:30 pm|2023-01-28|Oxford, OH|Eastern Michigan at Miami (OH)|Eastern Michigan Eagles at Miami (OH) RedHawks Basketball|Millett Hall|  4176|0.363|39.5171| -84.7346|Miami (OH) RedHawks Basketball|Eastern Michigan Eagles Basketball|NA|NA|  24|  32|    76|NCAA BB|College Basketball
ncaa_basketball|5800822|11:00 am|2023-01-21|Fayetteville, AR|Ole Miss at Arkansas|Ole Miss Rebels at Arkansas Razorbacks Basketball|Bud Walton Arena|  3475|0.620|36.0616| -94.1780|Arkansas Razorbacks Basketball|Ole Miss Rebels Basketball|NA|NA| 144| 220|   779|NCAA BB|College Basketball
ncaa_basketball|5812456|05:00 pm|2023-01-28|Eugene, OR|Utah Utes at Oregon Ducks Basketball|Utah Utes at Oregon Ducks Basketball|Matthew Knight Arena|  3454|0.508|44.0449|-123.0660|Oregon Ducks Basketball|Utah Utes Basketball|NA|NA|  19|  56|   396|NCAA BB|College Basketball
ncaa_basketball|5811763|06:00 pm|2023-01-17|Valparaiso, IN|UIC at Valparaiso|UIC Flames at Valparaiso Beacons Basketball|Athletics-Recreation Center|  4181|0.372|41.4642| -87.0484|Valparaiso Beacons Basketball|UIC Flames Basketball|NA|NA|  30|  31|    58|NCAA BB|College Basketball
ncaa_basketball|5807654|07:00 pm|2023-01-28|Blacksburg, VA|Syracuse at Virginia Tech|Syracuse Orange at Virginia Tech Hokies Basketball|Cassell Coliseum|  3460|0.620|37.2230| -80.4196|Virginia Tech Hokies Basketball|Syracuse Orange Basketball|NA|NA| 144| 195| 13919|NCAA BB|College Basketball
ncaa_basketball|5812340|06:00 pm|2023-01-12|Los Angeles, CA|Colorado at USC|Colorado Buffaloes at USC Trojans Basketball|Galen Center|  3451|0.478|34.0208|-118.2800|USC Trojans Basketball|Colorado Buffaloes Basketball|NA|NA|  32|  55|   144|NCAA BB|College Basketball
ncaa_basketball|5817810|06:00 pm|2023-01-21|Morgantown, WV|Texas at West Virginia|Texas Longhorns at West Virginia Mountaineers Basketball|WVU Coliseum|  3288|0.568|39.6493| -79.9815|West Virginia Mountaineers Basketball|Texas Longhorns Basketball|NA|NA|  52| 118|  1269|NCAA BB|College Basketball
ncaa_basketball|5817979|06:00 pm|2023-02-04|Philadelphia, PA|Cornell at Penn|Cornell Big Red at Pennsylvania Quakers Basketball|The Palestra|  3490|0.457|39.9514| -75.1887|Pennsylvania Quakers Basketball|Cornell Big Red Basketball|NA|NA|  34|  43|   153|NCAA BB|College Basketball
ncaa_basketball|5800846|03:30 pm|2023-02-11|Gainesville, FL|Vanderbilt at Florida|Vanderbilt Commodores at Florida Gators Basketball|Exactech Arena at the Stephen C. O'Connell Center|  3459|0.506|29.6494| -82.3512|Florida Gators Basketball|Vanderbilt Commodores Basketball|NA|NA|  28|  88|  1803|NCAA BB|College Basketball
ncaa_basketball|5812457|08:00 pm|2023-02-09|Eugene, OR|USC at Oregon|USC Trojans at Oregon Ducks Basketball|Matthew Knight Arena|  3454|0.506|44.0449|-123.0660|Oregon Ducks Basketball|USC Trojans Basketball|NA|NA|  18|  68|   396|NCAA BB|College Basketball
ncaa_basketball|5833518|07:00 pm|2023-01-26|Lynchburg, VA|Stetson at Liberty|Stetson Hatters at Liberty Flames Basketball|Liberty Arena|518716|0.361|37.3531| -79.1770|Liberty Flames Basketball|Stetson Hatters Basketball|NA|NA|  28|  53|    78|NCAA BB|College Basketball
ncaa_basketball|5807738|01:00 pm|2023-01-28|Winston-Salem, NC|North Carolina State at Wake Forest|NC State Wolfpack at Wake Forest Demon Deacons Basketball|Lawrence Joel Veterans Memorial Coliseum|  1515|0.506|36.1277| -80.2575|Wake Forest Demon Deacons Basketball|NC State Wolfpack Basketball|NA|NA|  30|  73|   258|NCAA BB|College Basketball
ncaa_basketball|5801477|04:00 pm|2023-01-14|Washington, DC|Saint Louis at George Washington|Saint Louis Billikens at George Washington Colonials Basketball|Charles E. Smith Center|  3350|0.361|38.8978| -77.0493|George Washington Colonials Basketball|Saint Louis Billikens Basketball|NA|NA|  33|  66|   313|NCAA BB|College Basketball
ncaa_basketball|5807750|07:00 pm|2023-02-14|Syracuse, NY|North Carolina State at Syracuse|NC State Wolfpack at Syracuse Orange Basketball|JMA Wireless Dome|  1620|0.619|43.0362| -76.1363|Syracuse Orange Basketball|NC State Wolfpack Basketball|NA|NA|  16| 112|  7735|NCAA BB|College Basketball
ncaa_basketball|5858257|01:00 pm|2023-01-21|Baltimore, MD|New Hampshire at UMBC|New Hampshire Wildcats at UMBC Retrievers Basketball|Chesapeake Employers Insurance Arena|437845|0.360|39.2556| -76.7110|UMBC Retrievers Basketball|New Hampshire Wildcats Basketball|NA|NA|  33|  53|   326|NCAA BB|College Basketball
ncaa_basketball|5805248|06:00 pm|2023-02-14|Newark, NJ|Georgetown at Seton Hall|Georgetown Hoyas at Seton Hall Pirates Basketball|Prudential Center|  1500|0.503|40.7332| -74.1717|Seton Hall Pirates Basketball|Georgetown Hoyas Basketball|NA|NA|  23|  79|   890|NCAA BB|College Basketball
ncaa_basketball|5807500|06:30 pm|2023-02-04|Durham, NC|North Carolina at Duke|North Carolina Tar Heels at Duke Blue Devils Basketball|Cameron Indoor Stadium|  3437|0.749|35.9975| -78.9422|Duke Blue Devils Basketball|North Carolina Tar Heels Basketball|NA|NA|1344|2479|  7713|NCAA BB|College Basketball
ncaa_basketball|5807420|07:00 pm|2023-02-13|Chapel Hill, NC|Miami (FL) at North Carolina|Miami Hurricanes at North Carolina Tar Heels Basketball|Dean Smith Center|  3438|0.638|35.9004| -79.0432|North Carolina Tar Heels Basketball|Miami Hurricanes Basketball|NA|NA|  28|  66|  1001|NCAA BB|College Basketball
ncaa_basketball|5817784|11:00 am|2023-02-04|Ames, IA|Kansas at Iowa State|Kansas Jayhawks at Iowa State Cyclones Basketball|Hilton Coliseum|  3458|0.638|42.0210| -93.6348|Iowa State Cyclones Basketball|Kansas Jayhawks Basketball|NA|NA|  79| 235|  1432|NCAA BB|College Basketball
ncaa_basketball|5812555|03:30 am|2023-02-04|Tempe, AZ|Oregon at Arizona State|Oregon Ducks at Arizona State Sun Devils Basketball|Desert Financial Arena|  5150|0.546|33.4246|-111.9310|Arizona State Sun Devils Basketball|Oregon Ducks Basketball|NA|NA|  25|  76|   670|NCAA BB|College Basketball
ncaa_basketball|5735816|01:00 pm|2023-01-28|Norman, OK|Alabama at Oklahoma|Alabama Crimson Tide at Oklahoma Sooners Basketball|Lloyd Noble Center|  3426|0.546|35.1873| -97.4443|Oklahoma Sooners Basketball|Alabama Crimson Tide Basketball|NA|NA|  33|  48|   288|NCAA BB|College Basketball
ncaa_basketball|5801033|06:00 pm|2023-02-11|Knoxville, TN|Missouri at Tennessee|Missouri Tigers at Tennessee Volunteers Basketball|Thompson-Boling Arena|   461|0.546|35.9507| -83.9252|Tennessee Volunteers Basketball|Missouri Tigers Basketball|NA|NA|  46| 105|  6330|NCAA BB|College Basketball
ncaa_basketball|5801023|12:00 pm|2023-01-14|Knoxville, TN|Kentucky at Tennessee|Kentucky Wildcats at Tennessee Volunteers Basketball|Thompson-Boling Arena|   461|0.637|35.9507| -83.9252|Tennessee Volunteers Basketball|Kentucky Wildcats Basketball|NA|NA|  72| 214|  5930|NCAA BB|College Basketball
ncaa_basketball|5805051|08:30 pm|2023-01-25|Providence, RI|Butler at Providence|Butler Bulldogs at Providence Friars Basketball|Amica Mutual Pavilion|   805|0.501|41.8236| -71.4180|Providence Friars Basketball|Butler Bulldogs Basketball|NA|NA|  24|  47| 15818|NCAA BB|College Basketball
ncaa_basketball|5801221|07:00 pm|2023-02-15|Bronx, NY|St. Bonaventure at Fordham|St. Bonaventure Bonnies at Fordham Rams Basketball|Rose Hill Gym|  4188|0.393|40.8612| -73.8892|Fordham Rams Basketball|St. Bonaventure Bonnies Basketball|NA|NA|  75|  73|    76|NCAA BB|College Basketball
