league|id|time|date|city|title|full|venue|ven_id|score|lat|long|t1|t2|t3|t4|low|med|high|name|xname
ncaa_football|5816675|06:45 pm|2023-11-04|Tuscaloosa, AL|LSU at Alabama|LSU Tigers at Alabama Crimson Tide Football|Bryant-Denny Stadium|  2755|0.970|33.2083| -87.5504|Alabama Crimson Tide Football|LSU Tigers Football|NA|NA|195| 434| 6720|NCAA FB|College Football
ncaa_football|5929710|03:30 am|2023-11-04|Stillwater, OK|Oklahoma at Oklahoma State|Oklahoma Sooners at Oklahoma State Cowboys Football|Boone Pickens Stadium|  2785|0.948|36.1256| -97.0665|Oklahoma State Cowboys Football|Oklahoma Sooners Football|NA|NA|415| 761| 3516|NCAA FB|College Football
ncaa_football|5816707|03:30 am|2023-11-25|Auburn, AL|Alabama at Auburn|Alabama Crimson Tide at Auburn Tigers Football|Jordan-Hare Stadium|  2768|0.899|32.6022| -85.4891|Auburn Tigers Football|Alabama Crimson Tide Football|NA|NA|238| 437| 5855|NCAA FB|College Football
ncaa_football|5816737|03:30 am|2023-11-18|Knoxville, TN|Georgia at Tennessee|Georgia Bulldogs at Tennessee Volunteers Football|Neyland Stadium|  2757|0.934|35.9555| -83.9253|Tennessee Volunteers Football|Georgia Bulldogs Football|NA|NA|345| 688| 5855|NCAA FB|College Football
ncaa_football|5853542|12:00 pm|2023-11-25|Ann Arbor, MI|Ohio State at Michigan|Ohio State Buckeyes at Michigan Wolverines Football|Michigan Stadium|  2782|0.933|42.2657| -83.7495|Michigan Wolverines Football|Ohio State Buckeyes Football|NA|NA|649|1039| 6505|NCAA FB|College Football
ncaa_football|5929788|03:30 am|2023-11-04|Austin, TX|Kansas State at Texas|Kansas State Wildcats at Texas Longhorns Football|Darrell K Royal - Texas Memorial Stadium|  2802|0.930|30.2837| -97.7336|Texas Longhorns Football|Kansas State Wildcats Football|NA|NA|128| 274| 6155|NCAA FB|College Football
ncaa_football|5929786|06:30 pm|2023-11-24|Austin, TX|Texas Tech at Texas|Texas Tech Red Raiders at Texas Longhorns Football|Darrell K Royal - Texas Memorial Stadium|  2802|0.922|30.2837| -97.7336|Texas Longhorns Football|Texas Tech Red Raiders Football|NA|NA|157| 379| 5905|NCAA FB|College Football
ncaa_football|5930756|07:00 pm|2023-10-28|Stillwater, OK|Cincinnati at Oklahoma State|Cincinnati Bearcats at Oklahoma State Cowboys Football|Boone Pickens Stadium|  2785|0.917|36.1256| -97.0665|Oklahoma State Cowboys Football|Cincinnati Bearcats Football|NA|NA| 63| 134|11547|NCAA FB|College Football
ncaa_football|5816764|11:00 am|2023-10-28|College Station, TX|South Carolina at Texas A&M|South Carolina Gamecocks at Texas A&M Aggies Football|Kyle Field|  2754|0.888|30.6041| -96.3388|Texas A&M Aggies Football|South Carolina Gamecocks Football|NA|NA| 27|  99| 1505|NCAA FB|College Football
ncaa_football|5816745|03:30 am|2023-11-11|Baton Rouge, LA|Florida at LSU|Florida Gators at LSU Tigers Football|Tiger Stadium|  2105|0.887|30.4120| -91.1838|LSU Tigers Football|Florida Gators Football|NA|NA| 87| 272| 6155|NCAA FB|College Football
ncaa_football|5853568|06:30 pm|2023-10-28|Madison, WI|#3 Ohio State at Wisconsin|#3 Ohio State Buckeyes at Wisconsin Badgers Football|Camp Randall Stadium|  2814|0.878|43.0696| -89.4120|Wisconsin Badgers Football|Ohio State Buckeyes Football|College Football Rankings|NA| 50| 147|12618|NCAA FB|College Football
ncaa_football|5918064|08:00 pm|2023-11-04|Boulder, CO|Oregon State at Colorado|Oregon State Beavers at Colorado Buffaloes Football|Folsom Field|  2833|0.902|40.0092|-105.2670|Colorado Buffaloes Football|Oregon State Beavers Football|NA|NA|217| 342| 1760|NCAA FB|College Football
ncaa_football|5853540|07:30 pm|2023-11-04|Ann Arbor, MI|Purdue at Michigan|Purdue Boilermakers at Michigan Wolverines Football|Michigan Stadium|  2782|0.900|42.2657| -83.7495|Michigan Wolverines Football|Purdue Boilermakers Football|NA|NA|128| 275| 1152|NCAA FB|College Football
ncaa_football|5929774|02:30 pm|2023-10-28|Austin, TX|BYU at #7 Texas|BYU Cougars at #7 Texas Longhorns Football|Darrell K Royal - Texas Memorial Stadium|  2802|0.900|30.2837| -97.7336|Texas Longhorns Football|BYU Cougars Football|College Football Rankings|NA| 57| 137| 6155|NCAA FB|College Football
ncaa_football|5929694|03:30 am|2023-11-11|Fort Worth, TX|Texas at TCU|Texas Longhorns at TCU Horned Frogs Football|Amon G. Carter Stadium|  2803|0.900|32.7097| -97.3682|TCU Horned Frogs Football|Texas Longhorns Football|NA|NA|241| 423| 4126|NCAA FB|College Football
ncaa_football|5816667|03:30 pm|2023-10-28|Jacksonville, FL|#1 Georgia vs Florida|#1 Georgia Bulldogs vs Florida Gators Football|EverBank Stadium|  5178|0.873|30.3240| -81.6373|Georgia Bulldogs Football|Florida Gators Football|College Football Rankings|NA| 92| 212|25233|NCAA FB|College Football
ncaa_football|5929104|03:30 am|2023-11-11|Tallahassee, FL|Miami (FL) at Florida State|Miami Hurricanes at Florida State Seminoles Football|Doak Campbell Stadium|  2751|0.899|30.4377| -84.3050|Florida State Seminoles Football|Miami Hurricanes Football|NA|NA|203| 374| 3575|NCAA FB|College Football
ncaa_football|5929068|02:00 pm|2023-10-28|Raleigh, NC|Clemson at NC State|Clemson Tigers at NC State Wolfpack Football|Carter-Finley Stadium|    37|0.871|35.8010| -78.7190|NC State Wolfpack Football|Clemson Tigers Football|NA|NA| 72| 115|  511|NCAA FB|College Football
ncaa_football|5918088|04:30 pm|2023-11-04|Los Angeles, CA|Washington at USC|Washington Huskies at USC Trojans Football|Los Angeles Memorial Coliseum| 51012|0.892|34.0139|-118.2830|USC Trojans Football|Washington Huskies Football|NA|NA|111| 260| 1342|NCAA FB|College Football
ncaa_football|5816683|03:30 pm|2023-11-04|Athens, GA|Missouri at Georgia|Missouri Tigers at Georgia Bulldogs Football|Sanford Stadium|  2771|0.867|33.9488| -83.3736|Georgia Bulldogs Football|Missouri Tigers Football|NA|NA|162| 327| 5855|NCAA FB|College Football
ncaa_football|5816776|11:00 am|2023-11-04|Oxford, MS|Texas A&M at Ole Miss|Texas A&M Aggies at Ole Miss Rebels Football|Vaught Hemingway Stadium|  2772|0.837|34.3619| -89.5342|Ole Miss Rebels Football|Texas A&M Aggies Football|NA|NA| 85| 141| 1357|NCAA FB|College Football
ncaa_football|5816691|03:30 am|2023-11-11|Athens, GA|Ole Miss at Georgia|Ole Miss Rebels at Georgia Bulldogs Football|Sanford Stadium|  2771|0.863|33.9488| -83.3736|Georgia Bulldogs Football|Ole Miss Rebels Football|NA|NA|351| 713| 5855|NCAA FB|College Football
ncaa_football|5918066|03:30 am|2023-11-11|Boulder, CO|Arizona at Colorado|Arizona Wildcats at Colorado Buffaloes Football|Folsom Field|  2833|0.861|40.0092|-105.2670|Colorado Buffaloes Football|Arizona Wildcats Football|NA|NA|169| 314| 1481|NCAA FB|College Football
ncaa_football|5917899|03:30 pm|2023-10-28|Notre Dame, IN|Pittsburgh at #14 Notre Dame|Pittsburgh Panthers at #14 Notre Dame Fighting Irish Football|Notre Dame Stadium|  2762|0.853|41.6971| -86.2326|Notre Dame Fighting Irish Football|Pittsburgh Panthers Football|College Football Rankings|NA| 51| 120| 1297|NCAA FB|College Football
ncaa_football|5853526|12:00 pm|2023-11-11|University Park, PA|Michigan at Penn State|Michigan Wolverines at Penn State Nittany Lions Football|Beaver Stadium|  2773|0.849|40.8125| -77.8562|Penn State Nittany Lions Football|Michigan Wolverines Football|NA|NA|216| 335| 2414|NCAA FB|College Football
ncaa_football|6107684|11:00 am|2023-12-02|Arlington, TX|Dr Pepper Big 12 Championship Game|Dr Pepper Big 12 Championship Game|AT&T Stadium|  4965|0.875|32.7473| -97.0945|Big 12 Football Championship|NA|NA|NA|160| 369|17705|NCAA FB|College Football
ncaa_football|5816725|03:30 am|2023-11-11|Lexington, KY|Alabama at Kentucky|Alabama Crimson Tide at Kentucky Wildcats Football|Kroger Field|  2810|0.834|38.0233| -84.5062|Kentucky Wildcats Football|Alabama Crimson Tide Football|NA|NA|192| 391| 2254|NCAA FB|College Football
ncaa_football|5918104|04:30 pm|2023-10-28|Pasadena, CA|Colorado at #23 UCLA|Colorado Buffaloes at #23 UCLA Bruins Football|Rose Bowl|    45|0.874|34.1590|-118.1680|UCLA Bruins Football|Colorado Buffaloes Football|College Football Rankings|NA|178| 273| 5955|NCAA FB|College Football
ncaa_football|5816756|03:30 am|2023-11-25|Baton Rouge, LA|Texas A&M at LSU|Texas A&M Aggies at LSU Tigers Football|Tiger Stadium|  2105|0.839|30.4120| -91.1838|LSU Tigers Football|Texas A&M Aggies Football|NA|NA| 96| 272| 2281|NCAA FB|College Football
ncaa_football|5929690|11:00 am|2023-10-28|Lawrence, KS|#6 Oklahoma at Kansas|#6 Oklahoma Sooners at Kansas Jayhawks Football|David Booth Kansas Memorial Stadium|  2786|0.839|38.9643| -95.2468|Kansas Jayhawks Football|Oklahoma Sooners Football|College Football Rankings|NA| 46|  94|  620|NCAA FB|College Football
ncaa_football|5918092|03:30 am|2023-11-18|Los Angeles, CA|UCLA at USC|UCLA Bruins at USC Trojans Football|Los Angeles Memorial Coliseum| 51012|0.838|34.0139|-118.2830|USC Trojans Football|UCLA Bruins Football|NA|NA|122| 341| 1518|NCAA FB|College Football
ncaa_football|5929094|03:30 am|2023-11-11|Chapel Hill, NC|Duke at North Carolina|Duke Blue Devils at North Carolina Tar Heels Football|Kenan Memorial Stadium|  2824|0.838|35.9087| -79.0485|North Carolina Tar Heels Football|Duke Blue Devils Football|NA|NA|222| 315| 1254|NCAA FB|College Football
ncaa_football|5917912|03:30 am|2023-11-04|Clemson, SC|Notre Dame at Clemson|Notre Dame Fighting Irish at Clemson Tigers Football|Clemson Memorial Stadium|  2761|0.841|34.6802| -82.8464|Clemson Tigers Football|Notre Dame Fighting Irish Football|NA|NA|148| 420| 3445|NCAA FB|College Football
nfl|6019560|01:00 pm|2023-10-29|East Rutherford, NJ|Jets at Giants|New York Jets at New York Giants|MetLife Stadium|  1587|0.874|40.8142| -74.0737|New York Giants|New York Jets|NA|NA|276| 504|67505|NFL|NFL Football
nfl|5964245|12:00 pm|2023-10-29|Arlington, TX|Rams at Cowboys|Los Angeles Rams at Dallas Cowboys|AT&T Stadium|  4965|0.944|32.7473| -97.0945|Dallas Cowboys|Los Angeles Rams|NA|NA| 39| 361| 3068|NFL|NFL Football
nfl|6019301|02:25 pm|2023-10-29|Denver, CO|Chiefs at Broncos|Kansas City Chiefs at Denver Broncos|Empower Field at Mile High|  1131|0.894|39.7439|-105.0200|Denver Broncos|Kansas City Chiefs|NA|NA|141| 294| 1047|NFL|NFL Football
nfl|5965086|12:00 pm|2023-11-05|New Orleans, LA|Bears at Saints|Chicago Bears at New Orleans Saints|Caesars Superdome|   128|0.906|29.9511| -90.0812|New Orleans Saints|Chicago Bears|NA|NA| 83| 285| 2563|NFL|NFL Football
nfl|5964244|03:25 pm|2023-11-12|Arlington, TX|Giants at Cowboys|New York Giants at Dallas Cowboys|AT&T Stadium|  4965|0.891|32.7473| -97.0945|Dallas Cowboys|New York Giants|NA|NA| 32| 429| 3885|NFL|NFL Football
nfl|5964241|07:15 pm|2023-11-30|Arlington, TX|Seahawks at Cowboys|Seattle Seahawks at Dallas Cowboys|AT&T Stadium|  4965|0.846|32.7473| -97.0945|Dallas Cowboys|Seattle Seahawks|NA|NA| 32| 392| 9096|NFL|NFL Football
nfl|5988353|01:00 pm|2023-10-29|Landover, MD|Eagles at Commanders|Philadelphia Eagles at Washington Commanders|FedExField|    35|0.913|38.9076| -76.8645|Washington Commanders|Philadelphia Eagles|NA|NA|118| 336|12132|NFL|NFL Football
nfl|5964242|03:30 pm|2023-11-23|Arlington, TX|Commanders at Cowboys|Washington Commanders at Dallas Cowboys|AT&T Stadium|  4965|0.904|32.7473| -97.0945|Dallas Cowboys|Washington Commanders|NA|NA| 62| 469| 5096|NFL|NFL Football
nfl|6019458|05:20 pm|2023-10-29|Inglewood, CA|Bears at Chargers|Chicago Bears at Los Angeles Chargers|SoFi Stadium|487036|0.834|33.9535|-118.3390|Los Angeles Chargers|Chicago Bears|NA|NA| 61| 143| 1531|NFL|NFL Football
nfl|5966326|01:25 pm|2023-10-29|Glendale, AZ|Ravens at Cardinals|Baltimore Ravens at Arizona Cardinals|State Farm Stadium|    43|0.872|33.5276|-112.2630|Arizona Cardinals|Baltimore Ravens|NA|NA| 34| 147| 1047|NFL|NFL Football
nfl|6019626|01:25 pm|2023-10-29|Santa Clara, CA|Bengals at 49ers|Cincinnati Bengals at San Francisco 49ers|Levi's Stadium| 58670|0.870|37.4023|-121.9690|San Francisco 49ers|Cincinnati Bengals|NA|NA|227| 453|12154|NFL|NFL Football
mlb|6105114|07:00 pm|2023-10-27|Arlington, TX|World Series - Diamondbacks at Rangers (Gm 1, HG 1)|World Series: Arizona Diamondbacks at Texas Rangers (Game 1 - Home Game 1)|Globe Life Field|487468|0.889|32.7472| -97.0838|Texas Rangers|Arizona Diamondbacks|MLB World Series|MLB Postseason|481|1105|28077|MLB|MLB Baseball
mlb|6105116|07:00 pm|2023-10-28|Arlington, TX|World Series - Diamondbacks at Rangers (Gm 2, HG 2)|World Series: Arizona Diamondbacks at Texas Rangers (Game 2 - Home Game 2)|Globe Life Field|487468|0.877|32.7472| -97.0838|Texas Rangers|Arizona Diamondbacks|MLB World Series|MLB Postseason|544|1304|26639|MLB|MLB Baseball
nba|6119805|07:30 pm|2023-10-27|Boston, MA|Heat at Celtics|Miami Heat at Boston Celtics|TD Garden|  1544|0.842|42.3653| -71.0618|Boston Celtics|Miami Heat|NA|NA|167| 406| 6025|NBA|NBA Basketball
nba|6114499|07:00 pm|2023-10-30|New Orleans, LA|Warriors at Pelicans|Golden State Warriors at New Orleans Pelicans|Smoothie King Center|   184|0.864|29.9490| -90.0821|New Orleans Pelicans|Golden State Warriors|NA|NA| 44| 136| 5203|NBA|NBA Basketball
nba|6099671|07:30 pm|2023-10-27|Cleveland, OH|Thunder at Cavaliers|Oklahoma City Thunder at Cleveland Cavaliers|Rocket Mortgage FieldHouse|   120|0.838|41.4971| -81.6884|Cleveland Cavaliers|Oklahoma City Thunder|NA|NA| 36| 129| 3294|NBA|NBA Basketball
nba|6114500|06:00 pm|2023-10-28|New Orleans, LA|Knicks at Pelicans|New York Knicks at New Orleans Pelicans|Smoothie King Center|   184|0.834|29.9490| -90.0821|New Orleans Pelicans|New York Knicks|NA|NA| 21|  68| 4000|NBA|NBA Basketball