league|id|time|date|city|title|full|venue|ven_id|score|lat|long|t1|t2|t3|t4|low|med|high|name|xname
ncaa_basketball|5805188|03:30 am|2023-01-15|Cincinnati, OH|Marquette Golden Eagles at Xavier Musketeers Basketball|Marquette Golden Eagles at Xavier Musketeers Basketball|Cintas Center|  3431|0.536|39.1504| -84.4719|Xavier Musketeers Basketball|Marquette Golden Eagles Basketball|NA|NA|  80| 134|   342|NCAA BB|College Basketball
ncaa_basketball|5800844|07:00 pm|2023-02-01|Gainesville, FL|Tennessee at Florida|Tennessee Volunteers at Florida Gators Basketball|Exactech Arena at the Stephen C. O'Connell Center|  3459|0.536|29.6494| -82.3512|Florida Gators Basketball|Tennessee Volunteers Basketball|NA|NA|  28|  65|  1254|NCAA BB|College Basketball
ncaa_basketball|5844480|02:00 pm|2023-01-21|Boston, MA|Cornell at Harvard|Cornell Big Red at Harvard Crimson Basketball|Lavietes Pavilion|  4185|0.387|42.3683| -71.1237|Harvard Crimson Basketball|Cornell Big Red Basketball|NA|NA|  64|  73|   104|NCAA BB|College Basketball
ncaa_basketball|5817856|01:00 pm|2023-01-14|Fort Worth, TX|Kansas State at TCU|Kansas State Wildcats at TCU Horned Frogs Basketball|Ed and Rae Schollmaier Arena|  4245|0.535|32.7093| -97.3652|TCU Horned Frogs Basketball|Kansas State Wildcats Basketball|NA|NA|  72|  94|   484|NCAA BB|College Basketball
ncaa_basketball|5853014|07:00 pm|2023-01-21|Fort Myers, FL|Kennesaw State at FGCU|Kennesaw State Owls at Florida Gulf Coast Eagles Basketball|Alico Arena|  4252|0.387|26.4618| -81.7759|Florida Gulf Coast Eagles Basketball|Kennesaw State Owls Basketball|NA|NA|  30|  37|    68|NCAA BB|College Basketball
ncaa_basketball|5800518|03:00 pm|2023-01-14|Tuscaloosa, AL|LSU Tigers at Alabama Crimson Tide Basketball|LSU Tigers at Alabama Crimson Tide Basketball|Coleman Coliseum|  3444|0.534|33.2027| -87.5397|Alabama Crimson Tide Basketball|LSU Tigers Basketball|NA|NA|  42| 103|   763|NCAA BB|College Basketball
ncaa_basketball|5848461|02:00 pm|2023-01-28|Cheney, WA|Weber State at Eastern Washington|Weber State Wildcats at Eastern Washington Eagles Basketball|Reese Court|  4183|0.385|47.4914|-117.5890|Eastern Washington Eagles Basketball|Weber State Wildcats Basketball|NA|NA|  18|  40|    73|NCAA BB|College Basketball
ncaa_basketball|5841534|06:00 pm|2023-01-21|Milwaukee, WI|Youngstown State at Milwaukee|Youngstown State Penguins at Milwaukee Panthers Basketball|UW-Milwaukee Panther Arena|  1921|0.385|43.0417| -87.9169|Milwaukee Panthers Basketball|Youngstown State Penguins Basketball|NA|NA|  25|  53|   183|NCAA BB|College Basketball
ncaa_basketball|5847216|02:00 pm|2023-02-11|Muncie, IN|Bowling Green at Ball State|Bowling Green Falcons at Ball State Cardinals Basketball|John E. Worthen Arena|  3904|0.385|40.2015| -85.4072|Ball State Cardinals Basketball|Bowling Green Falcons Basketball|NA|NA|  32|  45|   187|NCAA BB|College Basketball
ncaa_basketball|5800857|06:30 pm|2023-01-11|Athens, GA|Mississippi State at Georgia|Mississippi State Bulldogs at Georgia Bulldogs Basketball|Stegeman Coliseum|  3482|0.439|33.9425| -83.3779|Georgia Bulldogs Basketball|Mississippi State Bulldogs Basketball|NA|NA|  11|  29|    95|NCAA BB|College Basketball
ncaa_basketball|5807696|01:00 pm|2023-02-04|Notre Dame, IN|Wake Forest at Notre Dame|Wake Forest Demon Deacons at Notre Dame Fighting Irish Basketball|Purcell Pavilion at the Joyce Center|  3453|0.533|41.6972| -86.2313|Notre Dame Fighting Irish Basketball|Wake Forest Demon Deacons Basketball|NA|NA|  36|  68|   403|NCAA BB|College Basketball
ncaa_basketball|5768028|08:00 pm|2023-01-19|Santa Clara, CA|BYU at Santa Clara|BYU Cougars at Santa Clara Broncos Basketball|Leavey Center|  4151|0.384|37.3517|-121.9370|Santa Clara Broncos Basketball|BYU Cougars Basketball|NA|NA|  16|  33|   106|NCAA BB|College Basketball
ncaa_basketball|5812388|08:00 pm|2023-01-21|Stanford, CA|Oregon at Stanford|Oregon Ducks at Stanford Cardinal Basketball|Maples Pavilion|  3468|0.532|37.4296|-122.1610|Stanford Cardinal Basketball|Oregon Ducks Basketball|NA|NA|  43|  83|   185|NCAA BB|College Basketball
ncaa_basketball|5801063|06:00 pm|2023-02-08|Nashville, TN|Tennessee at Vanderbilt|Tennessee Volunteers at Vanderbilt Commodores Basketball|Memorial Gym|  3432|0.532|36.1446| -86.8073|Vanderbilt Commodores Basketball|Tennessee Volunteers Basketball|NA|NA|  79| 139|   272|NCAA BB|College Basketball
ncaa_basketball|5812563|08:00 pm|2023-01-26|Seattle, WA|Arizona State at Washington|Arizona State Sun Devils at Washington Huskies Basketball|Alaska Airlines Arena at Hec Edmundson Pavilion|  3440|0.435|47.6521|-122.3020|Washington Huskies Basketball|Arizona State Sun Devils Basketball|NA|NA|  16|  64|   290|NCAA BB|College Basketball
ncaa_basketball|5751129|03:30 am|2023-01-19|Troy, AL|James Madison at Troy|James Madison Dukes at Troy Trojans Basketball|Trojan Arena|  6462|0.382|31.8073| -85.9626|Troy Trojans Basketball|James Madison Dukes Basketball|NA|NA|  18|  29|    64|NCAA BB|College Basketball
ncaa_basketball|5803344|01:00 pm|2023-02-12|Evanston, IL|Purdue at Northwestern|Purdue Boilermakers at Northwestern Wildcats Basketball|Welsh-Ryan Arena|  3445|0.579|42.0668| -87.6925|Northwestern Wildcats Basketball|Purdue Boilermakers Basketball|NA|NA|  95| 185|   863|NCAA BB|College Basketball
ncaa_basketball|5846110|07:00 pm|2023-01-16|San Antonio, TX|Rice at UTSA|Rice Owls at UTSA Roadrunners Basketball|UTSA Convocation Center|  4145|0.382|29.5824| -98.6215|UTSA Roadrunners Basketball|Rice Owls Basketball|NA|NA|  30|  30|    52|NCAA BB|College Basketball
ncaa_basketball|5768084|05:00 pm|2023-01-21|San Francisco, CA|BYU at San Francisco|BYU Cougars at San Francisco Dons Basketball|War Memorial At The Sobrato Center| 39291|0.381|37.7766|-122.4510|San Francisco Dons Basketball|BYU Cougars Basketball|NA|NA|  42|  41|    43|NCAA BB|College Basketball
ncaa_basketball|5817236|02:00 pm|2023-02-05|Tulsa, OK|Wichita State at Tulsa|Wichita State Shockers at Tulsa Golden Hurricane Basketball|Reynolds Center|  3449|0.381|36.1490| -95.9421|Tulsa Golden Hurricane Basketball|Wichita State Shockers Basketball|NA|NA|  33|  57|    88|NCAA BB|College Basketball
ncaa_basketball|5801251|01:00 pm|2023-02-11|Philadelphia, PA|George Washington at Saint Josephs|George Washington Colonials at Saint Josephs Hawks Basketball|Michael J. Hagan '85 Arena|  3478|0.434|39.9957| -75.2351|Saint Josephs Hawks Basketball|George Washington Colonials Basketball|NA|NA|  46|  76|   113|NCAA BB|College Basketball
ncaa_basketball|5767980|08:00 pm|2023-02-02|Moraga, CA|San Francisco at Saint Mary's|San Francisco Dons at Saint Mary's Gaels Basketball|University Credit Union Pavilion|  4219|0.380|37.8413|-122.1100|Saint Mary's Gaels Basketball|San Francisco Dons Basketball|NA|NA|  48|  81|   153|NCAA BB|College Basketball
ncaa_basketball|5805071|04:00 pm|2023-01-28|Indianapolis, IN|Seton Hall at Butler|Seton Hall Pirates at Butler Bulldogs Basketball|Hinkle Fieldhouse|  3147|0.528|39.8436| -86.1673|Butler Bulldogs Basketball|Seton Hall Pirates Basketball|NA|NA|  26|  80|   721|NCAA BB|College Basketball
ncaa_basketball|5844310|07:00 pm|2023-02-09|Denton, TX|UAB at North Texas|UAB Blazers at North Texas Mean Green Basketball|UNT Coliseum (Super Pit)|  4159|0.379|33.2086| -97.1541|North Texas Mean Green Basketball|UAB Blazers Basketball|NA|NA|  20|  35|    78|NCAA BB|College Basketball
ncaa_basketball|5807702|02:00 pm|2023-02-11|Notre Dame, IN|Virginia Tech at Notre Dame|Virginia Tech Hokies at Notre Dame Fighting Irish Basketball|Purcell Pavilion at the Joyce Center|  3453|0.528|41.6972| -86.2313|Notre Dame Fighting Irish Basketball|Virginia Tech Hokies Basketball|NA|NA|  36|  65|   403|NCAA BB|College Basketball
ncaa_basketball|5817322|02:00 pm|2023-01-08|Orlando, FL|SMU at UCF| SMU Mustangs at UCF Knights Basketball|Addition Financial Arena|  5595|0.378|28.6072| -81.1974|UCF Knights Basketball|SMU Mustangs Basketball|NA|NA|  11|  60|   271|NCAA BB|College Basketball
ncaa_basketball|5807572|04:00 pm|2023-01-14|Tallahassee, FL|Virginia at Florida State|Virginia Cavaliers at Florida State Seminoles Basketball|Donald L. Tucker Civic Center|   354|0.528|30.4378| -84.2867|Florida State Seminoles Basketball|Virginia Cavaliers Basketball|NA|NA|  12|  39|   231|NCAA BB|College Basketball
ncaa_basketball|5767990|04:00 pm|2023-01-28|Portland, OR|Gonzaga at Portland|Gonzaga Bulldogs at Portland Pilots Basketball|Chiles Center|  5169|0.527|45.5736|-122.7280|Portland Pilots Basketball|Gonzaga Bulldogs Basketball|NA|NA|  78| 182|   253|NCAA BB|College Basketball
ncaa_basketball|5849024|07:00 pm|2023-02-11|Ogden, UT|Montana at Weber State|Montana Grizzlies at Weber State Wildcats Basketball|Dee Events Center|  4259|0.378|41.1831|-111.9490|Weber State Wildcats Basketball|Montana Grizzlies Basketball|NA|NA|  17|  63|    66|NCAA BB|College Basketball
ncaa_basketball|5817842|03:00 pm|2023-02-04|Manhattan, KS|Texas at Kansas State|Texas Longhorns at Kansas State Wildcats Basketball|Bramlage Coliseum|  3464|0.527|39.2004| -96.5938|Kansas State Wildcats Basketball|Texas Longhorns Basketball|NA|NA|  62|  77|   252|NCAA BB|College Basketball
ncaa_basketball|5801328|04:30 pm|2023-01-14|Amherst, MA|Rhode Island at Massachusetts|Rhode Island Rams at UMass Minutemen Basketball|Mullins Center|  1352|0.377|42.3732| -72.5199|UMass Minutemen Basketball|Rhode Island Rams Basketball|NA|NA|  35|  61|   194|NCAA BB|College Basketball
ncaa_basketball|5805109|08:30 pm|2023-02-01|Jamaica, NY|Seton Hall at St. John's|Seton Hall Pirates at St. John's Red Storm Basketball|Carnesecca Arena|  3479|0.527|40.7256| -73.7916|St. John's Red Storm Basketball|Seton Hall Pirates Basketball|NA|NA|  31|  91|   687|NCAA BB|College Basketball
ncaa_basketball|5805222|08:30 pm|2023-01-10|Washington, DC|Seton Hall at Georgetown|Seton Hall Pirates at Georgetown Hoyas Basketball|Capital One Arena|   181|0.527|38.8981| -77.0209|Georgetown Hoyas Basketball|Seton Hall Pirates Basketball|NA|NA|   9|  76|   492|NCAA BB|College Basketball
ncaa_basketball|5795511|03:30 am|2023-01-31|Fort Collins, CO|UNLV at Colorado State|UNLV Rebels at Colorado State Rams Basketball|Moby Arena|  4169|0.375|40.5756|-105.0840|Colorado State Rams Basketball|UNLV Rebels Basketball|NA|NA|  35|  48|    64|NCAA BB|College Basketball
ncaa_basketball|5817824|08:00 pm|2023-02-14|Stillwater, OK|Kansas at Oklahoma State|Kansas Jayhawks at Oklahoma State Cowboys Basketball|Gallagher-Iba Arena|  3439|0.526|36.1257| -97.0651|Oklahoma State Cowboys Basketball|Kansas Jayhawks Basketball|NA|NA|  38|  68|   374|NCAA BB|College Basketball
ncaa_basketball|5800993|03:30 pm|2023-02-04|Columbia, SC|Arkansas at South Carolina|Arkansas Razorbacks at South Carolina Gamecocks Basketball|Colonial Life Arena|  1429|0.526|33.9947| -81.0370|South Carolina Gamecocks Basketball|Arkansas Razorbacks Basketball|NA|NA|  38|  70|   770|NCAA BB|College Basketball
ncaa_basketball|5812475|05:00 pm|2023-01-14|Pullman, WA|Stanford at Washington State|Stanford Cardinal at Washington State Cougars Basketball|Beasley Coliseum|  3481|0.375|46.7352|-117.1580|Washington State Cougars Basketball|Stanford Cardinal Basketball|NA|NA|  19|  49|   124|NCAA BB|College Basketball
ncaa_basketball|5842429|03:00 pm|2023-01-28|San Antonio, TX|Louisiana Tech at UTSA|Louisiana Tech Bulldogs at UTSA Roadrunners Basketball|UTSA Convocation Center|  4145|0.374|29.5824| -98.6215|UTSA Roadrunners Basketball|Louisiana Tech Bulldogs Basketball|NA|NA|  30|  34|    53|NCAA BB|College Basketball
ncaa_basketball|5803376|03:30 pm|2023-02-05|Lincoln, NE|Penn State at Nebraska|Penn State Nittany Lions at Nebraska Cornhuskers Basketball |Pinnacle Bank Arena| 48918|0.524|40.8179| -96.7126|Nebraska Cornhuskers Basketball|Penn State Nittany Lions Basketball|NA|NA|  10|  70|   398|NCAA BB|College Basketball
ncaa_basketball|5844307|05:00 pm|2023-02-11|Denton, TX|Charlotte at North Texas|Charlotte 49ers at North Texas Mean Green Basketball|UNT Coliseum (Super Pit)|  4159|0.373|33.2086| -97.1541|North Texas Mean Green Basketball|Charlotte 49ers Basketball|NA|NA|  20|  33|    72|NCAA BB|College Basketball
ncaa_basketball|5811729|07:00 pm|2023-01-10|Cedar Falls, IA|Murray State at UNI|Murray State Racers at Northern Iowa Panthers Basketball|McLeod Center|  1877|0.373|42.5144| -92.4673|Northern Iowa Panthers Basketball|Murray State Racers Basketball|NA|NA|  10|  15|    63|NCAA BB|College Basketball
ncaa_basketball|5825294|03:00 pm|2023-01-29|Greensboro, NC|Furman at UNCG|Furman Paladins at UNC Greensboro Spartans Basketball|Greensboro Coliseum Complex|  4318|0.373|36.0580| -79.8248|UNC Greensboro Spartans Basketball|Furman Paladins Basketball|NA|NA|  40|  42|    64|NCAA BB|College Basketball
ncaa_basketball|5805238|04:00 pm|2023-01-21|Newark, NJ|Marquette Golden Eagles at Seton Hall Pirates Basketball|Marquette Golden Eagles at Seton Hall Pirates Basketball|Prudential Center|  1500|0.522|40.7332| -74.1717|Seton Hall Pirates Basketball|Marquette Golden Eagles Basketball|NA|NA|  35| 110|  1096|NCAA BB|College Basketball
ncaa_basketball|5795630|08:30 pm|2023-01-10|Logan, UT|Wyoming at Utah State|Wyoming Cowboys at Utah State Aggies Basketball|Dee Glen Smith Spectrum|  4172|0.278|41.7529|-111.8070|Utah State Aggies Basketball|Wyoming Cowboys Basketball|NA|NA|  28|  79|   100|NCAA BB|College Basketball
ncaa_basketball|5795671|08:00 pm|2023-01-31|Reno, NV|San Diego State at Nevada|San Diego State Aztecs at Nevada Wolf Pack Basketball|Lawlor Events Center|  4150|0.372|39.5459|-119.8190|Nevada Wolf Pack Basketball|San Diego State Aztecs Basketball|NA|NA|  33|  44|   245|NCAA BB|College Basketball
ncaa_basketball|5805186|06:00 pm|2023-01-11|Milwaukee, WI|UConn Huskies at Marquette Golden Eagles Basketball|UConn Huskies at Marquette Golden Eagles Basketball|Fiserv Forum|435592|0.521|43.0417| -87.9162|Marquette Golden Eagles Basketball|UConn Huskies Basketball|NA|NA|  21|  75|  1292|NCAA BB|College Basketball
ncaa_basketball|5735815|05:00 pm|2023-01-28|Manhattan, KS|Florida at Kansas State|Florida Gators at Kansas State Wildcats Basketball|Bramlage Coliseum|  3464|0.521|39.2004| -96.5938|Kansas State Wildcats Basketball|Florida Gators Basketball|NA|NA|  80| 119|   231|NCAA BB|College Basketball
ncaa_basketball|5812523|07:00 pm|2023-01-19|Salt Lake City, UT|Washington State Cougars at Utah Utes Basketball|Washington State Cougars at Utah Utes Basketball|Jon M. Huntsman Center|  4255|0.371|40.7621|-111.8390|Utah Utes Basketball|Washington State Cougars Basketball|NA|NA|   9|  51|  1089|NCAA BB|College Basketball
ncaa_basketball|5848552|03:30 pm|2023-02-11|Moscow, ID|Eastern Washington at Idaho|Eastern Washington Eagles at Idaho Vandals Basketball|Idaho Central Credit Union Arena|519525|0.371|46.7320|-117.0070|Idaho Vandals Basketball|Eastern Washington Eagles Basketball|NA|NA|  15|  15|    19|NCAA BB|College Basketball
ncaa_basketball|5747500|07:00 pm|2023-02-02|Bozeman, MT|Northern Arizona at Montana State|Northern Arizona Lumberjacks at Montana State Bobcats Basketball|Brick Breeden Fieldhouse|   918|0.273|45.6650|-111.0510|Montana State Bobcats Basketball|Northern Arizona Lumberjacks Basketball|NA|NA|  31|  77|   122|NCAA BB|College Basketball
ncaa_basketball|5807550|09:00 pm|2023-02-07|Charlottesville, VA|North Carolina State at Virginia|NC State Wolfpack at Virginia Cavaliers Basketball|John Paul Jones Arena|    90|0.626|38.0463| -78.5074|Virginia Cavaliers Basketball|NC State Wolfpack Basketball|NA|NA|  46|  58|   157|NCAA BB|College Basketball
ncaa_basketball|5849592|07:00 pm|2023-01-25|Rock Hill, SC|Charleston Southern at Winthrop|Charleston Southern Buccaneers at Winthrop Eagles Basketball|Winthrop Coliseum|  6596|0.272|34.9481| -81.0149|Winthrop Eagles Basketball|Charleston Southern Buccaneers Basketball|NA|NA|  16|  17|    59|NCAA BB|College Basketball
ncaa_basketball|5849516|02:00 pm|2023-01-14|Radford, VA|Charleston Southern at Radford|Charleston Southern Buccaneers at Radford Highlanders Basketball|Dedmon Center|  6589|0.369|37.1385| -80.5416|Radford Highlanders Basketball|Charleston Southern Buccaneers Basketball|NA|NA|  26|  29|    59|NCAA BB|College Basketball
ncaa_basketball|5848682|07:00 pm|2023-01-21|Missoula, MT|Montana State at Montana|Montana State Bobcats at Montana Grizzlies Basketball|Dahlberg Arena at the Adams Center|  5153|0.369|46.8606|-113.9820|Montana Grizzlies Basketball|Montana State Bobcats Basketball|NA|NA|  17|  23|    74|NCAA BB|College Basketball
ncaa_basketball|5811412|02:00 pm|2023-01-29|Nashville, TN|Drake at Belmont|Drake Bulldogs at Belmont Bruins Basketball|Curb Event Center|  5164|0.369|36.1331| -86.7954|Belmont Bruins Basketball|Drake Bulldogs Basketball|NA|NA|  22|  27|    34|NCAA BB|College Basketball
ncaa_basketball|5767905|07:00 pm|2023-02-11|Spokane, WA|BYU at Gonzaga|BYU Cougars at Gonzaga Bulldogs Basketball|McCarthey Athletic Center|  4167|0.518|47.6654|-117.3990|Gonzaga Bulldogs Basketball|BYU Cougars Basketball|NA|NA|1385|1414|  1511|NCAA BB|College Basketball
ncaa_basketball|5805200|06:00 pm|2023-02-15|Milwaukee, WI|Xavier Musketeers at Marquette Golden Eagles Basketball|Xavier Musketeers at Marquette Golden Eagles Basketball|Fiserv Forum|435592|0.517|43.0417| -87.9162|Marquette Golden Eagles Basketball|Xavier Musketeers Basketball|NA|NA|   9|  82|   456|NCAA BB|College Basketball
ncaa_basketball|5817818|07:00 pm|2023-02-08|Morgantown, WV|Iowa State at West Virginia|Iowa State Cyclones at West Virginia Mountaineers Basketball|WVU Coliseum|  3288|0.517|39.6493| -79.9815|West Virginia Mountaineers Basketball|Iowa State Cyclones Basketball|NA|NA|  19|  46|   638|NCAA BB|College Basketball
ncaa_basketball|5803200|02:30 pm|2023-01-16|East Lansing, MI|Purdue at Michigan State|Purdue Boilermakers at Michigan State Spartans Basketball|Jack Breslin Student Events Center|  3456|0.624|42.7287| -84.4927|Michigan State Spartans Basketball|Purdue Boilermakers Basketball|NA|NA|  49| 142|   646|NCAA BB|College Basketball
ncaa_basketball|5848498|07:00 pm|2023-02-16|Charlotte, NC|Western Kentucky at Charlotte|Western Kentucky Hilltoppers at Charlotte 49ers Basketball|Halton Arena|  3442|0.270|35.3063| -80.7344|Charlotte 49ers Basketball|Western Kentucky Hilltoppers Basketball|NA|NA|  26|  52|   108|NCAA BB|College Basketball
ncaa_basketball|5841535|07:00 pm|2023-01-12|Milwaukee, WI|Northern Kentucky Norse at Milwaukee Panthers Basketball|Northern Kentucky Norse at Milwaukee Panthers Basketball|UW-Milwaukee Panther Arena|  1921|0.367|43.0417| -87.9169|Milwaukee Panthers Basketball|Northern Kentucky Norse Basketball|NA|NA|  16|  53|   176|NCAA BB|College Basketball
ncaa_basketball|5800899|06:00 pm|2023-01-18|Baton Rouge, LA|Auburn Tigers at LSU Tigers Basketball|Auburn Tigers at LSU Tigers Basketball|Pete Maravich Assembly Center|  3480|0.515|30.4173| -91.1856|LSU Tigers Basketball|Auburn Tigers Basketball|NA|NA|   8|  44|   295|NCAA BB|College Basketball
ncaa_basketball|5795549|06:00 pm|2023-01-28|San Diego, CA|San Jose State at San Diego State|San Jose State Spartans at San Diego State Aztecs Basketball|Viejas Arena at Aztec Bowl|  1328|0.515|32.7745|-117.0750|San Diego State Aztecs Basketball|San Jose State Spartans Basketball|NA|NA|  31|  97|   744|NCAA BB|College Basketball
ncaa_basketball|5846065|03:00 pm|2023-02-04|Birmingham, AL|FIU at UAB|Florida International Panthers at UAB Blazers Basketball|Bartow Arena|  3487|0.269|33.5013| -86.8095|UAB Blazers Basketball|Florida International Panthers Basketball|NA|NA|  26|  27|    52|NCAA BB|College Basketball
ncaa_basketball|5803230|08:00 pm|2023-01-18|Iowa City, IA|Northwestern at Iowa|Northwestern Wildcats at Iowa Hawkeyes Basketball|Carver-Hawkeye Arena|  3467|0.514|41.6639| -91.5545|Iowa Hawkeyes Basketball|Northwestern Wildcats Basketball|NA|NA|  11|  30|   403|NCAA BB|College Basketball
ncaa_basketball|5751005|07:00 pm|2023-02-04|Lafayette, LA|Marshall at Louisiana|Marshall Thundering Herd at Louisiana Ragin' Cajuns Basketball|Cajundome|   113|0.365|30.2184| -92.0389|Louisiana Ragin' Cajuns Basketball|Marshall Thundering Herd Basketball|NA|NA|  29|  55|    72|NCAA BB|College Basketball
ncaa_basketball|5844477|02:00 pm|2023-02-11|Boston, MA|Penn at Harvard|Pennsylvania Quakers at Harvard Crimson Basketball|Lavietes Pavilion|  4185|0.365|42.3683| -71.1237|Harvard Crimson Basketball|Pennsylvania Quakers Basketball|NA|NA|  38|  60|   102|NCAA BB|College Basketball
ncaa_basketball|5805057|03:30 am|2023-02-14|Providence, RI|Creighton at Providence|Creighton Bluejays at Providence Friars Basketball|Amica Mutual Pavilion|   805|0.514|41.8236| -71.4180|Providence Friars Basketball|Creighton Bluejays Basketball|NA|NA|  25|  81| 22143|NCAA BB|College Basketball
ncaa_basketball|5847158|05:00 pm|2023-02-11|Rock Hill, SC|USC Upstate at Winthrop|USC Upstate Spartans at Winthrop Eagles Basketball|Winthrop Coliseum|  6596|0.269|34.9481| -81.0149|Winthrop Eagles Basketball|USC Upstate Spartans Basketball|NA|NA|  32|  32|    59|NCAA BB|College Basketball
ncaa_basketball|5848455|03:30 am|2023-01-14|Cheney, WA|Idaho (Women) at Eastern Washington (Women)|Idaho Vandals at Eastern Washington Eagles Basketball|Reese Court|  4183|0.363|47.4914|-117.5890|Eastern Washington Eagles Womens Basketball|Idaho Vandals Womens Basketball|NA|NA|  18|  30|    74|NCAA BB|College Basketball
ncaa_basketball|5801546|01:30 pm|2023-02-04|Chicago, IL|George Mason at Loyola Chicago|George Mason Patriots at Loyola Chicago Ramblers Basketball|Gentile Arena|  5183|0.363|42.0006| -87.6591|Loyola Chicago Ramblers Basketball|George Mason Patriots Basketball|NA|NA|  81|  79|   130|NCAA BB|College Basketball
ncaa_basketball|5848550|02:00 pm|2023-01-28|Moscow, ID|Idaho State at Idaho|Idaho State Bengals at Idaho Vandals Basketball|Idaho Central Credit Union Arena|519525|0.363|46.7320|-117.0070|Idaho Vandals Basketball|Idaho State Bengals Basketball|NA|NA|  15|  19|    64|NCAA BB|College Basketball
ncaa_basketball|5751115|07:00 pm|2023-01-26|San Marcos, TX|Georgia Southern at Texas State|Georgia Southern Eagles at Texas State Bobcats Basketball|Strahan Arena at the University Events Center|  4260|0.363|29.8887| -97.9374|Texas State Bobcats Basketball|Georgia Southern Eagles Basketball|NA|NA|  36|  48|    82|NCAA BB|College Basketball
ncaa_basketball|5803268|03:30 am|2023-01-15|Ann Arbor, MI|Northwestern at Michigan|Northwestern Wildcats at Michigan Wolverines Basketball|Crisler Center|  3450|0.622|42.2650| -83.7467|Michigan Wolverines Basketball|Northwestern Wildcats Basketball|NA|NA|  15|  35|   370|NCAA BB|College Basketball
ncaa_basketball|5801100|07:00 pm|2023-01-11|Davidson, NC|Richmond at Davidson|Richmond Spiders at Davidson Wildcats Basketball|Belk Arena|  4247|0.266|35.4993| -80.8405|Davidson Wildcats Basketball|Richmond Spiders Basketball|NA|NA|  30|  34|    69|NCAA BB|College Basketball
ncaa_basketball|5803374|07:30 pm|2023-01-24|Lincoln, NE|Northwestern at Nebraska|Northwestern Wildcats at Nebraska Cornhuskers Basketball|Pinnacle Bank Arena| 48918|0.511|40.8179| -96.7126|Nebraska Cornhuskers Basketball|Northwestern Wildcats Basketball|NA|NA|   8|  50|  1109|NCAA BB|College Basketball
ncaa_basketball|5812513|07:30 pm|2023-02-11|Pullman, WA|Washington at Washington State|Washington Huskies at Washington State Cougars Basketball|Beasley Coliseum|  3481|0.363|46.7352|-117.1580|Washington State Cougars Basketball|Washington Huskies Basketball|NA|NA|  30|  55|   129|NCAA BB|College Basketball
ncaa_basketball|5844309|05:00 pm|2023-01-28|Denton, TX|UTEP at North Texas|UTEP Miners at North Texas Mean Green Basketball|UNT Coliseum (Super Pit)|  4159|0.363|33.2086| -97.1541|North Texas Mean Green Basketball|UTEP Miners Basketball|NA|NA|  20|  35|    77|NCAA BB|College Basketball
ncaa_basketball|5768130|07:00 pm|2023-01-26|Malibu, CA|San Diego at Pepperdine|San Diego Toreros at Pepperdine Waves Basketball|Firestone Fieldhouse|  5187|0.264|34.0347|-118.7040|Pepperdine Waves Basketball|San Diego Toreros Basketball|NA|NA|  34|  37|    64|NCAA BB|College Basketball
ncaa_basketball|5848681|07:00 pm|2023-01-14|Missoula, MT|Idaho State at Montana|Idaho State Bengals at Montana Grizzlies Basketball|Dahlberg Arena at the Adams Center|  5153|0.363|46.8606|-113.9820|Montana Grizzlies Basketball|Idaho State Bengals Basketball|NA|NA|  18|  24|    56|NCAA BB|College Basketball
ncaa_basketball|5891177|07:00 pm|2023-01-28|Dayton, OH|Green Bay at Wright State|Green Bay Phoenix at Wright State Raiders Basketball|Wright State University Nutter Center|  1622|0.264|39.7747| -84.0797|Wright State Raiders Basketball|Green Bay Phoenix Basketball|NA|NA|  23|  70|   395|NCAA BB|College Basketball
ncaa_basketball|5801284|06:00 pm|2023-02-03|St. Louis, MO|VCU at Saint Louis|VCU Rams at Saint Louis Billikens Basketball|Chaifetz Arena|   775|0.509|38.6325| -90.2279|Saint Louis Billikens Basketball|VCU Rams Basketball|NA|NA|  26|  98|   386|NCAA BB|College Basketball
ncaa_basketball|5848671|06:00 pm|2023-01-21|Pocatello, ID|Portland State at Idaho State|Portland State Vikings at Idaho State Bengals Basketball|Reed Gym|  6560|0.363|42.8627|-112.4330|Idaho State Bengals Basketball|Portland State Vikings Basketball|NA|NA|  24|  24|    64|NCAA BB|College Basketball
ncaa_basketball|5817354|07:00 pm|2023-02-11|Orlando, FL|Tulsa at UCF|Tulsa Golden Hurricane at UCF Knights Basketball|Addition Financial Arena|  5595|0.362|28.6072| -81.1974|UCF Knights Basketball|Tulsa Golden Hurricane Basketball|NA|NA|  14|  60|  1231|NCAA BB|College Basketball
ncaa_basketball|5735811|03:30 am|2023-01-28|Waco, TX|Arkansas at Baylor|Arkansas Razorbacks at Baylor Bears Basketball|Ferrell Center|  3471|0.508|31.5495| -97.1052|Baylor Bears Basketball|Arkansas Razorbacks Basketball|NA|NA| 111| 231|  1126|NCAA BB|College Basketball
